{
  "system_name": "BM25 RAG",
  "total_chunks": 16228,
  "chunk_size": 500,
  "chunk_overlap": 50,
  "k1": 1.5,
  "b": 0.75,
  "llm_model": "fallback (без LLM)",
  "queries": [
    {
      "question": "What are the main business segments of the company according to the latest annual report?",
      "answer": " as taking certain measures to support our customers.\nInformation about Segments\nWe operate our business in multiple operating segments. Google is our only reportable\nsegment. None of our other segments meet the quantitative thresholds to qualify as reportable\nsegments; therefore, the other operating segments are combined and disclosed as Other\nBets.\nOur reported segments are:\n•\nGoogle – Google includes our main products such as ads, Android, Chrome,\nhardware, Google Cloud, Google Maps, Google P\n\n may differ materially.\nInformation about Segments\nWe operate our business in multiple operating segments. Google is our only reportable\nsegment. None of our other segments meet the quantitative thresholds to qualify as reportable\nsegments; therefore, the other operating segments are combined and disclosed as Other\nBets.\nOur reported segments are:\n•\nGoogle – Google includes our main products such as ads, Android, Chrome,\nhardware, Google Cloud, Google Maps, Google Play, Search, and YouTube. Our\n\n\ne performance, and historical trends in our financial results may differ\nmaterially.\nInformation about Segments\nWe operate our business in multiple operating segments. Google is our only reportable\nsegment. None of our other segments meet the quantitative thresholds to qualify as reportable\nsegments; therefore, the other operating segments are combined and disclosed as Other\nBets.\nOur reported segments are:\n•\nGoogle – Google includes our main products such as ads, Android, Chrome,\nhardware, Goog",
      "contexts": [
        " as taking certain measures to support our customers.\nInformation about Segments\nWe operate our business in multiple operating segments. Google is our only reportable\nsegment. None of our other segments meet the quantitative thresholds to qualify as reportable\nsegments; therefore, the other operating segments are combined and disclosed as Other\nBets.\nOur reported segments are:\n•\nGoogle – Google includes our main products such as ads, Android, Chrome,\nhardware, Google Cloud, Google Maps, Google P",
        " may differ materially.\nInformation about Segments\nWe operate our business in multiple operating segments. Google is our only reportable\nsegment. None of our other segments meet the quantitative thresholds to qualify as reportable\nsegments; therefore, the other operating segments are combined and disclosed as Other\nBets.\nOur reported segments are:\n•\nGoogle – Google includes our main products such as ads, Android, Chrome,\nhardware, Google Cloud, Google Maps, Google Play, Search, and YouTube. Our\n",
        "e performance, and historical trends in our financial results may differ\nmaterially.\nInformation about Segments\nWe operate our business in multiple operating segments. Google is our only reportable\nsegment. None of our other segments meet the quantitative thresholds to qualify as reportable\nsegments; therefore, the other operating segments are combined and disclosed as Other\nBets.\nOur reported segments are:\n•\nGoogle – Google includes our main products such as ads, Android, Chrome,\nhardware, Goog",
        "ad vilification of police officers8 and a rise in crime across the\ncountry.9\n \nCorporate underperformance can be avoided if directors exercise greater risk oversight objectively. According to Alphabet’s Investor Relations, “the\nfundamental responsibility of the directors is to exercise their business judgment to act in what they reasonably believe to be the best interests of\nAlphabet and its stockholders,”10 but shareholders are uninformed about members’ ideological and political views. Greater ",
        "ne of our\nother segments meet the quantitative thresholds to qualify as reportable segments; therefore, the other operating\nsegments are combined and disclosed as Other Bets.\nOur reported segments are:\n•\nGoogle – Google includes our main products such as ads, Android, Chrome, hardware, Google Cloud, Google\nMaps, Google Play, Search, and YouTube. Our technical infrastructure is also included in Google. Google\ngenerates revenues primarily from advertising; sales of apps, in-app purchases, digital "
      ],
      "retrieved_docs": 5,
      "top_scores": [
        18.914702764773292,
        18.88157164741678,
        18.88157164741678
      ],
      "sources": [
        "goog-20200331.pdf",
        "goog-20200630.pdf",
        "goog-20200930.pdf",
        "ALPHABET INC. - DEF 14A.pdf",
        "Document.pdf"
      ],
      "execution_time": 0.21079206466674805,
      "k1": 1.5,
      "b": 0.75,
      "category": "company_overview",
      "query_id": 1,
      "difficulty": "easy"
    },
    {
      "question": "In which geographic regions does the company generate most of its revenue?",
      "answer": "in 2007), making Google the first major company to achieve carbon neutrality for its entire operating history. In\nour third decade of climate action, we’ve set our most ambitious goal yet: to run our business on carbon-free energy\neverywhere, at all times, by 2030.\nWe're also investing in technologies to help our partners and people all over the world make sustainable choices.\nFor example, we intend to enable 5 GW of new carbon-free energy across our key manufacturing regions by 2030\nthrough inv\n\ns of its current advertising system, it has not shown\nevidence of any human rights due diligence associated with these plans. In 2022, Google scrapped FLoC, its planned replacement for third-party\ncookies, due to widespread concern about privacy impacts. The Company has repeatedly delayed the deprecation of cookies, most recently to late\n2025.2 This means its adverse impacts will endure. Furthermore, Google does not disclose whether it plans to conduct a structured human rights review\nof FLoC’s \n\n.\nWe engage in share repurchases from time to time. In July 2019 the Board of Directors\nof Alphabet authorized the company to repurchase up to $25.0 billion of its Class C capital\nstock, which was completed during the third quarter of 2020. In July 2020, the Board of\nDirectors of Alphabet authorized the company to repurchase up to an additional $28.0 billion\nof its Class C capital stock. As of September  30, 2020, $25.5 billion remains available for\nrepurchase. Our repurchase program does not ha",
      "contexts": [
        "in 2007), making Google the first major company to achieve carbon neutrality for its entire operating history. In\nour third decade of climate action, we’ve set our most ambitious goal yet: to run our business on carbon-free energy\neverywhere, at all times, by 2030.\nWe're also investing in technologies to help our partners and people all over the world make sustainable choices.\nFor example, we intend to enable 5 GW of new carbon-free energy across our key manufacturing regions by 2030\nthrough inv",
        "s of its current advertising system, it has not shown\nevidence of any human rights due diligence associated with these plans. In 2022, Google scrapped FLoC, its planned replacement for third-party\ncookies, due to widespread concern about privacy impacts. The Company has repeatedly delayed the deprecation of cookies, most recently to late\n2025.2 This means its adverse impacts will endure. Furthermore, Google does not disclose whether it plans to conduct a structured human rights review\nof FLoC’s ",
        ".\nWe engage in share repurchases from time to time. In July 2019 the Board of Directors\nof Alphabet authorized the company to repurchase up to $25.0 billion of its Class C capital\nstock, which was completed during the third quarter of 2020. In July 2020, the Board of\nDirectors of Alphabet authorized the company to repurchase up to an additional $28.0 billion\nof its Class C capital stock. As of September  30, 2020, $25.5 billion remains available for\nrepurchase. Our repurchase program does not ha",
        "lieve that a Board of Directors with racial and gender composition reflective of Alphabet’s customer base will more astutely minimize business risk,\nmaximize opportunity, and increase shareholder value.\n \nResolved : Shareholders request that Alphabet report annually on its policies and practices to help ensure its elected Board of Directors attains racial\nand gender representation that is better aligned with the demographics of its customers and/or regions in which it operates.\n \nThe report shou",
        "other\nviolations of our guidelines could affect the quality of our services, which could damage our reputation and\ndeter our current and potential users from using our products and services.\nWe, like others in the industry, face violations of our content guidelines, including sophisticated attempts by bad\nactors to manipulate our hosting and advertising systems to fraudulently generate revenues, or to otherwise generate\ntraffic that does not represent genuine user interest or intent. While we in"
      ],
      "retrieved_docs": 5,
      "top_scores": [
        15.81571643213249,
        15.581107959643544,
        13.357192879719424
      ],
      "sources": [
        "goog-20201231.pdf",
        "ALPHABET INC. - DEF 14A_2.pdf",
        "goog-20200930.pdf",
        "ALPHABET INC. DEF 14A.pdf",
        "Document.pdf"
      ],
      "execution_time": 0.21036601066589355,
      "k1": 1.5,
      "b": 0.75,
      "category": "company_overview",
      "query_id": 2,
      "difficulty": "medium"
    },
    {
      "question": "Summarize the company’s core products and services described in the annual report.",
      "answer": "ptions in our service. In addition, our products and services are highly technical and\ncomplex and may contain errors or vulnerabilities, which could result in interruptions in or failure of our services or\nsystems.\nIn addition, we rely extensively on information systems and technology to manage our business and summarize\noperating results. We are in the process of a multi-year implementation of a new ERP system, which will replace much\nof our existing core financial systems. The ERP system is d\n\nancial officer, as appropriate, to allow timely decisions regarding required disclosure.\nChanges in Internal Control over Financial Reporting\nWe rely extensively on information systems to manage our business and summarize and report operating results.\nIn 2019, we began a multi-year implementation of a new global enterprise resource planning (“ERP”) system, which will\nreplace much of our existing core financial systems. The ERP system is designed to accurately maintain the\nCompany’s financial rec\n\nnsparency is core to our commitment to respect human rights” and mentions human rights impact\nassessments.19 However, there is no information on how the increasing use of Alphabet products and services for surveillance, military and/or\ncensorship purposes in CAHRA exposes the company to human rights risks. The requested report will provide investors with meaningful insights into the\ncompany’s governance of these material risks.\n \n \n(1)\nhttp://dx.doi.org/10.1787/9789264185050-en\n(2)\nhttps://www.w",
      "contexts": [
        "ptions in our service. In addition, our products and services are highly technical and\ncomplex and may contain errors or vulnerabilities, which could result in interruptions in or failure of our services or\nsystems.\nIn addition, we rely extensively on information systems and technology to manage our business and summarize\noperating results. We are in the process of a multi-year implementation of a new ERP system, which will replace much\nof our existing core financial systems. The ERP system is d",
        "ancial officer, as appropriate, to allow timely decisions regarding required disclosure.\nChanges in Internal Control over Financial Reporting\nWe rely extensively on information systems to manage our business and summarize and report operating results.\nIn 2019, we began a multi-year implementation of a new global enterprise resource planning (“ERP”) system, which will\nreplace much of our existing core financial systems. The ERP system is designed to accurately maintain the\nCompany’s financial rec",
        "nsparency is core to our commitment to respect human rights” and mentions human rights impact\nassessments.19 However, there is no information on how the increasing use of Alphabet products and services for surveillance, military and/or\ncensorship purposes in CAHRA exposes the company to human rights risks. The requested report will provide investors with meaningful insights into the\ncompany’s governance of these material risks.\n \n \n(1)\nhttp://dx.doi.org/10.1787/9789264185050-en\n(2)\nhttps://www.w",
        "ay view the Annual Meeting through our Investor Relations YouTube channel at www.youtube.com/c/AlphabetIR. Further details regarding participation in the Annual Meeting and the business to be conducted are described in the Notice you received in the mail and in this proxy statement. We have also made available a copy of our 2019 Annual Report to Stockholders (Annual Report) with this proxy statement. We encourage you to read our Annual Report. It includes our audited financial statements and pro",
        "r Investor Relations YouTube channel at www.youtube.com/c/AlphabetIR.\n \nFurther details regarding participation in the Annual Meeting and the business to be conducted are described in the Notice you received in the mail and in\nthis proxy statement. We have also made available a copy of our 2021 Annual Report to Stockholders (Annual Report) with this proxy statement. We\nencourage you to read our Annual Report. It includes our audited financial statements and provides information about our busines"
      ],
      "retrieved_docs": 5,
      "top_scores": [
        17.803329879770097,
        16.21451562349094,
        15.916337439342573
      ],
      "sources": [
        "Document.pdf",
        "Document.pdf",
        "ALPHABET INC. - DEF14A.pdf",
        "lgoog2020_def14a.pdf",
        "ALPHABET INC. DEF 14A.pdf"
      ],
      "execution_time": 0.20774197578430176,
      "k1": 1.5,
      "b": 0.75,
      "category": "company_overview",
      "query_id": 3,
      "difficulty": "medium"
    },
    {
      "question": "How does the company describe its overall business model and value proposition?",
      "answer": "lders that its business model is well positioned in the face of increasing regulation.\n \n \n \n(1)\nhttps://abc.xyz/investor/static/pdf/2021_alphabet_annual_report.pdf?cache=3a96f54\n(2)\nhttps://martech.org/google-delayed-third-party-cookie-deprecation-why-and-whats-next/\n(3)\nhttps://about.google/human-rights/\n(4)\nhttps://rankingdigitalrights.org/bts22/companies/Google\n(5)\nhttps://services.google.com/fh/files/blogs/bsr-google-cr-api-hria-executive-summary.pdf\n(6)\nhttps://ec.europa.eu/commission/pres\n\ny for human rights and assure shareholders that its business model is well positioned in the face of increasing\nregulation.\n \n(1)\nhttps://abc.xyz/assets/d4/4f/a48b94d548d0b2fdc029a95e8c63/2022-alphabet-annual-report.pdf\n(2)\nhttps://edri.org/wp-content/uploads/2021/06/EDRi_Discrimination_Online.pdf\n(3)\nhttps://blog.google/technology/ads/announcing-the-launch-of-the-new-ads-transparency-center/\n(4)\nhttps://blog.google/technology/safety-security/online-safety-features-updates-google-io-2023/\n(5)\nht\n\nrom Search, except in very limited circumstances, such as illegal content. Our collection of blog\nposts on How Search Works describe how we build and operate Google Search, when and why we remove content from search results, how we\nupdate our systems to improve results, and how Google’s Search Quality Rater Guidelines help improve search quality around the world. The Search\nRater Guidelines are also designed to prevent bias entering into the testing process. They explicitly state that “[r]atings",
      "contexts": [
        "lders that its business model is well positioned in the face of increasing regulation.\n \n \n \n(1)\nhttps://abc.xyz/investor/static/pdf/2021_alphabet_annual_report.pdf?cache=3a96f54\n(2)\nhttps://martech.org/google-delayed-third-party-cookie-deprecation-why-and-whats-next/\n(3)\nhttps://about.google/human-rights/\n(4)\nhttps://rankingdigitalrights.org/bts22/companies/Google\n(5)\nhttps://services.google.com/fh/files/blogs/bsr-google-cr-api-hria-executive-summary.pdf\n(6)\nhttps://ec.europa.eu/commission/pres",
        "y for human rights and assure shareholders that its business model is well positioned in the face of increasing\nregulation.\n \n(1)\nhttps://abc.xyz/assets/d4/4f/a48b94d548d0b2fdc029a95e8c63/2022-alphabet-annual-report.pdf\n(2)\nhttps://edri.org/wp-content/uploads/2021/06/EDRi_Discrimination_Online.pdf\n(3)\nhttps://blog.google/technology/ads/announcing-the-launch-of-the-new-ads-transparency-center/\n(4)\nhttps://blog.google/technology/safety-security/online-safety-features-updates-google-io-2023/\n(5)\nht",
        "rom Search, except in very limited circumstances, such as illegal content. Our collection of blog\nposts on How Search Works describe how we build and operate Google Search, when and why we remove content from search results, how we\nupdate our systems to improve results, and how Google’s Search Quality Rater Guidelines help improve search quality around the world. The Search\nRater Guidelines are also designed to prevent bias entering into the testing process. They explicitly state that “[r]atings",
        "nt effective human rights policies and processes\nmay expose shareholders to material legal, regulatory and reputational risks.\n \nA robust and transparent Assessment is essential to enable the company to better identify, address, mitigate and prevent adverse human rights impacts.\nIt will also contribute to establishing an effective system of accountability for human rights for the industry as a whole. Lastly, such an Assessment will\nassure shareholders that its business model is well positioned i",
        "ontradicts well-established scientific consensus around the existence and causes of climate change.”3 Alphabet also discloses a list of its\nmemberships in trade associations and policy-focused non-profits. Alphabet does not, however, disclose sufficient information as to how it ensures\nlobbying practices (directly and indirectly via these groups) align with the Paris Agreement’s aims.\n \nOf particular concern are industry and policy groups that represent business but too often present obstacles o"
      ],
      "retrieved_docs": 5,
      "top_scores": [
        14.704531625603964,
        14.382756535037027,
        13.629646819225144
      ],
      "sources": [
        "ALPHABET INC. - DEF 14A_2.pdf",
        "ALPHABET INC. - DEF 14A.pdf",
        "ALPHABET INC. - DEF 14A_2.pdf",
        "ALPHABET INC. - DEF 14A_2.pdf",
        "ALPHABET INC. DEF 14A.pdf"
      ],
      "execution_time": 0.2011122703552246,
      "k1": 1.5,
      "b": 0.75,
      "category": "company_overview",
      "query_id": 4,
      "difficulty": "hard"
    },
    {
      "question": "What key macroeconomic or industry trends does management highlight as influencing the company’s performance?",
      "answer": "We obtain input, as appropriate, for our\ncybersecurity risk management program on the security industry and threat trends from multiple external experts and\ninternal threat intelligence teams. Teams of dedicated privacy, safety, and security professionals oversee cybersecurity\nrisk management and mitigation, incident prevention, detection, and remediation. Leadership for these teams are\nprofessionals with deep cybersecurity expertise across multiple industries, including our Vice President of Pr\n\nWe obtain input, as appropriate, for our cybersecurity risk\nmanagement program on the security industry and threat trends from multiple external experts and internal threat\nintelligence teams. Teams of dedicated privacy, safety, and security professionals oversee cybersecurity risk\nmanagement and mitigation, incident prevention, detection, and remediation. These teams comprise professionals with\ndeep cybersecurity expertise across multiple industries and are led by our Vice President of Privacy,\n\nour industry\nand actively engage with key stakeholders, including civil liberties, civil rights, and reproductive healthcare groups. Given our existing strong approach,\nour Board does not believe it is in the best interest of our stockholders to develop the report requested by the proposal and recommends a vote\nAGAINST this proposal.\n \nWe Routinely Push Back on Overbroad or Otherwise Inappropriate Requests for User Information\n \nA variety of laws allow federal, state, and local government agenci",
      "contexts": [
        "We obtain input, as appropriate, for our\ncybersecurity risk management program on the security industry and threat trends from multiple external experts and\ninternal threat intelligence teams. Teams of dedicated privacy, safety, and security professionals oversee cybersecurity\nrisk management and mitigation, incident prevention, detection, and remediation. Leadership for these teams are\nprofessionals with deep cybersecurity expertise across multiple industries, including our Vice President of Pr",
        "We obtain input, as appropriate, for our cybersecurity risk\nmanagement program on the security industry and threat trends from multiple external experts and internal threat\nintelligence teams. Teams of dedicated privacy, safety, and security professionals oversee cybersecurity risk\nmanagement and mitigation, incident prevention, detection, and remediation. These teams comprise professionals with\ndeep cybersecurity expertise across multiple industries and are led by our Vice President of Privacy,",
        "our industry\nand actively engage with key stakeholders, including civil liberties, civil rights, and reproductive healthcare groups. Given our existing strong approach,\nour Board does not believe it is in the best interest of our stockholders to develop the report requested by the proposal and recommends a vote\nAGAINST this proposal.\n \nWe Routinely Push Back on Overbroad or Otherwise Inappropriate Requests for User Information\n \nA variety of laws allow federal, state, and local government agenci",
        "ing Amazon.com, Citigroup, and Home Depot.\n \nSeveral actions by Alphabet employees over the last few years highlight the risks posed by a corporate culture that is out of alignment with the values of\nits employees:\n \n \n• In 2018, thousands of Alphabet employees signed petitions opposing the Company’s involvement in censorship (“Project Dragonfly”) and in\ndeveloping military technology (“Project Maven”). Moreover, approximately 20,000 employees and contractors staged a walkout to protest how the\n",
        ".\n \nFurther, we also disclose how we collaborate with our stakeholders to advance human rights matters and address related risks. For example, we are an\noriginal co-founder of the Global Network Initiative, where we work closely with civil society, academics, investors and industry peers to protect and\nadvance freedom of expression and privacy globally.\n \nOur Human Rights Governance and Management Structure Provides Effective Oversight of Key Human\nRights Risks and Mitigation Strategies\n \nAs dis"
      ],
      "retrieved_docs": 5,
      "top_scores": [
        15.017098856637109,
        14.930914457501542,
        14.538346336086127
      ],
      "sources": [
        "goog-20231231.pdf",
        "goog-20241231.pdf",
        "ALPHABET INC. - DEF 14A_2.pdf",
        "ALPHABET INC. DEF 14A.pdf",
        "ALPHABET INC. DEF 14A.pdf"
      ],
      "execution_time": 0.20091009140014648,
      "k1": 1.5,
      "b": 0.75,
      "category": "company_overview",
      "query_id": 36,
      "difficulty": "medium"
    },
    {
      "question": "What was the company’s total revenue in the most recent fiscal year, and how did it change compared to the previous year?",
      "answer": " Stockholders,\n \nWhen I last wrote to you all as Chair of the Alphabet Board last year, we had just begun to grasp the profound reality of what life would be like during\nthe COVID-19 pandemic. I stressed how the company we are all invested in was stepping up to a truly global challenge – to help people everywhere\nstay informed, stay connected, stay in business, and, most important, stay healthy, while also helping to sustain and support our workforce.\n \nTwelve months on, we’re still feeling the \n\n or enforcement actions; and be published on the company’s website by June 1, 2024.\n \nWHEREAS: Google advertising accounted for approximately 80% of Alphabet’s revenue in 2021. Alphabet’s ad business, including Google Search,\nYouTube Ads and Google Network, has grown significantly in recent years, reaching $209 billion in 2021.1\n \nAlgorithmic systems are deployed to enable the delivery of targeted advertisements, determining what users see. This often results in and exacerbates\nsystemic discrimi\n\nve positions that risk shareholder value while being unrelated to the Company’s business.\n \nRecent events have made clear that shareholder value drops when companies engage in the sort of activism that the CEI demands. Following Bud\nLight’s embrace of such divisiveness, its revenue fell $395 million in North America compared to a year prior.5 Target’s market cap fell over $15 billion\namid backlash for similar actions.6 Disney stock fell 44% in 2022 – its worst performance in nearly 50 years – fo",
      "contexts": [
        " Stockholders,\n \nWhen I last wrote to you all as Chair of the Alphabet Board last year, we had just begun to grasp the profound reality of what life would be like during\nthe COVID-19 pandemic. I stressed how the company we are all invested in was stepping up to a truly global challenge – to help people everywhere\nstay informed, stay connected, stay in business, and, most important, stay healthy, while also helping to sustain and support our workforce.\n \nTwelve months on, we’re still feeling the ",
        " or enforcement actions; and be published on the company’s website by June 1, 2024.\n \nWHEREAS: Google advertising accounted for approximately 80% of Alphabet’s revenue in 2021. Alphabet’s ad business, including Google Search,\nYouTube Ads and Google Network, has grown significantly in recent years, reaching $209 billion in 2021.1\n \nAlgorithmic systems are deployed to enable the delivery of targeted advertisements, determining what users see. This often results in and exacerbates\nsystemic discrimi",
        "ve positions that risk shareholder value while being unrelated to the Company’s business.\n \nRecent events have made clear that shareholder value drops when companies engage in the sort of activism that the CEI demands. Following Bud\nLight’s embrace of such divisiveness, its revenue fell $395 million in North America compared to a year prior.5 Target’s market cap fell over $15 billion\namid backlash for similar actions.6 Disney stock fell 44% in 2022 – its worst performance in nearly 50 years – fo",
        "SR is the sole and most important financial performance measure as it\nrelates to CAP.\n  Most Important Performance Measures\nRelative Total Shareholder Return\n \nRelative to 2023, the PEO’s 2024 CAP amount decreased despite increases to the company’s TSR and Net Income. This is driven by a decrease in the\ncompany’s 1-Year TSR ranking relative to the S&P 100 (the Alphabet-selected measure in the CAP table above) and the fact that the PEO’s number of\noutstanding shares has decreased as no new grants",
        "ation, to be\npublished within one year of the Annual Meeting and updated annually thereafter, which assesses the risks to the Company’s operations and finances,\nand to public welfare, presented by the real or potential unethical or improper usage of external data in the development, training, and deployment of its\nartificial intelligence offerings; what steps the Company takes to mitigate those risks; and how it measures the effectiveness of such efforts.\n \n \n(1)\nhttps://www.wsj.com/tech/ai/ai-t"
      ],
      "retrieved_docs": 5,
      "top_scores": [
        20.36985593534004,
        19.564202008111785,
        18.493071792596822
      ],
      "sources": [
        "ALPHABET INC. - DEF 14A_3.pdf",
        "ALPHABET INC. - DEF 14A_2.pdf",
        "ALPHABET INC. - DEF14A.pdf",
        "ALPHABET INC. - DEF14A.pdf",
        "ALPHABET INC. - DEF14A.pdf"
      ],
      "execution_time": 0.2499830722808838,
      "k1": 1.5,
      "b": 0.75,
      "category": "financials",
      "query_id": 5,
      "difficulty": "easy"
    },
    {
      "question": "What are the main drivers of revenue growth mentioned in the Management’s Discussion and Analysis (MD&A)?",
      "answer": "nc.\nITEM 7.\nMANAGEMENT’S DISCUSSION AND ANALYSIS OF FINANCIAL CONDITION AND RESULTS OF\nOPERATIONS\nPlease read the following discussion and analysis of our financial condition and results of operations together with\nour consolidated financial statements and related notes included under Part II, Item 8 of this Annual Report on Form\n10-K.\nWe have omitted discussion of 2018 results where it would be redundant to the discussion previously included in\nPart II, Item 7 of our 2019 Annual Report on Form \n\n2.\n30\nTable of Contents\nAlphabet In\nITEM 2.\nMANAGEMENT’S DISCUSSION AND ANALYSIS OF FINANCIAL\nCONDITION AND RESULTS OF OPERATIONS\nPlease read the following discussion and analysis of our financial condition and results of\noperations together with our consolidated financial statements and related notes included\nunder Part I, Item 1 of this Quarterly Report on Form 10-Q.\nExecutive Overview of Results\nBelow are our key financial results for the three months ended March 31, 2020\n(consolidated unless\n\n be completed later this year.\n33\nTable of Contents\nAlphabet In\nITEM 2.\nMANAGEMENT’S DISCUSSION AND ANALYSIS OF FINANCIAL\nCONDITION AND RESULTS OF OPERATIONS\nPlease read the following discussion and analysis of our financial condition and results of\noperations together with our consolidated financial statements and related notes included\nunder Part I, Item 1 of this Quarterly Report on Form 10-Q.\nExecutive Overview of Results\nBelow are our key financial results for the three months ended June 30",
      "contexts": [
        "nc.\nITEM 7.\nMANAGEMENT’S DISCUSSION AND ANALYSIS OF FINANCIAL CONDITION AND RESULTS OF\nOPERATIONS\nPlease read the following discussion and analysis of our financial condition and results of operations together with\nour consolidated financial statements and related notes included under Part II, Item 8 of this Annual Report on Form\n10-K.\nWe have omitted discussion of 2018 results where it would be redundant to the discussion previously included in\nPart II, Item 7 of our 2019 Annual Report on Form ",
        "2.\n30\nTable of Contents\nAlphabet In\nITEM 2.\nMANAGEMENT’S DISCUSSION AND ANALYSIS OF FINANCIAL\nCONDITION AND RESULTS OF OPERATIONS\nPlease read the following discussion and analysis of our financial condition and results of\noperations together with our consolidated financial statements and related notes included\nunder Part I, Item 1 of this Quarterly Report on Form 10-Q.\nExecutive Overview of Results\nBelow are our key financial results for the three months ended March 31, 2020\n(consolidated unless",
        " be completed later this year.\n33\nTable of Contents\nAlphabet In\nITEM 2.\nMANAGEMENT’S DISCUSSION AND ANALYSIS OF FINANCIAL\nCONDITION AND RESULTS OF OPERATIONS\nPlease read the following discussion and analysis of our financial condition and results of\noperations together with our consolidated financial statements and related notes included\nunder Part I, Item 1 of this Quarterly Report on Form 10-Q.\nExecutive Overview of Results\nBelow are our key financial results for the three months ended June 30",
        "cember 31, 2016 in stock or in index, including reinvestment of dividends. Fiscal year ending December 31.\nCopyright  2022 S&P, a division of The McGraw-Hill Companies Inc. All rights reserved.\nITEM 6.\n[Reserved]\n©\n27\nTable of Contents\nAlphabet Inc.\nITEM 7.\nMANAGEMENT’S DISCUSSION AND ANALYSIS OF FINANCIAL CONDITION AND RESULTS OF\nOPERATIONS\nPlease read the following discussion and analysis of our financial condition and results of operations together with\n“Note about Forward-Looking Statements,",
        "nited States\n$\n93,565  $\n96,519 \nInternational\n33,484 \n35,488 \nTotal long-lived assets\n$\n127,049  $\n132,007 \n29\nTable of Contents\nAlphabet Inc.\nITEM \n2.\nMANAGEMENT’S \nDISCUSSION \nAND \nANALYSIS \nOF \nFINANCIAL\nCONDITION AND RESULTS OF OPERATIONS\nPlease read the following discussion and analysis of our financial condition and results of\noperations together with \"Note About Forward-Looking Statements\" and our consolidated\nfinancial statements and related notes included under Item 1 of this Quarterly"
      ],
      "retrieved_docs": 5,
      "top_scores": [
        20.64445613094002,
        20.234845480127237,
        20.141044373185732
      ],
      "sources": [
        "goog-20201231.pdf",
        "goog-20200331.pdf",
        "goog-20200630.pdf",
        "goog-20211231.pdf",
        "goog-20230331.pdf"
      ],
      "execution_time": 0.21059107780456543,
      "k1": 1.5,
      "b": 0.75,
      "category": "financials",
      "query_id": 6,
      "difficulty": "medium"
    },
    {
      "question": "How does the company break down its revenue by segment or product line?",
      "answer": " on transforming our products to provide our users the most\nhelpful tools. Examples include AI Overviews, which allow users to ask their most complex questions, break down\nconcepts in a format that is useful for them, or take a video and ask a question out loud, and NotebookLM, which helps\nusers understand complex information by summarizing sources and providing relevant quotes. We are embedding the\npower of generative AI to continue helping our users express themselves and get things done. For \n\ns, conservation organizations, and communities to better manage water resources collectively.”5\n \nYet, despite acknowledging the importance of these issues,6 our Company offers no recent reporting on its total enterprise-wide water use, nor does it\ndisclose annual water use or other risk metrics by location. In fact, Google states that its local water use information, and its water use agreements with\nlocal governments, are trade secret.7 The company has claimed that public officials cannot disc\n\nest\nensure that it is meeting its obligations to employees — especially younger employees — by appropriately mitigating climate risk in its retirement plan\ninvestments.\n \nRESOLVED: Shareholders request Alphabet publish a report disclosing how the Company is protecting plan beneficiaries — especially those with a\nlonger investment time horizon — from increased future portfolio risk created by present-day investments in high-carbon companies.\n \n \n \n(1)\nhttps://www.nytimes.com/2021/04/22/climate/cl",
      "contexts": [
        " on transforming our products to provide our users the most\nhelpful tools. Examples include AI Overviews, which allow users to ask their most complex questions, break down\nconcepts in a format that is useful for them, or take a video and ask a question out loud, and NotebookLM, which helps\nusers understand complex information by summarizing sources and providing relevant quotes. We are embedding the\npower of generative AI to continue helping our users express themselves and get things done. For ",
        "s, conservation organizations, and communities to better manage water resources collectively.”5\n \nYet, despite acknowledging the importance of these issues,6 our Company offers no recent reporting on its total enterprise-wide water use, nor does it\ndisclose annual water use or other risk metrics by location. In fact, Google states that its local water use information, and its water use agreements with\nlocal governments, are trade secret.7 The company has claimed that public officials cannot disc",
        "est\nensure that it is meeting its obligations to employees — especially younger employees — by appropriately mitigating climate risk in its retirement plan\ninvestments.\n \nRESOLVED: Shareholders request Alphabet publish a report disclosing how the Company is protecting plan beneficiaries — especially those with a\nlonger investment time horizon — from increased future portfolio risk created by present-day investments in high-carbon companies.\n \n \n \n(1)\nhttps://www.nytimes.com/2021/04/22/climate/cl",
        "\nalso participate in staff level discussions on the Business Roundtable’s Energy and Environment committee.\n \nWe participate in trade associations to advance the interests of our company and our stockholders. We respect the independence and agency of trade\nassociations and third parties to shape their own policy agendas, events, and advocacy positions. Our sponsorship or collaboration with an organization\ndoes not mean that we endorse its entire agenda, its events or advocacy positions, or the v",
        "\n(2,935)\n(144)%\nNet Income\n$\n18,936 \n$\n13,910 \n$\n(5,026)\n(27)%\nDiluted EPS\n$\n1.40 \n$\n1.06 \n$\n(0.34)\n(24)%\nNumber of Employees\n150,028 \n186,779\n36,751\n24 %\n•\nRevenues were $69.1 billion, an increase of 6% year over year, primarily driven by an\nincrease in Google Cloud segment revenues of $1.9 billion, or 38%, and an increase\nin Google Services segment revenues of $1.5 billion, or 2%. Hedging gains\ncontributed approximately one percentage point to consolidated revenue growth.\n•\nTotal constant curr"
      ],
      "retrieved_docs": 5,
      "top_scores": [
        17.644391739325556,
        14.554599409498667,
        12.601003222086842
      ],
      "sources": [
        "goog-20241231.pdf",
        "ALPHABET INC. DEF 14A.pdf",
        "ALPHABET INC. - DEF 14A.pdf",
        "ALPHABET INC. - DEF 14A_2.pdf",
        "goog-20220930.pdf"
      ],
      "execution_time": 0.1759200096130371,
      "k1": 1.5,
      "b": 0.75,
      "category": "financials",
      "query_id": 7,
      "difficulty": "medium"
    },
    {
      "question": "What are the company’s operating income and net income for the latest year, and what are the main reasons for any significant changes?",
      "answer": "vices\nOver the years, our Pixel phones have incorporated AI compute directly into the device and built experiences on\ntop of it. Our latest Pixel devices were built around AI, bringing the best AI-assistive experiences to our users, such as\nBest Take, Magic Editor, and Audio Magic Eraser. As we look ahead, we are designing our Android and Chrome\noperating systems with new AI-forward user experiences.\nMoonshots\nMany companies get comfortable doing what they have always done, making only increment\n\neasily explore the range of places available to determine what might be most\nhelpful to them. Our ranking systems on Search and Maps are designed to return the most relevant results from the most reliable sources. For topics\nwhere quality information is particularly important — like health — we place an even greater emphasis on factors related to expertise and\ntrustworthiness. We work hard to surface results that are relevant and reliable, and help users find what they are looking for.\n \nWhen a \n\ne for net deferred tax assets that are not likely to be realized\nrelating to certain of our Other Bets.\n88\nTable of Contents\nAlphabet Inc.\nDeferred Income Taxes\nDeferred income taxes reflect the net effects of temporary differences between the carrying amounts of assets and\nliabilities for financial reporting purposes and the amounts used for income tax purposes. Significant components of our\ndeferred tax assets and liabilities are as follows (in millions):\nAs of December 31,\n2019\n2020\nDeferred ",
      "contexts": [
        "vices\nOver the years, our Pixel phones have incorporated AI compute directly into the device and built experiences on\ntop of it. Our latest Pixel devices were built around AI, bringing the best AI-assistive experiences to our users, such as\nBest Take, Magic Editor, and Audio Magic Eraser. As we look ahead, we are designing our Android and Chrome\noperating systems with new AI-forward user experiences.\nMoonshots\nMany companies get comfortable doing what they have always done, making only increment",
        "easily explore the range of places available to determine what might be most\nhelpful to them. Our ranking systems on Search and Maps are designed to return the most relevant results from the most reliable sources. For topics\nwhere quality information is particularly important — like health — we place an even greater emphasis on factors related to expertise and\ntrustworthiness. We work hard to surface results that are relevant and reliable, and help users find what they are looking for.\n \nWhen a ",
        "e for net deferred tax assets that are not likely to be realized\nrelating to certain of our Other Bets.\n88\nTable of Contents\nAlphabet Inc.\nDeferred Income Taxes\nDeferred income taxes reflect the net effects of temporary differences between the carrying amounts of assets and\nliabilities for financial reporting purposes and the amounts used for income tax purposes. Significant components of our\ndeferred tax assets and liabilities are as follows (in millions):\nAs of December 31,\n2019\n2020\nDeferred ",
        "eeting. This proxy statement includes\ninformation that we are required to provide to you under the SEC rules and that is designed to assist you in voting your shares.\n \n2.\nWhat is included in the proxy materials?\n \nThe proxy materials include:\n \n●our proxy statement for the Annual Meeting;\n●our Annual Report, which includes our Annual Report on Form 10-K for the fiscal year ended December 31, 2022; and\n●the proxy card or a voting instruction form for the Annual Meeting.\n \n3.\nWhat information is ",
        " or enforcement actions; and be published on the company’s website by June 1, 2024.\n \nWHEREAS: Google advertising accounted for approximately 80% of Alphabet’s revenue in 2021. Alphabet’s ad business, including Google Search,\nYouTube Ads and Google Network, has grown significantly in recent years, reaching $209 billion in 2021.1\n \nAlgorithmic systems are deployed to enable the delivery of targeted advertisements, determining what users see. This often results in and exacerbates\nsystemic discrimi"
      ],
      "retrieved_docs": 5,
      "top_scores": [
        21.011876402814565,
        19.42188061394843,
        19.333059982202897
      ],
      "sources": [
        "goog-20231231.pdf",
        "ALPHABET INC. - DEF 14A.pdf",
        "goog-20201231.pdf",
        "ALPHABET INC. - DEF 14A_2.pdf",
        "ALPHABET INC. - DEF 14A_2.pdf"
      ],
      "execution_time": 0.23846793174743652,
      "k1": 1.5,
      "b": 0.75,
      "category": "financials",
      "query_id": 8,
      "difficulty": "hard"
    },
    {
      "question": "How much did the company spend on research and development (R&D) in the latest fiscal year?",
      "answer": " competition law matters and otherwise. See, for example, Alphabet’s latest Annual Report on Form 10-K filed with the SEC.\nAdditionally, the company periodically posts updates and commentary about the company’s new and ongoing legal matters, including competition\nlegal matters, on Google’s Public Policy blog.\n \nOur Board of Directors does not believe that an additional report as detailed in the proposal would enhance our stockholders’ understanding of how\nthe company oversees competition risks. \n\nves, in particular in support of artificial intelligence\n(AI) products and services;\n•\nour plans to continue to invest in new businesses, products, services and\ntechnologies, and systems, as well as to continue to invest in acquisitions and\nstrategic investments;\n•\nour pace of hiring and our plans to provide competitive compensation programs;\n•\nour expectation that our cost of revenues, research and development (R&D)\nexpenses, sales and marketing expenses, and general and administrative expenses\n\n in new businesses, products, services and\ntechnologies, systems, land and buildings for data centers and offices, and\ninfrastructure, as well as to continue to invest in acquisitions and strategic\ninvestments;\n•\nour pace of hiring and our plans to provide competitive compensation programs;\n•\nour expectation that our cost of revenues, research and development (R&D)\nexpenses, sales and marketing expenses, and general and administrative\nexpenses may increase in amount and/or may increase as a perc",
      "contexts": [
        " competition law matters and otherwise. See, for example, Alphabet’s latest Annual Report on Form 10-K filed with the SEC.\nAdditionally, the company periodically posts updates and commentary about the company’s new and ongoing legal matters, including competition\nlegal matters, on Google’s Public Policy blog.\n \nOur Board of Directors does not believe that an additional report as detailed in the proposal would enhance our stockholders’ understanding of how\nthe company oversees competition risks. ",
        "ves, in particular in support of artificial intelligence\n(AI) products and services;\n•\nour plans to continue to invest in new businesses, products, services and\ntechnologies, and systems, as well as to continue to invest in acquisitions and\nstrategic investments;\n•\nour pace of hiring and our plans to provide competitive compensation programs;\n•\nour expectation that our cost of revenues, research and development (R&D)\nexpenses, sales and marketing expenses, and general and administrative expenses",
        " in new businesses, products, services and\ntechnologies, systems, land and buildings for data centers and offices, and\ninfrastructure, as well as to continue to invest in acquisitions and strategic\ninvestments;\n•\nour pace of hiring and our plans to provide competitive compensation programs;\n•\nour expectation that our cost of revenues, research and development (R&D)\nexpenses, sales and marketing expenses, and general and administrative\nexpenses may increase in amount and/or may increase as a perc",
        "ditures;\n•\nour plans to continue to invest in new businesses, products, services and\ntechnologies, systems, land and buildings for data centers and offices, and\ninfrastructure, as well as to continue to invest in acquisitions and strategic\ninvestments;\n•\nour pace of hiring and our plans to provide competitive compensation programs;\n•\nour expectation that our cost of revenues, research and development (R&D)\nexpenses, sales and marketing expenses, and general and administrative\nexpenses may increa",
        "esses, products, services and technologies,\nsystems, land and buildings for data centers, and infrastructure, as well as to continue\nto invest in acquisitions and strategic investments;\n•\nour pace of hiring and our plans to provide competitive compensation programs;\n•\nour expectation that our cost of revenues, research and development (R&D) expenses,\nsales and marketing expenses, and general and administrative expenses may increase\nin amount and/or may increase as a percentage of revenues and ma"
      ],
      "retrieved_docs": 5,
      "top_scores": [
        16.411417208788848,
        15.463440154166063,
        15.414858690436409
      ],
      "sources": [
        "ALPHABET INC. - DEF 14A_3.pdf",
        "goog-20240630.pdf",
        "goog-20220331.pdf",
        "goog-20220630.pdf",
        "goog-20230930.pdf"
      ],
      "execution_time": 0.20441198348999023,
      "k1": 1.5,
      "b": 0.75,
      "category": "financials",
      "query_id": 9,
      "difficulty": "easy"
    },
    {
      "question": "Describe the company’s capital structure: what is the mix between debt and equity according to the balance sheet?",
      "answer": "ad vilification of police officers8 and a rise in crime across the\ncountry.9\n \nCorporate underperformance can be avoided if directors exercise greater risk oversight objectively. According to Alphabet’s Investor Relations, “the\nfundamental responsibility of the directors is to exercise their business judgment to act in what they reasonably believe to be the best interests of\nAlphabet and its stockholders,”10 but shareholders are uninformed about members’ ideological and political views. Greater \n\nidentifying the median employee, we calculated annual total compensation for the median employee according to the methodology used to report the\nannual compensation of our named executive officers in the Summary Compensation Table on page 51.\n \nALPHABET  •  2022 PROXY STATEMENT     55\n \nBack to Contents\n \nEQUITY COMPENSATION PLAN\nINFORMATION\n \nThe following table summarizes our equity compensation plan information as of December 31, 2021. Information is included for equity compensation\nplans app\n\n, caused by a decline in our share price, was offset by a new equity award granted in December 2022. For non-PEO NEOs,\nCAP amounts are generally aligned with the aforementioned measures. However, 2021 was a transition year during which their equity award mix was\nupdated to include performance-based awards, thereby reducing the target-value of grants compared to 2020. This resulted in a decline in non-PEO\nCAP for 2021 relative to 2020, despite the increase in the Company’s TSR, Net Income, and 1-",
      "contexts": [
        "ad vilification of police officers8 and a rise in crime across the\ncountry.9\n \nCorporate underperformance can be avoided if directors exercise greater risk oversight objectively. According to Alphabet’s Investor Relations, “the\nfundamental responsibility of the directors is to exercise their business judgment to act in what they reasonably believe to be the best interests of\nAlphabet and its stockholders,”10 but shareholders are uninformed about members’ ideological and political views. Greater ",
        "identifying the median employee, we calculated annual total compensation for the median employee according to the methodology used to report the\nannual compensation of our named executive officers in the Summary Compensation Table on page 51.\n \nALPHABET  •  2022 PROXY STATEMENT     55\n \nBack to Contents\n \nEQUITY COMPENSATION PLAN\nINFORMATION\n \nThe following table summarizes our equity compensation plan information as of December 31, 2021. Information is included for equity compensation\nplans app",
        ", caused by a decline in our share price, was offset by a new equity award granted in December 2022. For non-PEO NEOs,\nCAP amounts are generally aligned with the aforementioned measures. However, 2021 was a transition year during which their equity award mix was\nupdated to include performance-based awards, thereby reducing the target-value of grants compared to 2020. This resulted in a decline in non-PEO\nCAP for 2021 relative to 2020, despite the increase in the Company’s TSR, Net Income, and 1-",
        "lders to assess the proportion of the workforce subject to mandatory arbitration of employment-related together with the risks posed by the use of such provisions. Our intent with respect to “workforce” is similar to that of the Financial Reporting Council (FRC) in its UK Corporate Governance Code. According to the FRC, “This term has been carefully chosen to capture the complexity and diversity of modern contractual relationships between companies and individuals undertaking work for them. The ",
        "orting years,\n2021 was a transition year during which non-PEO NEOs’ equity award mix was updated to include performance-based awards, thereby reducing the\ntarget-value of grants compared to 2020. This resulted in a decline in non-PEO CAP for 2021 relative to 2020, despite the increase in the company’s\nTSR, Net Income, and 1-Year TSR ranking relative to the S&P 100 for 2021 relative to 2020.\n \nAlphabet 2024 Proxy Statement     59\n \nBack to Contents\nProxy Statement\nSummary &\nHighlights\nCorporate\nG"
      ],
      "retrieved_docs": 5,
      "top_scores": [
        14.706209808409518,
        13.746591205876932,
        13.733515266338811
      ],
      "sources": [
        "ALPHABET INC. - DEF 14A.pdf",
        "ALPHABET INC. DEF 14A.pdf",
        "ALPHABET INC. - DEF 14A_2.pdf",
        "lgoog2020_def14a.pdf",
        "ALPHABET INC. - DEF 14A.pdf"
      ],
      "execution_time": 0.21573138236999512,
      "k1": 1.5,
      "b": 0.75,
      "category": "financials",
      "query_id": 10,
      "difficulty": "hard"
    },
    {
      "question": "What is the company’s free cash flow in the latest year, if disclosed, and how is it calculated?",
      "answer": "ts shareholders that it is protecting fundamental freedoms that will contribute to a free and fair\nsociety and serve its diverse users and customers.\n \nResolved: Shareholders request the Board of Directors of Alphabet assess and issue a report within the next year, at reasonable cost and excluding\nconfidential information, evaluating how it oversees risks related to GenAI bias against religion (including religious views) or political views, and whether\nsuch discrimination may impact customers’, \n\n \nWe believe that algorithmic transparency can be effective — and safe — where it is focused on explaining what the algorithm is intended to do and how it\nworks in general terms. That is why we publish a number of policies and reports that provide meaningful visibility into how those services operate, as well\nas provide easy-to-use tools that put users in control, including:\n \n●An overview of How Search Works, including how we build and operate Google Search, when and why we remove content from \n\no-led Big Tech’s opposition to the Kid’s Online Safety Act (KOSA) which “would assign to platforms\nwhat it calls a “duty of care,” essentially putting a legal onus on them to take steps to address mental-health disorders, addiction-like behaviors, bullying,\nsexual exploitation and more.” It further reported that KOSA is the first major federal legislation about child safety online since 1998 and had enjoyed rare\nbipartisan support until targeted by Big Tech lobbyists.1\n \nThis is just the latest ",
      "contexts": [
        "ts shareholders that it is protecting fundamental freedoms that will contribute to a free and fair\nsociety and serve its diverse users and customers.\n \nResolved: Shareholders request the Board of Directors of Alphabet assess and issue a report within the next year, at reasonable cost and excluding\nconfidential information, evaluating how it oversees risks related to GenAI bias against religion (including religious views) or political views, and whether\nsuch discrimination may impact customers’, ",
        " \nWe believe that algorithmic transparency can be effective — and safe — where it is focused on explaining what the algorithm is intended to do and how it\nworks in general terms. That is why we publish a number of policies and reports that provide meaningful visibility into how those services operate, as well\nas provide easy-to-use tools that put users in control, including:\n \n●An overview of How Search Works, including how we build and operate Google Search, when and why we remove content from ",
        "o-led Big Tech’s opposition to the Kid’s Online Safety Act (KOSA) which “would assign to platforms\nwhat it calls a “duty of care,” essentially putting a legal onus on them to take steps to address mental-health disorders, addiction-like behaviors, bullying,\nsexual exploitation and more.” It further reported that KOSA is the first major federal legislation about child safety online since 1998 and had enjoyed rare\nbipartisan support until targeted by Big Tech lobbyists.1\n \nThis is just the latest ",
        "y.\nEnable Organizations and Developers to Innovate on Google Cloud\nAI is not only a powerful enabler, it is also a major platform shift. Globally, businesses from startups to large\nenterprises, and the public sector are thinking about how to drive transformation. That is why we are focused on\nmaking it easy and scalable for others to innovate, and grow, with AI. That means providing the most advanced\ncomputing infrastructure and expanding access to Google’s latest AI models that have been rigoro",
        "2020, CEO Sundar Pichai responded to ongoing structural racism and racist violence, including the murder of George Floyd, by announcing new\ngoals and resources. This includes goals to increase representation of underrepresented groups at senior levels and “more than double the number\nof Black+ Googlers at all other levels by 2025.” However, it is not clear how that strategy is driven by executive accountability. Clearly disclosed,\ncomprehensive links among sustainability, diversity, and executiv"
      ],
      "retrieved_docs": 5,
      "top_scores": [
        21.67743471801588,
        20.521480602266216,
        19.60574519890473
      ],
      "sources": [
        "ALPHABET INC. - DEF14A.pdf",
        "ALPHABET INC. - DEF 14A_2.pdf",
        "ALPHABET INC. - DEF14A.pdf",
        "goog-20231231.pdf",
        "ALPHABET INC. - DEF 14A_3.pdf"
      ],
      "execution_time": 0.21721982955932617,
      "k1": 1.5,
      "b": 0.75,
      "category": "financials",
      "query_id": 37,
      "difficulty": "hard"
    },
    {
      "question": "What are the top three risk factors highlighted in the Risk Factors section of the annual report?",
      "answer": "y providing insight into our management of data privacy and security risks. For example,\nour Annual Report on Form 10-K includes robust disclosures on the most significant risks we face, including risks related to user data collection, privacy,\nand security. In fact, six of our risk factors discuss these risks, and two risk factors give detailed descriptions of these risks and the steps we take to\nmanage them. Specifically, our risk factors disclose:\n \n• The adequacy of our practices with regard\n\n1A.\nRISK FACTORS                \nOur operations and financial results are subject to various risks and uncertainties,\nincluding those described in Part I, Item 1A, \"Risk Factors\" in our Annual Report on Form\n10-K for the year ended December 31, 2020, which could adversely affect our business,\nfinancial condition, results of operations, cash flows, and the trading price of our common\nand capital stock. Below are changes to our risk factors since our Annual Report on Form\n10-K for the year ended D\n\nour past results as an indication of our future\nperformance. Our quarterly, year-to-date, and annual expenses as a percentage of our\nrevenues may differ significantly from our historical rates. Our operating results in future\nquarters may fall below expectations. Any of these events could cause our stock price to fall.\nEach of the risk factors listed in this section in addition to the following factors may affect our\noperating results:\n•\nOur ability to continue to attract and retain users and cu",
      "contexts": [
        "y providing insight into our management of data privacy and security risks. For example,\nour Annual Report on Form 10-K includes robust disclosures on the most significant risks we face, including risks related to user data collection, privacy,\nand security. In fact, six of our risk factors discuss these risks, and two risk factors give detailed descriptions of these risks and the steps we take to\nmanage them. Specifically, our risk factors disclose:\n \n• The adequacy of our practices with regard",
        "1A.\nRISK FACTORS                \nOur operations and financial results are subject to various risks and uncertainties,\nincluding those described in Part I, Item 1A, \"Risk Factors\" in our Annual Report on Form\n10-K for the year ended December 31, 2020, which could adversely affect our business,\nfinancial condition, results of operations, cash flows, and the trading price of our common\nand capital stock. Below are changes to our risk factors since our Annual Report on Form\n10-K for the year ended D",
        "our past results as an indication of our future\nperformance. Our quarterly, year-to-date, and annual expenses as a percentage of our\nrevenues may differ significantly from our historical rates. Our operating results in future\nquarters may fall below expectations. Any of these events could cause our stock price to fall.\nEach of the risk factors listed in this section in addition to the following factors may affect our\noperating results:\n•\nOur ability to continue to attract and retain users and cu",
        ", in light of risk factors like\nwidespread violations of human and civil rights.\n \nAlphabet Opposing Statement\n \nIn their letter to our stockholders at the time of Google’s initial public offering in 2004, our Co-Founders, Larry and Sergey, highlighted Google’s goal\nto “develop services that significantly improve the lives of as many people as possible.” This vision continues today –we believe in technology’s\npower and potential to have a profoundly positive impact across the world.\n \nAcross Goo",
        ". Our quarterly, year-to-date, and annual expenses as a percentage of\nour revenues may differ significantly from our historical rates. Our operating results in future quarters may fall below\nexpectations. Any of these events could cause our stock price to fall. Each of the risk factors listed in this section in\naddition to the following factors may affect our operating results:\n•\nOur ability to continue to attract and retain users and customers to our products and services.\n•\nOur ability to attr"
      ],
      "retrieved_docs": 5,
      "top_scores": [
        26.14467987907383,
        25.568012371690962,
        23.360810818584675
      ],
      "sources": [
        "ALPHABET INC. DEF 14A.pdf",
        "goog-20210630.pdf",
        "goog-20200630.pdf",
        "ALPHABET INC. - DEF 14A_3.pdf",
        "Document.pdf"
      ],
      "execution_time": 0.2061901092529297,
      "k1": 1.5,
      "b": 0.75,
      "category": "risks",
      "query_id": 11,
      "difficulty": "medium"
    },
    {
      "question": "Does the company mention dependence on key suppliers or customers as a risk, and how is this described?",
      "answer": "iven our existing robust environmental and climate change reporting, our Board does not believe that the report requested by this proposal would be an\neffective use of company resources or provide additional information that would be of value to our stockholders and therefore recommends a vote\nAGAINST this proposal.\n \nWe Maintain an Effective Climate Risk Assessment Process\n \nSustainability is one of our key priorities. In April 2021, we formally expressed our support for the Task Force on Clima\n\nations. Sometimes, these issues may be caused by components we purchase from other manufacturers or\nsuppliers. If the quality of our products and services does not meet expectations or our products or services are\ndefective or require a recall, it could harm our business, reputation, financial condition, and operating results.\nWe require our suppliers and business partners to comply with laws and, where applicable, our company policies\nand practices, such as the Google Supplier Code of Conduct, \n\nndition, and operating results.\nWe require our suppliers and business partners to comply with laws and, where\napplicable, our company policies, such as the Google Supplier Code of Conduct, regarding\nworkplace and employment practices, data security, environmental compliance and\nintellectual property licensing, but we do not control them or their practices. Violations of law\nor unethical business practices could result in supply chain disruptions, canceled orders, harm\nto key relationships, and d",
      "contexts": [
        "iven our existing robust environmental and climate change reporting, our Board does not believe that the report requested by this proposal would be an\neffective use of company resources or provide additional information that would be of value to our stockholders and therefore recommends a vote\nAGAINST this proposal.\n \nWe Maintain an Effective Climate Risk Assessment Process\n \nSustainability is one of our key priorities. In April 2021, we formally expressed our support for the Task Force on Clima",
        "ations. Sometimes, these issues may be caused by components we purchase from other manufacturers or\nsuppliers. If the quality of our products and services does not meet expectations or our products or services are\ndefective or require a recall, it could harm our business, reputation, financial condition, and operating results.\nWe require our suppliers and business partners to comply with laws and, where applicable, our company policies\nand practices, such as the Google Supplier Code of Conduct, ",
        "ndition, and operating results.\nWe require our suppliers and business partners to comply with laws and, where\napplicable, our company policies, such as the Google Supplier Code of Conduct, regarding\nworkplace and employment practices, data security, environmental compliance and\nintellectual property licensing, but we do not control them or their practices. Violations of law\nor unethical business practices could result in supply chain disruptions, canceled orders, harm\nto key relationships, and d",
        "We require our suppliers and business partners to comply with laws and, where applicable, our company policies\nand practices, such as the Google Supplier Code of Conduct, regarding workplace and employment practices, data\nsecurity, environmental compliance, and intellectual property licensing, but we do not control them or their practices.\nViolations of law or unethical business practices could result in supply chain disruptions, canceled orders, harm to key\nrelationships, and damage to our repu",
        "lts.\nWe require our suppliers and business partners to comply with laws and, where applicable, our company policies,\nsuch as the Google Supplier Code of Conduct, regarding workplace and employment practices, data security,\nenvironmental compliance and intellectual property licensing, but we do not control them or their practices. Violations of\nlaw or unethical business practices could result in supply chain disruptions, canceled orders, harm to key relationships,\nand damage to our reputation. Th"
      ],
      "retrieved_docs": 5,
      "top_scores": [
        18.03257311705662,
        16.234445538671736,
        16.09160224069638
      ],
      "sources": [
        "ALPHABET INC. DEF 14A.pdf",
        "goog-20241231.pdf",
        "goog-20200930.pdf",
        "goog-20231231.pdf",
        "Document.pdf"
      ],
      "execution_time": 0.21372485160827637,
      "k1": 1.5,
      "b": 0.75,
      "category": "risks",
      "query_id": 12,
      "difficulty": "medium"
    },
    {
      "question": "How does the company describe competitive risks in its industry?",
      "answer": "ns of this CD&A describe how we think about compensation and how that affects our pay practices. Other compensation-related\ndetails that may be important considerations for our investors are discussed below.\n \nRisk Considerations\n \nThe Leadership Development and Compensation Committee reviewed our compensation programs for employees and concluded that these\nprograms do not create risks that are reasonably likely to have a material adverse effect on the company.\n \nThe Leadership Development and C\n\nts SWGs that lobby\nlike Americans for Tax Reform and Taxpayers Protection Alliance, and funds controversial nonprofits like the Competitive Enterprise Institute (CEI)3 and\nIndependent Women’s Forum (IWF).\n \nAlphabet’s lack of disclosure presents reputational risks when its lobbying contradicts company public positions. For example, Alphabet believes in\naddressing climate change, but the Chamber and CEI undermined the Paris climate accord. Alphabet signed a statement opposing state voter\nrestrict\n\nhether the Company is failing to disclose these potential liabilities as material\nrisks in its public filings. There is currently no single source providing shareholders the information sought by this resolution.\n \nAlphabet Opposing Statement\n \nOur Board has considered this proposal and, for the reasons set forth below, does not believe that it is in the best interests of our company and our\nstockholders and recommends a vote AGAINST this proposal.\n \nWe Are Committed to Robust Information Govern",
      "contexts": [
        "ns of this CD&A describe how we think about compensation and how that affects our pay practices. Other compensation-related\ndetails that may be important considerations for our investors are discussed below.\n \nRisk Considerations\n \nThe Leadership Development and Compensation Committee reviewed our compensation programs for employees and concluded that these\nprograms do not create risks that are reasonably likely to have a material adverse effect on the company.\n \nThe Leadership Development and C",
        "ts SWGs that lobby\nlike Americans for Tax Reform and Taxpayers Protection Alliance, and funds controversial nonprofits like the Competitive Enterprise Institute (CEI)3 and\nIndependent Women’s Forum (IWF).\n \nAlphabet’s lack of disclosure presents reputational risks when its lobbying contradicts company public positions. For example, Alphabet believes in\naddressing climate change, but the Chamber and CEI undermined the Paris climate accord. Alphabet signed a statement opposing state voter\nrestrict",
        "hether the Company is failing to disclose these potential liabilities as material\nrisks in its public filings. There is currently no single source providing shareholders the information sought by this resolution.\n \nAlphabet Opposing Statement\n \nOur Board has considered this proposal and, for the reasons set forth below, does not believe that it is in the best interests of our company and our\nstockholders and recommends a vote AGAINST this proposal.\n \nWe Are Committed to Robust Information Govern",
        "nificance of privacy, regulatory scrutiny is likely to only increase going forward. Companies who wish to\nremain competitive must stay ahead of the regulatory curve by proactively managing, mitigating, and disclosing information about such issues.\n \nAlphabet is particularly exposed to these risks. Unfortunately, the company may not be adequately managing these risks and lacks transparency in its\nhandling of such issues, as evidenced by multiple Congressional inquiries regarding the Company’s dat",
        "rom Search, except in very limited circumstances, such as illegal content. Our collection of blog\nposts on How Search Works describe how we build and operate Google Search, when and why we remove content from search results, how we\nupdate our systems to improve results, and how Google’s Search Quality Rater Guidelines help improve search quality around the world. The Search\nRater Guidelines are also designed to prevent bias entering into the testing process. They explicitly state that “[r]atings"
      ],
      "retrieved_docs": 5,
      "top_scores": [
        15.677774101729081,
        14.151853252388003,
        13.991683972819134
      ],
      "sources": [
        "ALPHABET INC. - DEF 14A_3.pdf",
        "ALPHABET INC. DEF 14A.pdf",
        "ALPHABET INC. DEF 14A.pdf",
        "ALPHABET INC. DEF 14A.pdf",
        "ALPHABET INC. - DEF 14A_2.pdf"
      ],
      "execution_time": 0.17450881004333496,
      "k1": 1.5,
      "b": 0.75,
      "category": "risks",
      "query_id": 13,
      "difficulty": "medium"
    },
    {
      "question": "Are there any legal or regulatory proceedings disclosed that could materially affect the company’s financial position?",
      "answer": "cy of our sources of funding;\n•\nour potential exposure in connection with new and pending investigations, proceedings, and other\ncontingencies, including the possibility that certain legal proceedings to which we are a party could harm our\nbusiness, financial condition, and operating results;\n•\nour expectation that we will continue to face heightened regulatory scrutiny and changes in regulatory\nconditions, laws, and public policies, which could affect our business practices and financial result\n\nings, and other contingencies, including the possibility that certain legal\nproceedings to which we are a party could harm our business, financial condition, and\noperating results;\n3\nTable of Contents\nAlphabet Inc.\n•\nour expectation that we will continue to face heightened regulatory scrutiny, and\nchanges in regulatory conditions, laws, and public policies, which could affect our\nbusiness practices and financial results;\n•\nthe expected timing, amount, and effect of Alphabet Inc.'s share repurcha\n\ntation, financial condition, and operating results.\nAny of these legal proceedings could result in legal costs, diversion of management resources, negative publicity\nand other harms to our business. Estimating liabilities for our pending proceedings is a complex, fact-specific, and\nspeculative process that requires significant judgment, and the amounts we are ultimately liable for may be less than or\nexceed our estimates. The resolution of one or more such proceedings has resulted in, and may in",
      "contexts": [
        "cy of our sources of funding;\n•\nour potential exposure in connection with new and pending investigations, proceedings, and other\ncontingencies, including the possibility that certain legal proceedings to which we are a party could harm our\nbusiness, financial condition, and operating results;\n•\nour expectation that we will continue to face heightened regulatory scrutiny and changes in regulatory\nconditions, laws, and public policies, which could affect our business practices and financial result",
        "ings, and other contingencies, including the possibility that certain legal\nproceedings to which we are a party could harm our business, financial condition, and\noperating results;\n3\nTable of Contents\nAlphabet Inc.\n•\nour expectation that we will continue to face heightened regulatory scrutiny, and\nchanges in regulatory conditions, laws, and public policies, which could affect our\nbusiness practices and financial results;\n•\nthe expected timing, amount, and effect of Alphabet Inc.'s share repurcha",
        "tation, financial condition, and operating results.\nAny of these legal proceedings could result in legal costs, diversion of management resources, negative publicity\nand other harms to our business. Estimating liabilities for our pending proceedings is a complex, fact-specific, and\nspeculative process that requires significant judgment, and the amounts we are ultimately liable for may be less than or\nexceed our estimates. The resolution of one or more such proceedings has resulted in, and may in",
        "eputation, financial condition, and operating\nresults.\nFor additional information about the ongoing material legal proceedings to which we are subject, see Legal\nProceedings in Item 3 of this Annual Report on Form 10-K.\nPrivacy, data protection, data usage, and portability regulations are complex and rapidly evolving areas.\nAny failure or alleged failure to comply with these laws could harm our business, reputation, financial\ncondition, and operating results.\nAuthorities around the world have ad",
        "ude all adjustments of a normal recurring nature necessary for fair financial\nstatement presentation. Interim results are not necessarily indicative of the results to be\nexpected for the full year ending December  31, 2025. We have made estimates and\nassumptions that affect the amounts reported and disclosed in the financial statements and\nthe accompanying notes. Actual results could differ materially from these estimates.\nThese consolidated financial statements and other information presented i"
      ],
      "retrieved_docs": 5,
      "top_scores": [
        26.243642448967947,
        26.17580007896919,
        23.67080183444893
      ],
      "sources": [
        "goog-20231231.pdf",
        "goog-20250331.pdf",
        "goog-20231231.pdf",
        "goog-20241231.pdf",
        "goog-20250930.pdf"
      ],
      "execution_time": 0.2048170566558838,
      "k1": 1.5,
      "b": 0.75,
      "category": "risks",
      "query_id": 14,
      "difficulty": "hard"
    },
    {
      "question": "Who are the key executive officers of the company according to the latest proxy statement or annual report?",
      "answer": "identifying the median employee, we calculated annual total compensation for the median employee according to the methodology used to report the\nannual compensation of our named executive officers in the Summary Compensation Table on page 51.\n \nALPHABET  •  2022 PROXY STATEMENT     55\n \nBack to Contents\n \nEQUITY COMPENSATION PLAN\nINFORMATION\n \nThe following table summarizes our equity compensation plan information as of December 31, 2021. Information is included for equity compensation\nplans app\n\nected the employee with the median award value. After identifying the median employee, we calculated annual total\ncompensation for the median employee according to the methodology used to report the annual compensation of our named\nexecutive officers in the Summary Compensation Table on page 44.\n \nALPHABET • 2021 PROXY STATEMENT\n48\n \nBack to Contents\nEQUITY COMPENSATION PLAN\nINFORMATION\n \nThe following table summarizes our equity compensation plan information as of December 31, 2020. Information\n\n\n  101\nInformation Concerning Alphabet’s Annual Meeting of Stockholders\n  103\n \nAlphabet 2025 Proxy Statement     15\n \nBack to Contents\nProxy Statement\nSummary &\nHighlights\nCorporate\nGovernance\nDirector and\nExecutive\nCompensation\nAudit Matters\nProposals\nQ&A\n \nDirectors, Executive Officers, and Corporate Governance\n \nDirectors and Executive Officers\n \nOur Board of Directors (our Board) is composed of highly experienced leaders who have shaped prominent global organizations and institutions. Our\nB",
      "contexts": [
        "identifying the median employee, we calculated annual total compensation for the median employee according to the methodology used to report the\nannual compensation of our named executive officers in the Summary Compensation Table on page 51.\n \nALPHABET  •  2022 PROXY STATEMENT     55\n \nBack to Contents\n \nEQUITY COMPENSATION PLAN\nINFORMATION\n \nThe following table summarizes our equity compensation plan information as of December 31, 2021. Information is included for equity compensation\nplans app",
        "ected the employee with the median award value. After identifying the median employee, we calculated annual total\ncompensation for the median employee according to the methodology used to report the annual compensation of our named\nexecutive officers in the Summary Compensation Table on page 44.\n \nALPHABET • 2021 PROXY STATEMENT\n48\n \nBack to Contents\nEQUITY COMPENSATION PLAN\nINFORMATION\n \nThe following table summarizes our equity compensation plan information as of December 31, 2020. Information",
        "\n  101\nInformation Concerning Alphabet’s Annual Meeting of Stockholders\n  103\n \nAlphabet 2025 Proxy Statement     15\n \nBack to Contents\nProxy Statement\nSummary &\nHighlights\nCorporate\nGovernance\nDirector and\nExecutive\nCompensation\nAudit Matters\nProposals\nQ&A\n \nDirectors, Executive Officers, and Corporate Governance\n \nDirectors and Executive Officers\n \nOur Board of Directors (our Board) is composed of highly experienced leaders who have shaped prominent global organizations and institutions. Our\nB",
        "more than one individual at the median level, we\nassessed the grant date fair value of standard equity awards for these individuals and selected the employee with the median award value. After\nidentifying the median employee, we calculated annual total compensation for the median employee according to the methodology used to report the\nannual total compensation of our named executive officers in the 2022 Summary Compensation Table on page 53.\n \nALPHABET ● 2023 PROXY STATEMENT        57\n \nBack to",
        "\n \nAs of the date of this proxy statement, no awards have been made under the 2021 Stock Plan. The benefits or amounts that will be received by or\nallocated to each named executive officer, all current executive officers as a group, all directors who are not executive officers as a group, and all\nemployees who are not executive officers as a group under the 2021 Stock Plan are not presently determinable.\n \nRequired Vote\n \nApproval of the 2021 Stock Plan requires the affirmative “FOR” vote of the"
      ],
      "retrieved_docs": 5,
      "top_scores": [
        23.710607218120536,
        23.495551344023788,
        23.239362518864407
      ],
      "sources": [
        "ALPHABET INC. DEF 14A.pdf",
        "ALPHABET INC. - DEF 14A_3.pdf",
        "ALPHABET INC. - DEF14A.pdf",
        "ALPHABET INC. - DEF 14A_2.pdf",
        "ALPHABET INC. - DEF 14A_3.pdf"
      ],
      "execution_time": 0.2111799716949463,
      "k1": 1.5,
      "b": 0.75,
      "category": "governance",
      "query_id": 15,
      "difficulty": "easy"
    },
    {
      "question": "How is the board of directors structured (size, independence, key committees)?",
      "answer": "lishing selection criteria that reflect our business strategies, identifying and developing internal candidates to ensure the continuity of our culture, and making key management succession decisions. Management succession is regularly discussed by the directors in board meetings and in executive sessions of the Board of Directors. Directors become familiar with potential successors for key management positions through various means, including regular organization and talent reviews, presentatio\n\nequirements or other securities regulations. This includes regulations related to director independence, committee composition, and the maintenance of an audit committee financial expert.\nBack to Contents\nOur Board of Directors believes that current nominating and voting procedures for election to our Board of Directors, as opposed to a mandated majority voting standard, provide the Board the flexibility to appropriately respond to stockholder interests without the risk of potential corporate go\n\ne Board of Directors is ultimately responsible for risk oversight at Alphabet, our Board of\nDirectors has delegated to its committees oversight of risks associated with their respective areas of responsibility, as summarized below. When\nappropriate, the committees provide reports to the full Board of Directors on these and other areas for review. Each committee meets in executive\nsession with key management personnel and representatives of outside advisors as needed.\n \nIn particular, the Board o",
      "contexts": [
        "lishing selection criteria that reflect our business strategies, identifying and developing internal candidates to ensure the continuity of our culture, and making key management succession decisions. Management succession is regularly discussed by the directors in board meetings and in executive sessions of the Board of Directors. Directors become familiar with potential successors for key management positions through various means, including regular organization and talent reviews, presentatio",
        "equirements or other securities regulations. This includes regulations related to director independence, committee composition, and the maintenance of an audit committee financial expert.\nBack to Contents\nOur Board of Directors believes that current nominating and voting procedures for election to our Board of Directors, as opposed to a mandated majority voting standard, provide the Board the flexibility to appropriately respond to stockholder interests without the risk of potential corporate go",
        "e Board of Directors is ultimately responsible for risk oversight at Alphabet, our Board of\nDirectors has delegated to its committees oversight of risks associated with their respective areas of responsibility, as summarized below. When\nappropriate, the committees provide reports to the full Board of Directors on these and other areas for review. Each committee meets in executive\nsession with key management personnel and representatives of outside advisors as needed.\n \nIn particular, the Board o",
        " \nOur Board of Directors believes that the directors and the Chief Executive Officer should collaborate on succession planning and that the entire\nBoard of Directors should be involved in the critical aspects of the management succession planning process, including establishing selection criteria\nthat reflect our business strategies, identifying and developing internal candidates to ensure the continuity of our culture, and making key\nmanagement succession decisions.\n \nManagement succession is r",
        "succession decisions.\n \nManagement succession is regularly discussed by the directors in meetings and in executive sessions of the Board of Directors. Directors become\nfamiliar with potential successors for key management positions through various means, including regular organization and talent reviews,\npresentations to the Board of Directors, and informal meetings.\n \nBoard’s Role in Risk Oversight\n \nThe Board of Directors, as a whole and through its committees, has responsibility for oversight"
      ],
      "retrieved_docs": 5,
      "top_scores": [
        15.603873016449604,
        14.8745132059167,
        14.616607128869898
      ],
      "sources": [
        "lgoog2020_def14a.pdf",
        "lgoog2020_def14a.pdf",
        "ALPHABET INC. - DEF 14A_3.pdf",
        "ALPHABET INC. - DEF 14A_3.pdf",
        "ALPHABET INC. - DEF 14A_3.pdf"
      ],
      "execution_time": 0.1774590015411377,
      "k1": 1.5,
      "b": 0.75,
      "category": "governance",
      "query_id": 16,
      "difficulty": "medium"
    },
    {
      "question": "What performance metrics are used to determine executive compensation?",
      "answer": "that the Compensation Committee should retain its flexibility in determining\nwhat particular performance metrics to use to best increase stockholder value. The Compensation Committee adjusts its assessments as necessary to\nstay competitive and attract, retain, and motivate highly-qualified executive officers.\n \nOur Board believes that our current executive compensation policies and practices are appropriate and effective, serve the best interests of our\nstockholders, and advance the objectives o\n\n with this policy shall be excused if it would cause the company to violate any existing contractual obligations or the terms of any\ncompensation plan, but shall apply to future employment agreements and plans.\n \nSUPPORTING STATEMENT\n \nSenior executive pay should be aligned with operational results and the individual contributions of senior executives, not financial engineering. Stock\nbuybacks directly affect many of the financial ratios used as performance metrics for incentive pay of senior ex\n\narm reduction performance metrics for investors and\nstakeholders to judge the effectiveness of Alphabet’s announced tools, policies and actions.\n \nResolved: Shareholders request that the Board of Directors publishes a report (prepared at reasonable expense, excluding proprietary information) that\nincludes quantitative metrics appropriate to assessing whether and how Alphabet/YouTube has improved its performance globally regarding child safety\nimpacts and actual harm reduction to children on its ",
      "contexts": [
        "that the Compensation Committee should retain its flexibility in determining\nwhat particular performance metrics to use to best increase stockholder value. The Compensation Committee adjusts its assessments as necessary to\nstay competitive and attract, retain, and motivate highly-qualified executive officers.\n \nOur Board believes that our current executive compensation policies and practices are appropriate and effective, serve the best interests of our\nstockholders, and advance the objectives o",
        " with this policy shall be excused if it would cause the company to violate any existing contractual obligations or the terms of any\ncompensation plan, but shall apply to future employment agreements and plans.\n \nSUPPORTING STATEMENT\n \nSenior executive pay should be aligned with operational results and the individual contributions of senior executives, not financial engineering. Stock\nbuybacks directly affect many of the financial ratios used as performance metrics for incentive pay of senior ex",
        "arm reduction performance metrics for investors and\nstakeholders to judge the effectiveness of Alphabet’s announced tools, policies and actions.\n \nResolved: Shareholders request that the Board of Directors publishes a report (prepared at reasonable expense, excluding proprietary information) that\nincludes quantitative metrics appropriate to assessing whether and how Alphabet/YouTube has improved its performance globally regarding child safety\nimpacts and actual harm reduction to children on its ",
        "easily explore the range of places available to determine what might be most\nhelpful to them. Our ranking systems on Search and Maps are designed to return the most relevant results from the most reliable sources. For topics\nwhere quality information is particularly important — like health — we place an even greater emphasis on factors related to expertise and\ntrustworthiness. We work hard to surface results that are relevant and reliable, and help users find what they are looking for.\n \nWhen a ",
        "e considers Alphabet’s stock repurchase approvals, as well as current outstanding\nrepurchase authorizations and historical stock repurchase trends, when setting performance metrics for executive compensation awards. This proposal\nwould limit our ability to align our executive compensation arrangements with our overall capital allocation strategy and would unduly restrict our ability to\nuse all tools at our disposal to maximize alignment with our stockholders’ interests.\n \nIt is unclear how this "
      ],
      "retrieved_docs": 5,
      "top_scores": [
        18.69636060286772,
        14.204112354368398,
        12.595083674329114
      ],
      "sources": [
        "ALPHABET INC. - DEF14A.pdf",
        "ALPHABET INC. - DEF14A.pdf",
        "ALPHABET INC. - DEF14A.pdf",
        "ALPHABET INC. - DEF 14A.pdf",
        "ALPHABET INC. - DEF14A.pdf"
      ],
      "execution_time": 0.14864301681518555,
      "k1": 1.5,
      "b": 0.75,
      "category": "governance",
      "query_id": 17,
      "difficulty": "hard"
    },
    {
      "question": "Does the company mention any recent changes in leadership or the board, and what are the reasons?",
      "answer": "s, conservation organizations, and communities to better manage water resources collectively.”5\n \nYet, despite acknowledging the importance of these issues,6 our Company offers no recent reporting on its total enterprise-wide water use, nor does it\ndisclose annual water use or other risk metrics by location. In fact, Google states that its local water use information, and its water use agreements with\nlocal governments, are trade secret.7 The company has claimed that public officials cannot disc\n\ny delegate to a subcommittee of one or more members of our Board of Directors or\nemployees of the Company the authority to grant incentive awards, subject to such limitations as the Leadership Development and Compensation\nCommittee shall specify and to the requirements of applicable law.\n \nEligibility\n \nAny employee or consultant of, or person who renders services directly or indirectly to, the Company and any member of our Board of Directors is\neligible for selection by the Leadership Developme\n\ne with the SEC, and any references to our\nwebsites are intended to be inactive textual references only.\nITEM 3.\nQUANTITATIVE AND QUALITATIVE DISCLOSURES ABOUT MARKET\nRISK\nWe are exposed to financial market risks, including changes in foreign currency\nexchange rates, interest rates and equity investment risks. Due to recent financial market\nmovements and changes to our expectations of near-term possible movements caused by the\nimpact of COVID-19, we are providing an update to the disclosures made",
      "contexts": [
        "s, conservation organizations, and communities to better manage water resources collectively.”5\n \nYet, despite acknowledging the importance of these issues,6 our Company offers no recent reporting on its total enterprise-wide water use, nor does it\ndisclose annual water use or other risk metrics by location. In fact, Google states that its local water use information, and its water use agreements with\nlocal governments, are trade secret.7 The company has claimed that public officials cannot disc",
        "y delegate to a subcommittee of one or more members of our Board of Directors or\nemployees of the Company the authority to grant incentive awards, subject to such limitations as the Leadership Development and Compensation\nCommittee shall specify and to the requirements of applicable law.\n \nEligibility\n \nAny employee or consultant of, or person who renders services directly or indirectly to, the Company and any member of our Board of Directors is\neligible for selection by the Leadership Developme",
        "e with the SEC, and any references to our\nwebsites are intended to be inactive textual references only.\nITEM 3.\nQUANTITATIVE AND QUALITATIVE DISCLOSURES ABOUT MARKET\nRISK\nWe are exposed to financial market risks, including changes in foreign currency\nexchange rates, interest rates and equity investment risks. Due to recent financial market\nmovements and changes to our expectations of near-term possible movements caused by the\nimpact of COVID-19, we are providing an update to the disclosures made",
        "ed officers of the\nCompany for the taxable year, and any other individual who was a covered employee of the company for the preceding tax year beginning after\nDecember 31, 2016.\n \nTHE FOREGOING IS ONLY A SUMMARY OF THE EFFECT OF U.S. FEDERAL INCOME TAXATION WITH RESPECT TO THE GRANT AND\nEXERCISE OF AWARDS UNDER THE PLAN. IT DOES NOT PURPORT TO BE COMPLETE AND DOES NOT DISCUSS THE TAX CONSEQUENCES\nOF AN INDIVIDUAL’S DEATH OR THE PROVISIONS OF THE INCOME TAX LAWS OF ANY MUNICIPALITY, STATE OR FORE",
        " or enforcement actions; and be published on the company’s website by June 1, 2024.\n \nWHEREAS: Google advertising accounted for approximately 80% of Alphabet’s revenue in 2021. Alphabet’s ad business, including Google Search,\nYouTube Ads and Google Network, has grown significantly in recent years, reaching $209 billion in 2021.1\n \nAlgorithmic systems are deployed to enable the delivery of targeted advertisements, determining what users see. This often results in and exacerbates\nsystemic discrimi"
      ],
      "retrieved_docs": 5,
      "top_scores": [
        16.78366111129287,
        15.50754052632173,
        14.52372504827709
      ],
      "sources": [
        "ALPHABET INC. DEF 14A.pdf",
        "ALPHABET INC. - DEF 14A_3.pdf",
        "goog-20200331.pdf",
        "ALPHABET INC. - DEF 14A_2.pdf",
        "ALPHABET INC. - DEF 14A_2.pdf"
      ],
      "execution_time": 0.2089710235595703,
      "k1": 1.5,
      "b": 0.75,
      "category": "governance",
      "query_id": 18,
      "difficulty": "medium"
    },
    {
      "question": "Are there any shareholder proposals or significant voting results discussed in the proxy statement?",
      "answer": " SEC rules and that is designed to assist you in voting your shares. 2. What is included in the proxy materials? The proxy materials include: •our proxy statement for the Annual Meeting; •our Annual Report, which includes our Annual Report on Form 10-K for the fiscal year ended December 31, 2019; and •the proxy card or a voting instruction form for the Annual Meeting. 3. What information is contained in this proxy statement? The information in this proxy statement relates to the proposals to be \n\ns?\n \nThe proxy materials include:\n \n \n• this proxy statement;\n \n• our 2024 Annual Report to Stockholders, which includes our Annual Report on Form 10-K for the fiscal year ended December 31, 2024; and\n \n• the proxy card or a voting instruction form for the Annual Meeting.\n \n3.\nWhat information is contained in this proxy statement?\n \nThe information in this proxy statement relates to the proposals to be voted on at the Annual Meeting, the voting process, the compensation of our\ndirectors and cert\n\ns proxy statement?\n \nThe information in this proxy statement relates to the proposals to be voted on at the Annual Meeting, the voting process, the compensation of our\ndirectors and certain of our executive officers, corporate governance, and certain other required information.\n \n4.\nWhy did I receive a notice in the mail regarding the Internet availability of proxy\nmaterials instead of a full set of proxy materials?\n \nIn accordance with rules adopted by the SEC, we may furnish proxy materials, i",
      "contexts": [
        " SEC rules and that is designed to assist you in voting your shares. 2. What is included in the proxy materials? The proxy materials include: •our proxy statement for the Annual Meeting; •our Annual Report, which includes our Annual Report on Form 10-K for the fiscal year ended December 31, 2019; and •the proxy card or a voting instruction form for the Annual Meeting. 3. What information is contained in this proxy statement? The information in this proxy statement relates to the proposals to be ",
        "s?\n \nThe proxy materials include:\n \n \n• this proxy statement;\n \n• our 2024 Annual Report to Stockholders, which includes our Annual Report on Form 10-K for the fiscal year ended December 31, 2024; and\n \n• the proxy card or a voting instruction form for the Annual Meeting.\n \n3.\nWhat information is contained in this proxy statement?\n \nThe information in this proxy statement relates to the proposals to be voted on at the Annual Meeting, the voting process, the compensation of our\ndirectors and cert",
        "s proxy statement?\n \nThe information in this proxy statement relates to the proposals to be voted on at the Annual Meeting, the voting process, the compensation of our\ndirectors and certain of our executive officers, corporate governance, and certain other required information.\n \n4.\nWhy did I receive a notice in the mail regarding the Internet availability of proxy\nmaterials instead of a full set of proxy materials?\n \nIn accordance with rules adopted by the SEC, we may furnish proxy materials, i",
        " for the Annual Meeting.\n \n3.\nWhat information is contained in this proxy statement?\n \nThe information in this proxy statement relates to the proposals to be voted on at the Annual Meeting, the voting process, the compensation of our\ndirectors and certain of our executive officers, corporate governance, and certain other required information.\n \n4.\nWhy did I receive a notice in the mail regarding the Internet availability of proxy\nmaterials instead of a full set of proxy materials?\n \nIn accordanc",
        " in voting your shares.\n \n \n \n2.\nWhat is included in the proxy materials?\n \n \n \n \nThe proxy materials include:\n \n \n \n \n• our proxy statement for the Annual Meeting;\n \n \n \n \n• our Annual Report, which includes our Annual Report on Form 10-K for the fiscal year ended December 31, 2023; and\n \n \n \n \n• the proxy card or a voting instruction form for the Annual Meeting.\n \n \n \n3.\nWhat information is contained in this proxy statement?\n \n \n \n \nThe information in this proxy statement relates to the propos"
      ],
      "retrieved_docs": 5,
      "top_scores": [
        21.780243622732705,
        21.64452826245732,
        19.423157058464604
      ],
      "sources": [
        "lgoog2020_def14a.pdf",
        "ALPHABET INC. - DEF14A.pdf",
        "ALPHABET INC. DEF 14A.pdf",
        "ALPHABET INC. - DEF 14A_2.pdf",
        "ALPHABET INC. - DEF 14A.pdf"
      ],
      "execution_time": 0.19185996055603027,
      "k1": 1.5,
      "b": 0.75,
      "category": "governance",
      "query_id": 38,
      "difficulty": "hard"
    },
    {
      "question": "What are the company’s main strategic priorities for the next few years as described by management?",
      "answer": "ing Amazon.com, Citigroup, and Home Depot.\n \nSeveral actions by Alphabet employees over the last few years highlight the risks posed by a corporate culture that is out of alignment with the values of\nits employees:\n \n \n• In 2018, thousands of Alphabet employees signed petitions opposing the Company’s involvement in censorship (“Project Dragonfly”) and in\ndeveloping military technology (“Project Maven”). Moreover, approximately 20,000 employees and contractors staged a walkout to protest how the\n\n\nover the next few years. We completed the implementation of certain\nof our subledgers, which included changes to our processes, procedures and internal controls over financial reporting\nduring the second quarter of 2021. There have been no changes in our internal control over financial reporting that\noccurred during the quarter ended December  31, 2021 that have materially affected, or are reasonably likely to\nmaterially affect, our internal control over financial reporting. However, as the phas\n\nation, improve data management and provide\ntimely information to our management team. To date, significant progress has been made\nwith the implementation of various modules. Additional implementation activities are\nexpected to continue in phases over the next few years. There have been no changes in\nour internal control over financial reporting that occurred during the quarter ended June 30,\n2022 that have materially affected, or are reasonably likely to materially affect, our internal\ncontrol o",
      "contexts": [
        "ing Amazon.com, Citigroup, and Home Depot.\n \nSeveral actions by Alphabet employees over the last few years highlight the risks posed by a corporate culture that is out of alignment with the values of\nits employees:\n \n \n• In 2018, thousands of Alphabet employees signed petitions opposing the Company’s involvement in censorship (“Project Dragonfly”) and in\ndeveloping military technology (“Project Maven”). Moreover, approximately 20,000 employees and contractors staged a walkout to protest how the\n",
        "over the next few years. We completed the implementation of certain\nof our subledgers, which included changes to our processes, procedures and internal controls over financial reporting\nduring the second quarter of 2021. There have been no changes in our internal control over financial reporting that\noccurred during the quarter ended December  31, 2021 that have materially affected, or are reasonably likely to\nmaterially affect, our internal control over financial reporting. However, as the phas",
        "ation, improve data management and provide\ntimely information to our management team. To date, significant progress has been made\nwith the implementation of various modules. Additional implementation activities are\nexpected to continue in phases over the next few years. There have been no changes in\nour internal control over financial reporting that occurred during the quarter ended June 30,\n2022 that have materially affected, or are reasonably likely to materially affect, our internal\ncontrol o",
        "rk\nequipment, to support the long-term growth of our business.\nIn addition, acquisitions and strategic investments are an important part of our strategy and use of capital,\ncontributing to the breadth and depth of our offerings, expanding our expertise in engineering and other functional\nareas, and building strong partnerships around strategic initiatives. For example, in 2020 we announced our Google for\nIndia Digitization Fund to invest approximately $10 billion into India over the next 5-7 yea",
        "anton, MA 02021), by telephoning shareholder services 1-866-298-8535 (toll\nfree within the USA, US territories and Canada), or 1-781-575-2879 or by visiting Investor Centre™ portal at www.computershare.com/investor.\n \n—\nSTOCKHOLDER PROPOSALS, DIRECTOR NOMINATIONS, AND RELATED\nBYLAW PROVISIONS\n \n27. What is the deadline to propose actions for consideration at next year’s Annual Meeting\nof Stockholders or to nominate individuals to serve as directors?\n \nStockholder Proposals: Stockholders may pres"
      ],
      "retrieved_docs": 5,
      "top_scores": [
        17.73164899866255,
        14.49881008786086,
        14.192457932997705
      ],
      "sources": [
        "ALPHABET INC. DEF 14A.pdf",
        "goog-20211231.pdf",
        "goog-20220630.pdf",
        "goog-20201231.pdf",
        "ALPHABET INC. - DEF 14A_2.pdf"
      ],
      "execution_time": 0.20121192932128906,
      "k1": 1.5,
      "b": 0.75,
      "category": "strategy",
      "query_id": 19,
      "difficulty": "medium"
    },
    {
      "question": "How does the company plan to allocate capital (e.g., investments, dividends, share buybacks, debt repayment)?",
      "answer": "s spent a combined total of $795 billion on stock repurchases and another $588 billion on dividends, totaling more than\n85 percent of their reported earnings.2 This is a concern because retained earnings are a primary source of new investment. Academic research has\nshown that stock buybacks decrease capital expenditures and R&D spending, resulting in lower market-to-book ratios, profitability, innovation, and\ngrowth in the long run.3\n \nOur company spent $62.2 on share buybacks in 2023, but only \n\n868 \n306\n50,192 \nTotal share repurchases\n528 $\n62,184 \n379 $\n62,047 \nShares repurchased include unsettled repurchases.\nRepurchases are executed from time to time, subject to general business and market conditions and other\ninvestment opportunities, through open market purchases or privately negotiated transactions, including through Rule\n10b5-1 plans. The repurchase program does not have an expiration date.\nDividends\nDuring the year ended December 31, 2024, total cash dividends, which were first\n\nr 31, 2024, total cash dividends, which were first paid in June 2024, were $3.5\nbillion, $519 million, and $3.3 billion for Class A, Class B, and Class C shares, respectively.\nThe company intends to pay quarterly cash dividends in the future, subject to review and approval by the\ncompany’s Board of Directors in its sole discretion.\nNote 12. Net Income Per Share\nWe compute net income per share of Class A, Class B, and Class C stock using the two-class method. Basic net\nincome per share is compute",
      "contexts": [
        "s spent a combined total of $795 billion on stock repurchases and another $588 billion on dividends, totaling more than\n85 percent of their reported earnings.2 This is a concern because retained earnings are a primary source of new investment. Academic research has\nshown that stock buybacks decrease capital expenditures and R&D spending, resulting in lower market-to-book ratios, profitability, innovation, and\ngrowth in the long run.3\n \nOur company spent $62.2 on share buybacks in 2023, but only ",
        "868 \n306\n50,192 \nTotal share repurchases\n528 $\n62,184 \n379 $\n62,047 \nShares repurchased include unsettled repurchases.\nRepurchases are executed from time to time, subject to general business and market conditions and other\ninvestment opportunities, through open market purchases or privately negotiated transactions, including through Rule\n10b5-1 plans. The repurchase program does not have an expiration date.\nDividends\nDuring the year ended December 31, 2024, total cash dividends, which were first",
        "r 31, 2024, total cash dividends, which were first paid in June 2024, were $3.5\nbillion, $519 million, and $3.3 billion for Class A, Class B, and Class C shares, respectively.\nThe company intends to pay quarterly cash dividends in the future, subject to review and approval by the\ncompany’s Board of Directors in its sole discretion.\nNote 12. Net Income Per Share\nWe compute net income per share of Class A, Class B, and Class C stock using the two-class method. Basic net\nincome per share is compute",
        ".\nWe engage in share repurchases from time to time. In July 2019 the Board of Directors\nof Alphabet authorized the company to repurchase up to $25.0 billion of its Class C capital\nstock, which was completed during the third quarter of 2020. In July 2020, the Board of\nDirectors of Alphabet authorized the company to repurchase up to an additional $28.0 billion\nof its Class C capital stock. As of September  30, 2020, $25.5 billion remains available for\nrepurchase. Our repurchase program does not ha",
        "employee assistance programs (e.g., confidential counseling), matching gift program, and paid time off. We also pay life insurance\npremiums for all employees (other than Larry and Sergey).\n \nIn addition, we maintain a tax-qualified 401(k) retirement savings plan with both pre-tax and after-tax Roth savings features for eligible employees,\nincluding our named executive officers. In 2021, we provided a company match equal to the greater of 100% of contributions up to $3,000, or 50% of\n$19,500, the"
      ],
      "retrieved_docs": 5,
      "top_scores": [
        15.36894959997397,
        14.822165317982666,
        14.318211484112485
      ],
      "sources": [
        "ALPHABET INC. - DEF14A.pdf",
        "goog-20241231.pdf",
        "goog-20241231.pdf",
        "goog-20200930.pdf",
        "ALPHABET INC. DEF 14A.pdf"
      ],
      "execution_time": 0.19175982475280762,
      "k1": 1.5,
      "b": 0.75,
      "category": "strategy",
      "query_id": 20,
      "difficulty": "hard"
    },
    {
      "question": "Which acquisitions, divestitures, or major investments were completed during the reporting period?",
      "answer": "over the next few years. We completed the implementation of certain\nof our subledgers, which included changes to our processes, procedures and internal controls over financial reporting\nduring the second quarter of 2021. There have been no changes in our internal control over financial reporting that\noccurred during the quarter ended December  31, 2021 that have materially affected, or are reasonably likely to\nmaterially affect, our internal control over financial reporting. However, as the phas\n\nl reporting systems, was completed during the third quarter of 2020.\nThere have been no changes in our internal control over financial reporting that occurred during the quarter ended\nDecember 31, 2020 that have materially affected, or are reasonably likely to materially affect, our internal control over\nfinancial reporting. However, as the phased implementation of the new ERP system continues, we will change our\nprocesses and procedures, which in turn, could result in changes to our internal co\n\n Class A common stock and Class C\ncapital stock may fluctuate widely in response to various factors, many of which are beyond our control, including,\namong others:\n•\nQuarterly variations in our operating results or those of our competitors.\n•\nAnnouncements by us or our competitors of acquisitions, divestitures, investments, new products, significant\ncontracts, commercial relationships, or capital commitments.\n•\nRecommendations by securities analysts or changes in earnings estimates.\n•\nAnnounceme",
      "contexts": [
        "over the next few years. We completed the implementation of certain\nof our subledgers, which included changes to our processes, procedures and internal controls over financial reporting\nduring the second quarter of 2021. There have been no changes in our internal control over financial reporting that\noccurred during the quarter ended December  31, 2021 that have materially affected, or are reasonably likely to\nmaterially affect, our internal control over financial reporting. However, as the phas",
        "l reporting systems, was completed during the third quarter of 2020.\nThere have been no changes in our internal control over financial reporting that occurred during the quarter ended\nDecember 31, 2020 that have materially affected, or are reasonably likely to materially affect, our internal control over\nfinancial reporting. However, as the phased implementation of the new ERP system continues, we will change our\nprocesses and procedures, which in turn, could result in changes to our internal co",
        " Class A common stock and Class C\ncapital stock may fluctuate widely in response to various factors, many of which are beyond our control, including,\namong others:\n•\nQuarterly variations in our operating results or those of our competitors.\n•\nAnnouncements by us or our competitors of acquisitions, divestitures, investments, new products, significant\ncontracts, commercial relationships, or capital commitments.\n•\nRecommendations by securities analysts or changes in earnings estimates.\n•\nAnnounceme",
        " or our competitors of acquisitions, divestitures, investments,\nnew products, significant contracts, commercial relationships, or capital commitments.\n•\nRecommendations by securities analysts or changes in earnings estimates.\n•\nAnnouncements about our earnings that are not in line with analyst expectations, the\nrisk of which is enhanced because it is our policy not to give guidance on earnings.\n•\nAnnouncements by our competitors of their earnings that are not in line with analyst\nexpectations.\n•",
        "likelihood of our ability to realize appreciation in the value of our\ninvestments through liquidity events such as public offerings, acquisitions, private sales or other market events. As of\nDecember 31, 2019 and 2020, the carrying value of our non-marketable equity securities, which were accounted for\nunder the measurement alternative, was $11.4 billion and $18.9 billion, respectively. Valuations of our equity\ninvestments in private companies are inherently more complex due to the lack of readi"
      ],
      "retrieved_docs": 5,
      "top_scores": [
        17.967272543043517,
        17.68832229582357,
        15.500184435217378
      ],
      "sources": [
        "goog-20211231.pdf",
        "goog-20201231.pdf",
        "Document.pdf",
        "goog-20200630.pdf",
        "goog-20201231.pdf"
      ],
      "execution_time": 0.17774486541748047,
      "k1": 1.5,
      "b": 0.75,
      "category": "strategy",
      "query_id": 21,
      "difficulty": "medium"
    },
    {
      "question": "How does management describe the company’s competitive advantages or moats?",
      "answer": " them with competitive advantages and may affect our supply.\nOur products and services may have quality issues resulting from design, manufacturing, or operations.\nSometimes, these issues may be caused by components we purchase from other manufacturers or suppliers. If the\nquality of our products and services does not meet expectations or our products or services are defective, it could harm\nour reputation, financial condition, and operating results.\nWe require our suppliers and business partner\n\nommitments that may provide them with competitive advantages and may affect our supply.\nOur products and services may have quality issues resulting from design, manufacturing,\nor operations. Sometimes, these issues may be caused by components we purchase from\nother manufacturers or suppliers. If the quality of our products and services does not meet\nexpectations or our products or services are defective, it could harm our reputation, financial\ncondition, and operating results.\nWe require our sup\n\n more favorable contractual terms based on\nvolume and other commitments that may provide them with competitive advantages and may affect our supply.\nOur products and services may have quality issues resulting from design, manufacturing, or operations.\nSometimes, these issues may be caused by components we purchase from other manufacturers or suppliers. If the\nquality of our products and services does not meet expectations or our products or services are defective, it could harm\nour reputation, f",
      "contexts": [
        " them with competitive advantages and may affect our supply.\nOur products and services may have quality issues resulting from design, manufacturing, or operations.\nSometimes, these issues may be caused by components we purchase from other manufacturers or suppliers. If the\nquality of our products and services does not meet expectations or our products or services are defective, it could harm\nour reputation, financial condition, and operating results.\nWe require our suppliers and business partner",
        "ommitments that may provide them with competitive advantages and may affect our supply.\nOur products and services may have quality issues resulting from design, manufacturing,\nor operations. Sometimes, these issues may be caused by components we purchase from\nother manufacturers or suppliers. If the quality of our products and services does not meet\nexpectations or our products or services are defective, it could harm our reputation, financial\ncondition, and operating results.\nWe require our sup",
        " more favorable contractual terms based on\nvolume and other commitments that may provide them with competitive advantages and may affect our supply.\nOur products and services may have quality issues resulting from design, manufacturing, or operations.\nSometimes, these issues may be caused by components we purchase from other manufacturers or suppliers. If the\nquality of our products and services does not meet expectations or our products or services are defective, it could harm\nour reputation, f",
        "s may negotiate more favorable contractual terms based on volume and other\ncommitments that may provide them with competitive advantages and may affect our supply.\nOur products and services may have quality issues resulting from design, manufacturing,\nor operations. Sometimes, these issues may be caused by components we purchase from\nother manufacturers or suppliers. If the quality of our products and services does not meet\nexpectations or our products or services are defective, it could harm ou",
        "mum purchase requirements, if the volume of our\nhardware sales decreases or does not reach projected targets, we could face increased materials and manufacturing\ncosts or other financial liabilities that could make our products more costly per unit to manufacture and negatively affect\nour financial results. Furthermore, certain of our competitors may negotiate more favorable contractual terms based on\nvolume and other commitments that may provide them with competitive advantages and may affect o"
      ],
      "retrieved_docs": 5,
      "top_scores": [
        17.633941004392852,
        17.536327944615294,
        17.439828879820485
      ],
      "sources": [
        "Document.pdf",
        "goog-20200930.pdf",
        "goog-20201231.pdf",
        "goog-20200630.pdf",
        "Document.pdf"
      ],
      "execution_time": 0.16724729537963867,
      "k1": 1.5,
      "b": 0.75,
      "category": "strategy",
      "query_id": 22,
      "difficulty": "hard"
    },
    {
      "question": "How does the company plan to address key risks and uncertainties mentioned in the report?",
      "answer": "bout\nrisks and uncertainties applicable to our commitments to attain certain sustainability goals, see Risk Factors in Item 1A\nof this Annual Report on Form 10-K.\nCulture and Workforce\nWe are a company of curious, talented, and passionate people. We embrace collaboration and creativity, and\nencourage the iteration of ideas to address complex challenges in technology and society.\nOur people are critical for our continued success, so we work hard to create an environment where employees\ncan have f\n\ndustry continue to evolve, we expect our total GHG emissions to rise before dropping toward our\nabsolute emissions reduction target.\nFor additional information about risks and uncertainties applicable to our work on sustainability and efficiency, see\nItem 1A Risk Factors of this Annual Report on Form 10-K.\nCulture and Workforce\nWe are a company of curious, talented, and passionate people. We embrace collaboration and creativity, and\nencourage the iteration of ideas to address complex challenges \n\ncy. Additionally, as we shared with\nthe proponent, we have updated our Privacy Sandbox initiative to address concerns similar to those raised in this proposal. For these reasons, our Board\ndoes not believe that implementing the requests of this proposal would provide additional useful information to stockholders and therefore recommends\nAGAINST this proposal.\n \nOur Human Rights Governance and Management Structure Provides Effective Oversight of Key Human\nRights Risks and Mitigation Strategies\n \n",
      "contexts": [
        "bout\nrisks and uncertainties applicable to our commitments to attain certain sustainability goals, see Risk Factors in Item 1A\nof this Annual Report on Form 10-K.\nCulture and Workforce\nWe are a company of curious, talented, and passionate people. We embrace collaboration and creativity, and\nencourage the iteration of ideas to address complex challenges in technology and society.\nOur people are critical for our continued success, so we work hard to create an environment where employees\ncan have f",
        "dustry continue to evolve, we expect our total GHG emissions to rise before dropping toward our\nabsolute emissions reduction target.\nFor additional information about risks and uncertainties applicable to our work on sustainability and efficiency, see\nItem 1A Risk Factors of this Annual Report on Form 10-K.\nCulture and Workforce\nWe are a company of curious, talented, and passionate people. We embrace collaboration and creativity, and\nencourage the iteration of ideas to address complex challenges ",
        "cy. Additionally, as we shared with\nthe proponent, we have updated our Privacy Sandbox initiative to address concerns similar to those raised in this proposal. For these reasons, our Board\ndoes not believe that implementing the requests of this proposal would provide additional useful information to stockholders and therefore recommends\nAGAINST this proposal.\n \nOur Human Rights Governance and Management Structure Provides Effective Oversight of Key Human\nRights Risks and Mitigation Strategies\n \n",
        ".\n \nFurther, we also disclose how we collaborate with our stakeholders to advance human rights matters and address related risks. For example, we are an\noriginal co-founder of the Global Network Initiative, where we work closely with civil society, academics, investors and industry peers to protect and\nadvance freedom of expression and privacy globally.\n \nOur Human Rights Governance and Management Structure Provides Effective Oversight of Key Human\nRights Risks and Mitigation Strategies\n \nAs dis",
        "governance and management structure provides effective oversight of key human rights risks and mitigation strategies\n•   We have progressed solutions that are built based on privacy enhancing technologies to address concerns similar to those raised in this\nproposal\n \n \nOur human rights governance and management structure work alongside policies that are designed to safeguard user privacy and safety, which provides\neffective oversight over key risks related to human rights. We collaborate across "
      ],
      "retrieved_docs": 5,
      "top_scores": [
        18.672161759719383,
        18.605131339258364,
        17.226871109108416
      ],
      "sources": [
        "goog-20221231.pdf",
        "goog-20241231.pdf",
        "ALPHABET INC. - DEF 14A_2.pdf",
        "ALPHABET INC. DEF 14A.pdf",
        "ALPHABET INC. - DEF 14A.pdf"
      ],
      "execution_time": 0.19652295112609863,
      "k1": 1.5,
      "b": 0.75,
      "category": "strategy",
      "query_id": 40,
      "difficulty": "hard"
    },
    {
      "question": "What environmental, social, and governance (ESG) topics does the company highlight as most material?",
      "answer": "d developments in corporate governance.\n \n \nEngagement\n \nWe proactively engage with our stockholders and other stakeholders throughout the year on a broad range of topics that are of interest and priority to the\ncompany and our stockholders. These include business strategy and performance, and environmental, social and governance (ESG) topics such as\nenvironmental sustainability, human capital, workforce diversity, executive compensation, and Board leadership and composition.\n \nOur engagement en\n\nrency we provide on the topics discussed above, we are continually focused on evolving our\nEnvironmental, Social, and Governance (ESG) reporting to align with best practices and stockholder and stakeholder expectations. To that end, we\nexpect to share in the upcoming months our first index of ESG disclosures mapped to the Sustainable Accounting Standards Board (SASB) and to the\nTask Force on Climate-Related Financial Disclosures (TCFD) framework. This builds on our longstanding practice of publi\n\nd services\nthat we believe have a positive impact on the world and further the long-term interests of our business, stockholders, and stakeholders.\n \nOur Board and its committees provide oversight of environmental, social, and governance matters. At the committee level, oversight of specific\nenvironmental, social, and governance topics is assigned to the relevant committees, including:\n \n• Our Audit and Compliance Committee has the primary responsibility for oversight of risks associated with, a",
      "contexts": [
        "d developments in corporate governance.\n \n \nEngagement\n \nWe proactively engage with our stockholders and other stakeholders throughout the year on a broad range of topics that are of interest and priority to the\ncompany and our stockholders. These include business strategy and performance, and environmental, social and governance (ESG) topics such as\nenvironmental sustainability, human capital, workforce diversity, executive compensation, and Board leadership and composition.\n \nOur engagement en",
        "rency we provide on the topics discussed above, we are continually focused on evolving our\nEnvironmental, Social, and Governance (ESG) reporting to align with best practices and stockholder and stakeholder expectations. To that end, we\nexpect to share in the upcoming months our first index of ESG disclosures mapped to the Sustainable Accounting Standards Board (SASB) and to the\nTask Force on Climate-Related Financial Disclosures (TCFD) framework. This builds on our longstanding practice of publi",
        "d services\nthat we believe have a positive impact on the world and further the long-term interests of our business, stockholders, and stakeholders.\n \nOur Board and its committees provide oversight of environmental, social, and governance matters. At the committee level, oversight of specific\nenvironmental, social, and governance topics is assigned to the relevant committees, including:\n \n• Our Audit and Compliance Committee has the primary responsibility for oversight of risks associated with, a",
        "rformance supporting the environmental, social,\nand governance (ESG) goals that have long been a key part of Alphabet and Google’s work.\n \nBy no means is this summary of our work exhaustive. The company has made significant progress in continuing to build products, especially in AI,\nethically and responsibly; ensuring the privacy and security of our users; supporting quality publishers and promoting quality content online; and\ndoing it all in a landscape where we compete fairly and give our user",
        "roposal Regarding Report on\nSustainability Metrics\n \nWHEREAS: Studies suggest that companies that integrate environmental, social, and governance (ESG) factors into business strategy reduce\nreputational, legal, and regulatory risks and improve long-term performance. Leading companies have integrated sustainability metrics into executive\npay plans, among them Unilever and Walmart. The UN Principles for Responsible Investment (2012) state that considering ESG factors in\ncompensation can help prote"
      ],
      "retrieved_docs": 5,
      "top_scores": [
        29.512364011277526,
        28.81548836168344,
        28.168092181106122
      ],
      "sources": [
        "ALPHABET INC. DEF 14A.pdf",
        "ALPHABET INC. DEF 14A.pdf",
        "ALPHABET INC. - DEF 14A.pdf",
        "ALPHABET INC. - DEF 14A_3.pdf",
        "ALPHABET INC. - DEF 14A_3.pdf"
      ],
      "execution_time": 0.19478917121887207,
      "k1": 1.5,
      "b": 0.75,
      "category": "esg",
      "query_id": 23,
      "difficulty": "medium"
    },
    {
      "question": "Does the company disclose greenhouse gas (GHG) emissions or climate-related targets?",
      "answer": ". In 2017, it became the first major company\nto match 100 percent of its annual global electricity consumption with renewable energy, and it is pioneering 24/7 carbon free energy (CFE) – that is,\nmatching its global electricity demand with clean energy around the clock.\n \nIn 2021, Alphabet announced it would reach net-zero greenhouse gas (GHG) emissions, reduce 50 percent of its operational and value chain emissions,\nand source 24/7 CFE for its worldwide operations by 2030.\n \nIn its 2023 10-K, A\n\nunched in 2019 include recycled plastic content and we launched carbon neutral shipping for Google’s direct customers who buy a product on Google Shopping or purchase Made by Google hardware. •The Environmental Insights Explorer is enabling municipalities — which represent more than 70% of global greenhouse gas emissions according to the 2016 United Nations Habitat World Cities Report — to estimate emissions and develop climate action plans. In 2019, we expanded this tool to more than 100 cities\n\nnities we have identified over the short, medium, and long term; and\n• Our Scope 1, Scope 2, and, where appropriate, Scope 3 greenhouse gas emissions.\n \nWe Have Set Robust Climate-Related Environmental Goals\n \nUnderstanding the importance of creating a climate transition plan, in 2020 we launched our third decade of climate action to accelerate the climate\ntransition. We are now working toward a new set of ambitious goals, which should strengthen our resilience to climate-related risks and help ",
      "contexts": [
        ". In 2017, it became the first major company\nto match 100 percent of its annual global electricity consumption with renewable energy, and it is pioneering 24/7 carbon free energy (CFE) – that is,\nmatching its global electricity demand with clean energy around the clock.\n \nIn 2021, Alphabet announced it would reach net-zero greenhouse gas (GHG) emissions, reduce 50 percent of its operational and value chain emissions,\nand source 24/7 CFE for its worldwide operations by 2030.\n \nIn its 2023 10-K, A",
        "unched in 2019 include recycled plastic content and we launched carbon neutral shipping for Google’s direct customers who buy a product on Google Shopping or purchase Made by Google hardware. •The Environmental Insights Explorer is enabling municipalities — which represent more than 70% of global greenhouse gas emissions according to the 2016 United Nations Habitat World Cities Report — to estimate emissions and develop climate action plans. In 2019, we expanded this tool to more than 100 cities",
        "nities we have identified over the short, medium, and long term; and\n• Our Scope 1, Scope 2, and, where appropriate, Scope 3 greenhouse gas emissions.\n \nWe Have Set Robust Climate-Related Environmental Goals\n \nUnderstanding the importance of creating a climate transition plan, in 2020 we launched our third decade of climate action to accelerate the climate\ntransition. We are now working toward a new set of ambitious goals, which should strengthen our resilience to climate-related risks and help ",
        "es may do little to offset climate\nrisks.”3\n \nWhile our Company has taken actions to address its operational greenhouse gas emissions,4 it has not acted to meaningfully address the emissions\ngenerated by its retirement plan investments. The plan’s “default” investment option — into which participants are automatically enrolled if they do not\naffirmatively select another option — is the Vanguard Target Retirement fund series. The funds in this series account for 65% of plan assets.5 These\nfunds i",
        "ur the construction of more than $2 billion in new energy infrastructure.\n•\n100% of Nest products launched in 2019 include recycled plastic content and we launched carbon neutral\nshipping for Google’s direct customers who buy a product on Google Shopping or purchase Made by Google\nhardware.\n•\nThe Environmental Insights Explorer is enabling municipalities — which represent more than 70% of global\ngreenhouse gas emissions according to the 2016 United Nations Habitat World Cities Report — to estima"
      ],
      "retrieved_docs": 5,
      "top_scores": [
        27.313576409166373,
        25.54032534197867,
        25.21520266783124
      ],
      "sources": [
        "ALPHABET INC. - DEF14A.pdf",
        "lgoog2020_def14a.pdf",
        "ALPHABET INC. DEF 14A.pdf",
        "ALPHABET INC. - DEF 14A.pdf",
        "Document.pdf"
      ],
      "execution_time": 0.16522908210754395,
      "k1": 1.5,
      "b": 0.75,
      "category": "esg",
      "query_id": 24,
      "difficulty": "hard"
    },
    {
      "question": "How does the company describe its approach to diversity, equity, and inclusion (DEI)?",
      "answer": "ronmental report\n  Diversity,\nEquity\nand Inclusion\n \nConducted and released a voluntary civil rights audit of our policies, practices, and products. This audit was conducted\nby Debo P. Adegbile, Chair of WilmerHale’s Anti-Discrimination Practice, and it identifies significant strengths, as well as\nopportunities to further advance civil rights, equity, and inclusion\n  Human Rights \nEstablished company-wide approach to ongoing human rights due diligence. Our approach applies a strategic and\ncross-\n\nals.\n \nWe track and provide transparent information and data on our environmental sustainability initiatives. Please see our Sustainability website for more\ninformation.\n \nDiversity, Equity, and Inclusion (DEI): Building a world where progress, equitable outcomes, diversity, and inclusion can be realities is at the heart of\nwhat we do — from how we build our products to how we build our workforce. We have deepened our efforts to drive meaningful change but we know\nthere is more to be done. We ha\n\nr\nannual environmental report for more information on our actions and progress.\n \nALPHABET ● 2023 PROXY STATEMENT        12\n \nDiversity, Equity, and Inclusion (DEI): Building a world where progress, equitable outcomes, diversity, and inclusion can be realities is at the heart of\nwhat we do — from how we build our products to how we build our workforce. We have deepened our efforts to drive meaningful change and we also\nknow there is more to be done. We have a responsibility to continue scaling o",
      "contexts": [
        "ronmental report\n  Diversity,\nEquity\nand Inclusion\n \nConducted and released a voluntary civil rights audit of our policies, practices, and products. This audit was conducted\nby Debo P. Adegbile, Chair of WilmerHale’s Anti-Discrimination Practice, and it identifies significant strengths, as well as\nopportunities to further advance civil rights, equity, and inclusion\n  Human Rights \nEstablished company-wide approach to ongoing human rights due diligence. Our approach applies a strategic and\ncross-",
        "als.\n \nWe track and provide transparent information and data on our environmental sustainability initiatives. Please see our Sustainability website for more\ninformation.\n \nDiversity, Equity, and Inclusion (DEI): Building a world where progress, equitable outcomes, diversity, and inclusion can be realities is at the heart of\nwhat we do — from how we build our products to how we build our workforce. We have deepened our efforts to drive meaningful change but we know\nthere is more to be done. We ha",
        "r\nannual environmental report for more information on our actions and progress.\n \nALPHABET ● 2023 PROXY STATEMENT        12\n \nDiversity, Equity, and Inclusion (DEI): Building a world where progress, equitable outcomes, diversity, and inclusion can be realities is at the heart of\nwhat we do — from how we build our products to how we build our workforce. We have deepened our efforts to drive meaningful change and we also\nknow there is more to be done. We have a responsibility to continue scaling o",
        "ell. We provide a variety of high quality training and\nsupport to our managers to build and strengthen their capabilities-–ranging from courses for new managers, to learning\nresources that help them provide feedback and manage performance, to coaching and individual support.\nAt Alphabet, we are committed to making diversity, equity, and inclusion part of everything we do and to growing a\nworkforce that is representative of the users we serve. More information on Google’s approach to diversity ca",
        " a variety of high quality training and\nsupport to managers to build and strengthen their capabilities-–ranging from courses for new managers, to learning\nresources that help them provide feedback and manage performance, to coaching and individual support.\nAt Alphabet, we are committed to making diversity, equity, and inclusion part of everything we do and to growing a\nworkforce that is representative of the users we serve. More information on Google’s approach to diversity can be\nfound in our a"
      ],
      "retrieved_docs": 5,
      "top_scores": [
        26.808404611013387,
        26.4585710528794,
        26.15398208353533
      ],
      "sources": [
        "ALPHABET INC. - DEF 14A_2.pdf",
        "ALPHABET INC. DEF 14A.pdf",
        "ALPHABET INC. - DEF 14A_2.pdf",
        "goog-20211231.pdf",
        "goog-20231231.pdf"
      ],
      "execution_time": 0.19063305854797363,
      "k1": 1.5,
      "b": 0.75,
      "category": "esg",
      "query_id": 25,
      "difficulty": "medium"
    },
    {
      "question": "Are there any notable ESG-related risks or controversies mentioned in the report?",
      "answer": "nations.\n \nSupporting Statement\n \nThe Securities & Exchange Commission has long and consistently stated that charitable contributions by corporations are “generally found to involve\na matter of corporate policy which is extraordinary in nature and beyond a company’s ordinary business operations,”1 and so is amenable, without\nomission, to shareholder proposals to require reporting about them and about potential or realized risks and controversies arising from them, so long\nas the proposal relates\n\nty crisis threatens worker safety, talent retention, product development, and customer service. These human capital risks are playing out as controversies and employee unrest at Alphabet: . In 2018, approximately 20,000 workers walked out protesting Alphabet’s mishandling of sexual misconduct cases. . In 2019, “more than 2,000 Googlers … signed a petition to remove a member of the company’s newly formed council on\nartificial intelligence ethics for alleged anti-trans and anti-immigrant views. Th\n\nontroversies associated\nwith the donations, including an explanation of the objective and consistent standards by which such controversies were discovered and their\neffect on the Company gauged; and\n5.\nIdentify, if and as appropriate, philanthropic areas of initiatives considered most germane to corporate values while posting less risk to Company\nreputation; or in the alternative, any decision to scale back without replacement risky or misused donations.\n \nSupporting Statement\n \nThe Securities &",
      "contexts": [
        "nations.\n \nSupporting Statement\n \nThe Securities & Exchange Commission has long and consistently stated that charitable contributions by corporations are “generally found to involve\na matter of corporate policy which is extraordinary in nature and beyond a company’s ordinary business operations,”1 and so is amenable, without\nomission, to shareholder proposals to require reporting about them and about potential or realized risks and controversies arising from them, so long\nas the proposal relates",
        "ty crisis threatens worker safety, talent retention, product development, and customer service. These human capital risks are playing out as controversies and employee unrest at Alphabet: . In 2018, approximately 20,000 workers walked out protesting Alphabet’s mishandling of sexual misconduct cases. . In 2019, “more than 2,000 Googlers … signed a petition to remove a member of the company’s newly formed council on\nartificial intelligence ethics for alleged anti-trans and anti-immigrant views. Th",
        "ontroversies associated\nwith the donations, including an explanation of the objective and consistent standards by which such controversies were discovered and their\neffect on the Company gauged; and\n5.\nIdentify, if and as appropriate, philanthropic areas of initiatives considered most germane to corporate values while posting less risk to Company\nreputation; or in the alternative, any decision to scale back without replacement risky or misused donations.\n \nSupporting Statement\n \nThe Securities &",
        "spent or used: the purposes to which the donations were to be put, the purposes to which the donations were\nactually put, the method by which the use of the donations was monitored and ascertained, and an evaluation of the efficacy of the donations\nand the Company’s intention with regard to future donations to the organization;\n4.\nInclude management’s analysis of the risks to the Company’s brand, reputation, or shareholder value posed by public controversies associated\nwith the donations, includ",
        "f its enforcement of Google’s and YouTube’s Terms of Service related to content policies, and assessing the risks posed by content\nmanagement controversies related to issues such as election interference, freedom of expression, and inequitable application of policies, and how they\naffect the Company’s finances, operations, and reputation.\n \nSUPPORTING STATEMENT:\n \nEvidence has accumulated over many years that show Alphabet Inc.’s platforms discriminate against disfavored speech, interfered in el"
      ],
      "retrieved_docs": 5,
      "top_scores": [
        14.179811533990646,
        12.894264867972757,
        12.599300057438365
      ],
      "sources": [
        "ALPHABET INC. - DEF 14A_3.pdf",
        "lgoog2020_def14a.pdf",
        "ALPHABET INC. - DEF 14A_3.pdf",
        "ALPHABET INC. - DEF 14A_3.pdf",
        "ALPHABET INC. - DEF 14A_2.pdf"
      ],
      "execution_time": 0.17008495330810547,
      "k1": 1.5,
      "b": 0.75,
      "category": "esg",
      "query_id": 26,
      "difficulty": "hard"
    },
    {
      "question": "Does the company link executive compensation to ESG or sustainability metrics?",
      "answer": "roposal Regarding Report on\nSustainability Metrics\n \nWHEREAS: Studies suggest that companies that integrate environmental, social, and governance (ESG) factors into business strategy reduce\nreputational, legal, and regulatory risks and improve long-term performance. Leading companies have integrated sustainability metrics into executive\npay plans, among them Unilever and Walmart. The UN Principles for Responsible Investment (2012) state that considering ESG factors in\ncompensation can help prote\n\nal’s 2022 ESG Bonus payout is $775,000. While both the\nCompensation Committee and the ESG Participants recognize each ESG Participant’s strong individual performance against ESG goals in 2022, each\nESG Participant also encouraged the Compensation Committee’s decision, in its sole discretion, to adjust ESG bonuses downward in order to reflect\nmacroeconomic conditions.\n \nEquity Awards\n \nWe grant equity awards to our named executive officers to reinforce management’s focus on long-term stockholder \n\nrld’s best talent, support Alphabet’s culture of innovation and\nperformance, and align employee and stockholder interests.\n \n Sound\nProgram Design   \n \nPay for Performance   \n \nBest Practices in Executive\nCompensation                        \nCompetitive total pay opportunity to\nattract, retain, and motivate leaders\nPrimarily equity-based compensation\nwith payout aligned to long-term\ncompany performance\nMulti-year vesting of stock awards\nDiscourage unnecessary and excessive\nrisk taking\nESG bonus ",
      "contexts": [
        "roposal Regarding Report on\nSustainability Metrics\n \nWHEREAS: Studies suggest that companies that integrate environmental, social, and governance (ESG) factors into business strategy reduce\nreputational, legal, and regulatory risks and improve long-term performance. Leading companies have integrated sustainability metrics into executive\npay plans, among them Unilever and Walmart. The UN Principles for Responsible Investment (2012) state that considering ESG factors in\ncompensation can help prote",
        "al’s 2022 ESG Bonus payout is $775,000. While both the\nCompensation Committee and the ESG Participants recognize each ESG Participant’s strong individual performance against ESG goals in 2022, each\nESG Participant also encouraged the Compensation Committee’s decision, in its sole discretion, to adjust ESG bonuses downward in order to reflect\nmacroeconomic conditions.\n \nEquity Awards\n \nWe grant equity awards to our named executive officers to reinforce management’s focus on long-term stockholder ",
        "rld’s best talent, support Alphabet’s culture of innovation and\nperformance, and align employee and stockholder interests.\n \n Sound\nProgram Design   \n \nPay for Performance   \n \nBest Practices in Executive\nCompensation                        \nCompetitive total pay opportunity to\nattract, retain, and motivate leaders\nPrimarily equity-based compensation\nwith payout aligned to long-term\ncompany performance\nMulti-year vesting of stock awards\nDiscourage unnecessary and excessive\nrisk taking\nESG bonus ",
        "esence. Though ESG or environmental, social and corporate\ngovernance issues are at the forefront of our company ethos, at the director level, the board doesn’t seem to have any oversight with environmental\nsustainability.\n \nCurrent board committees at Alphabet include the Audit and Compliance Committee, Leadership Development and Compensation Committee,\nNominating and Corporate Governance Committee and the Executive Committee. Within the verbiage of all committees’ responsibilities and purpose,\n",
        " Committee decided to align the amounts of the 2022 ESG Bonus payouts for all\nfour individuals. Based on the strong Google and individual performance against ESG goals in 2022, the Compensation Committee initially proposed a\nbonus amount of $1.55 million for each ESG Participant. However, in light of macroeconomic conditions, the Compensation Committee decided to\nreduce ESG Bonus payouts for the ESG Participants by 50%. As a result, each individual’s 2022 ESG Bonus payout is $775,000. While both"
      ],
      "retrieved_docs": 5,
      "top_scores": [
        18.29471976896145,
        18.160703182737326,
        15.742529483754826
      ],
      "sources": [
        "ALPHABET INC. - DEF 14A_3.pdf",
        "ALPHABET INC. - DEF 14A_2.pdf",
        "ALPHABET INC. - DEF 14A_2.pdf",
        "ALPHABET INC. DEF 14A.pdf",
        "ALPHABET INC. - DEF 14A_2.pdf"
      ],
      "execution_time": 0.17434310913085938,
      "k1": 1.5,
      "b": 0.75,
      "category": "esg",
      "query_id": 39,
      "difficulty": "hard"
    },
    {
      "question": "How has the company’s revenue growth over the last three years compared to its net income growth?",
      "answer": "ing Amazon.com, Citigroup, and Home Depot.\n \nSeveral actions by Alphabet employees over the last few years highlight the risks posed by a corporate culture that is out of alignment with the values of\nits employees:\n \n \n• In 2018, thousands of Alphabet employees signed petitions opposing the Company’s involvement in censorship (“Project Dragonfly”) and in\ndeveloping military technology (“Project Maven”). Moreover, approximately 20,000 employees and contractors staged a walkout to protest how the\n\n\ns advertisers are willing to pay based on how they manage their advertising costs;\n•\ngeneral economic conditions;\n•\nseasonality; and\n•\ntraffic growth in emerging markets compared to more mature markets and across\nvarious advertising verticals and channels.\nOur advertising revenue growth rate has been affected over time as a result of a number\nof factors, including challenges in maintaining our growth rate as revenues increase to higher\nlevels; changes in our product mix; changes in advertising q\n\n\nchanges in device mix;\n•\nchanges in foreign currency exchange rates;\n•\nfees advertisers are willing to pay based on how they manage their advertising costs;\n•\ngeneral economic conditions;\n•\nseasonality; and\n•\ntraffic growth in emerging markets compared to more mature markets and across various advertising verticals\nand channels.\nOur advertising revenue growth rate has been affected over time as a result of a number of factors, including\nchallenges in maintaining our growth rate as revenues incr",
      "contexts": [
        "ing Amazon.com, Citigroup, and Home Depot.\n \nSeveral actions by Alphabet employees over the last few years highlight the risks posed by a corporate culture that is out of alignment with the values of\nits employees:\n \n \n• In 2018, thousands of Alphabet employees signed petitions opposing the Company’s involvement in censorship (“Project Dragonfly”) and in\ndeveloping military technology (“Project Maven”). Moreover, approximately 20,000 employees and contractors staged a walkout to protest how the\n",
        "s advertisers are willing to pay based on how they manage their advertising costs;\n•\ngeneral economic conditions;\n•\nseasonality; and\n•\ntraffic growth in emerging markets compared to more mature markets and across\nvarious advertising verticals and channels.\nOur advertising revenue growth rate has been affected over time as a result of a number\nof factors, including challenges in maintaining our growth rate as revenues increase to higher\nlevels; changes in our product mix; changes in advertising q",
        "\nchanges in device mix;\n•\nchanges in foreign currency exchange rates;\n•\nfees advertisers are willing to pay based on how they manage their advertising costs;\n•\ngeneral economic conditions;\n•\nseasonality; and\n•\ntraffic growth in emerging markets compared to more mature markets and across various advertising verticals\nand channels.\nOur advertising revenue growth rate has been affected over time as a result of a number of factors, including\nchallenges in maintaining our growth rate as revenues incr",
        "ve positions that risk shareholder value while being unrelated to the Company’s business.\n \nRecent events have made clear that shareholder value drops when companies engage in the sort of activism that the CEI demands. Following Bud\nLight’s embrace of such divisiveness, its revenue fell $395 million in North America compared to a year prior.5 Target’s market cap fell over $15 billion\namid backlash for similar actions.6 Disney stock fell 44% in 2022 – its worst performance in nearly 50 years – fo",
        "\nchanges in advertising quality, formats, delivery or policy;\n•\nchanges in device mix;\n•\nchanges in foreign currency exchange rates;\n•\nfees advertisers are willing to pay based on how they manage their advertising costs;\n•\ngeneral economic conditions;\n•\nseasonality; and\n•\ntraffic growth in emerging markets compared to more mature markets and across\nvarious advertising verticals and channels.\nOur advertising revenue growth rate has been affected over time as a result of a number\nof factors, inclu"
      ],
      "retrieved_docs": 5,
      "top_scores": [
        23.647069180775013,
        22.41868120283046,
        22.35380477549625
      ],
      "sources": [
        "ALPHABET INC. DEF 14A.pdf",
        "goog-20200630.pdf",
        "Document.pdf",
        "ALPHABET INC. - DEF14A.pdf",
        "goog-20200930.pdf"
      ],
      "execution_time": 0.20811009407043457,
      "k1": 1.5,
      "b": 0.75,
      "category": "comparison",
      "query_id": 27,
      "difficulty": "hard"
    },
    {
      "question": "Compare the share of revenue coming from the top business segment now versus two years ago.",
      "answer": "ervices' core products and platforms include ads, Android, Chrome, hardware, Gmail, Google Drive,\nGoogle Maps, Google Photos, Google Play, Search, and YouTube, each with broad and growing adoption by users\naround the world.\nOur products and services have come a long way since the company was founded more than two decades ago.\nRather than the ten blue links in our early search results, users can now get direct answers to their questions using\ntheir computer, mobile device, or their own voice, mak\n\nery business has the opportunity and obligation to protect our planet. Sustainability is one of our\ncore values at Google, and we strive to build sustainability into everything we do. We have been a leader on\nsustainability and climate change since Google’s founding over 20 years ago. These are some of our key achievements\nover the past two decades:\n•\nIn 2007, we became the first major company to be carbon neutral for our operations.\n•\nIn 2017, we became the first major company to match 100% of \n\nome, Gmail, Google Drive, Google Maps,\nGoogle Photos, Google Play, Search, and YouTube, each with broad and growing adoption by users around the world.\nOur products and services have come a long way since the company was founded more than two decades ago.\nRather than the ten blue links in our early search results, users can now get direct answers to their questions using\ntheir computer, mobile device, or their own voice, making it quicker, easier and more natural to find what you're looking\nfor.",
      "contexts": [
        "ervices' core products and platforms include ads, Android, Chrome, hardware, Gmail, Google Drive,\nGoogle Maps, Google Photos, Google Play, Search, and YouTube, each with broad and growing adoption by users\naround the world.\nOur products and services have come a long way since the company was founded more than two decades ago.\nRather than the ten blue links in our early search results, users can now get direct answers to their questions using\ntheir computer, mobile device, or their own voice, mak",
        "ery business has the opportunity and obligation to protect our planet. Sustainability is one of our\ncore values at Google, and we strive to build sustainability into everything we do. We have been a leader on\nsustainability and climate change since Google’s founding over 20 years ago. These are some of our key achievements\nover the past two decades:\n•\nIn 2007, we became the first major company to be carbon neutral for our operations.\n•\nIn 2017, we became the first major company to match 100% of ",
        "ome, Gmail, Google Drive, Google Maps,\nGoogle Photos, Google Play, Search, and YouTube, each with broad and growing adoption by users around the world.\nOur products and services have come a long way since the company was founded more than two decades ago.\nRather than the ten blue links in our early search results, users can now get direct answers to their questions using\ntheir computer, mobile device, or their own voice, making it quicker, easier and more natural to find what you're looking\nfor.",
        "mail, Google\nDrive, Google Maps, Google Photos, Google Play, Search, and YouTube, with broad and growing adoption by users\naround the world.\nOur products and services have come a long way since the company was founded more than two decades ago.\nRather than the ten blue links in our early search results, users can now get direct answers to their questions using\ntheir computer or mobile device, their own voice, a photo, or an image, making it quicker, easier, and more natural to\nfind what they are",
        "20 years ago. These are some of our key\nachievements over the past two decades:\n•\nIn 2007, we became the first major company to be carbon neutral for our operations.\n•\nIn 2017, we became the first major company to match 100% of our annual electricity use with renewable\nenergy, which we have achieved for five consecutive years.\n•\nIn 2020, we issued $5.75 billion in sustainability bonds—the largest sustainability or green bond issuance by\nany company in history at the time. The net proceeds from t"
      ],
      "retrieved_docs": 5,
      "top_scores": [
        17.58591117884501,
        17.533187348227614,
        17.2941610291498
      ],
      "sources": [
        "goog-20211231.pdf",
        "goog-20211231.pdf",
        "goog-20201231.pdf",
        "goog-20221231.pdf",
        "goog-20221231.pdf"
      ],
      "execution_time": 0.20184707641601562,
      "k1": 1.5,
      "b": 0.75,
      "category": "comparison",
      "query_id": 28,
      "difficulty": "hard"
    },
    {
      "question": "How has the company’s debt level changed over the last three reporting periods?",
      "answer": " audit provides a reasonable basis for our opinion.\nDefinition and Limitations of Internal Control over Financial Reporting\nA company’s internal control over financial reporting is a process designed to provide reasonable assurance\nregarding the reliability of financial reporting and the preparation of financial statements for external purposes in\naccordance with generally accepted accounting principles. A company’s internal control over financial reporting\nincludes those policies and procedures\n\ninion thereon.\nBasis for Opinion\nThe Company’s management is responsible for maintaining effective internal control over financial reporting and\nfor its assessment of the effectiveness of internal control over financial reporting included in the accompanying\nManagement’s Report on Internal Control over Financial Reporting. Our responsibility is to express an opinion on the\nCompany’s internal control over financial reporting based on our audit. We are a public accounting firm registered with\nthe \n\ne has specific oversight of data privacy and security matters.\n \nALPHABET  •  2022 PROXY STATEMENT     13\n \nWe are committed to promoting transparency across our platforms and provide detailed reporting at the company level and, where applicable, individual\nbusiness level regarding our policies, programs, and performance including:\n \n• Our Transparency Report, which shares data on how we handle content that violates our policies, as well as how we handle government requests for\nremoval of conten",
      "contexts": [
        " audit provides a reasonable basis for our opinion.\nDefinition and Limitations of Internal Control over Financial Reporting\nA company’s internal control over financial reporting is a process designed to provide reasonable assurance\nregarding the reliability of financial reporting and the preparation of financial statements for external purposes in\naccordance with generally accepted accounting principles. A company’s internal control over financial reporting\nincludes those policies and procedures",
        "inion thereon.\nBasis for Opinion\nThe Company’s management is responsible for maintaining effective internal control over financial reporting and\nfor its assessment of the effectiveness of internal control over financial reporting included in the accompanying\nManagement’s Report on Internal Control over Financial Reporting. Our responsibility is to express an opinion on the\nCompany’s internal control over financial reporting based on our audit. We are a public accounting firm registered with\nthe ",
        "e has specific oversight of data privacy and security matters.\n \nALPHABET  •  2022 PROXY STATEMENT     13\n \nWe are committed to promoting transparency across our platforms and provide detailed reporting at the company level and, where applicable, individual\nbusiness level regarding our policies, programs, and performance including:\n \n• Our Transparency Report, which shares data on how we handle content that violates our policies, as well as how we handle government requests for\nremoval of conten",
        "f the Company and our report dated February 4, 2025\nexpressed an unqualified opinion thereon.\nBasis for Opinion\nThe Company’s management is responsible for maintaining effective internal control over financial reporting and for its\nassessment of the effectiveness of internal control over financial reporting included in the accompanying\nManagement’s Report on Internal Control over Financial Reporting. Our responsibility is to express an opinion on the\nCompany’s internal control over financial rep",
        "ements of the Company and our report dated February 2, 2021\nexpressed an unqualified opinion thereon.\nBasis for Opinion\nThe Company’s management is responsible for maintaining effective internal control over financial reporting and for its\nassessment of the effectiveness of internal control over financial reporting included in the accompanying\nManagement’s Report on Internal Control over Financial Reporting. Our responsibility is to express an opinion on the\nCompany’s internal control over finan"
      ],
      "retrieved_docs": 5,
      "top_scores": [
        18.33780049546902,
        18.013706628097395,
        17.313648781573534
      ],
      "sources": [
        "Document.pdf",
        "Document.pdf",
        "ALPHABET INC. DEF 14A.pdf",
        "goog-20241231.pdf",
        "goog-20201231.pdf"
      ],
      "execution_time": 0.1766960620880127,
      "k1": 1.5,
      "b": 0.75,
      "category": "comparison",
      "query_id": 29,
      "difficulty": "medium"
    },
    {
      "question": "What changes in risk factors are highlighted when comparing the latest report to the previous year?",
      "answer": "1A.\nRISK FACTORS                \nOur operations and financial results are subject to various risks and uncertainties,\nincluding those described in Part I, Item 1A, \"Risk Factors\" in our Annual Report on Form\n10-K for the year ended December 31, 2020, which could adversely affect our business,\nfinancial condition, results of operations, cash flows, and the trading price of our common\nand capital stock. Below are changes to our risk factors since our Annual Report on Form\n10-K for the year ended D\n\n, in light of risk factors like\nwidespread violations of human and civil rights.\n \nAlphabet Opposing Statement\n \nIn their letter to our stockholders at the time of Google’s initial public offering in 2004, our Co-Founders, Larry and Sergey, highlighted Google’s goal\nto “develop services that significantly improve the lives of as many people as possible.” This vision continues today –we believe in technology’s\npower and potential to have a profoundly positive impact across the world.\n \nAcross Goo\n\neasily explore the range of places available to determine what might be most\nhelpful to them. Our ranking systems on Search and Maps are designed to return the most relevant results from the most reliable sources. For topics\nwhere quality information is particularly important — like health — we place an even greater emphasis on factors related to expertise and\ntrustworthiness. We work hard to surface results that are relevant and reliable, and help users find what they are looking for.\n \nWhen a ",
      "contexts": [
        "1A.\nRISK FACTORS                \nOur operations and financial results are subject to various risks and uncertainties,\nincluding those described in Part I, Item 1A, \"Risk Factors\" in our Annual Report on Form\n10-K for the year ended December 31, 2020, which could adversely affect our business,\nfinancial condition, results of operations, cash flows, and the trading price of our common\nand capital stock. Below are changes to our risk factors since our Annual Report on Form\n10-K for the year ended D",
        ", in light of risk factors like\nwidespread violations of human and civil rights.\n \nAlphabet Opposing Statement\n \nIn their letter to our stockholders at the time of Google’s initial public offering in 2004, our Co-Founders, Larry and Sergey, highlighted Google’s goal\nto “develop services that significantly improve the lives of as many people as possible.” This vision continues today –we believe in technology’s\npower and potential to have a profoundly positive impact across the world.\n \nAcross Goo",
        "easily explore the range of places available to determine what might be most\nhelpful to them. Our ranking systems on Search and Maps are designed to return the most relevant results from the most reliable sources. For topics\nwhere quality information is particularly important — like health — we place an even greater emphasis on factors related to expertise and\ntrustworthiness. We work hard to surface results that are relevant and reliable, and help users find what they are looking for.\n \nWhen a ",
        "s is recorded as\ngoodwill. Acquisition-related expenses are recognized separately from the business combination and are expensed as\nincurred.\nLong-Lived Assets, Goodwill and Other Acquired Intangible Assets\nWe review property and equipment, long-term prepayments and intangible assets, excluding goodwill, for\nimpairment when events or changes in circumstances indicate the carrying amount may not be recoverable. We\nmeasure recoverability of these assets by comparing the carrying amounts to the fut",
        "angible Assets\nWe review property and equipment, long-term prepayments and intangible assets, excluding goodwill, for\nimpairment when events or changes in circumstances indicate the carrying amount may not be recoverable. We\nmeasure recoverability of these assets by comparing the carrying amounts to the future undiscounted cash flows that\nthe assets or the asset group are expected to generate. If the carrying value of the assets or asset group are not\nrecoverable, the impairment recognized is me"
      ],
      "retrieved_docs": 5,
      "top_scores": [
        18.39477369194368,
        16.425178961427093,
        16.11059728931039
      ],
      "sources": [
        "goog-20210630.pdf",
        "ALPHABET INC. - DEF 14A_3.pdf",
        "ALPHABET INC. - DEF 14A.pdf",
        "Document.pdf",
        "goog-20201231.pdf"
      ],
      "execution_time": 0.19624090194702148,
      "k1": 1.5,
      "b": 0.75,
      "category": "comparison",
      "query_id": 30,
      "difficulty": "hard"
    },
    {
      "question": "Locate and summarize the table that presents the breakdown of revenue by geographic region.",
      "answer": "ies; query growth rates; and shifts in the geographic mix of our revenues. We\nalso expect that our revenue growth rate will continue to be affected by evolving user\npreferences, the acceptance by users of our products and services as they are delivered on\ndiverse devices and modalities, our ability to create a seamless experience for both users and\nadvertisers, and movements in foreign currency exchange rates.\nThe following table presents our Google advertising revenues (in millions, unaudited):\n\ne mix, geographic mix, partner mix, partner agreement terms such as\nrevenue share arrangements, and the percentage of queries channeled through\npaid access points;\n•\nThe amount of TAC paid to Google Network partners, which is affected by a\ncombination of factors such as geographic mix, product mix, and revenue share\nterms;\n•\nRelative revenue growth rates of Google properties and Google Network\nproperties;\n•\nCertain costs that are less variable in nature and may not correlate with the related\nrev\n\n\n0 \n0 \n0 \n3 \nTotal depreciation, amortization, and\nimpairment\n$\n2,920  $\n3,478  $\n8,368  $\n9,972 \nReconciling items relate to corporate administrative and other costs that are not allocated to\nindividual segments.\nFor purposes of segment reporting, SBC represents awards that we expect to settle in Alphabet\nstock.\n(3)\n(4)\n(3)\n(3)       \n(4)       \n33\nTable of Contents\nAlphabet In\nThe following table presents our long-lived assets by geographic area (in millions):\nAs of\nDecember 31,\n2019\nAs of\nSep",
      "contexts": [
        "ies; query growth rates; and shifts in the geographic mix of our revenues. We\nalso expect that our revenue growth rate will continue to be affected by evolving user\npreferences, the acceptance by users of our products and services as they are delivered on\ndiverse devices and modalities, our ability to create a seamless experience for both users and\nadvertisers, and movements in foreign currency exchange rates.\nThe following table presents our Google advertising revenues (in millions, unaudited):",
        "e mix, geographic mix, partner mix, partner agreement terms such as\nrevenue share arrangements, and the percentage of queries channeled through\npaid access points;\n•\nThe amount of TAC paid to Google Network partners, which is affected by a\ncombination of factors such as geographic mix, product mix, and revenue share\nterms;\n•\nRelative revenue growth rates of Google properties and Google Network\nproperties;\n•\nCertain costs that are less variable in nature and may not correlate with the related\nrev",
        "\n0 \n0 \n0 \n3 \nTotal depreciation, amortization, and\nimpairment\n$\n2,920  $\n3,478  $\n8,368  $\n9,972 \nReconciling items relate to corporate administrative and other costs that are not allocated to\nindividual segments.\nFor purposes of segment reporting, SBC represents awards that we expect to settle in Alphabet\nstock.\n(3)\n(4)\n(3)\n(3)       \n(4)       \n33\nTable of Contents\nAlphabet In\nThe following table presents our long-lived assets by geographic area (in millions):\nAs of\nDecember 31,\n2019\nAs of\nSep",
        "ted to individual\nsegments.\n(4) For purposes of segment reporting, SBC represents awards that we expect to settle in Alphabet stock.\nThe following table presents our long-lived assets by geographic area (in millions):\nAs of\nDecember 31,\n2019\nAs of\nMarch 31, 2020\n \n \n(unaudited)\nLong-lived assets:\nUnited States\n$\n94,907   $\n96,216  \nInternational\n28,424  \n30,169  \nTotal long-lived assets\n$\n123,331   $\n126,385  \nFor revenues by geography, see Note 2.\n30\nTable of Contents\nAlphabet In\nITEM 2.\nMANAGE",
        "nts.\n(4) For purposes of segment reporting, SBC represents awards that we expect to settle in Alphabet stock.\n32\nTable of Contents\nAlphabet In\nThe following table presents our long-lived assets by geographic area (in millions):\nAs of\nDecember 31,\n2019\nAs of\nJune 30, 2020\n \n \n(unaudited)\nLong-lived assets:\nUnited States\n$\n94,907   $\n98,209  \nInternational\n28,424  \n31,214  \nTotal long-lived assets\n$\n123,331   $\n129,423  \nFor revenues by geography, see Note 2.\nNote 16. Subsequent Event\nIn July 2020"
      ],
      "retrieved_docs": 5,
      "top_scores": [
        16.83483104784117,
        14.831993923447977,
        14.236683043209005
      ],
      "sources": [
        "goog-20200331.pdf",
        "goog-20210331.pdf",
        "goog-20200930.pdf",
        "goog-20200331.pdf",
        "goog-20200630.pdf"
      ],
      "execution_time": 0.19220304489135742,
      "k1": 1.5,
      "b": 0.75,
      "category": "technical",
      "query_id": 31,
      "difficulty": "medium"
    },
    {
      "question": "Identify the note in the financial statements that explains the company’s revenue recognition policy and summarize it.",
      "answer": "ng-Friendly\nGuidelines; eligibility requirements for the YouTube Partner Program; account management and content control settings for creators and users; and\nbasic how-tos for creators. The sections pertaining to our policies provide examples of what content is prohibited, how we evaluate content for\nEducational, Documentary, Scientific or Artistic (EDSA) context, and content that may have monetization restrictions placed on it.\n●The How YouTube Works website, which explains how YouTube provides\n\ntion with the consolidated financial statements and the\nrelated notes included in our Annual Report on Form 10-K for the fiscal year ended\nDecember 31, 2021 filed with the SEC.\nNote 2. Revenues\nRevenue Recognition\nThe following table presents revenues disaggregated by type (in millions).\nThree Months Ended\nMarch 31,\n2021\n2022\nGoogle Search & other\n$\n31,879  $\n39,618 \nYouTube ads\n6,005 \n6,869 \nGoogle Network\n6,800 \n8,174 \nGoogle advertising\n44,684 \n54,661 \nGoogle other\n6,494 \n6,811 \nGoogle Servic\n\n of the\nNotes to the Consolidated Financial Statements included in Item 1 of this Quarterly\nReport on Form 10-Q for additional information.\n•\nThe company announced in February 2022 that the Board of Directors had\napproved and declared a 20-for-one stock split in the form of a one-time special\nstock dividend on each share of the company’s Class A, Class B, and Class C\nstock. See Note 10 of the Notes to Consolidated Financial Statements included in\nItem 1 of this Quarterly Report on Form 10-Q for ",
      "contexts": [
        "ng-Friendly\nGuidelines; eligibility requirements for the YouTube Partner Program; account management and content control settings for creators and users; and\nbasic how-tos for creators. The sections pertaining to our policies provide examples of what content is prohibited, how we evaluate content for\nEducational, Documentary, Scientific or Artistic (EDSA) context, and content that may have monetization restrictions placed on it.\n●The How YouTube Works website, which explains how YouTube provides",
        "tion with the consolidated financial statements and the\nrelated notes included in our Annual Report on Form 10-K for the fiscal year ended\nDecember 31, 2021 filed with the SEC.\nNote 2. Revenues\nRevenue Recognition\nThe following table presents revenues disaggregated by type (in millions).\nThree Months Ended\nMarch 31,\n2021\n2022\nGoogle Search & other\n$\n31,879  $\n39,618 \nYouTube ads\n6,005 \n6,869 \nGoogle Network\n6,800 \n8,174 \nGoogle advertising\n44,684 \n54,661 \nGoogle other\n6,494 \n6,811 \nGoogle Servic",
        " of the\nNotes to the Consolidated Financial Statements included in Item 1 of this Quarterly\nReport on Form 10-Q for additional information.\n•\nThe company announced in February 2022 that the Board of Directors had\napproved and declared a 20-for-one stock split in the form of a one-time special\nstock dividend on each share of the company’s Class A, Class B, and Class C\nstock. See Note 10 of the Notes to Consolidated Financial Statements included in\nItem 1 of this Quarterly Report on Form 10-Q for ",
        "e 3 for the effect on our\nconsolidated financial statements.\nPrior Period Reclassifications\nCertain amounts in prior periods have been reclassified to conform with current period presentation. See Note 15\nfor further details.\n65\nTable of Contents\nAlphabet Inc.\nNote 2. Revenues\nRevenue Recognition\nThe following table presents our revenues disaggregated by type (in millions).\nYear Ended December 31,\n2018\n2019\n2020\nGoogle Search & other\n$\n85,296 \n$\n98,115 \n$\n104,062 \nYouTube ads\n11,155 \n15,149 \n19,",
        "dures as we considered necessary in the circumstances. We believe\nthat our audit provides a reasonable basis for our opinion.\nDefinition and Limitations of Internal Control Over Financial Reporting\nA company’s internal control over financial reporting is a process designed to provide reasonable assurance regarding\nthe reliability of financial reporting and the preparation of financial statements for external purposes in accordance with\ngenerally accepted accounting principles. A company’s intern"
      ],
      "retrieved_docs": 5,
      "top_scores": [
        17.483625393479315,
        16.4799541291984,
        15.21873555776021
      ],
      "sources": [
        "ALPHABET INC. - DEF 14A_2.pdf",
        "goog-20220331.pdf",
        "goog-20220331.pdf",
        "goog-20201231.pdf",
        "goog-20241231.pdf"
      ],
      "execution_time": 0.21602821350097656,
      "k1": 1.5,
      "b": 0.75,
      "category": "technical",
      "query_id": 32,
      "difficulty": "hard"
    },
    {
      "question": "Which accounting standards (e.g., IFRS, US GAAP) does the company use, and are there any significant recent changes mentioned?",
      "answer": " related\nnotes included in our Annual Report on Form 10-K for the fiscal year ended December 31,\n2023 filed with the SEC.\nRecent Accounting Pronouncements\nIn November 2023, the Financial Accounting Standards Board (FASB) issued Accounting\nStandards Update (ASU) 2023-07 \"Segment Reporting (Topic 280): Improvements to\nReportable Segment Disclosures\" which expands annual and interim disclosure requirements\nfor reportable segments, primarily through enhanced disclosures about significant segment\nexp\n\nies utilize\nSustainability Accounting Standards Board (SASB) and Climate Disclosure Standards Board (CDSB) which are “well-established in the market with\nrigorously developed TCFD-aligned reporting tools,” as guidance to help shape reporting on mitigation strategies for physical climate risks. The\nimplementation guide illustrates how a company should go beyond identifying physical risks, to also report on measures being taken to protect the\ncompany’s business from those risks.\n \nA recent scienti\n\nal expenses totaled approximately $5.1 billion, $6.4\nbillion, and $6.8 billion, respectively.\nRecent Accounting Pronouncements\nRecently issued accounting pronouncements not yet adopted\nIn June 2016, the Financial Accounting Standards Board (FASB) issued Accounting Standards Update No. 2016-\n13 (ASU 2016-13) \"Financial Instruments-Credit Losses (Topic 326): Measurement of Credit Losses on Financial\nInstruments\", which requires the measurement and recognition of expected credit losses for financia",
      "contexts": [
        " related\nnotes included in our Annual Report on Form 10-K for the fiscal year ended December 31,\n2023 filed with the SEC.\nRecent Accounting Pronouncements\nIn November 2023, the Financial Accounting Standards Board (FASB) issued Accounting\nStandards Update (ASU) 2023-07 \"Segment Reporting (Topic 280): Improvements to\nReportable Segment Disclosures\" which expands annual and interim disclosure requirements\nfor reportable segments, primarily through enhanced disclosures about significant segment\nexp",
        "ies utilize\nSustainability Accounting Standards Board (SASB) and Climate Disclosure Standards Board (CDSB) which are “well-established in the market with\nrigorously developed TCFD-aligned reporting tools,” as guidance to help shape reporting on mitigation strategies for physical climate risks. The\nimplementation guide illustrates how a company should go beyond identifying physical risks, to also report on measures being taken to protect the\ncompany’s business from those risks.\n \nA recent scienti",
        "al expenses totaled approximately $5.1 billion, $6.4\nbillion, and $6.8 billion, respectively.\nRecent Accounting Pronouncements\nRecently issued accounting pronouncements not yet adopted\nIn June 2016, the Financial Accounting Standards Board (FASB) issued Accounting Standards Update No. 2016-\n13 (ASU 2016-13) \"Financial Instruments-Credit Losses (Topic 326): Measurement of Credit Losses on Financial\nInstruments\", which requires the measurement and recognition of expected credit losses for financia",
        "change transaction gains and losses resulting from the conversion of the transaction\ncurrency to functional currency as a component of foreign currency exchange gain (loss) in OI&E.\nRecent Accounting Pronouncements\nIn November 2023, the Financial Standards Accounting Board (FASB) issued Accounting Standards Update\n(ASU) 2023-07 \"Segment Reporting (Topic 280):Improvements to Reportable Segment Disclosures\" which expands\nannual and interim disclosure requirements for reportable segments, primarily",
        "s, conservation organizations, and communities to better manage water resources collectively.”5\n \nYet, despite acknowledging the importance of these issues,6 our Company offers no recent reporting on its total enterprise-wide water use, nor does it\ndisclose annual water use or other risk metrics by location. In fact, Google states that its local water use information, and its water use agreements with\nlocal governments, are trade secret.7 The company has claimed that public officials cannot disc"
      ],
      "retrieved_docs": 5,
      "top_scores": [
        23.6675434365064,
        22.250393741821703,
        21.39330523259787
      ],
      "sources": [
        "goog-20240331.pdf",
        "ALPHABET INC. DEF 14A.pdf",
        "Document.pdf",
        "goog-20231231.pdf",
        "ALPHABET INC. DEF 14A.pdf"
      ],
      "execution_time": 0.20876288414001465,
      "k1": 1.5,
      "b": 0.75,
      "category": "technical",
      "query_id": 33,
      "difficulty": "medium"
    },
    {
      "question": "Find and summarize any sensitivity analysis related to interest rates, foreign exchange, or other market risks.",
      "answer": "rterly Report on Form 10-Q or in any other report or document we\nfile with the SEC, and any references to our websites are intended to be inactive textual\nreferences only.\nITEM 3.\nQUANTITATIVE AND QUALITATIVE DISCLOSURES ABOUT MARKET\nRISK\nWe are exposed to financial market risks, including changes in foreign currency\nexchange rates, interest rates and equity investment risks. Our exposure to market risk\nhas not changed materially since December 31, 2020. For quantitative and qualitative\ndisclosu\n\ntent of our websites are not incorporated by reference into this Quarterly\nReport on Form 10-Q or in any other report or document we file with the SEC, and any\nreferences to our websites are intended to be inactive textual references only.\n41\nTable of Contents\nAlphabet Inc.\nITEM 3.\nQUANTITATIVE AND QUALITATIVE DISCLOSURES ABOUT MARKET\nRISK\nWe are exposed to financial market risks, including changes in foreign currency\nexchange rates, interest rates and equity investment risks. Our exposure to ma\n\nquire\njudgment and the use of estimates, including discount rates, investee revenues and costs, and comparable market data\nof private and public companies, among others. When our assessment indicates that an impairment exists, we\nmeasure our non-marketable securities at fair value.\nITEM 7A.\nQUANTITATIVE AND QUALITATIVE DISCLOSURES ABOUT MARKET RISK\nWe are exposed to financial market risks, including changes in foreign currency exchange rates, interest rates,\nand equity investment risks.\nForeign ",
      "contexts": [
        "rterly Report on Form 10-Q or in any other report or document we\nfile with the SEC, and any references to our websites are intended to be inactive textual\nreferences only.\nITEM 3.\nQUANTITATIVE AND QUALITATIVE DISCLOSURES ABOUT MARKET\nRISK\nWe are exposed to financial market risks, including changes in foreign currency\nexchange rates, interest rates and equity investment risks. Our exposure to market risk\nhas not changed materially since December 31, 2020. For quantitative and qualitative\ndisclosu",
        "tent of our websites are not incorporated by reference into this Quarterly\nReport on Form 10-Q or in any other report or document we file with the SEC, and any\nreferences to our websites are intended to be inactive textual references only.\n41\nTable of Contents\nAlphabet Inc.\nITEM 3.\nQUANTITATIVE AND QUALITATIVE DISCLOSURES ABOUT MARKET\nRISK\nWe are exposed to financial market risks, including changes in foreign currency\nexchange rates, interest rates and equity investment risks. Our exposure to ma",
        "quire\njudgment and the use of estimates, including discount rates, investee revenues and costs, and comparable market data\nof private and public companies, among others. When our assessment indicates that an impairment exists, we\nmeasure our non-marketable securities at fair value.\nITEM 7A.\nQUANTITATIVE AND QUALITATIVE DISCLOSURES ABOUT MARKET RISK\nWe are exposed to financial market risks, including changes in foreign currency exchange rates, interest rates,\nand equity investment risks.\nForeign ",
        "e amount recorded, and such amounts could be material.\nITEM 7A.\nQUANTITATIVE AND QUALITATIVE DISCLOSURES ABOUT MARKET RISK\nWe are exposed to financial market risks, including changes in foreign currency exchange rates, interest rates,\nand equity investment risks.\nForeign Currency Exchange Risk\nWe transact business globally in multiple currencies. International revenues, as well as costs and expenses\ndenominated in foreign currencies, expose us to the risk of fluctuations in foreign currency exch",
        "ancial Statements included in Item 8 of this Annual Report on Form 10-K.\n44.\nTable of Contents\nAlphabet Inc.\nITEM 7A.\nQUANTITATIVE AND QUALITATIVE DISCLOSURES ABOUT MARKET RISK\nWe are exposed to financial market risks, including changes in foreign currency exchange rates, interest rates,\nand equity investment risks.\nForeign Currency Exchange Risk\nWe transact business globally in multiple currencies. International revenues, as well as costs and expenses\ndenominated in foreign currencies, expose u"
      ],
      "retrieved_docs": 5,
      "top_scores": [
        25.89178841329394,
        24.840475602325462,
        24.421552887912732
      ],
      "sources": [
        "goog-20210630.pdf",
        "goog-20210331.pdf",
        "Document.pdf",
        "goog-20241231.pdf",
        "goog-20231231.pdf"
      ],
      "execution_time": 0.20682215690612793,
      "k1": 1.5,
      "b": 0.75,
      "category": "technical",
      "query_id": 34,
      "difficulty": "hard"
    },
    {
      "question": "Does the report include non-GAAP financial measures, and how does the company reconcile them to GAAP/IFRS figures?",
      "answer": " competition law matters and otherwise. See, for example, Alphabet’s latest Annual Report on Form 10-K filed with the SEC.\nAdditionally, the company periodically posts updates and commentary about the company’s new and ongoing legal matters, including competition\nlegal matters, on Google’s Public Policy blog.\n \nOur Board of Directors does not believe that an additional report as detailed in the proposal would enhance our stockholders’ understanding of how\nthe company oversees competition risks. \n\nrcentage of male earnings (Organization for Economic Cooperation and Development). SUPPORTING STATEMENT: A report adequate for investors to assess company strategy and performance would include the percentage global median pay gap between male\nand female employees across race and ethnicity, including base, bonus and equity compensation. Alphabet Opposing Statement Our Board of Directors has carefully considered this proposal and, for the reasons set forth below, does not believe that it is in th\n\net robust external reporting requirements worldwide,\nwhich we believe provides information more substantive and instructive in nature than the type of report requested by the proponent in this proposal. For\nthese reasons, our Board does not believe that the additional report requested by this proposal would provide additional useful information to our\nstockholders, and recommends a vote AGAINST this proposal.\n \nWe promote content that is helpful for children\n \nFrom how we build and design our pr",
      "contexts": [
        " competition law matters and otherwise. See, for example, Alphabet’s latest Annual Report on Form 10-K filed with the SEC.\nAdditionally, the company periodically posts updates and commentary about the company’s new and ongoing legal matters, including competition\nlegal matters, on Google’s Public Policy blog.\n \nOur Board of Directors does not believe that an additional report as detailed in the proposal would enhance our stockholders’ understanding of how\nthe company oversees competition risks. ",
        "rcentage of male earnings (Organization for Economic Cooperation and Development). SUPPORTING STATEMENT: A report adequate for investors to assess company strategy and performance would include the percentage global median pay gap between male\nand female employees across race and ethnicity, including base, bonus and equity compensation. Alphabet Opposing Statement Our Board of Directors has carefully considered this proposal and, for the reasons set forth below, does not believe that it is in th",
        "et robust external reporting requirements worldwide,\nwhich we believe provides information more substantive and instructive in nature than the type of report requested by the proponent in this proposal. For\nthese reasons, our Board does not believe that the additional report requested by this proposal would provide additional useful information to our\nstockholders, and recommends a vote AGAINST this proposal.\n \nWe promote content that is helpful for children\n \nFrom how we build and design our pr",
        "e association or other organization of which Alphabet is a\nmember.\n \nBoth “direct and indirect lobbying” and “grassroots lobbying communications” include efforts at the local, state and federal levels.\n \nThe report shall be presented to the Nominating Committee and posted on Alphabet’s website.\n \nSupporting Statement\n \nAlphabet spent $105,845,000 on federal lobbying from 2015 – 2021. This does not include state lobbying. Alphabet lobbied in at least 38 states in\n2021. Alphabet also lobbies abroa",
        "olume-based pricing or minimum purchase requirements, if the volume of our hardware\nsales decreases or does not reach projected targets, we could face increased materials and\nmanufacturing costs or other financial liabilities that could make our products more costly per\nunit to manufacture and negatively affect our financial results. Furthermore, certain of our\ncompetitors may negotiate more favorable contractual terms based on volume and other\ncommitments that may provide them with competitive "
      ],
      "retrieved_docs": 5,
      "top_scores": [
        19.503267287807994,
        16.74798055643759,
        15.43922391275073
      ],
      "sources": [
        "ALPHABET INC. - DEF 14A_3.pdf",
        "lgoog2020_def14a.pdf",
        "ALPHABET INC. - DEF 14A.pdf",
        "ALPHABET INC. - DEF 14A_2.pdf",
        "goog-20200930.pdf"
      ],
      "execution_time": 0.2004070281982422,
      "k1": 1.5,
      "b": 0.75,
      "category": "technical",
      "query_id": 35,
      "difficulty": "hard"
    }
  ],
  "metrics": {
    "average_execution_time": 0.1979321300983429,
    "average_top_score": 19.55559742467514,
    "total_queries": 40,
    "indexing_time": 10.259079217910767
  }
}