{
  "system_name": "FAISS RAG",
  "total_chunks": 16228,
  "chunk_size": 500,
  "chunk_overlap": 50,
  "embedding_model": "sentence-transformers/all-MiniLM-L6-v2",
  "embedding_dim": 384,
  "llm_model": "fallback (без LLM)",
  "queries": [
    {
      "question": "What are the main business segments of the company according to the latest annual report?",
      "answer": " largest of which is Google. We report Google in two segments,\nGoogle Services and Google Cloud; we also report all non-Google businesses collectively as Other Bets. For additional\ninformation on our segments, see Part I, Item 1 Business and Note 15 of the Notes to Consolidated Financial\nStatements included in Item 8 of this Annual Report on Form 10-K.\nTrends in Our Business and Financial Effect\nThe following long-term trends have contributed to the results of our consolidated operations, and we\n\nof this Quarterly Report on Form\n10-Q as well as our Annual Report on Form 10-K for the fiscal year ended December  31,\n2024, including Part I, Item 1A \"Risk Factors.\"\nUnderstanding Alphabet’s Financial Results\nAlphabet is a collection of businesses — the largest of which is Google. We report\nGoogle in two segments, Google Services and Google Cloud; we also report all non-Google\nbusinesses collectively as Other Bets. For further details on our segments, see Note 15 of the\nNotes to Consolidated F\n\nredundant to the discussion previously included in\nItem 7 of our 2021 Annual Report on Form 10-K.\nUnderstanding Alphabet’s Financial Results\nAlphabet is a collection of businesses — the largest of which is Google. We report Google in two segments,\nGoogle Services and Google Cloud; we also report all non-Google businesses collectively as Other Bets. For further\ndetails on our segments, see Part I, Item 1 “Business” and Note 15 of the Notes to Consolidated Financial Statements\nincluded in Item 8 o",
      "contexts": [
        " largest of which is Google. We report Google in two segments,\nGoogle Services and Google Cloud; we also report all non-Google businesses collectively as Other Bets. For additional\ninformation on our segments, see Part I, Item 1 Business and Note 15 of the Notes to Consolidated Financial\nStatements included in Item 8 of this Annual Report on Form 10-K.\nTrends in Our Business and Financial Effect\nThe following long-term trends have contributed to the results of our consolidated operations, and we",
        "of this Quarterly Report on Form\n10-Q as well as our Annual Report on Form 10-K for the fiscal year ended December  31,\n2024, including Part I, Item 1A \"Risk Factors.\"\nUnderstanding Alphabet’s Financial Results\nAlphabet is a collection of businesses — the largest of which is Google. We report\nGoogle in two segments, Google Services and Google Cloud; we also report all non-Google\nbusinesses collectively as Other Bets. For further details on our segments, see Note 15 of the\nNotes to Consolidated F",
        "redundant to the discussion previously included in\nItem 7 of our 2021 Annual Report on Form 10-K.\nUnderstanding Alphabet’s Financial Results\nAlphabet is a collection of businesses — the largest of which is Google. We report Google in two segments,\nGoogle Services and Google Cloud; we also report all non-Google businesses collectively as Other Bets. For further\ndetails on our segments, see Part I, Item 1 “Business” and Note 15 of the Notes to Consolidated Financial Statements\nincluded in Item 8 o",
        " be completed later this year.\n33\nTable of Contents\nAlphabet In\nITEM 2.\nMANAGEMENT’S DISCUSSION AND ANALYSIS OF FINANCIAL\nCONDITION AND RESULTS OF OPERATIONS\nPlease read the following discussion and analysis of our financial condition and results of\noperations together with our consolidated financial statements and related notes included\nunder Part I, Item 1 of this Quarterly Report on Form 10-Q.\nExecutive Overview of Results\nBelow are our key financial results for the three months ended June 30",
        "ddition to a combination of factors, none of which were\nindividually significant.\nSegment Profitability\nWe report our segment results as Google Services, Google Cloud, and Other Bets. Additionally, certain costs are\nnot allocated to our segments because they represent Alphabet-level activities. For further details on our segments, see\nPart I, Item 1 Business and Note 15 of the Notes to Consolidated Financial Statements included in Item 8 of this Annual\nReport on Form 10-K.\nThe following table pr"
      ],
      "retrieved_docs": 5,
      "top_scores": [
        0.6132380962371826,
        0.6081774234771729,
        0.6047688126564026
      ],
      "sources": [
        "goog-20231231.pdf",
        "goog-20250930.pdf",
        "goog-20221231.pdf",
        "goog-20200630.pdf",
        "goog-20241231.pdf"
      ],
      "execution_time": 0.1536250114440918,
      "embedding_dim": 384,
      "category": "company_overview",
      "query_id": 1,
      "difficulty": "easy"
    },
    {
      "question": "In which geographic regions does the company generate most of its revenue?",
      "answer": "enues by Geography\nThe following table presents revenues by geography as a percentage of revenues,\ndetermined based on the addresses of our customers:\nThree Months Ended\nNine Months Ended\n \nSeptember 30,\nSeptember 30,\n \n2023\n2024\n2023\n2024\nUnited States\n47 %\n49 %\n47 %\n49 %\nEMEA\n30 %\n29 %\n30 %\n29 %\nAPAC\n17 %\n16 %\n17 %\n16 %\nOther Americas\n6 %\n6 %\n6 %\n6 %\nHedging gains (losses)\n0 %\n0 %\n0 %\n0 %\nFor additional information, see Note 2 of the Notes to Consolidated Financial Statements\nincluded in Item \n\n \n84 \nTotal revenues\n$\n68,011  $\n69,787 \nThe following table presents revenues disaggregated by geography, based on the\naddresses of our customers (in millions):\n \nThree Months Ended\nMarch 31,\n \n2022\n2023\nUnited States\n$\n31,733 \n47 % $\n32,864 \n47 %\nEMEA\n20,317 \n30 \n21,078 \n30 \nAPAC\n11,841 \n17 \n11,681 \n17 \nOther Americas\n3,842 \n6 \n4,080 \n6 \nHedging gains (losses)\n278 \n0 \n84 \n0 \nTotal revenues\n$\n68,011 \n100 % $\n69,787 \n100 %\n    Regions represent Europe, the Middle East, and Africa (EMEA); Asia-Pa\n\naffected by customer usage, market dynamics, as\nwell as new product and service launches.\nRevenues by Geography\nThe following table presents our revenues by geography as a percentage of revenues, determined based on the\naddresses of our customers:\n \nYear Ended December 31,\n \n2019\n2020\nUnited States\n46 %\n47 %\nEMEA\n31 %\n30 %\nAPAC\n17 %\n18 %\nOther Americas\n6 %\n5 %\nFor further details on revenues by geography, see Note 2 of the Notes to Consolidated Financial Statements\nincluded in Part II, Item 8 of",
      "contexts": [
        "enues by Geography\nThe following table presents revenues by geography as a percentage of revenues,\ndetermined based on the addresses of our customers:\nThree Months Ended\nNine Months Ended\n \nSeptember 30,\nSeptember 30,\n \n2023\n2024\n2023\n2024\nUnited States\n47 %\n49 %\n47 %\n49 %\nEMEA\n30 %\n29 %\n30 %\n29 %\nAPAC\n17 %\n16 %\n17 %\n16 %\nOther Americas\n6 %\n6 %\n6 %\n6 %\nHedging gains (losses)\n0 %\n0 %\n0 %\n0 %\nFor additional information, see Note 2 of the Notes to Consolidated Financial Statements\nincluded in Item ",
        " \n84 \nTotal revenues\n$\n68,011  $\n69,787 \nThe following table presents revenues disaggregated by geography, based on the\naddresses of our customers (in millions):\n \nThree Months Ended\nMarch 31,\n \n2022\n2023\nUnited States\n$\n31,733 \n47 % $\n32,864 \n47 %\nEMEA\n20,317 \n30 \n21,078 \n30 \nAPAC\n11,841 \n17 \n11,681 \n17 \nOther Americas\n3,842 \n6 \n4,080 \n6 \nHedging gains (losses)\n278 \n0 \n84 \n0 \nTotal revenues\n$\n68,011 \n100 % $\n69,787 \n100 %\n    Regions represent Europe, the Middle East, and Africa (EMEA); Asia-Pa",
        "affected by customer usage, market dynamics, as\nwell as new product and service launches.\nRevenues by Geography\nThe following table presents our revenues by geography as a percentage of revenues, determined based on the\naddresses of our customers:\n \nYear Ended December 31,\n \n2019\n2020\nUnited States\n46 %\n47 %\nEMEA\n31 %\n30 %\nAPAC\n17 %\n18 %\nOther Americas\n6 %\n5 %\nFor further details on revenues by geography, see Note 2 of the Notes to Consolidated Financial Statements\nincluded in Part II, Item 8 of",
        "Geography\nThe following table presents our revenues by geography as a percentage of\nrevenues, determined based on the addresses of our customers:\nThree Months Ended\nSix Months Ended\n \nJune 30,\nJune 30,\n \n2020\n2021\n2020\n2021\nUnited States\n47 %\n46 %\n47 %\n45 %\nEMEA\n30 %\n31 %\n30 %\n31 %\nAPAC\n18 %\n18 %\n18 %\n19 %\nOther Americas\n5 %\n5 %\n5 %\n5 %\nFor further details on revenues by geography, see Note 2 of the Notes to\nConsolidated Financial Statements included in Part I, Item 1 of this Quarterly Report on",
        "fected by customer\nusage, market dynamics, as well as new product and service launches.\nRevenues by Geography\nThe following table presents our revenues by geography as a percentage of\nrevenues, determined based on the addresses of our customers:\nThree Months Ended\nNine Months Ended\n \nSeptember 30,\nSeptember 30,\n \n2020\n2021\n2020\n2021\nUnited States\n47 %\n46 %\n47 %\n46 %\nEMEA\n30 %\n30 %\n30 %\n31 %\nAPAC\n18 %\n18 %\n18 %\n18 %\nOther Americas\n5 %\n6 %\n5 %\n5 %\nFor further details on revenues by geography, see "
      ],
      "retrieved_docs": 5,
      "top_scores": [
        0.6653376817703247,
        0.6603981256484985,
        0.6591796875
      ],
      "sources": [
        "goog-20240930.pdf",
        "goog-20230331.pdf",
        "goog-20201231.pdf",
        "goog-20210630.pdf",
        "goog-20210930.pdf"
      ],
      "execution_time": 0.33046412467956543,
      "embedding_dim": 384,
      "category": "company_overview",
      "query_id": 2,
      "difficulty": "medium"
    },
    {
      "question": "Summarize the company’s core products and services described in the annual report.",
      "answer": "h infrastructure and platform\nservices as well as communication and collaboration tools; sales of other products and\nservices, such as fees received for subscription-based products, apps and in-app purchases,\nand devices. For additional information on how we recognize revenue, see Note 1 of the Notes\nto Consolidated Financial Statements included in Part II, Item 8 in our Annual Report on Form\n10-K for the fiscal year ended December 31, 2023.\nIn addition to the long-term trends and their financia\n\nplatform\nservices, and applications; sales of other products and services, such as fees received for\nsubscription-based products, apps and in-app purchases, and devices. For additional\ninformation on how we recognize revenue, see Note 1 of the Notes to Consolidated Financial\nStatements included in Part II, Item 8 in our Annual Report on Form 10-K for the fiscal year\nended December 31, 2024.\nIn addition to the long-term trends and their financial effect on our business discussed in\n\"Trends in Our\n\n, platform\nservices, and applications; sales of other products and services, such as fees received for\nsubscription-based products, apps and in-app purchases, and devices. For additional\ninformation on how we recognize revenue, see Note 1 of the Notes to Consolidated Financial\nStatements included in Part II, Item 8 in our Annual Report on Form 10-K for the fiscal year\nended December 31, 2024.\nIn addition to the long-term trends and their financial effect on our business discussed in\n\"Trends in O",
      "contexts": [
        "h infrastructure and platform\nservices as well as communication and collaboration tools; sales of other products and\nservices, such as fees received for subscription-based products, apps and in-app purchases,\nand devices. For additional information on how we recognize revenue, see Note 1 of the Notes\nto Consolidated Financial Statements included in Part II, Item 8 in our Annual Report on Form\n10-K for the fiscal year ended December 31, 2023.\nIn addition to the long-term trends and their financia",
        "platform\nservices, and applications; sales of other products and services, such as fees received for\nsubscription-based products, apps and in-app purchases, and devices. For additional\ninformation on how we recognize revenue, see Note 1 of the Notes to Consolidated Financial\nStatements included in Part II, Item 8 in our Annual Report on Form 10-K for the fiscal year\nended December 31, 2024.\nIn addition to the long-term trends and their financial effect on our business discussed in\n\"Trends in Our",
        ", platform\nservices, and applications; sales of other products and services, such as fees received for\nsubscription-based products, apps and in-app purchases, and devices. For additional\ninformation on how we recognize revenue, see Note 1 of the Notes to Consolidated Financial\nStatements included in Part II, Item 8 in our Annual Report on Form 10-K for the fiscal year\nended December 31, 2024.\nIn addition to the long-term trends and their financial effect on our business discussed in\n\"Trends in O",
        " products and\nservices, such as apps and in-app purchases, and hardware; and fees received for\nsubscription-based products. For details on how we recognize revenue, see Note 1 of the Notes\nto Consolidated Financial Statements included in Part II, Item 8 in our Annual Report on Form\n10-K for the fiscal year ended December 31, 2022.\nIn addition to the long-term trends and their financial effect on our business noted in\n\"Trends in Our Business and Financial Effect\" in Part II, Item 7 of our Annual ",
        " be completed later this year.\n33\nTable of Contents\nAlphabet In\nITEM 2.\nMANAGEMENT’S DISCUSSION AND ANALYSIS OF FINANCIAL\nCONDITION AND RESULTS OF OPERATIONS\nPlease read the following discussion and analysis of our financial condition and results of\noperations together with our consolidated financial statements and related notes included\nunder Part I, Item 1 of this Quarterly Report on Form 10-Q.\nExecutive Overview of Results\nBelow are our key financial results for the three months ended June 30"
      ],
      "retrieved_docs": 5,
      "top_scores": [
        0.5403014421463013,
        0.5249202251434326,
        0.52134108543396
      ],
      "sources": [
        "goog-20240930.pdf",
        "goog-20250630.pdf",
        "goog-20250331.pdf",
        "goog-20230331.pdf",
        "goog-20200630.pdf"
      ],
      "execution_time": 0.061604976654052734,
      "embedding_dim": 384,
      "category": "company_overview",
      "query_id": 3,
      "difficulty": "medium"
    },
    {
      "question": "How does the company describe its overall business model and value proposition?",
      "answer": "ain and motivate our\nexisting employees.\nIn addition, we believe that our corporate culture fosters innovation, creativity, and teamwork. As our organization\ngrows, and we are required to implement more complex organizational management structures, particularly in light of\nour holding company structure, adverse changes to our corporate culture could harm our business operations.\nIn preparing our financial statements, we incorporate valuation methodologies that are subjective in\nnature and valuat\n\n strong\ncompany and creating stockholder value. This value creation is supported by the stability provided by our capital structure, which insulates us from short-\nterm pressures and gives us greater ability to focus on long-term opportunities. A multi-class structure allows our management to take calculated risks in\nfurtherance of maximizing long-term returns, and the strategic decisions made over the years by Alphabet’s management has enabled it to become one\nof the most successful companies i\n\n by the use of our\nproducts or services to disseminate information that is deemed to be false or misleading.\nFurthermore, failure to maintain and enhance equity in our brands may harm our\nbusiness, financial condition, and operating results. Our success will depend largely on our\nability to remain a technology leader and continue to provide high-quality, innovative products\nand services that are truly useful and play a valuable role in a range of settings.\nWe face a number of manufacturing and s",
      "contexts": [
        "ain and motivate our\nexisting employees.\nIn addition, we believe that our corporate culture fosters innovation, creativity, and teamwork. As our organization\ngrows, and we are required to implement more complex organizational management structures, particularly in light of\nour holding company structure, adverse changes to our corporate culture could harm our business operations.\nIn preparing our financial statements, we incorporate valuation methodologies that are subjective in\nnature and valuat",
        " strong\ncompany and creating stockholder value. This value creation is supported by the stability provided by our capital structure, which insulates us from short-\nterm pressures and gives us greater ability to focus on long-term opportunities. A multi-class structure allows our management to take calculated risks in\nfurtherance of maximizing long-term returns, and the strategic decisions made over the years by Alphabet’s management has enabled it to become one\nof the most successful companies i",
        " by the use of our\nproducts or services to disseminate information that is deemed to be false or misleading.\nFurthermore, failure to maintain and enhance equity in our brands may harm our\nbusiness, financial condition, and operating results. Our success will depend largely on our\nability to remain a technology leader and continue to provide high-quality, innovative products\nand services that are truly useful and play a valuable role in a range of settings.\nWe face a number of manufacturing and s",
        "corporate culture and work environments\nto ever-changing circumstances, such as during times of a natural disaster or pandemic\n(including COVID-19), and these changes could impact our ability to compete effectively or\nhave an adverse impact on our corporate culture.\nIn preparing our financial statements, we incorporate valuation methodologies\nthat are subjective in nature and valuations may fluctuate over time.\nWe measure certain of our non-marketable equity and debt investments, certain other\ni",
        "lex\norganizational management structures or adapt our corporate culture and work environments\nto ever-changing circumstances, such as during times of a natural disaster or pandemic\n(including COVID-19), and these changes could impact our ability to compete effectively or\nhave an adverse impact on our corporate culture.\nIn preparing our financial statements, we incorporate valuation methodologies\nthat are subjective in nature and valuations may fluctuate over time.\nWe measure certain of our non-m"
      ],
      "retrieved_docs": 5,
      "top_scores": [
        0.5757277011871338,
        0.5123777389526367,
        0.4960891008377075
      ],
      "sources": [
        "Document.pdf",
        "ALPHABET INC. - DEF14A.pdf",
        "goog-20200930.pdf",
        "goog-20200930.pdf",
        "goog-20200630.pdf"
      ],
      "execution_time": 0.011621236801147461,
      "embedding_dim": 384,
      "category": "company_overview",
      "query_id": 4,
      "difficulty": "hard"
    },
    {
      "question": "What key macroeconomic or industry trends does management highlight as influencing the company’s performance?",
      "answer": "nality. Our rapid growth has tended to\nmask the cyclicality and seasonality of our business. As our growth rate has slowed,\nthe cyclicality and seasonality in our business has become more pronounced and\ncaused our operating results to fluctuate.\n•\nGeopolitical events, including trade disputes.\n•\nChanges in global business or macroeconomic conditions.\nBecause our businesses are changing and evolving, our historical operating results may\nnot be useful to you in predicting our future operating resu\n\ns does not reflect an endorsement of their agendas.\n \nThe proposal seeks to micromanage the company’s ordinary business operations\n \nDecisions regarding future participation in specific benchmarking tools are operational matters best executed by members of our management team who\npossess the necessary expertise and strategic insights. These decisions involve internal assessments, stakeholder consultations, and ongoing\nevaluations of effectiveness, all requiring management discretion. This propos\n\nperformance metrics for incentive pay of senior executives. For example, stock buybacks\ncan increase earnings per share, return on assets, and return on equity. While stock buybacks may also boost stock prices in the short term, we are\nconcerned that they can deprive companies of capital necessary for creating long term growth.\n \nIn our view, senior executives are responsible for improving our company’s operational performance, whereas the Board of Directors is responsible for\ndetermining when s",
      "contexts": [
        "nality. Our rapid growth has tended to\nmask the cyclicality and seasonality of our business. As our growth rate has slowed,\nthe cyclicality and seasonality in our business has become more pronounced and\ncaused our operating results to fluctuate.\n•\nGeopolitical events, including trade disputes.\n•\nChanges in global business or macroeconomic conditions.\nBecause our businesses are changing and evolving, our historical operating results may\nnot be useful to you in predicting our future operating resu",
        "s does not reflect an endorsement of their agendas.\n \nThe proposal seeks to micromanage the company’s ordinary business operations\n \nDecisions regarding future participation in specific benchmarking tools are operational matters best executed by members of our management team who\npossess the necessary expertise and strategic insights. These decisions involve internal assessments, stakeholder consultations, and ongoing\nevaluations of effectiveness, all requiring management discretion. This propos",
        "performance metrics for incentive pay of senior executives. For example, stock buybacks\ncan increase earnings per share, return on assets, and return on equity. While stock buybacks may also boost stock prices in the short term, we are\nconcerned that they can deprive companies of capital necessary for creating long term growth.\n \nIn our view, senior executives are responsible for improving our company’s operational performance, whereas the Board of Directors is responsible for\ndetermining when s",
        "s regarding:\n•\nthe ongoing effect of the novel coronavirus pandemic (\"COVID-19\"), including its macroeconomic effects on our\nbusiness, operations, and financial results; and the effect of governmental lockdowns, restrictions and new\nregulations on our operations and processes;\n•\nthe growth of our business and revenues and our expectations about the factors that influence our success and\ntrends in our business, including the size and timing of the expected return on our continuing investments in\n",
        " many\noutside of our control, including the cyclical nature and seasonality in our business and geopolitical events. As a result,\ncomparing our operating results (including our expenses as a percentage of our revenues) on a period-to-period basis\nmay not be meaningful, and our past results should not be relied on as an indication of our future performance.\nConsequently, our operating results in future quarters may fall below expectations.\nAcquisitions, joint ventures, investments, and divestitur"
      ],
      "retrieved_docs": 5,
      "top_scores": [
        0.5291755199432373,
        0.5231317281723022,
        0.5174751281738281
      ],
      "sources": [
        "goog-20200930.pdf",
        "ALPHABET INC. - DEF14A.pdf",
        "ALPHABET INC. - DEF14A.pdf",
        "goog-20201231.pdf",
        "goog-20241231.pdf"
      ],
      "execution_time": 0.03029179573059082,
      "embedding_dim": 384,
      "category": "company_overview",
      "query_id": 36,
      "difficulty": "medium"
    },
    {
      "question": "What was the company’s total revenue in the most recent fiscal year, and how did it change compared to the previous year?",
      "answer": "dated financial results (in millions, except for per share information and\npercentages):\nYear Ended December 31,\n2023\n2024\n$ Change\n% Change\nConsolidated revenues\n$\n307,394 \n$\n350,018 \n$\n42,624 \n14 %\nChange in consolidated constant currency revenues\n15 %\nCost of revenues\n$\n133,332 \n$\n146,306 \n$\n12,974 \n10 %\nOperating expenses\n$\n89,769 \n$\n91,322 \n$\n1,553 \n2 %\nOperating income\n$\n84,293 \n$\n112,390 \n$\n28,097 \n33 %\nOperating margin\n27 %\n32 %\n5 %\nOther income (expense), net\n$\n1,424 \n$\n7,425 \n$\n6,001 \n\n\nfluctuations in our quarterly results, including fluctuations in sequential revenue growth rates.\n \nQuarter Ended\n \nMar 31,\n2019\nJun 30,\n2019\nSept 30,\n2019\nDec 31,\n2019\nMar 31,\n2020\nJun 30,\n2020\nSept 30,\n2020\nDec 31,\n2020\n(In millions, except per share amounts) (unaudited)\nConsolidated Statements of Income Data:\nRevenues\n$ 36,339  $ 38,944  $ 40,499  $ 46,075  $ 41,159  $ 38,297  $ 46,173 \n56,898 \nCosts and expenses:\nCost of revenues\n16,012 \n17,296 \n17,568 \n21,020 \n18,982 \n18,553 \n21,117 \n26,080\n\n see Note 9 of the Notes to Consolidated Financial Statements\nincluded in Item 1 of this Quarterly Report on Form 10-Q.\n•\nOperating cash flow was $26.6 billion for the three months ended June 30, 2024.\n•\nCapital expenditures, which primarily reflected investments in technical infrastructure,\nwere $13.2 billion for the three months ended June 30, 2024.\n•\nAs of June 30, 2024, we had 179,582 employees.\nFinancial Results\nRevenues\nThe following table presents revenues by type (in millions):\n \nThree M",
      "contexts": [
        "dated financial results (in millions, except for per share information and\npercentages):\nYear Ended December 31,\n2023\n2024\n$ Change\n% Change\nConsolidated revenues\n$\n307,394 \n$\n350,018 \n$\n42,624 \n14 %\nChange in consolidated constant currency revenues\n15 %\nCost of revenues\n$\n133,332 \n$\n146,306 \n$\n12,974 \n10 %\nOperating expenses\n$\n89,769 \n$\n91,322 \n$\n1,553 \n2 %\nOperating income\n$\n84,293 \n$\n112,390 \n$\n28,097 \n33 %\nOperating margin\n27 %\n32 %\n5 %\nOther income (expense), net\n$\n1,424 \n$\n7,425 \n$\n6,001 \n",
        "fluctuations in our quarterly results, including fluctuations in sequential revenue growth rates.\n \nQuarter Ended\n \nMar 31,\n2019\nJun 30,\n2019\nSept 30,\n2019\nDec 31,\n2019\nMar 31,\n2020\nJun 30,\n2020\nSept 30,\n2020\nDec 31,\n2020\n(In millions, except per share amounts) (unaudited)\nConsolidated Statements of Income Data:\nRevenues\n$ 36,339  $ 38,944  $ 40,499  $ 46,075  $ 41,159  $ 38,297  $ 46,173 \n56,898 \nCosts and expenses:\nCost of revenues\n16,012 \n17,296 \n17,568 \n21,020 \n18,982 \n18,553 \n21,117 \n26,080",
        " see Note 9 of the Notes to Consolidated Financial Statements\nincluded in Item 1 of this Quarterly Report on Form 10-Q.\n•\nOperating cash flow was $26.6 billion for the three months ended June 30, 2024.\n•\nCapital expenditures, which primarily reflected investments in technical infrastructure,\nwere $13.2 billion for the three months ended June 30, 2024.\n•\nAs of June 30, 2024, we had 179,582 employees.\nFinancial Results\nRevenues\nThe following table presents revenues by type (in millions):\n \nThree M",
        "r the fiscal year ended\nDecember  31, 2022 as well as Note 13 of the Notes to Consolidated Financial Statements\nincluded in Item 1 of this Quarterly Report on Form 10-Q.\nExecutive Overview\nThe following table summarizes our consolidated financial results (in millions, except per\nshare information and percentages):\nThree Months Ended\nMarch 31,\n2022\n2023\n$ Change\n% Change\nConsolidated revenues\n$\n68,011 \n$\n69,787 \n$\n1,776 \n3 %\nChange in consolidated constant\ncurrency revenues\n6 %\nCost of revenues\n$",
        "atements\nincluded in Part II, Item 8 in our Annual Report on Form 10-K for the fiscal year ended\nDecember  31, 2024 as well as Note 14 of the Notes to Consolidated Financial Statements\nincluded in Item 1 of this Quarterly Report on Form 10-Q.\nExecutive Overview\nThe following table summarizes consolidated financial results (in millions, except per\nshare information and percentages):\nThree Months Ended\nJune 30,\n2024\n2025\n$ Change\n% Change\nConsolidated revenues\n$\n84,742 \n$\n96,428 \n$\n11,686 \n14 %\nCh"
      ],
      "retrieved_docs": 5,
      "top_scores": [
        0.6671714782714844,
        0.6308143734931946,
        0.6306219696998596
      ],
      "sources": [
        "goog-20241231.pdf",
        "goog-20201231.pdf",
        "goog-20240630.pdf",
        "goog-20230331.pdf",
        "goog-20250630.pdf"
      ],
      "execution_time": 0.029835939407348633,
      "embedding_dim": 384,
      "category": "financials",
      "query_id": 5,
      "difficulty": "easy"
    },
    {
      "question": "What are the main drivers of revenue growth mentioned in the Management’s Discussion and Analysis (MD&A)?",
      "answer": "dvertising revenue growth rate has been affected over time as a result of a\nnumber of factors, including challenges in maintaining our growth rate as revenues\nincrease to higher levels; changes in our product mix; changes in advertising quality or\nformats and delivery; the evolution of the online advertising market; increasing competition;\nour investments in new business strategies; query growth rates; and shifts in the\ngeographic mix of our revenues. We also expect that our revenue growth rate \n\n infrastructure, platform services, and applications; sales of other products and\nservices, such as fees received for subscription-based products, apps and in-app purchases, and devices. For\nadditional information on how we recognize revenue, see Note 1 of the Notes to Consolidated Financial Statements\nincluded in Item 8 of this Annual Report on Form 10-K.\nIn addition to the long-term trends and their financial effect on our business discussed above, fluctuations in our\nrevenues have been and ma\n\nation, financial condition, and\noperating results.\nOur revenue growth rate could decline over time, and we anticipate downward pressure on our operating\nmargin in the future.\nOur revenue growth rate could decline over time as a result of a number of factors, including increasing\ncompetition and the continued expansion of our business into a variety of new fields. Changes in device mix,\ngeographic mix, ongoing product and policy changes, product mix, and property mix and an increasing competition",
      "contexts": [
        "dvertising revenue growth rate has been affected over time as a result of a\nnumber of factors, including challenges in maintaining our growth rate as revenues\nincrease to higher levels; changes in our product mix; changes in advertising quality or\nformats and delivery; the evolution of the online advertising market; increasing competition;\nour investments in new business strategies; query growth rates; and shifts in the\ngeographic mix of our revenues. We also expect that our revenue growth rate ",
        " infrastructure, platform services, and applications; sales of other products and\nservices, such as fees received for subscription-based products, apps and in-app purchases, and devices. For\nadditional information on how we recognize revenue, see Note 1 of the Notes to Consolidated Financial Statements\nincluded in Item 8 of this Annual Report on Form 10-K.\nIn addition to the long-term trends and their financial effect on our business discussed above, fluctuations in our\nrevenues have been and ma",
        "ation, financial condition, and\noperating results.\nOur revenue growth rate could decline over time, and we anticipate downward pressure on our operating\nmargin in the future.\nOur revenue growth rate could decline over time as a result of a number of factors, including increasing\ncompetition and the continued expansion of our business into a variety of new fields. Changes in device mix,\ngeographic mix, ongoing product and policy changes, product mix, and property mix and an increasing competition",
        "es in maintaining our growth rate as revenues increase to higher levels; changes in our product mix; changes\nin advertising quality or formats and delivery; the evolution of the online advertising market; increasing competition; our\ninvestments in new business strategies; query growth rates; and shifts in the geographic mix of our revenues. We also\nexpect that our revenue growth rate will continue to be affected by evolving user preferences, the acceptance by users\nof our products and services a",
        "consolidated revenue growth.\n•\nTotal constant currency revenues, which exclude the effect of hedging, increased 11%\nyear over year reflecting the strengthening of the U.S. dollar.\n•\nCost of revenues was $31.2 billion, an increase of 13% year over year, primarily\ndriven by an increase in other costs of revenues.\n•\nOperating expenses were $20.8 billion, an increase of 26% year over year, primarily\ndriven by increases in compensation expenses due to headcount growth and\nadvertising and promotional "
      ],
      "retrieved_docs": 5,
      "top_scores": [
        0.6099729537963867,
        0.58505779504776,
        0.5730630159378052
      ],
      "sources": [
        "goog-20210930.pdf",
        "goog-20241231.pdf",
        "goog-20201231.pdf",
        "Document.pdf",
        "goog-20220930.pdf"
      ],
      "execution_time": 0.029455900192260742,
      "embedding_dim": 384,
      "category": "financials",
      "query_id": 6,
      "difficulty": "medium"
    },
    {
      "question": "How does the company break down its revenue by segment or product line?",
      "answer": "s\nas a percentage of revenues\n5 %\n4 %\n5 %\n4 %\nGeneral and administrative expenses decreased $380 million and $1.4 billion from the\nthree and nine months ended September 30, 2023 to the three and nine months ended\nSeptember 30, 2024, primarily driven by a reduction in charges related to legal and other\nmatters of $693 million and $1.4 billion, respectively, partially offset by a combination of\nfactors, none of which were individually significant.\nSegment Profitability\nThe following table presents\n\n25 and a $1.4 billion legal accrual made in\nthe second quarter of 2025.\nSegment Profitability\nWe report our segment results as Google Services, Google Cloud, and Other Bets.\nAdditionally, certain costs are not allocated to our segments because they represent Alphabet-\nlevel activities. For further details on our segments, see Note 15 of the Notes to Consolidated\nFinancial Statements included in Item 1 of this Quarterly Report on Form 10-Q.\nThe following table presents segment operating income (l\n\nerating segments as a service cost generally based on usage or headcount.\nUnallocated corporate costs primarily include corporate initiatives, corporate shared\ncosts, such as finance and legal, including certain fines and settlements, as well as costs\nassociated with certain shared R&D activities. Additionally, hedging gains (losses) related to\nrevenue are included in corporate costs.\nOur operating segments are not evaluated using asset information.\nThe following table presents information about",
      "contexts": [
        "s\nas a percentage of revenues\n5 %\n4 %\n5 %\n4 %\nGeneral and administrative expenses decreased $380 million and $1.4 billion from the\nthree and nine months ended September 30, 2023 to the three and nine months ended\nSeptember 30, 2024, primarily driven by a reduction in charges related to legal and other\nmatters of $693 million and $1.4 billion, respectively, partially offset by a combination of\nfactors, none of which were individually significant.\nSegment Profitability\nThe following table presents",
        "25 and a $1.4 billion legal accrual made in\nthe second quarter of 2025.\nSegment Profitability\nWe report our segment results as Google Services, Google Cloud, and Other Bets.\nAdditionally, certain costs are not allocated to our segments because they represent Alphabet-\nlevel activities. For further details on our segments, see Note 15 of the Notes to Consolidated\nFinancial Statements included in Item 1 of this Quarterly Report on Form 10-Q.\nThe following table presents segment operating income (l",
        "erating segments as a service cost generally based on usage or headcount.\nUnallocated corporate costs primarily include corporate initiatives, corporate shared\ncosts, such as finance and legal, including certain fines and settlements, as well as costs\nassociated with certain shared R&D activities. Additionally, hedging gains (losses) related to\nrevenue are included in corporate costs.\nOur operating segments are not evaluated using asset information.\nThe following table presents information about",
        "ddition to a combination of factors, none of which were\nindividually significant.\nSegment Profitability\nWe report our segment results as Google Services, Google Cloud, and Other Bets. Additionally, certain costs are\nnot allocated to our segments because they represent Alphabet-level activities. For further details on our segments, see\nPart I, Item 1 Business and Note 15 of the Notes to Consolidated Financial Statements included in Item 8 of this Annual\nReport on Form 10-K.\nThe following table pr",
        "venues, cost of revenues, and operating expenses are generally directly attributed to\nour segments. Inter-segment revenues are not presented separately, as these amounts are\nimmaterial. Our Chief Operating Decision Maker does not evaluate operating segments using\nasset information.\n28\nTable of Contents\nAlphabet In\nInformation about segments during the periods presented were as follows (in millions,\nunaudited):\n \nThree Months Ended\nMarch 31,\n \n2019\n2020\nRevenues:\nGoogle\n$\n36,032   $\n40,975  \nOthe"
      ],
      "retrieved_docs": 5,
      "top_scores": [
        0.6404846906661987,
        0.6173681020736694,
        0.6082792282104492
      ],
      "sources": [
        "goog-20240930.pdf",
        "goog-20250930.pdf",
        "goog-20220930.pdf",
        "goog-20241231.pdf",
        "goog-20200331.pdf"
      ],
      "execution_time": 0.08542108535766602,
      "embedding_dim": 384,
      "category": "financials",
      "query_id": 7,
      "difficulty": "medium"
    },
    {
      "question": "What are the company’s operating income and net income for the latest year, and what are the main reasons for any significant changes?",
      "answer": "dated financial results (in millions, except for per share information and\npercentages):\nYear Ended December 31,\n2023\n2024\n$ Change\n% Change\nConsolidated revenues\n$\n307,394 \n$\n350,018 \n$\n42,624 \n14 %\nChange in consolidated constant currency revenues\n15 %\nCost of revenues\n$\n133,332 \n$\n146,306 \n$\n12,974 \n10 %\nOperating expenses\n$\n89,769 \n$\n91,322 \n$\n1,553 \n2 %\nOperating income\n$\n84,293 \n$\n112,390 \n$\n28,097 \n33 %\nOperating margin\n27 %\n32 %\n5 %\nOther income (expense), net\n$\n1,424 \n$\n7,425 \n$\n6,001 \n\n\n6 million. Operating income of $852  million for the nine\nmonths ended September 30, 2023 compared to an operating loss of $1.7 billion for the nine\nmonths ended September 30, 2022 represents an increase of $2.6 billion. The increase in\noperating income was primarily driven by revenue growth, partially offset by an increase in\ncompensation expenses. Additionally, operating income benefited from a reduction in costs\ndriven by the change in the estimated useful lives of our servers and certain net\n\n\n \nYear Ended December 31,\n \n2017\n \n2018\n2019\nOperating activities\n \n \n \nNet income\n$\n12,662   $\n30,736\n$\n34,343\nAdjustments:\n \n \n \nDepreciation and impairment of property and equipment\n6,103  \n8,164\n10,856\nAmortization and impairment of intangible assets\n812  \n871\n925\nStock-based compensation expense\n7,679  \n9,353\n10,794\nDeferred income taxes\n258  \n778\n173\n(Gain) loss on debt and equity securities, net\n37  \n(6,650)\n(2,798)\nOther\n294  \n(189)\n(592)\nChanges in assets and liabilities, net of effect",
      "contexts": [
        "dated financial results (in millions, except for per share information and\npercentages):\nYear Ended December 31,\n2023\n2024\n$ Change\n% Change\nConsolidated revenues\n$\n307,394 \n$\n350,018 \n$\n42,624 \n14 %\nChange in consolidated constant currency revenues\n15 %\nCost of revenues\n$\n133,332 \n$\n146,306 \n$\n12,974 \n10 %\nOperating expenses\n$\n89,769 \n$\n91,322 \n$\n1,553 \n2 %\nOperating income\n$\n84,293 \n$\n112,390 \n$\n28,097 \n33 %\nOperating margin\n27 %\n32 %\n5 %\nOther income (expense), net\n$\n1,424 \n$\n7,425 \n$\n6,001 \n",
        "6 million. Operating income of $852  million for the nine\nmonths ended September 30, 2023 compared to an operating loss of $1.7 billion for the nine\nmonths ended September 30, 2022 represents an increase of $2.6 billion. The increase in\noperating income was primarily driven by revenue growth, partially offset by an increase in\ncompensation expenses. Additionally, operating income benefited from a reduction in costs\ndriven by the change in the estimated useful lives of our servers and certain net",
        "\n \nYear Ended December 31,\n \n2017\n \n2018\n2019\nOperating activities\n \n \n \nNet income\n$\n12,662   $\n30,736\n$\n34,343\nAdjustments:\n \n \n \nDepreciation and impairment of property and equipment\n6,103  \n8,164\n10,856\nAmortization and impairment of intangible assets\n812  \n871\n925\nStock-based compensation expense\n7,679  \n9,353\n10,794\nDeferred income taxes\n258  \n778\n173\n(Gain) loss on debt and equity securities, net\n37  \n(6,650)\n(2,798)\nOther\n294  \n(189)\n(592)\nChanges in assets and liabilities, net of effect",
        "mentary Data” of this Annual Report on\nForm 10-K. The historical results are not necessarily indicative of the results to be expected in any future period.\n \nYear Ended December 31,\n \n2016\n2017\n2018\n2019\n2020\n \n(in millions, except per share amounts)\nConsolidated Statements of Income Data:\nRevenues\n$\n90,272 \n$\n110,855 \n$\n136,819 \n$\n161,857 \n$\n182,527 \nIncome from operations\n$\n23,737 \n$\n26,178 \n$\n27,524 \n$\n34,231 \n$\n41,224 \nNet income\n$\n19,478 \n$\n12,662 \n$\n30,736 \n$\n34,343 \n$\n40,269 \nBasic net in",
        " December 31, 2020 for more information.\nExecutive Overview\nThe following table summarizes our consolidated financial results (in millions, except\nfor per share information and percentages).\nThree Months Ended\nSeptember 30,\n2020\n2021\nRevenues\n$\n46,173 \n$\n65,118 \nChange in revenues year over year\n14 %\n41 %\nChange in constant currency revenues year over year\n15 %\n39 %\nOperating income\n$\n11,213 \n$\n21,031 \nOperating margin\n24 %\n32 %\nOther income (expense), net\n$\n2,146 \n$\n2,033 \nNet Income\n$\n11,247 \n"
      ],
      "retrieved_docs": 5,
      "top_scores": [
        0.6737303137779236,
        0.6669071912765503,
        0.6393958330154419
      ],
      "sources": [
        "goog-20241231.pdf",
        "goog-20230930.pdf",
        "Document.pdf",
        "goog-20201231.pdf",
        "goog-20210930.pdf"
      ],
      "execution_time": 0.02938103675842285,
      "embedding_dim": 384,
      "category": "financials",
      "query_id": 8,
      "difficulty": "hard"
    },
    {
      "question": "How much did the company spend on research and development (R&D) in the latest fiscal year?",
      "answer": " presents R&D expenses (in millions, except percentages):\nThree Months Ended\nSix Months Ended\n \nJune 30,\nJune 30,\n \n2021\n2022\n2021\n2022\nResearch and development\nexpenses\n$\n7,675 \n$\n9,841 \n$ 15,160 \n$ 18,960 \nResearch and development\nexpenses as a percentage of\nrevenues\n12.4 %\n14.1 %\n12.9 %\n13.8 %\nR&D expenses increased $2.2 billion from the three months ended June 30, 2021 to\nthe three months ended June 30, 2022. The increase was primarily driven by an increase\nin compensation expenses of $1.4 b\n\ndue to the change in the estimated useful life of\nour servers and certain network equipment.\nResearch and Development\nThe following table presents R&D expenses (in millions, except percentages):\nThree Months Ended\n \nMarch 31,\n \n2022\n2023\nResearch and development expenses\n$\n9,119 \n$\n11,468 \nResearch and development expenses as a percentage of\nrevenues\n13 %\n16 %\nR&D expenses increased $2.3 billion from the three months ended March 31, 2022 to the\nthree months ended March 31, 2023 primarily driven \n\n, which generally have higher\ncosts of revenues, relative to our advertising revenues.\nResearch and Development\nThe following table presents our R&D expenses (in millions, except percentages):\nThree Months Ended\n \nMarch 31,\n \n2020\n2021\nResearch and development expenses\n$\n6,820 \n$\n7,485 \nResearch and development expenses as a percentage\nof revenues\n16.6 %\n13.5 %\nR&D expenses consist primarily of:\n•\nCompensation expenses (including SBC) for engineering and technical employees\nresponsible for R&D o",
      "contexts": [
        " presents R&D expenses (in millions, except percentages):\nThree Months Ended\nSix Months Ended\n \nJune 30,\nJune 30,\n \n2021\n2022\n2021\n2022\nResearch and development\nexpenses\n$\n7,675 \n$\n9,841 \n$ 15,160 \n$ 18,960 \nResearch and development\nexpenses as a percentage of\nrevenues\n12.4 %\n14.1 %\n12.9 %\n13.8 %\nR&D expenses increased $2.2 billion from the three months ended June 30, 2021 to\nthe three months ended June 30, 2022. The increase was primarily driven by an increase\nin compensation expenses of $1.4 b",
        "due to the change in the estimated useful life of\nour servers and certain network equipment.\nResearch and Development\nThe following table presents R&D expenses (in millions, except percentages):\nThree Months Ended\n \nMarch 31,\n \n2022\n2023\nResearch and development expenses\n$\n9,119 \n$\n11,468 \nResearch and development expenses as a percentage of\nrevenues\n13 %\n16 %\nR&D expenses increased $2.3 billion from the three months ended March 31, 2022 to the\nthree months ended March 31, 2023 primarily driven ",
        ", which generally have higher\ncosts of revenues, relative to our advertising revenues.\nResearch and Development\nThe following table presents our R&D expenses (in millions, except percentages):\nThree Months Ended\n \nMarch 31,\n \n2020\n2021\nResearch and development expenses\n$\n6,820 \n$\n7,485 \nResearch and development expenses as a percentage\nof revenues\n16.6 %\n13.5 %\nR&D expenses consist primarily of:\n•\nCompensation expenses (including SBC) for engineering and technical employees\nresponsible for R&D o",
        "ollowing table presents R&D expenses (in millions, except percentages):\n \nYear Ended December 31,\n \n2021\n2022\nResearch and development expenses\n$\n31,562 \n$\n39,500 \nResearch and development expenses as a percentage of revenues\n12 %\n14 %\nR&D expenses increased $7.9 billion from 2021 to 2022 primarily driven by an increase in compensation\nexpenses of $5.4 billion, largely resulting from a 21% increase in average headcount, and an increase in third-party\nservice fees of $704 million.\nSales and Marke",
        "\n27,573 \n$\n31,562 \nResearch and development expenses as a percentage of revenues\n15.1 %\n12.3 %\nR&D expenses increased $4.0 billion from 2020 to 2021. The increase was primarily due to an increase in\ncompensation expenses of $3.5 billion, largely resulting from an 11% increase in headcount, and an increase in\nprofessional service fees of $516 million. This increase was partially offset by a reduction in depreciation expense of\n$450 million including the effect of our change in the estimated usefu"
      ],
      "retrieved_docs": 5,
      "top_scores": [
        0.7772926092147827,
        0.7763654589653015,
        0.7579347491264343
      ],
      "sources": [
        "goog-20220630.pdf",
        "goog-20230331.pdf",
        "goog-20210331.pdf",
        "goog-20221231.pdf",
        "goog-20211231.pdf"
      ],
      "execution_time": 0.03693699836730957,
      "embedding_dim": 384,
      "category": "financials",
      "query_id": 9,
      "difficulty": "easy"
    },
    {
      "question": "Describe the company’s capital structure: what is the mix between debt and equity according to the balance sheet?",
      "answer": "of these\ncompanies.\n2\nTable of Contents\nAlphabet In\nPART I.    FINANCIAL INFORMATION\nITEM 1.\nFINANCIAL STATEMENTS\nAlphabet Inc.\nCONSOLIDATED BALANCE SHEETS\n(in millions, except share amounts which are reflected in thousands, and par value per share\namounts)\nAs of\nDecember 31,\n2019\nAs of\nSeptember 30,\n2020\n(unaudited)\nAssets\nCurrent assets:\nCash and cash equivalents\n$\n18,498  $\n20,129 \nMarketable securities\n101,177 \n112,467 \nTotal cash, cash equivalents, and marketable\nsecurities\n119,675 \n132,596\n\n, or any relationship with any of\nthese companies.\n4\nTable of Contents\nAlphabet Inc.\nPART I.    FINANCIAL INFORMATION\nITEM 1.\nFINANCIAL STATEMENTS\nAlphabet Inc.\nCONSOLIDATED BALANCE SHEETS\n(in millions, except par value per share amounts)\nAs of\nDecember 31,\n2022\nAs of\nMarch 31, 2023\n(unaudited)\nAssets\nCurrent assets:\nCash and cash equivalents\n$\n21,879  $\n25,924 \nMarketable securities\n91,883 \n89,178 \nTotal cash, cash equivalents, and marketable securities\n113,762 \n115,102 \nAccounts receivable, ne\n\nany relationship with any of these\ncompanies.\n4\nTable of Contents\nAlphabet Inc.\nPART I.    FINANCIAL INFORMATION\nITEM 1.\nFINANCIAL STATEMENTS\nAlphabet Inc.\nCONSOLIDATED BALANCE SHEETS\n(in millions, except par value per share amounts)\nAs of\nDecember 31,\n2021\nAs of\nSeptember 30,\n2022\n(unaudited)\nAssets\nCurrent assets:\nCash and cash equivalents\n$\n20,945  $\n21,984 \nMarketable securities\n118,704 \n94,275 \nTotal cash, cash equivalents, and marketable\nsecurities\n139,649 \n116,259 \nAccounts receivable, ne",
      "contexts": [
        "of these\ncompanies.\n2\nTable of Contents\nAlphabet In\nPART I.    FINANCIAL INFORMATION\nITEM 1.\nFINANCIAL STATEMENTS\nAlphabet Inc.\nCONSOLIDATED BALANCE SHEETS\n(in millions, except share amounts which are reflected in thousands, and par value per share\namounts)\nAs of\nDecember 31,\n2019\nAs of\nSeptember 30,\n2020\n(unaudited)\nAssets\nCurrent assets:\nCash and cash equivalents\n$\n18,498  $\n20,129 \nMarketable securities\n101,177 \n112,467 \nTotal cash, cash equivalents, and marketable\nsecurities\n119,675 \n132,596",
        ", or any relationship with any of\nthese companies.\n4\nTable of Contents\nAlphabet Inc.\nPART I.    FINANCIAL INFORMATION\nITEM 1.\nFINANCIAL STATEMENTS\nAlphabet Inc.\nCONSOLIDATED BALANCE SHEETS\n(in millions, except par value per share amounts)\nAs of\nDecember 31,\n2022\nAs of\nMarch 31, 2023\n(unaudited)\nAssets\nCurrent assets:\nCash and cash equivalents\n$\n21,879  $\n25,924 \nMarketable securities\n91,883 \n89,178 \nTotal cash, cash equivalents, and marketable securities\n113,762 \n115,102 \nAccounts receivable, ne",
        "any relationship with any of these\ncompanies.\n4\nTable of Contents\nAlphabet Inc.\nPART I.    FINANCIAL INFORMATION\nITEM 1.\nFINANCIAL STATEMENTS\nAlphabet Inc.\nCONSOLIDATED BALANCE SHEETS\n(in millions, except par value per share amounts)\nAs of\nDecember 31,\n2021\nAs of\nSeptember 30,\n2022\n(unaudited)\nAssets\nCurrent assets:\nCash and cash equivalents\n$\n20,945  $\n21,984 \nMarketable securities\n118,704 \n94,275 \nTotal cash, cash equivalents, and marketable\nsecurities\n139,649 \n116,259 \nAccounts receivable, ne",
        " of Contents\nAlphabet Inc.\nPART I.    FINANCIAL INFORMATION\nITEM 1.\nFINANCIAL STATEMENTS\nAlphabet Inc.\nCONSOLIDATED BALANCE SHEETS\n(in millions, except par value per share amounts)\nAs of\nDecember 31,\n2021\nAs of\nJune 30, 2022\n(unaudited)\nAssets\nCurrent assets:\nCash and cash equivalents\n$\n20,945  $\n17,936 \nMarketable securities\n118,704 \n107,061 \nTotal cash, cash equivalents, and marketable\nsecurities\n139,649 \n124,997 \nAccounts receivable, net\n39,304 \n35,707 \nIncome taxes receivable, net\n966 \n1,366",
        "Alphabet Inc.\nPART I.    FINANCIAL INFORMATION\nITEM 1.\nFINANCIAL STATEMENTS\nAlphabet Inc.\nCONSOLIDATED BALANCE SHEETS\n(in millions, except par value per share amounts)\nAs of\nDecember 31,\n2024\nAs of\nMarch 31, 2025\n(unaudited)\nAssets\nCurrent assets:\nCash and cash equivalents\n$\n23,466  $\n23,264 \nMarketable securities\n72,191 \n72,064 \nTotal cash, cash equivalents, and marketable\nsecurities\n95,657 \n95,328 \nAccounts receivable, net\n52,340 \n51,000 \nOther current assets\n15,714 \n15,724 \nTotal current asse"
      ],
      "retrieved_docs": 5,
      "top_scores": [
        0.6420572400093079,
        0.6372137069702148,
        0.6285309791564941
      ],
      "sources": [
        "goog-20200930.pdf",
        "goog-20230331.pdf",
        "goog-20220930.pdf",
        "goog-20220630.pdf",
        "goog-20250331.pdf"
      ],
      "execution_time": 0.0355229377746582,
      "embedding_dim": 384,
      "category": "financials",
      "query_id": 10,
      "difficulty": "hard"
    },
    {
      "question": "What is the company’s free cash flow in the latest year, if disclosed, and how is it calculated?",
      "answer": " see Note 9 of the Notes to Consolidated Financial Statements\nincluded in Item 1 of this Quarterly Report on Form 10-Q.\n•\nOperating cash flow was $26.6 billion for the three months ended June 30, 2024.\n•\nCapital expenditures, which primarily reflected investments in technical infrastructure,\nwere $13.2 billion for the three months ended June 30, 2024.\n•\nAs of June 30, 2024, we had 179,582 employees.\nFinancial Results\nRevenues\nThe following table presents revenues by type (in millions):\n \nThree M\n\nor the long-term growth of the business. We regularly evaluate our\ncash and capital structure, including the size, pace, and form of capital return to stockholders.\nThe following table presents cash flows (in millions):\n \nNine Months Ended\nSeptember 30,\n \n2024\n2025\nNet cash provided by operating activities\n$\n86,186  $\n112,311 \nNet cash used in investing activities\n$\n(29,356) $\n(68,515)\nNet cash used in financing activities\n$\n(60,697) $\n(44,416)\nCash Provided by Operating Activities\nOur largest s\n\nn by headcount growth\nand partially offset by declines in advertising and promotional expenses and travel and entertainment\nexpenses.\nOther information:\n•\nOperating cash flow was $65.1 billion.\n•\nCapital expenditures, which primarily included investments in technical infrastructure, were $22.3 billion.\n•\nNumber of employees was 135,301 as of December 31, 2020. The majority of new hires during the year were\nengineers and product managers.\nOur Segments\nBeginning in the fourth quarter of 2020, we r",
      "contexts": [
        " see Note 9 of the Notes to Consolidated Financial Statements\nincluded in Item 1 of this Quarterly Report on Form 10-Q.\n•\nOperating cash flow was $26.6 billion for the three months ended June 30, 2024.\n•\nCapital expenditures, which primarily reflected investments in technical infrastructure,\nwere $13.2 billion for the three months ended June 30, 2024.\n•\nAs of June 30, 2024, we had 179,582 employees.\nFinancial Results\nRevenues\nThe following table presents revenues by type (in millions):\n \nThree M",
        "or the long-term growth of the business. We regularly evaluate our\ncash and capital structure, including the size, pace, and form of capital return to stockholders.\nThe following table presents cash flows (in millions):\n \nNine Months Ended\nSeptember 30,\n \n2024\n2025\nNet cash provided by operating activities\n$\n86,186  $\n112,311 \nNet cash used in investing activities\n$\n(29,356) $\n(68,515)\nNet cash used in financing activities\n$\n(60,697) $\n(44,416)\nCash Provided by Operating Activities\nOur largest s",
        "n by headcount growth\nand partially offset by declines in advertising and promotional expenses and travel and entertainment\nexpenses.\nOther information:\n•\nOperating cash flow was $65.1 billion.\n•\nCapital expenditures, which primarily included investments in technical infrastructure, were $22.3 billion.\n•\nNumber of employees was 135,301 as of December 31, 2020. The majority of new hires during the year were\nengineers and product managers.\nOur Segments\nBeginning in the fourth quarter of 2020, we r",
        "e, pace, and form of capital return to stockholders.\nThe following table presents our cash flows (in millions):\n \nNine Months Ended\nSeptember 30,\n \n2022\n2023\nNet cash provided by operating activities\n$\n67,881  $\n82,831 \nNet cash used in investing activities\n$\n(14,071) $\n(20,896)\nNet cash used in financing activities\n$\n(52,128) $\n(52,785)\nCash Provided by Operating Activities\nOur largest source of cash provided by operations are advertising revenues generated by\nGoogle Search & other properties, ",
        "wth of the business. We regularly\nevaluate our cash and capital structure, including the size, pace and form of capital return\nto stockholders.\nThe following table presents our cash flows (in millions):\n \nThree Months Ended\nMarch 31,\n \n2021\n2022\nNet cash provided by operating activities\n$\n19,289  $\n25,106 \nNet cash used in investing activities\n$\n(5,383) $\n(9,051)\nNet cash used in financing activities\n$\n(13,606) $\n(16,214)\nCash Provided by Operating Activities\nOur largest source of cash provided "
      ],
      "retrieved_docs": 5,
      "top_scores": [
        0.6316972374916077,
        0.6229143142700195,
        0.6196894645690918
      ],
      "sources": [
        "goog-20240630.pdf",
        "goog-20250930.pdf",
        "goog-20201231.pdf",
        "goog-20230930.pdf",
        "goog-20220331.pdf"
      ],
      "execution_time": 0.010288000106811523,
      "embedding_dim": 384,
      "category": "financials",
      "query_id": 37,
      "difficulty": "hard"
    },
    {
      "question": "What are the top three risk factors highlighted in the Risk Factors section of the annual report?",
      "answer": "1A.\nRISK FACTORS                \nOur operations and financial results are subject to various risks and uncertainties,\nincluding those described in Part I, Item 1A, \"Risk Factors\" in our Annual Report on Form\n10-K for the year ended December 31, 2020, which could adversely affect our business,\nfinancial condition, results of operations, cash flows, and the trading price of our common\nand capital stock. Below are changes to our risk factors since our Annual Report on Form\n10-K for the year ended D\n\ns and assumptions that are subject to risks and uncertainties, which could\ncause our actual results to differ materially from those reflected in the forward-looking\nstatements. Factors that could cause or contribute to such differences include, but are not\nlimited to, those discussed in this Quarterly Report on Form 10-Q, and in particular, the\nrisks discussed in Part I, Item 1A, \"Risk Factors\" in our Annual Report on Form 10-K for\nthe fiscal year ended December 31, 2021, and those discussed in \n\nsubject to\nrisks and uncertainties, which could cause our actual results to differ materially from those\nreflected in the forward-looking statements. Factors that could cause or contribute to such\ndifferences include, but are not limited to, those discussed in this Quarterly Report on Form\n10-Q, and in particular, the risks discussed in Part I, Item 1A, \"Risk Factors\" in our Annual\nReport on Form 10-K for the fiscal year ended December  31, 2021, and including material\nchanges reflected in this ",
      "contexts": [
        "1A.\nRISK FACTORS                \nOur operations and financial results are subject to various risks and uncertainties,\nincluding those described in Part I, Item 1A, \"Risk Factors\" in our Annual Report on Form\n10-K for the year ended December 31, 2020, which could adversely affect our business,\nfinancial condition, results of operations, cash flows, and the trading price of our common\nand capital stock. Below are changes to our risk factors since our Annual Report on Form\n10-K for the year ended D",
        "s and assumptions that are subject to risks and uncertainties, which could\ncause our actual results to differ materially from those reflected in the forward-looking\nstatements. Factors that could cause or contribute to such differences include, but are not\nlimited to, those discussed in this Quarterly Report on Form 10-Q, and in particular, the\nrisks discussed in Part I, Item 1A, \"Risk Factors\" in our Annual Report on Form 10-K for\nthe fiscal year ended December 31, 2021, and those discussed in ",
        "subject to\nrisks and uncertainties, which could cause our actual results to differ materially from those\nreflected in the forward-looking statements. Factors that could cause or contribute to such\ndifferences include, but are not limited to, those discussed in this Quarterly Report on Form\n10-Q, and in particular, the risks discussed in Part I, Item 1A, \"Risk Factors\" in our Annual\nReport on Form 10-K for the fiscal year ended December  31, 2021, and including material\nchanges reflected in this ",
        "al Statements included in Part I, Item 1\nof this Quarterly Report on Form 10-Q, which is incorporated herein by reference.\nITEM 1A.\nRISK FACTORS    \nOur operations and financial results are subject to various risks and uncertainties,\nincluding but not limited to those described below, which could harm our business, reputation,\nfinancial condition, and operating results.\nRisks Specific to our Company\nWe generate a significant portion of our revenues from advertising, and reduced\nspending by adver",
        " 10-Q, which is incorporated herein\nby reference.\nITEM 1A.\nRISK FACTORS                \nOur operations and financial results are subject to various risks and uncertainties,\nincluding but not limited to those described in Part I, Item 1A, \"Risk Factors\" in our Annual\nReport on Form 10-K for the year ended December 31, 2024, which could harm our business,\nreputation, financial condition, and operating results, and affect the trading price of our Class A\nand Class C stock.\nFor additional informatio"
      ],
      "retrieved_docs": 5,
      "top_scores": [
        0.6574203372001648,
        0.6473658084869385,
        0.6471286416053772
      ],
      "sources": [
        "goog-20210630.pdf",
        "goog-20220630.pdf",
        "goog-20220930.pdf",
        "goog-20200630.pdf",
        "goog-20250630.pdf"
      ],
      "execution_time": 0.010345935821533203,
      "embedding_dim": 384,
      "category": "risks",
      "query_id": 11,
      "difficulty": "medium"
    },
    {
      "question": "Does the company mention dependence on key suppliers or customers as a risk, and how is this described?",
      "answer": " a range of settings.\nWe face a number of manufacturing and supply chain risks that, if not properly managed, could harm our\nfinancial condition, operating results, and prospects.\nWe face a number of risks related to manufacturing and supply chain management, which could affect our ability\nto supply both our products and our internet-based services.\nWe rely on other companies to manufacture many of our finished products, to design certain of our components\nand parts, and to participate in the di\n\nm our business, financial\ncondition, and operating results.\nWe face a number of risks related to manufacturing and supply chain management, which could affect our ability\nto supply both our products and our services.\nWe rely on contract manufacturers to manufacture or assemble our devices and servers and networking\nequipment used in our technical infrastructure, and we may supply the contract manufacturers with components to\nassemble the devices and equipment. We also rely on other companies to \n\n settings.\nWe face a number of manufacturing and supply chain risks that, if not properly\nmanaged, could harm our financial condition, operating results, and prospects.\nWe face a number of risks related to manufacturing and supply chain management,\nwhich could affect our ability to supply both our products and our internet-based services.\nWe rely on other companies to manufacture many of our assemblies and finished\nproducts, to design certain of our components and parts, and to participate in th",
      "contexts": [
        " a range of settings.\nWe face a number of manufacturing and supply chain risks that, if not properly managed, could harm our\nfinancial condition, operating results, and prospects.\nWe face a number of risks related to manufacturing and supply chain management, which could affect our ability\nto supply both our products and our internet-based services.\nWe rely on other companies to manufacture many of our finished products, to design certain of our components\nand parts, and to participate in the di",
        "m our business, financial\ncondition, and operating results.\nWe face a number of risks related to manufacturing and supply chain management, which could affect our ability\nto supply both our products and our services.\nWe rely on contract manufacturers to manufacture or assemble our devices and servers and networking\nequipment used in our technical infrastructure, and we may supply the contract manufacturers with components to\nassemble the devices and equipment. We also rely on other companies to ",
        " settings.\nWe face a number of manufacturing and supply chain risks that, if not properly\nmanaged, could harm our financial condition, operating results, and prospects.\nWe face a number of risks related to manufacturing and supply chain management,\nwhich could affect our ability to supply both our products and our internet-based services.\nWe rely on other companies to manufacture many of our assemblies and finished\nproducts, to design certain of our components and parts, and to participate in th",
        "ill depend largely on our\nability to remain a technology leader and continue to provide high-quality, innovative products\nand services that are truly useful and play a valuable role in a range of settings.\nWe face a number of manufacturing and supply chain risks that, if not properly\nmanaged, could harm our financial condition, operating results, and prospects.\nWe face a number of risks related to manufacturing and supply chain management,\nwhich could affect our ability to supply both our produc",
        "y a valuable role in a range of\nsettings.\nWe face a number of manufacturing and supply chain risks that could harm our financial condition,\noperating results, and prospects.\nWe face a number of risks related to manufacturing and supply chain management, which could affect our ability\nto supply both our products and our internet-based services.\nWe rely on other companies to manufacture many of our finished products; to design certain of our components\nand parts; to participate in the distribution"
      ],
      "retrieved_docs": 5,
      "top_scores": [
        0.662541389465332,
        0.6574273705482483,
        0.6248027682304382
      ],
      "sources": [
        "goog-20201231.pdf",
        "goog-20231231.pdf",
        "goog-20200930.pdf",
        "goog-20200331.pdf",
        "goog-20211231.pdf"
      ],
      "execution_time": 0.0322117805480957,
      "embedding_dim": 384,
      "category": "risks",
      "query_id": 12,
      "difficulty": "medium"
    },
    {
      "question": "How does the company describe competitive risks in its industry?",
      "answer": " a range of settings.\nWe face a number of manufacturing and supply chain risks that, if not properly managed, could harm our\nfinancial condition, operating results, and prospects.\nWe face a number of risks related to manufacturing and supply chain management, which could affect our ability\nto supply both our products and our internet-based services.\nWe rely on other companies to manufacture many of our finished products, to design certain of our components\nand parts, and to participate in the di\n\nng of how\nthe company oversees competition risks. In fact, the requested report could be a detriment to both the company’s and our stockholders’ interests. As\ndisclosed in our filings with the SEC, our company is involved in legal proceedings concerning antitrust and various competition matters both in the\nUnited States and in other jurisdictions around the world, and disagrees with a number of the claims and characterizations in those matters and in the\nsupporting statement to this proposal. As\n\n, substantially similar to or better than ours. This may force\nus to compete in different ways and expend significant resources in order to remain competitive. If our competitors are\nmore successful than we are in providing compelling products and services or in attracting and retaining users,\nadvertisers, publishers, customers, and content providers, our operating results could be harmed.\nOur ongoing investment in new businesses, products, services, and technologies is inherently risky, and\ncou",
      "contexts": [
        " a range of settings.\nWe face a number of manufacturing and supply chain risks that, if not properly managed, could harm our\nfinancial condition, operating results, and prospects.\nWe face a number of risks related to manufacturing and supply chain management, which could affect our ability\nto supply both our products and our internet-based services.\nWe rely on other companies to manufacture many of our finished products, to design certain of our components\nand parts, and to participate in the di",
        "ng of how\nthe company oversees competition risks. In fact, the requested report could be a detriment to both the company’s and our stockholders’ interests. As\ndisclosed in our filings with the SEC, our company is involved in legal proceedings concerning antitrust and various competition matters both in the\nUnited States and in other jurisdictions around the world, and disagrees with a number of the claims and characterizations in those matters and in the\nsupporting statement to this proposal. As",
        ", substantially similar to or better than ours. This may force\nus to compete in different ways and expend significant resources in order to remain competitive. If our competitors are\nmore successful than we are in providing compelling products and services or in attracting and retaining users,\nadvertisers, publishers, customers, and content providers, our operating results could be harmed.\nOur ongoing investment in new businesses, products, services, and technologies is inherently risky, and\ncou",
        " competitive position relative to our peers,\nand/or otherwise have an adverse effect on our business, reputation, financial condition, and operating results.\nFor additional information about government regulation applicable to our business, see Risk Factors in Item 1A,\nTrends in Our Business and Financial Effect in Part II, Item 7, and Legal Matters in Note 10 of the Notes to\nConsolidated Financial Statements included in Part II, Item 8 of this Annual Report on Form 10-K.\nIntellectual Property\nW",
        " settings.\nWe face a number of manufacturing and supply chain risks that, if not properly\nmanaged, could harm our financial condition, operating results, and prospects.\nWe face a number of risks related to manufacturing and supply chain management,\nwhich could affect our ability to supply both our products and our internet-based services.\nWe rely on other companies to manufacture many of our assemblies and finished\nproducts, to design certain of our components and parts, and to participate in th"
      ],
      "retrieved_docs": 5,
      "top_scores": [
        0.6798547506332397,
        0.6407762169837952,
        0.6323457956314087
      ],
      "sources": [
        "goog-20201231.pdf",
        "ALPHABET INC. - DEF 14A_3.pdf",
        "goog-20211231.pdf",
        "goog-20211231.pdf",
        "goog-20200930.pdf"
      ],
      "execution_time": 0.30681395530700684,
      "embedding_dim": 384,
      "category": "risks",
      "query_id": 13,
      "difficulty": "medium"
    },
    {
      "question": "Are there any legal or regulatory proceedings disclosed that could materially affect the company’s financial position?",
      "answer": "any are being made only in\naccordance with authorizations of management and directors of the company; and (3) provide reasonable assurance\nregarding prevention or timely detection of unauthorized acquisition, use, or disposition of the company’s assets that\ncould have a material effect on the financial statements.\nBecause of its inherent limitations, internal control over financial reporting may not prevent or detect\nmisstatements. Also, projections of any evaluation of effectiveness to future p\n\nhether the Company is failing to disclose these potential liabilities as material\nrisks in its public filings. There is currently no single source providing shareholders the information sought by this resolution.\n \nAlphabet Opposing Statement\n \nOur Board has considered this proposal and, for the reasons set forth below, does not believe that it is in the best interests of our company and our\nstockholders and recommends a vote AGAINST this proposal.\n \nWe Are Committed to Robust Information Govern\n\ncould have a material adverse effect on our results of operations or\ncash flows in a particular period.\nAs of March  31, 2024, we did not have any material indemnification claims that were\nprobable or reasonably possible.\nLegal Matters\nWe record a liability when we believe that it is probable that a loss has been incurred,\nand the amount can be reasonably estimated. If we determine that a loss is reasonably\npossible and the loss or range of loss can be estimated, we disclose the reasonably possi",
      "contexts": [
        "any are being made only in\naccordance with authorizations of management and directors of the company; and (3) provide reasonable assurance\nregarding prevention or timely detection of unauthorized acquisition, use, or disposition of the company’s assets that\ncould have a material effect on the financial statements.\nBecause of its inherent limitations, internal control over financial reporting may not prevent or detect\nmisstatements. Also, projections of any evaluation of effectiveness to future p",
        "hether the Company is failing to disclose these potential liabilities as material\nrisks in its public filings. There is currently no single source providing shareholders the information sought by this resolution.\n \nAlphabet Opposing Statement\n \nOur Board has considered this proposal and, for the reasons set forth below, does not believe that it is in the best interests of our company and our\nstockholders and recommends a vote AGAINST this proposal.\n \nWe Are Committed to Robust Information Govern",
        "could have a material adverse effect on our results of operations or\ncash flows in a particular period.\nAs of March  31, 2024, we did not have any material indemnification claims that were\nprobable or reasonably possible.\nLegal Matters\nWe record a liability when we believe that it is probable that a loss has been incurred,\nand the amount can be reasonably estimated. If we determine that a loss is reasonably\npossible and the loss or range of loss can be estimated, we disclose the reasonably possi",
        "provide oversight regarding significant financial matters, and review and discuss with management the company’s major risk\nexposures. The Audit Committee’s responsibilities include but are not limited to:\n \n• Overseeing the risks and exposures associated with:\n \n• Financial matters, including financial strategy and reporting, tax, accounting, disclosure, internal control over financial reporting, investment\nguidelines and credit and liquidity matters;\n \n• Data privacy and security, competition, ",
        "\nNotes to Consolidated Financial Statements\n11\nItem 2\nManagement’s Discussion and Analysis of Financial Condition and Results of\nOperations\n34\nItem 3\nQuantitative and Qualitative Disclosures About Market Risk\n49\nItem 4\nControls and Procedures\n49\nPART II. OTHER INFORMATION\nItem 1\nLegal Proceedings\n51\nItem 1A Risk Factors\n51\nItem 2\nUnregistered Sales of Equity Securities and Use of Proceeds\n51\nItem 5\nOther Information\n51\nItem 6\nExhibits\n52\nSignatures\n53\n2\nTable of Contents\nAlphabet Inc.\nNote About"
      ],
      "retrieved_docs": 5,
      "top_scores": [
        0.6527823805809021,
        0.622586727142334,
        0.606169581413269
      ],
      "sources": [
        "Document.pdf",
        "ALPHABET INC. DEF 14A.pdf",
        "goog-20240331.pdf",
        "ALPHABET INC. DEF 14A.pdf",
        "goog-20230930.pdf"
      ],
      "execution_time": 0.010755777359008789,
      "embedding_dim": 384,
      "category": "risks",
      "query_id": 14,
      "difficulty": "hard"
    },
    {
      "question": "Who are the key executive officers of the company according to the latest proxy statement or annual report?",
      "answer": "  10\n \nProxy Statement\nSummary &\nHighlights\nCorporate\nGovernance\nDirector and\nExecutive\nCompensation\nAudit Matters\nProposals\nQ&A\n \nAnnual Meeting of Stockholders\n \n \n   \n \nDate & Time:\nFriday, June 6, 2025\n9:00 a.m., Pacific Time\n   \nVirtual Meeting Access:\nAlphabet stockholders (or their proxy holders) can participate in and vote at the Annual Meeting by visiting\nwww.virtualshareholdermeeting.com/GOOGL25 and entering the 16-digit control number included in the\nNotice, voting instruction form, o\n\n under the caption “Directors, Executive Officers, and\nCorporate Governance” in our Proxy Statement for 2020 Annual Meeting of Stockholders to be filed with the SEC within\n120 days of the fiscal year ended December 31, 2019 (2020 Proxy Statement) and is incorporated herein by reference.\nITEM 11.\nEXECUTIVE COMPENSATION\nThe information required by this item will be included under the captions “Director Compensation,” “Executive\nCompensation” and “Directors, Executive Officers, and Corporate Govern\n\nmore information, please see the\nQuestions and Answers section of this proxy statement or visit the Annual Meeting of Stockholders section under the heading “Governance” on our\nInvestor Relations website at https://abc.xyz/investor/annual-meeting/.\n \nThank you for your ongoing support of, and continued interest in, Alphabet.\n \nSincerely,\n \n \n \nSundar Pichai\nJohn L. Hennessy\nChief Executive Officer\nChair of the Board of Directors\n \n \nApril 25, 2025\n \n \nAlphabet 2025 Proxy Statement     2\n \nLetter",
      "contexts": [
        "  10\n \nProxy Statement\nSummary &\nHighlights\nCorporate\nGovernance\nDirector and\nExecutive\nCompensation\nAudit Matters\nProposals\nQ&A\n \nAnnual Meeting of Stockholders\n \n \n   \n \nDate & Time:\nFriday, June 6, 2025\n9:00 a.m., Pacific Time\n   \nVirtual Meeting Access:\nAlphabet stockholders (or their proxy holders) can participate in and vote at the Annual Meeting by visiting\nwww.virtualshareholdermeeting.com/GOOGL25 and entering the 16-digit control number included in the\nNotice, voting instruction form, o",
        " under the caption “Directors, Executive Officers, and\nCorporate Governance” in our Proxy Statement for 2020 Annual Meeting of Stockholders to be filed with the SEC within\n120 days of the fiscal year ended December 31, 2019 (2020 Proxy Statement) and is incorporated herein by reference.\nITEM 11.\nEXECUTIVE COMPENSATION\nThe information required by this item will be included under the captions “Director Compensation,” “Executive\nCompensation” and “Directors, Executive Officers, and Corporate Govern",
        "more information, please see the\nQuestions and Answers section of this proxy statement or visit the Annual Meeting of Stockholders section under the heading “Governance” on our\nInvestor Relations website at https://abc.xyz/investor/annual-meeting/.\n \nThank you for your ongoing support of, and continued interest in, Alphabet.\n \nSincerely,\n \n \n \nSundar Pichai\nJohn L. Hennessy\nChief Executive Officer\nChair of the Board of Directors\n \n \nApril 25, 2025\n \n \nAlphabet 2025 Proxy Statement     2\n \nLetter",
        " service on other boards.\n \nAlphabet 2025 Proxy Statement     21\n \nBack to Contents\nProxy Statement\nSummary &\nHighlights\nCorporate\nGovernance\nDirector and\nExecutive\nCompensation\nAudit Matters\nProposals\nQ&A\n \nExecutive Officers\n \nThis section describes the business experience of our executive officers as of April 8, 2025, other than Sundar, whose biography can be found on page\n17. Our executive officers are appointed by and serve at the discretion of our Board. There are no family relationships a",
        "0\n \nALPHABET • 2021 PROXY STATEMENT\n69\n \nBack to Contents\n1\nCorporate\nGovernance\n2\nDirector and\nExecutive\nCompensation\n3\nAudit\nMatters  \n4\nManagement\nand Stockholder\nProposals\n5\nQuestions and\nAnswers\n \nReport, which provides transparency into the type of concerns employees have raised, the number of concerns employees have raised, and how the\ncompany has resolved those concerns.\n \nWhile we disagree with a number of the claims and characterizations in this proposal, beginning in September 2020, w"
      ],
      "retrieved_docs": 5,
      "top_scores": [
        0.7445777654647827,
        0.7320623993873596,
        0.7023902535438538
      ],
      "sources": [
        "ALPHABET INC. - DEF14A.pdf",
        "Document.pdf",
        "ALPHABET INC. - DEF14A.pdf",
        "ALPHABET INC. - DEF14A.pdf",
        "ALPHABET INC. - DEF 14A_3.pdf"
      ],
      "execution_time": 0.035130977630615234,
      "embedding_dim": 384,
      "category": "governance",
      "query_id": 15,
      "difficulty": "easy"
    },
    {
      "question": "How is the board of directors structured (size, independence, key committees)?",
      "answer": "idates also are evaluated in light of our other policies, such as those relating to\nindependence and service on other boards, as well as considerations relating to the size, structure, and needs of our Board. As part of its consideration\nof director succession, our Board and the Governance Committee monitor whether the directors as a group meet the criteria for the composition of our\nBoard.\n \nThe Governance Committee and our Board believe that the above-mentioned attributes, along with the leade\n\nand board committees of other public companies,\nand have an understanding of corporate governance practices and trends, different business processes, challenges, and strategies. Other directors\nhave experience as presidents or trustees of significant academic, research, and philanthropic institutions, which brings unique perspectives to the\nBoard of Directors. Further, our directors also have other experience that makes them valuable members, such as entrepreneurial experience and\nexperience dev\n\n accountability, and enhances the ability to communicate our messages and strategy.\n \nEach of the director nominees standing for election, other than Larry, Sergey, and Sundar, is independent (see “Director Independence” on page 33 of\nthis proxy statement), and our Board believes that the independent directors provide effective oversight of management.\n \nBoard Committees\n \nOur Board is currently composed of ten directors. Our Board has the following four standing committees:\n \n1.\nan Audit and Co",
      "contexts": [
        "idates also are evaluated in light of our other policies, such as those relating to\nindependence and service on other boards, as well as considerations relating to the size, structure, and needs of our Board. As part of its consideration\nof director succession, our Board and the Governance Committee monitor whether the directors as a group meet the criteria for the composition of our\nBoard.\n \nThe Governance Committee and our Board believe that the above-mentioned attributes, along with the leade",
        "and board committees of other public companies,\nand have an understanding of corporate governance practices and trends, different business processes, challenges, and strategies. Other directors\nhave experience as presidents or trustees of significant academic, research, and philanthropic institutions, which brings unique perspectives to the\nBoard of Directors. Further, our directors also have other experience that makes them valuable members, such as entrepreneurial experience and\nexperience dev",
        " accountability, and enhances the ability to communicate our messages and strategy.\n \nEach of the director nominees standing for election, other than Larry, Sergey, and Sundar, is independent (see “Director Independence” on page 33 of\nthis proxy statement), and our Board believes that the independent directors provide effective oversight of management.\n \nBoard Committees\n \nOur Board is currently composed of ten directors. Our Board has the following four standing committees:\n \n1.\nan Audit and Co",
        "or Independence” on page 27\nof this proxy statement), and the Board of Directors believes that the independent directors provide effective oversight\nof management.\n \nBoard Committees\n \nOur Board of Directors is currently composed of eleven directors. Our Board of Directors has the following four standing committees:\n \n1.\nan Audit and Compliance Committee,\n2.\na Leadership Development and Compensation Committee,\n3.\na Nominating and Corporate Governance Committee, and\n4.\nan Executive Committee.\n \nF",
        "evaluating nominees for directors balancing the appropriate size and composition of the Board of Directors and its respective committees with the qualifications of candidates in light of these needs. The Nominating and Corporate Governance Committee factors into its determination the following qualities, among others: integrity, professional reputation and strength of character, educational background, knowledge of our business, diversity of professional experience, including whether the person "
      ],
      "retrieved_docs": 5,
      "top_scores": [
        0.7286098599433899,
        0.7144850492477417,
        0.7132652997970581
      ],
      "sources": [
        "ALPHABET INC. - DEF14A.pdf",
        "ALPHABET INC. - DEF 14A_3.pdf",
        "ALPHABET INC. - DEF 14A.pdf",
        "ALPHABET INC. - DEF 14A_3.pdf",
        "lgoog2020_def14a.pdf"
      ],
      "execution_time": 0.011555671691894531,
      "embedding_dim": 384,
      "category": "governance",
      "query_id": 16,
      "difficulty": "medium"
    },
    {
      "question": "What performance metrics are used to determine executive compensation?",
      "answer": "that the Compensation Committee should retain its flexibility in determining\nwhat particular performance metrics to use to best increase stockholder value. The Compensation Committee adjusts its assessments as necessary to\nstay competitive and attract, retain, and motivate highly-qualified executive officers.\n \nOur Board believes that our current executive compensation policies and practices are appropriate and effective, serve the best interests of our\nstockholders, and advance the objectives o\n\n the strategic, financial, and execution risks and exposures associated with the financial, operational, and capital decisions that serve as inputs\nto our compensation programs.\n●Through discussions with management, the Compensation Committee gains insight into a reasonable range of future company performance\nexpectations. This information is incorporated into decisions regarding the compensation of our named executive officers.\n●The majority of compensation provided to our named executive offic\n\n vs. Performance\n \nCompensation Actually Paid\n \nAs outlined in the CD&A, the Compensation Committee has implemented an executive compensation program that prioritizes performance and aims to\nalign employee and stockholder interests. The following table sets forth additional compensation information for our principal executive officer (PEO) and\nour non-PEO named executive officers (Non-PEO NEOs), calculated in accordance with Item 402(v) of Regulation S-K, for fiscal years 2023, 2022,\n2021, and 2",
      "contexts": [
        "that the Compensation Committee should retain its flexibility in determining\nwhat particular performance metrics to use to best increase stockholder value. The Compensation Committee adjusts its assessments as necessary to\nstay competitive and attract, retain, and motivate highly-qualified executive officers.\n \nOur Board believes that our current executive compensation policies and practices are appropriate and effective, serve the best interests of our\nstockholders, and advance the objectives o",
        " the strategic, financial, and execution risks and exposures associated with the financial, operational, and capital decisions that serve as inputs\nto our compensation programs.\n●Through discussions with management, the Compensation Committee gains insight into a reasonable range of future company performance\nexpectations. This information is incorporated into decisions regarding the compensation of our named executive officers.\n●The majority of compensation provided to our named executive offic",
        " vs. Performance\n \nCompensation Actually Paid\n \nAs outlined in the CD&A, the Compensation Committee has implemented an executive compensation program that prioritizes performance and aims to\nalign employee and stockholder interests. The following table sets forth additional compensation information for our principal executive officer (PEO) and\nour non-PEO named executive officers (Non-PEO NEOs), calculated in accordance with Item 402(v) of Regulation S-K, for fiscal years 2023, 2022,\n2021, and 2",
        "nsation, peer groups,\ncompensation design, equity usage and allocation, risk assessment, and human capital management. As part of its process, the Compensation\nCommittee considers key drivers of company performance and holds executives accountable for delivering on such performance targets. In addition, the\nCompensation Committee regularly assesses our executive compensation program, considering our strategy, market practices and stockholder input to\nconfirm that it remains appropriately aligned",
        " and\nExecutive\nCompensation\n3\nAudit\nMatters\n4\nManagement\nand Stockholder\nProposals\n5\nQuestions and\nAnswers\n6\nAppendices\n \nSection 2—Determining Competitive Levels of Pay\n \nOur executive compensation decisions are informed by market data in addition to the reviews of individual roles and performance. We use peer group\ndata to obtain compensation benchmarks for our named executive officers.\n \nWe review our peer group and our evaluation criteria each year. For 2021, we determined our peer group by "
      ],
      "retrieved_docs": 5,
      "top_scores": [
        0.7034258842468262,
        0.6996963620185852,
        0.6966441869735718
      ],
      "sources": [
        "ALPHABET INC. - DEF14A.pdf",
        "ALPHABET INC. - DEF 14A_2.pdf",
        "ALPHABET INC. - DEF 14A.pdf",
        "ALPHABET INC. - DEF14A.pdf",
        "ALPHABET INC. DEF 14A.pdf"
      ],
      "execution_time": 0.01094818115234375,
      "embedding_dim": 384,
      "category": "governance",
      "query_id": 17,
      "difficulty": "hard"
    },
    {
      "question": "Does the company mention any recent changes in leadership or the board, and what are the reasons?",
      "answer": "management to ensure\naccountability to our stockholders. Our Board has endeavored to strike the right balance between long-term understanding of our business and fresh\nexternal perspectives, adding five new directors in the past seven years, as well as ensuring the diversity of backgrounds and perspectives within the\nboardroom.\n \nOur directors have extensive backgrounds as entrepreneurs, technologists, operational and financial experts, academics, scientists, investors, advisors,\nnonprofit board\n\nntinues, the company is committed to investing\nresponsibly for long-term growth, and to finding areas where it can operate more cost effectively.\n \nBeyond that, over the past year, our Board has redoubled its efforts to engage on many of the issues most important to our company, and environmental,\nsocial and governance topics have been front and center in many of those conversations. In my role as Chair of the Alphabet Board, I have worked\nclosely with our legal and investor relations teams to u\n\no ensure that our directors have backgrounds that\ncollectively add significant value to the strategic decisions made by the company and that enable them to provide oversight of management to ensure\naccountability to our stockholders. Our Board has endeavored to strike the right balance between long-term understanding of our business and fresh\nexternal perspectives, adding three new directors in the past five years, as well as ensuring the diversity of backgrounds and perspectives within the\nboar",
      "contexts": [
        "management to ensure\naccountability to our stockholders. Our Board has endeavored to strike the right balance between long-term understanding of our business and fresh\nexternal perspectives, adding five new directors in the past seven years, as well as ensuring the diversity of backgrounds and perspectives within the\nboardroom.\n \nOur directors have extensive backgrounds as entrepreneurs, technologists, operational and financial experts, academics, scientists, investors, advisors,\nnonprofit board",
        "ntinues, the company is committed to investing\nresponsibly for long-term growth, and to finding areas where it can operate more cost effectively.\n \nBeyond that, over the past year, our Board has redoubled its efforts to engage on many of the issues most important to our company, and environmental,\nsocial and governance topics have been front and center in many of those conversations. In my role as Chair of the Alphabet Board, I have worked\nclosely with our legal and investor relations teams to u",
        "o ensure that our directors have backgrounds that\ncollectively add significant value to the strategic decisions made by the company and that enable them to provide oversight of management to ensure\naccountability to our stockholders. Our Board has endeavored to strike the right balance between long-term understanding of our business and fresh\nexternal perspectives, adding three new directors in the past five years, as well as ensuring the diversity of backgrounds and perspectives within the\nboar",
        "port, Alphabet asserted, “Our\npeople are critical for our continued success” and cited problems with employee recruitment, retention, or motivation as a risk to the Company’s\ncontinued growth. Clearly, the Company’s relationship with its employees is critical to long-term shareholder value.\n \nExpanding and diversifying the pool of potential director nominees can have important benefits. A 2020 NBER study states that giving workers formal\ncontrol rights increases female board representation and r",
        "its review and discussions with management, the Leadership Development and Compensation Committee recommended to\nour Board of Directors that the Compensation Discussion and Analysis be included in our Annual Report on Form 10-K for the fiscal year ended\nDecember 31, 2020 and in this proxy statement.\n \nLEADERSHIP DEVELOPMENT AND COMPENSATION COMMITTEE\n \nRobin L. Washington, Chair\nL. John Doerr\nK. Ram Shriram\n \nALPHABET • 2021 PROXY STATEMENT\n43\n \nBack to Contents\n1\nCorporate\nGovernance\n2\nDirector"
      ],
      "retrieved_docs": 5,
      "top_scores": [
        0.5876506567001343,
        0.5719329118728638,
        0.567284345626831
      ],
      "sources": [
        "ALPHABET INC. - DEF 14A_2.pdf",
        "ALPHABET INC. - DEF 14A_2.pdf",
        "ALPHABET INC. DEF 14A.pdf",
        "ALPHABET INC. DEF 14A.pdf",
        "ALPHABET INC. - DEF 14A_3.pdf"
      ],
      "execution_time": 0.010170936584472656,
      "embedding_dim": 384,
      "category": "governance",
      "query_id": 18,
      "difficulty": "medium"
    },
    {
      "question": "Are there any shareholder proposals or significant voting results discussed in the proxy statement?",
      "answer": " 2025 Proxy Statement     72\n \nBack to Contents\nProxy Statement\nSummary &\nHighlights\nCorporate\nGovernance\nDirector and\nExecutive\nCompensation\nAudit Matters\nProposals\nQ&A\n \nAlphabet Opposing Statement\n \nOur Board of Directors recommends a vote AGAINST the stockholder proposal because:\n \n• The proposal inappropriately seeks to undermine our ability to manage ordinary business operations and strategic initiatives.\n• Our participation in organizations does not reflect an endorsement of their agendas\n\nare as follows:\n \n• Accurate and complete information about the proposed action is included in a proxy statement, which is widely distributed to stockholders before the\nmeeting;\n \nAlphabet 2025 Proxy Statement     65\n \nBack to Contents\nProxy Statement\nSummary &\nHighlights\nCorporate\nGovernance\nDirector and\nExecutive\nCompensation\nAudit Matters\nProposals\nQ&A\n \n• All stockholders have a chance to engage meaningfully in the process, voice their concerns, offer their perspectives, and cast their votes\n\n  10\n \nProxy Statement\nSummary &\nHighlights\nCorporate\nGovernance\nDirector and\nExecutive\nCompensation\nAudit Matters\nProposals\nQ&A\n \nAnnual Meeting of Stockholders\n \n \n   \n \nDate & Time:\nFriday, June 6, 2025\n9:00 a.m., Pacific Time\n   \nVirtual Meeting Access:\nAlphabet stockholders (or their proxy holders) can participate in and vote at the Annual Meeting by visiting\nwww.virtualshareholdermeeting.com/GOOGL25 and entering the 16-digit control number included in the\nNotice, voting instruction form, o",
      "contexts": [
        " 2025 Proxy Statement     72\n \nBack to Contents\nProxy Statement\nSummary &\nHighlights\nCorporate\nGovernance\nDirector and\nExecutive\nCompensation\nAudit Matters\nProposals\nQ&A\n \nAlphabet Opposing Statement\n \nOur Board of Directors recommends a vote AGAINST the stockholder proposal because:\n \n• The proposal inappropriately seeks to undermine our ability to manage ordinary business operations and strategic initiatives.\n• Our participation in organizations does not reflect an endorsement of their agendas",
        "are as follows:\n \n• Accurate and complete information about the proposed action is included in a proxy statement, which is widely distributed to stockholders before the\nmeeting;\n \nAlphabet 2025 Proxy Statement     65\n \nBack to Contents\nProxy Statement\nSummary &\nHighlights\nCorporate\nGovernance\nDirector and\nExecutive\nCompensation\nAudit Matters\nProposals\nQ&A\n \n• All stockholders have a chance to engage meaningfully in the process, voice their concerns, offer their perspectives, and cast their votes",
        "  10\n \nProxy Statement\nSummary &\nHighlights\nCorporate\nGovernance\nDirector and\nExecutive\nCompensation\nAudit Matters\nProposals\nQ&A\n \nAnnual Meeting of Stockholders\n \n \n   \n \nDate & Time:\nFriday, June 6, 2025\n9:00 a.m., Pacific Time\n   \nVirtual Meeting Access:\nAlphabet stockholders (or their proxy holders) can participate in and vote at the Annual Meeting by visiting\nwww.virtualshareholdermeeting.com/GOOGL25 and entering the 16-digit control number included in the\nNotice, voting instruction form, o",
        "● 2023 PROXY STATEMENT        84\n \nBack to contents\n \n1\nCorporate\nGovernance\n2\nDirector and\nExecutive\nCompensation\n3\nAudit\nMatters\n4\nManagement\nand Stockholder\nProposals\n5\nQuestions and\nAnswers\n6\nAppendices\n \nRequired Vote\n \nApproval of the stockholder proposal requires the affirmative FOR vote of the holders of a majority of the voting power of Alphabet’s shares of Class A\ncommon stock and Class B common stock present or represented by proxy at the Annual Meeting and entitled to vote thereon, v",
        " proxy at the Annual Meeting and entitled to vote thereon, voting together as a\nsingle class. Unless marked to the contrary, proxies received will be voted AGAINST the stockholder proposal.\n \nAlphabet Recommendation\n \nOUR BOARD OF DIRECTORS RECOMMENDS A VOTE AGAINST THE STOCKHOLDER PROPOSAL.\n \nALPHABET  •  2022 PROXY STATEMENT     97\n \nBack to Contents\n1\nCorporate\nGovernance\n2\nDirector and\nExecutive\nCompensation\n3\nAudit\nMatters\n4\nManagement\nand Stockholder\nProposals\n5\nQuestions and\nAnswers\n6\nApp"
      ],
      "retrieved_docs": 5,
      "top_scores": [
        0.7545908689498901,
        0.7509855031967163,
        0.7494282126426697
      ],
      "sources": [
        "ALPHABET INC. - DEF14A.pdf",
        "ALPHABET INC. - DEF14A.pdf",
        "ALPHABET INC. - DEF14A.pdf",
        "ALPHABET INC. - DEF 14A_2.pdf",
        "ALPHABET INC. DEF 14A.pdf"
      ],
      "execution_time": 0.0373227596282959,
      "embedding_dim": 384,
      "category": "governance",
      "query_id": 38,
      "difficulty": "hard"
    },
    {
      "question": "What are the company’s main strategic priorities for the next few years as described by management?",
      "answer": " best use of\ncompany resources. While our actions may not be exactly as prescribed in a proposal, they are designed to further the long-term interests of the\ncompany, our stockholders, and other stakeholders.\n• Alignment of the proposal with our long-term interests. Our Board and management team assess each proposal request carefully, taking into\naccount feedback from internal subject matter experts who have deep insight into our current priorities and approach to the matters raised by the\npropo\n\ns does not reflect an endorsement of their agendas.\n \nThe proposal seeks to micromanage the company’s ordinary business operations\n \nDecisions regarding future participation in specific benchmarking tools are operational matters best executed by members of our management team who\npossess the necessary expertise and strategic insights. These decisions involve internal assessments, stakeholder consultations, and ongoing\nevaluations of effectiveness, all requiring management discretion. This propos\n\n and future success depends in large part upon the continued service of key technical leads as\nwell as members of our senior management team. For instance, Sundar Pichai is critical to the overall management of\nAlphabet and its subsidiaries and plays an important role in the development of our technology, maintaining our culture,\nand setting our strategic direction.\nOur ability to compete effectively and our future success depend on our continuing to identify, hire, develop,\nmotivate, and retain",
      "contexts": [
        " best use of\ncompany resources. While our actions may not be exactly as prescribed in a proposal, they are designed to further the long-term interests of the\ncompany, our stockholders, and other stakeholders.\n• Alignment of the proposal with our long-term interests. Our Board and management team assess each proposal request carefully, taking into\naccount feedback from internal subject matter experts who have deep insight into our current priorities and approach to the matters raised by the\npropo",
        "s does not reflect an endorsement of their agendas.\n \nThe proposal seeks to micromanage the company’s ordinary business operations\n \nDecisions regarding future participation in specific benchmarking tools are operational matters best executed by members of our management team who\npossess the necessary expertise and strategic insights. These decisions involve internal assessments, stakeholder consultations, and ongoing\nevaluations of effectiveness, all requiring management discretion. This propos",
        " and future success depends in large part upon the continued service of key technical leads as\nwell as members of our senior management team. For instance, Sundar Pichai is critical to the overall management of\nAlphabet and its subsidiaries and plays an important role in the development of our technology, maintaining our culture,\nand setting our strategic direction.\nOur ability to compete effectively and our future success depend on our continuing to identify, hire, develop,\nmotivate, and retain",
        "ts. We expect\nto continue to evaluate and enter into discussions regarding a wide array of potential strategic transactions, which could\ncreate unforeseen operating difficulties and expenditures. Some of the areas where we face risks include:\n•\nDiversion of management time and focus from operating our business to challenges related to acquisitions and\nother strategic transactions.\n•\nFailure to successfully integrate and further develop the acquired business or technology.\n19\nTable of Contents\nAl",
        "ur stockholders and other stakeholders throughout the year on a broad range of topics that are of interest and priority to the\ncompany and our stockholders. These include business strategy and performance, corporate governance, executive compensation, environmental\nsustainability, content governance, data privacy and security, human rights, public policy and lobbying, and responsible AI, among other matters.\n \nOur engagement enables us to better understand our stockholders’ priorities and perspe"
      ],
      "retrieved_docs": 5,
      "top_scores": [
        0.5928918719291687,
        0.5825443267822266,
        0.5757364630699158
      ],
      "sources": [
        "ALPHABET INC. - DEF 14A.pdf",
        "ALPHABET INC. - DEF14A.pdf",
        "goog-20241231.pdf",
        "Document.pdf",
        "ALPHABET INC. - DEF14A.pdf"
      ],
      "execution_time": 0.011879920959472656,
      "embedding_dim": 384,
      "category": "strategy",
      "query_id": 19,
      "difficulty": "medium"
    },
    {
      "question": "How does the company plan to allocate capital (e.g., investments, dividends, share buybacks, debt repayment)?",
      "answer": "as well as the cash\nflow that we generate from our operations. The primary use of capital continues to be to invest for the long term growth\nof the business. We regularly evaluate our cash and capital structure, including the size, pace and form of capital return\nto stockholders.\nWe have a short-term debt financing program of up to $5.0 billion through the issuance of commercial paper. Net\nproceeds from this program are used for general corporate purposes. We had no commercial paper outstanding \n\nties,\nas well as the cash flow that we generate from operations. The primary use of capital\ncontinues to be to invest for the long-term growth of the business. We regularly evaluate our\ncash and capital structure, including the size, pace, and form of capital return to stockholders.\n38\nThe following table presents our cash flows (in millions):\n \nThree Months Ended\nMarch 31,\n \n2023\n2024\nNet cash provided by operating activities\n$\n23,509  $\n28,848 \nNet cash used in investing activities\n$\n(2,946) $\n\nurities,\nas well as the cash flow that we generate from operations. The primary use of capital\ncontinues to be to invest for the long-term growth of the business. We regularly evaluate our\ncash and capital structure, including the size, pace, and form of capital return to stockholders.\nThe following table presents our cash flows (in millions):\n \nSix Months Ended\nJune 30,\n \n2023\n2024\nNet cash provided by operating activities\n$\n52,175  $\n55,488 \nNet cash used in investing activities\n$\n(13,746) $\n(",
      "contexts": [
        "as well as the cash\nflow that we generate from our operations. The primary use of capital continues to be to invest for the long term growth\nof the business. We regularly evaluate our cash and capital structure, including the size, pace and form of capital return\nto stockholders.\nWe have a short-term debt financing program of up to $5.0 billion through the issuance of commercial paper. Net\nproceeds from this program are used for general corporate purposes. We had no commercial paper outstanding ",
        "ties,\nas well as the cash flow that we generate from operations. The primary use of capital\ncontinues to be to invest for the long-term growth of the business. We regularly evaluate our\ncash and capital structure, including the size, pace, and form of capital return to stockholders.\n38\nThe following table presents our cash flows (in millions):\n \nThree Months Ended\nMarch 31,\n \n2023\n2024\nNet cash provided by operating activities\n$\n23,509  $\n28,848 \nNet cash used in investing activities\n$\n(2,946) $",
        "urities,\nas well as the cash flow that we generate from operations. The primary use of capital\ncontinues to be to invest for the long-term growth of the business. We regularly evaluate our\ncash and capital structure, including the size, pace, and form of capital return to stockholders.\nThe following table presents our cash flows (in millions):\n \nSix Months Ended\nJune 30,\n \n2023\n2024\nNet cash provided by operating activities\n$\n52,175  $\n55,488 \nNet cash used in investing activities\n$\n(13,746) $\n(",
        "Plan shall include Capital Stock) are listed for trading:\n \n(a) Shares Available for Grants\n \nIn the event of any change in the number or type of shares of common stock of Alphabet outstanding by reason of any stock dividend or split,\nrecapitalization, merger, consolidation, combination or exchange of shares or similar corporate change, or any change in the type and number\nof shares of common stock of Alphabet outstanding by reason of any other event or transaction, the Committee shall make appr",
        "y use of capital continues to be to invest for the long-term growth of the\nbusiness. We regularly evaluate our cash and capital structure, including the size, pace, and form of capital return to\nstockholders.\n40.\nTable of Contents\nAlphabet Inc.\nThe following table presents our cash flows (in millions):\n \nYear Ended December 31,\n \n2022\n2023\nNet cash provided by operating activities\n$\n91,495 \n$\n101,746 \nNet cash used in investing activities\n$\n(20,298)\n$\n(27,063)\nNet cash used in financing activiti"
      ],
      "retrieved_docs": 5,
      "top_scores": [
        0.57684326171875,
        0.5603886842727661,
        0.5582994818687439
      ],
      "sources": [
        "Document.pdf",
        "goog-20240331.pdf",
        "goog-20240630.pdf",
        "ALPHABET INC. - DEF 14A_2.pdf",
        "goog-20231231.pdf"
      ],
      "execution_time": 0.1595149040222168,
      "embedding_dim": 384,
      "category": "strategy",
      "query_id": 20,
      "difficulty": "hard"
    },
    {
      "question": "Which acquisitions, divestitures, or major investments were completed during the reporting period?",
      "answer": "re operating results.\nAcquisitions, joint ventures, investments, and divestitures could result in operating difficulties, dilution,\nand other consequences that may harm our business, financial condition, and operating results.\nAcquisitions, joint ventures, investments and divestitures are important elements of our overall corporate strategy\nand use of capital, and these transactions could be material to our financial condition and operating results. We expect\nto continue to evaluate and enter in\n\nd evolving, our historical operating results may\nnot be useful to you in predicting our future operating results.\nAcquisitions, joint ventures, investments, and divestitures could result in\noperating difficulties, dilution, and other consequences that may harm our business,\nfinancial condition, and operating results.\nAcquisitions, joint ventures, investments and divestitures are important elements of our\noverall corporate strategy and use of capital, and these transactions could be material to o\n\nm our business, financial condition, and operating results.\nAcquisitions, joint ventures, investments, and divestitures are important elements of our overall corporate strategy\nand use of capital, and these transactions could be material to our financial condition and operating results. We expect\nto continue to evaluate and enter into discussions regarding a wide array of such potential strategic transactions, which\ncould create unforeseen operating difficulties and expenditures. Some of the are",
      "contexts": [
        "re operating results.\nAcquisitions, joint ventures, investments, and divestitures could result in operating difficulties, dilution,\nand other consequences that may harm our business, financial condition, and operating results.\nAcquisitions, joint ventures, investments and divestitures are important elements of our overall corporate strategy\nand use of capital, and these transactions could be material to our financial condition and operating results. We expect\nto continue to evaluate and enter in",
        "d evolving, our historical operating results may\nnot be useful to you in predicting our future operating results.\nAcquisitions, joint ventures, investments, and divestitures could result in\noperating difficulties, dilution, and other consequences that may harm our business,\nfinancial condition, and operating results.\nAcquisitions, joint ventures, investments and divestitures are important elements of our\noverall corporate strategy and use of capital, and these transactions could be material to o",
        "m our business, financial condition, and operating results.\nAcquisitions, joint ventures, investments, and divestitures are important elements of our overall corporate strategy\nand use of capital, and these transactions could be material to our financial condition and operating results. We expect\nto continue to evaluate and enter into discussions regarding a wide array of such potential strategic transactions, which\ncould create unforeseen operating difficulties and expenditures. Some of the are",
        "y harm our business, financial condition, and operating results.\nAcquisitions, joint ventures, investments and divestitures are important elements of our overall corporate strategy\nand use of capital, and these transactions could be material to our financial condition and operating results. We expect\nto continue to evaluate and enter into discussions regarding a wide array of such potential strategic transactions, which\ncould create unforeseen operating difficulties and expenditures. Some of the",
        "tions, joint ventures, investments, and divestitures could result in operating difficulties, dilution,\nand other consequences that could harm our business, financial condition, and operating results.\nAcquisitions, joint ventures, investments, and divestitures are important elements of our overall corporate strategy\nand use of capital, and these transactions could be material to our financial condition and operating results. We expect\nto continue to evaluate and enter into discussions regarding a"
      ],
      "retrieved_docs": 5,
      "top_scores": [
        0.6536481976509094,
        0.6513096690177917,
        0.6335841417312622
      ],
      "sources": [
        "Document.pdf",
        "goog-20200630.pdf",
        "goog-20221231.pdf",
        "goog-20201231.pdf",
        "goog-20241231.pdf"
      ],
      "execution_time": 0.011383056640625,
      "embedding_dim": 384,
      "category": "strategy",
      "query_id": 21,
      "difficulty": "medium"
    },
    {
      "question": "How does management describe the company’s competitive advantages or moats?",
      "answer": "and development,\nincluding through acquisitions, in order to enhance our technology and new and existing products and services.\nWe have many competitors in different industries. Our current and potential domestic and international\ncompetitors range from large and established companies to emerging start-ups. Some competitors have longer\noperating histories and well established relationships in various sectors. They can use their experience and resources\nin ways that could affect our competitive p\n\n to enhance our technology, products, and services.\nWe have many competitors in different industries. Our current and potential domestic and international\ncompetitors range from large and established companies to emerging start-ups. Some competitors have longer\noperating histories and well-established relationships in various sectors. They can use their experience and resources\nin ways that could affect our competitive position, including by making acquisitions and entering into other strategic\n\n\n strong\ncompany and creating stockholder value. This value creation is supported by the stability provided by our capital structure, which insulates us from short-\nterm pressures and gives us greater ability to focus on long-term opportunities. A multi-class structure allows our management to take calculated risks in\nfurtherance of maximizing long-term returns, and the strategic decisions made over the years by Alphabet’s management has enabled it to become one\nof the most successful companies i",
      "contexts": [
        "and development,\nincluding through acquisitions, in order to enhance our technology and new and existing products and services.\nWe have many competitors in different industries. Our current and potential domestic and international\ncompetitors range from large and established companies to emerging start-ups. Some competitors have longer\noperating histories and well established relationships in various sectors. They can use their experience and resources\nin ways that could affect our competitive p",
        " to enhance our technology, products, and services.\nWe have many competitors in different industries. Our current and potential domestic and international\ncompetitors range from large and established companies to emerging start-ups. Some competitors have longer\noperating histories and well-established relationships in various sectors. They can use their experience and resources\nin ways that could affect our competitive position, including by making acquisitions and entering into other strategic\n",
        " strong\ncompany and creating stockholder value. This value creation is supported by the stability provided by our capital structure, which insulates us from short-\nterm pressures and gives us greater ability to focus on long-term opportunities. A multi-class structure allows our management to take calculated risks in\nfurtherance of maximizing long-term returns, and the strategic decisions made over the years by Alphabet’s management has enabled it to become one\nof the most successful companies i",
        "ur financial\ncondition and operating results.\nWe face intense competition. If we do not continue to innovate and provide products and services that are\nuseful to users, customers, and other partners, we may not remain competitive, which could harm our\nbusiness and operating results.\nOur business environment is rapidly evolving and intensely competitive. Our businesses face changing\ntechnologies, shifting user needs, and frequent introductions of rival products and services. To compete successful",
        ", substantially similar to or better than ours. This may force\nus to compete in different ways and expend significant resources in order to remain competitive. If our competitors are\nmore successful than we are in providing compelling products and services or in attracting and retaining users,\nadvertisers, publishers, customers, and content providers, our operating results could be harmed.\nOur ongoing investment in new businesses, products, services, and technologies is inherently risky, and\ncou"
      ],
      "retrieved_docs": 5,
      "top_scores": [
        0.54584139585495,
        0.5383027791976929,
        0.53272545337677
      ],
      "sources": [
        "goog-20201231.pdf",
        "goog-20241231.pdf",
        "ALPHABET INC. - DEF14A.pdf",
        "goog-20211231.pdf",
        "goog-20211231.pdf"
      ],
      "execution_time": 0.01062774658203125,
      "embedding_dim": 384,
      "category": "strategy",
      "query_id": 22,
      "difficulty": "hard"
    },
    {
      "question": "How does the company plan to address key risks and uncertainties mentioned in the report?",
      "answer": "ocedures for mitigating these risks. A comprehensive report from the\nBoard on data risk management would be welcomed by a broad array of stakeholders.\n \nAlphabet Opposing Statement\n \nGiven our existing robust program, controls, data privacy and security operations, and transparent disclosure, our Board of Directors does not believe\nthat the report requested by this proposal would be an effective use of company resources or provide additional information of value to our stockholders.\nOur Board th\n\n in Risk Oversight” on page 31.\n \nThe scale and breadth of our products, services, and operations provide us both an opportunity and a responsibility to manage the company in a\nresponsible way. We have a long track record of transparency, and we are proud of the leadership role the company has played in advancing disclosures\non important issues. Visit our About Google website at https://about.google/company-info/reports/ for additional information and links to key reports\nacross a broad range of\n\nluding the risks discussed in Part I, Item 1A \"Risk Factors\" and\nthe trends discussed in Part II, Item 7 \"Management's Discussion and Analysis of Financial Condition and Results of\nOperations,\" and those discussed in other documents we file with the SEC. We undertake no obligation to revise or\npublicly release the results of any revision to these forward-looking statements, except as required by law. Given these\nrisks and uncertainties, readers are cautioned not to place undue reliance on such f",
      "contexts": [
        "ocedures for mitigating these risks. A comprehensive report from the\nBoard on data risk management would be welcomed by a broad array of stakeholders.\n \nAlphabet Opposing Statement\n \nGiven our existing robust program, controls, data privacy and security operations, and transparent disclosure, our Board of Directors does not believe\nthat the report requested by this proposal would be an effective use of company resources or provide additional information of value to our stockholders.\nOur Board th",
        " in Risk Oversight” on page 31.\n \nThe scale and breadth of our products, services, and operations provide us both an opportunity and a responsibility to manage the company in a\nresponsible way. We have a long track record of transparency, and we are proud of the leadership role the company has played in advancing disclosures\non important issues. Visit our About Google website at https://about.google/company-info/reports/ for additional information and links to key reports\nacross a broad range of",
        "luding the risks discussed in Part I, Item 1A \"Risk Factors\" and\nthe trends discussed in Part II, Item 7 \"Management's Discussion and Analysis of Financial Condition and Results of\nOperations,\" and those discussed in other documents we file with the SEC. We undertake no obligation to revise or\npublicly release the results of any revision to these forward-looking statements, except as required by law. Given these\nrisks and uncertainties, readers are cautioned not to place undue reliance on such f",
        "hether the Company is failing to disclose these potential liabilities as material\nrisks in its public filings. There is currently no single source providing shareholders the information sought by this resolution.\n \nAlphabet Opposing Statement\n \nOur Board has considered this proposal and, for the reasons set forth below, does not believe that it is in the best interests of our company and our\nstockholders and recommends a vote AGAINST this proposal.\n \nWe Are Committed to Robust Information Govern",
        " statements are based on current\nexpectations and assumptions that are subject to risks and uncertainties, which could cause\nour actual results to differ materially from those reflected in the forward-looking statements.\nFactors that could cause or contribute to such differences include, but are not limited to, those\ndiscussed in this Quarterly Report on Form 10-Q, and in particular, the risks discussed in Part\nII, Item 1A, \"Risk Factors\" and those discussed in other documents we file with the S"
      ],
      "retrieved_docs": 5,
      "top_scores": [
        0.6513938903808594,
        0.6376126408576965,
        0.6335936784744263
      ],
      "sources": [
        "ALPHABET INC. DEF 14A.pdf",
        "ALPHABET INC. - DEF14A.pdf",
        "goog-20231231.pdf",
        "ALPHABET INC. DEF 14A.pdf",
        "goog-20200630.pdf"
      ],
      "execution_time": 0.010226964950561523,
      "embedding_dim": 384,
      "category": "strategy",
      "query_id": 40,
      "difficulty": "hard"
    },
    {
      "question": "What environmental, social, and governance (ESG) topics does the company highlight as most material?",
      "answer": "ronmental, social, and governance (ESG) considerations could expose us to\npotential liabilities, increased costs, and reputational harm.\nWe are subject to laws, regulations, and other measures that govern a wide range of topics, including those\nrelated to matters beyond our core products and services. For instance, new laws, regulations, policies, and\ninternational accords relating to ESG matters, including sustainability, climate change, human capital, and diversity, are\nbeing developed and for\n\nd developments in corporate governance.\n \n \nEngagement\n \nWe proactively engage with our stockholders and other stakeholders throughout the year on a broad range of topics that are of interest and priority to the\ncompany and our stockholders. These include business strategy and performance, and environmental, social and governance (ESG) topics such as\nenvironmental sustainability, human capital, workforce diversity, executive compensation, and Board leadership and composition.\n \nOur engagement en\n\nesence. Though ESG or environmental, social and corporate\ngovernance issues are at the forefront of our company ethos, at the director level, the board doesn’t seem to have any oversight with environmental\nsustainability.\n \nCurrent board committees at Alphabet include the Audit and Compliance Committee, Leadership Development and Compensation Committee,\nNominating and Corporate Governance Committee and the Executive Committee. Within the verbiage of all committees’ responsibilities and purpose,\n",
      "contexts": [
        "ronmental, social, and governance (ESG) considerations could expose us to\npotential liabilities, increased costs, and reputational harm.\nWe are subject to laws, regulations, and other measures that govern a wide range of topics, including those\nrelated to matters beyond our core products and services. For instance, new laws, regulations, policies, and\ninternational accords relating to ESG matters, including sustainability, climate change, human capital, and diversity, are\nbeing developed and for",
        "d developments in corporate governance.\n \n \nEngagement\n \nWe proactively engage with our stockholders and other stakeholders throughout the year on a broad range of topics that are of interest and priority to the\ncompany and our stockholders. These include business strategy and performance, and environmental, social and governance (ESG) topics such as\nenvironmental sustainability, human capital, workforce diversity, executive compensation, and Board leadership and composition.\n \nOur engagement en",
        "esence. Though ESG or environmental, social and corporate\ngovernance issues are at the forefront of our company ethos, at the director level, the board doesn’t seem to have any oversight with environmental\nsustainability.\n \nCurrent board committees at Alphabet include the Audit and Compliance Committee, Leadership Development and Compensation Committee,\nNominating and Corporate Governance Committee and the Executive Committee. Within the verbiage of all committees’ responsibilities and purpose,\n",
        "on, and operating results.\nExpectations relating to ESG considerations could expose us to potential liabilities, increased costs, and\nreputational harm.\nWe are subject to laws, regulations, and other measures that govern a wide range of topics, including those\nrelated to matters beyond our core products and services. For instance, new laws, regulations, policies, and\ninternational accords relating to ESG matters, including sustainability, climate change, human capital, and diversity, are\nbeing d",
        " the best interests of our company\nand our stockholders and recommends a vote AGAINST this proposal.\n \nOur Board Already Has Robust Oversight of ESG Risks and Opportunities\n \nBuilding a sustainable company and contributing to a sustainable future has long been core to our corporate DNA. Our Board oversees the risks and\nexposures associated with environmental sustainability and climate change, and the Audit Committee, per its charter, reviews and discusses with\nmanagement our major risk exposures"
      ],
      "retrieved_docs": 5,
      "top_scores": [
        0.7067247629165649,
        0.6616976857185364,
        0.6513315439224243
      ],
      "sources": [
        "goog-20221231.pdf",
        "ALPHABET INC. DEF 14A.pdf",
        "ALPHABET INC. DEF 14A.pdf",
        "goog-20231231.pdf",
        "ALPHABET INC. DEF 14A.pdf"
      ],
      "execution_time": 0.010095834732055664,
      "embedding_dim": 384,
      "category": "esg",
      "query_id": 23,
      "difficulty": "medium"
    },
    {
      "question": "Does the company disclose greenhouse gas (GHG) emissions or climate-related targets?",
      "answer": "s prepared to meet its climate goals, thereby\nmitigating climate-related risks and upholding Alphabet’s reputation for climate leadership.\n \nResolved: Given the Company’s growing GHG emissions and the challenge of meeting its goals, shareholders request Alphabet disclose additional\ninformation illustrating if and how it will meet its 2030 climate goals. This disclosure should be beyond existing disclosures, at reasonable cost, omitting\nproprietary information, and made annually.\n \n \n \n(1)\nhttps:\n\ns and value chain and to become the first major company to operate on carbon-free energy 24 hours a\nday, seven days a week, 365 days a year by 2030. We disclose our emissions performance annually in our Environmental Report and through the CDP\nClimate survey.\n \nWe Already Publish Transparent and Extensive Lobbying Disclosures With Robust Board Oversight\n \nGoogle’s U.S. Public Policy Transparency Report for our public policy and lobbying activities provides robust and regularly updated disclosure\n\nr agendas\n7\nStockholder proposal regarding an enhanced\ndisclosure on climate goals (page 74)\n \nAGAINST\n \n•\nWe have a long track record of transparency and already\nprovide information about our climate goals, progress, policies,\nand practices in our existing environment reporting\n \n \n \n \n•\nWe strive to evolve our disclosures to align with best practices\nand expectations, including compliance with regulatory\nframeworks\n8\nStockholder proposal regarding equal shareholder\nvoting (page 76)\n \nAGAINST\n ",
      "contexts": [
        "s prepared to meet its climate goals, thereby\nmitigating climate-related risks and upholding Alphabet’s reputation for climate leadership.\n \nResolved: Given the Company’s growing GHG emissions and the challenge of meeting its goals, shareholders request Alphabet disclose additional\ninformation illustrating if and how it will meet its 2030 climate goals. This disclosure should be beyond existing disclosures, at reasonable cost, omitting\nproprietary information, and made annually.\n \n \n \n(1)\nhttps:",
        "s and value chain and to become the first major company to operate on carbon-free energy 24 hours a\nday, seven days a week, 365 days a year by 2030. We disclose our emissions performance annually in our Environmental Report and through the CDP\nClimate survey.\n \nWe Already Publish Transparent and Extensive Lobbying Disclosures With Robust Board Oversight\n \nGoogle’s U.S. Public Policy Transparency Report for our public policy and lobbying activities provides robust and regularly updated disclosure",
        "r agendas\n7\nStockholder proposal regarding an enhanced\ndisclosure on climate goals (page 74)\n \nAGAINST\n \n•\nWe have a long track record of transparency and already\nprovide information about our climate goals, progress, policies,\nand practices in our existing environment reporting\n \n \n \n \n•\nWe strive to evolve our disclosures to align with best practices\nand expectations, including compliance with regulatory\nframeworks\n8\nStockholder proposal regarding equal shareholder\nvoting (page 76)\n \nAGAINST\n ",
        "ties and local governments reduce an aggregate of 1 gigaton of carbon emissions annually.\n \nOur annual Environmental Report discloses our progress towards these and other sustainability targets. We regularly track our progress toward our\nenvironmental goals and targets, and share updates with our stakeholders. Data and transparency are important markers of the progress we are making\nto evaluate and address climate-related risks and opportunities.\n \nOur existing disclosures provide meaningful ins",
        "o\noversee and review policies and provide guidance on matters relating to environmental sustainability.\n \nSUPPORTING STATEMENT\n \nAs one of the largest corporations in the world, our company’s exposure to environmental sustainability and issues around climate change are\nconsiderable and could substantially affect our bottom line.\n \nIn a recent report put out by consulting firm Deloitte titled “Addressing Climate Change”1 the firm asked 353 committee members of large corporations,\n“How prepared ar"
      ],
      "retrieved_docs": 5,
      "top_scores": [
        0.6302165985107422,
        0.6140516400337219,
        0.6098299026489258
      ],
      "sources": [
        "ALPHABET INC. - DEF14A.pdf",
        "ALPHABET INC. DEF 14A.pdf",
        "ALPHABET INC. - DEF14A.pdf",
        "ALPHABET INC. DEF 14A.pdf",
        "ALPHABET INC. DEF 14A.pdf"
      ],
      "execution_time": 0.009752035140991211,
      "embedding_dim": 384,
      "category": "esg",
      "query_id": 24,
      "difficulty": "hard"
    },
    {
      "question": "How does the company describe its approach to diversity, equity, and inclusion (DEI)?",
      "answer": "als.\n \nWe track and provide transparent information and data on our environmental sustainability initiatives. Please see our Sustainability website for more\ninformation.\n \nDiversity, Equity, and Inclusion (DEI): Building a world where progress, equitable outcomes, diversity, and inclusion can be realities is at the heart of\nwhat we do — from how we build our products to how we build our workforce. We have deepened our efforts to drive meaningful change but we know\nthere is more to be done. We ha\n\nr\nannual environmental report for more information on our actions and progress.\n \nALPHABET ● 2023 PROXY STATEMENT        12\n \nDiversity, Equity, and Inclusion (DEI): Building a world where progress, equitable outcomes, diversity, and inclusion can be realities is at the heart of\nwhat we do — from how we build our products to how we build our workforce. We have deepened our efforts to drive meaningful change and we also\nknow there is more to be done. We have a responsibility to continue scaling o\n\nating\nour focus. Our Leadership Development, Inclusion and Compensation Committee is charged with overseeing matters relating to our human capital\nmanagement, including with respect to diversity and inclusion, workplace environment and safety, and corporate culture.\n \nIn 2020, we implemented a series of industry-leading principles and improvements that incorporated input from both employees and stockholders,\nincluding the creation of a new DEI Advisory Council, which comprises internal senior ex",
      "contexts": [
        "als.\n \nWe track and provide transparent information and data on our environmental sustainability initiatives. Please see our Sustainability website for more\ninformation.\n \nDiversity, Equity, and Inclusion (DEI): Building a world where progress, equitable outcomes, diversity, and inclusion can be realities is at the heart of\nwhat we do — from how we build our products to how we build our workforce. We have deepened our efforts to drive meaningful change but we know\nthere is more to be done. We ha",
        "r\nannual environmental report for more information on our actions and progress.\n \nALPHABET ● 2023 PROXY STATEMENT        12\n \nDiversity, Equity, and Inclusion (DEI): Building a world where progress, equitable outcomes, diversity, and inclusion can be realities is at the heart of\nwhat we do — from how we build our products to how we build our workforce. We have deepened our efforts to drive meaningful change and we also\nknow there is more to be done. We have a responsibility to continue scaling o",
        "ating\nour focus. Our Leadership Development, Inclusion and Compensation Committee is charged with overseeing matters relating to our human capital\nmanagement, including with respect to diversity and inclusion, workplace environment and safety, and corporate culture.\n \nIn 2020, we implemented a series of industry-leading principles and improvements that incorporated input from both employees and stockholders,\nincluding the creation of a new DEI Advisory Council, which comprises internal senior ex",
        "ability metrics, including metrics regarding diversity among senior executives, into performance measures or vesting conditions that may apply to senior executives under the Company’s compensation plans or arrangements. For the purposes of this proposal, “sustainability” is defined as how environmental and social considerations, and related financial impacts, are\nintegrated into long-term corporate strategy, and “diversity” refers to gender, racial, and ethnic diversity. Alphabet Opposing Statem",
        "g principles and improvements that incorporated input from both Googlers and our stockholders, including the creation of a new\nDiversity Equity and Inclusion (DEI) Advisory Council comprised of senior executives and external DEI experts. Our Board has been working closely with\nour CEO and senior leadership to ensure that issues of misconduct, including discrimination, are properly addressed and that those who report\nmisconduct receive care and support. Where allegations of misconduct are made ag"
      ],
      "retrieved_docs": 5,
      "top_scores": [
        0.6943325996398926,
        0.6909911632537842,
        0.6371395587921143
      ],
      "sources": [
        "ALPHABET INC. DEF 14A.pdf",
        "ALPHABET INC. - DEF 14A_2.pdf",
        "ALPHABET INC. DEF 14A.pdf",
        "lgoog2020_def14a.pdf",
        "ALPHABET INC. DEF 14A.pdf"
      ],
      "execution_time": 0.007563114166259766,
      "embedding_dim": 384,
      "category": "esg",
      "query_id": 25,
      "difficulty": "medium"
    },
    {
      "question": "Are there any notable ESG-related risks or controversies mentioned in the report?",
      "answer": "on, and operating results.\nExpectations relating to ESG considerations could expose us to potential liabilities, increased costs, and\nreputational harm.\nWe are subject to laws, regulations, and other measures that govern a wide range of topics, including those\nrelated to matters beyond our core products and services. For instance, new laws, regulations, policies, and\ninternational accords relating to ESG matters, including sustainability, climate change, human capital, and diversity, are\nbeing d\n\nes and adversely affect our business.\nOther\nWe are subject to claims, lawsuits, regulatory and government investigations, other proceedings, and consent\norders involving competition, intellectual property, data security, tax and related compliance, labor and employment,\ncommercial disputes, content generated by our users, goods and services offered by advertisers or publishers using\nour platforms, personal injury, consumer protection, and other matters. For example, in December 2023, a Californi\n\n the best interests of our company\nand our stockholders and recommends a vote AGAINST this proposal.\n \nOur Board Already Has Robust Oversight of ESG Risks and Opportunities\n \nBuilding a sustainable company and contributing to a sustainable future has long been core to our corporate DNA. Our Board oversees the risks and\nexposures associated with environmental sustainability and climate change, and the Audit Committee, per its charter, reviews and discusses with\nmanagement our major risk exposures",
      "contexts": [
        "on, and operating results.\nExpectations relating to ESG considerations could expose us to potential liabilities, increased costs, and\nreputational harm.\nWe are subject to laws, regulations, and other measures that govern a wide range of topics, including those\nrelated to matters beyond our core products and services. For instance, new laws, regulations, policies, and\ninternational accords relating to ESG matters, including sustainability, climate change, human capital, and diversity, are\nbeing d",
        "es and adversely affect our business.\nOther\nWe are subject to claims, lawsuits, regulatory and government investigations, other proceedings, and consent\norders involving competition, intellectual property, data security, tax and related compliance, labor and employment,\ncommercial disputes, content generated by our users, goods and services offered by advertisers or publishers using\nour platforms, personal injury, consumer protection, and other matters. For example, in December 2023, a Californi",
        " the best interests of our company\nand our stockholders and recommends a vote AGAINST this proposal.\n \nOur Board Already Has Robust Oversight of ESG Risks and Opportunities\n \nBuilding a sustainable company and contributing to a sustainable future has long been core to our corporate DNA. Our Board oversees the risks and\nexposures associated with environmental sustainability and climate change, and the Audit Committee, per its charter, reviews and discusses with\nmanagement our major risk exposures",
        "es and equity investment risks. Our exposure to market risk\nhas not changed materially since December 31, 2020. For quantitative and qualitative\ndisclosures about market risk, refer to Part II, Item 7A, Quantitative and Qualitative\nDisclosures About Market Risk, in our Annual Report on Form 10-K for the year ended\nDecember 31, 2020.\nITEM 4.\nCONTROLS AND PROCEDURES\nEvaluation of Disclosure Controls and Procedures\nOur management, with the participation of our chief executive officer and chief\nfina",
        "es,\nand other known and unknown liabilities.\n•\nLitigation or other claims in connection with the acquired company, including claims from terminated\nemployees, customers, former stockholders, or other third parties.\nOur failure to address these risks or other problems encountered in connection with our past or future acquisitions\nand other strategic transactions could cause us to fail to realize their anticipated benefits, incur unanticipated liabilities,\nand harm our business generally.\nOur acqu"
      ],
      "retrieved_docs": 5,
      "top_scores": [
        0.6853875517845154,
        0.5859457850456238,
        0.5736299157142639
      ],
      "sources": [
        "goog-20231231.pdf",
        "goog-20231231.pdf",
        "ALPHABET INC. DEF 14A.pdf",
        "goog-20210331.pdf",
        "Document.pdf"
      ],
      "execution_time": 0.009572982788085938,
      "embedding_dim": 384,
      "category": "esg",
      "query_id": 26,
      "difficulty": "hard"
    },
    {
      "question": "Does the company link executive compensation to ESG or sustainability metrics?",
      "answer": "roposal Regarding Report on\nSustainability Metrics\n \nWHEREAS: Studies suggest that companies that integrate environmental, social, and governance (ESG) factors into business strategy reduce\nreputational, legal, and regulatory risks and improve long-term performance. Leading companies have integrated sustainability metrics into executive\npay plans, among them Unilever and Walmart. The UN Principles for Responsible Investment (2012) state that considering ESG factors in\ncompensation can help prote\n\ns consists of two components – Environmental and Social – each with a maximum potential payout of $1.0 million. The Compensation\nCommittee is responsible for determining payout of the ESG Bonus for each ESG Participant, in conjunction with the CEO’s review of company-wide\nperformance and individual contributions made by each ESG Participant.\n \nFor the Environmental component, key accomplishments include progress toward advancing carbon-free energy across our global operations – as of\n2022, we ac\n\nes at other S&P 500 companies\nand startup organizations.\n \nProcess for Determining Compensation\n \nWe regularly review our compensation levels against our peer group and comparable opportunities. We also assess executives based on their individual\nperformance and overall company performance. Management uses this information to develop compensation recommendations for our named executive\nofficers. The Compensation Committee then reviews these recommendations, considers any relevant guidance from t",
      "contexts": [
        "roposal Regarding Report on\nSustainability Metrics\n \nWHEREAS: Studies suggest that companies that integrate environmental, social, and governance (ESG) factors into business strategy reduce\nreputational, legal, and regulatory risks and improve long-term performance. Leading companies have integrated sustainability metrics into executive\npay plans, among them Unilever and Walmart. The UN Principles for Responsible Investment (2012) state that considering ESG factors in\ncompensation can help prote",
        "s consists of two components – Environmental and Social – each with a maximum potential payout of $1.0 million. The Compensation\nCommittee is responsible for determining payout of the ESG Bonus for each ESG Participant, in conjunction with the CEO’s review of company-wide\nperformance and individual contributions made by each ESG Participant.\n \nFor the Environmental component, key accomplishments include progress toward advancing carbon-free energy across our global operations – as of\n2022, we ac",
        "es at other S&P 500 companies\nand startup organizations.\n \nProcess for Determining Compensation\n \nWe regularly review our compensation levels against our peer group and comparable opportunities. We also assess executives based on their individual\nperformance and overall company performance. Management uses this information to develop compensation recommendations for our named executive\nofficers. The Compensation Committee then reviews these recommendations, considers any relevant guidance from t",
        "inks among sustainability, diversity, and executive compensation would help deliver change and improve human capital\nmanagement.\n \nPeers such as Microsoft, Intel, and IBM have already begun linking parts of compensation to diversity goals.\n \nRESOLVED: Shareholders request the Board Compensation Committee prepare a report assessing the feasibility of integrating sustainability\nmetrics, including metrics regarding diversity among senior executives, into performance measures or vesting conditions t",
        "e Bonus\n \nIn January 2022, we adopted an Environmental, Social, and Governance Bonus (ESG Bonus) for members of Alphabet’s senior executive team,\nincluding our named executive officers Ruth, Prabhakar, Philipp, and Kent (ESG Participants). The ESG Bonus provides individual participants with a\nmaximum $2.0 million annual cash bonus opportunity, based on contributions to the company’s performance against environmental and social goals. The\nESG Bonus consists of two components – Environmental and S"
      ],
      "retrieved_docs": 5,
      "top_scores": [
        0.7487395405769348,
        0.7139866948127747,
        0.6471665501594543
      ],
      "sources": [
        "ALPHABET INC. - DEF 14A_3.pdf",
        "ALPHABET INC. - DEF 14A_2.pdf",
        "ALPHABET INC. DEF 14A.pdf",
        "ALPHABET INC. - DEF 14A_3.pdf",
        "ALPHABET INC. - DEF 14A_2.pdf"
      ],
      "execution_time": 0.010217905044555664,
      "embedding_dim": 384,
      "category": "esg",
      "query_id": 39,
      "difficulty": "hard"
    },
    {
      "question": "How has the company’s revenue growth over the last three years compared to its net income growth?",
      "answer": "dated financial results (in millions, except for per share information and\npercentages):\nYear Ended December 31,\n2023\n2024\n$ Change\n% Change\nConsolidated revenues\n$\n307,394 \n$\n350,018 \n$\n42,624 \n14 %\nChange in consolidated constant currency revenues\n15 %\nCost of revenues\n$\n133,332 \n$\n146,306 \n$\n12,974 \n10 %\nOperating expenses\n$\n89,769 \n$\n91,322 \n$\n1,553 \n2 %\nOperating income\n$\n84,293 \n$\n112,390 \n$\n28,097 \n33 %\nOperating margin\n27 %\n32 %\n5 %\nOther income (expense), net\n$\n1,424 \n$\n7,425 \n$\n6,001 \n\n\nfluctuations in our quarterly results, including fluctuations in sequential revenue growth rates.\n \nQuarter Ended\n \nMar 31,\n2019\nJun 30,\n2019\nSept 30,\n2019\nDec 31,\n2019\nMar 31,\n2020\nJun 30,\n2020\nSept 30,\n2020\nDec 31,\n2020\n(In millions, except per share amounts) (unaudited)\nConsolidated Statements of Income Data:\nRevenues\n$ 36,339  $ 38,944  $ 40,499  $ 46,075  $ 41,159  $ 38,297  $ 46,173 \n56,898 \nCosts and expenses:\nCost of revenues\n16,012 \n17,296 \n17,568 \n21,020 \n18,982 \n18,553 \n21,117 \n26,080\n\ne in constant currency revenues year over year\n15 %\n32 %\nOperating income\n$\n7,977 \n$\n16,437 \nOperating margin\n19 %\n30 %\nOther income (expense), net\n$\n(220)\n$\n4,846 \nNet Income\n$\n6,836 \n$\n17,930 \nDiluted EPS\n$\n9.87 \n$\n26.29 \n•\nTotal revenues were $55.3 billion, an increase of 34% year over year, primarily\ndriven by an increase in Google Services segment revenues of $13.0 billion or\n34% and an increase in Google Cloud segment\n29\nTable of Contents\nAlphabet Inc.\nrevenues of $1.3 billion or 46%. The ",
      "contexts": [
        "dated financial results (in millions, except for per share information and\npercentages):\nYear Ended December 31,\n2023\n2024\n$ Change\n% Change\nConsolidated revenues\n$\n307,394 \n$\n350,018 \n$\n42,624 \n14 %\nChange in consolidated constant currency revenues\n15 %\nCost of revenues\n$\n133,332 \n$\n146,306 \n$\n12,974 \n10 %\nOperating expenses\n$\n89,769 \n$\n91,322 \n$\n1,553 \n2 %\nOperating income\n$\n84,293 \n$\n112,390 \n$\n28,097 \n33 %\nOperating margin\n27 %\n32 %\n5 %\nOther income (expense), net\n$\n1,424 \n$\n7,425 \n$\n6,001 \n",
        "fluctuations in our quarterly results, including fluctuations in sequential revenue growth rates.\n \nQuarter Ended\n \nMar 31,\n2019\nJun 30,\n2019\nSept 30,\n2019\nDec 31,\n2019\nMar 31,\n2020\nJun 30,\n2020\nSept 30,\n2020\nDec 31,\n2020\n(In millions, except per share amounts) (unaudited)\nConsolidated Statements of Income Data:\nRevenues\n$ 36,339  $ 38,944  $ 40,499  $ 46,075  $ 41,159  $ 38,297  $ 46,173 \n56,898 \nCosts and expenses:\nCost of revenues\n16,012 \n17,296 \n17,568 \n21,020 \n18,982 \n18,553 \n21,117 \n26,080",
        "e in constant currency revenues year over year\n15 %\n32 %\nOperating income\n$\n7,977 \n$\n16,437 \nOperating margin\n19 %\n30 %\nOther income (expense), net\n$\n(220)\n$\n4,846 \nNet Income\n$\n6,836 \n$\n17,930 \nDiluted EPS\n$\n9.87 \n$\n26.29 \n•\nTotal revenues were $55.3 billion, an increase of 34% year over year, primarily\ndriven by an increase in Google Services segment revenues of $13.0 billion or\n34% and an increase in Google Cloud segment\n29\nTable of Contents\nAlphabet Inc.\nrevenues of $1.3 billion or 46%. The ",
        "ncome\n$ 16,437 \n$ 20,094 \n$\n3,657 \n22 %\nOperating margin\n30 %\n30 %\n0 %\nOther income (expense), net\n$\n4,846 \n$\n(1,160)\n$\n(6,006)\n(124)%\nNet Income\n$ 17,930 \n$ 16,436 \n$\n(1,494)\n(8)%\nDiluted EPS\n$\n26.29 \n$\n24.62 \n$\n(1.67)\n(6)%\nNumber of Employees\n139,995 \n163,906\n23,911\n17 %\n•\nRevenues were $68.0 billion, an increase of 23% year over year, primarily driven\nby an increase in Google Services segment revenues of $10.3 billion or 20% and\nan increase in Google Cloud segment revenues of $1.8 billion or ",
        "\n(2,935)\n(144)%\nNet Income\n$\n18,936 \n$\n13,910 \n$\n(5,026)\n(27)%\nDiluted EPS\n$\n1.40 \n$\n1.06 \n$\n(0.34)\n(24)%\nNumber of Employees\n150,028 \n186,779\n36,751\n24 %\n•\nRevenues were $69.1 billion, an increase of 6% year over year, primarily driven by an\nincrease in Google Cloud segment revenues of $1.9 billion, or 38%, and an increase\nin Google Services segment revenues of $1.5 billion, or 2%. Hedging gains\ncontributed approximately one percentage point to consolidated revenue growth.\n•\nTotal constant curr"
      ],
      "retrieved_docs": 5,
      "top_scores": [
        0.6315557956695557,
        0.6303207278251648,
        0.6233155727386475
      ],
      "sources": [
        "goog-20241231.pdf",
        "goog-20201231.pdf",
        "goog-20210331.pdf",
        "goog-20220331.pdf",
        "goog-20220930.pdf"
      ],
      "execution_time": 0.010790824890136719,
      "embedding_dim": 384,
      "category": "comparison",
      "query_id": 27,
      "difficulty": "hard"
    },
    {
      "question": "Compare the share of revenue coming from the top business segment now versus two years ago.",
      "answer": "dated financial results (in millions, except for per share information and\npercentages):\nYear Ended December 31,\n2023\n2024\n$ Change\n% Change\nConsolidated revenues\n$\n307,394 \n$\n350,018 \n$\n42,624 \n14 %\nChange in consolidated constant currency revenues\n15 %\nCost of revenues\n$\n133,332 \n$\n146,306 \n$\n12,974 \n10 %\nOperating expenses\n$\n89,769 \n$\n91,322 \n$\n1,553 \n2 %\nOperating income\n$\n84,293 \n$\n112,390 \n$\n28,097 \n33 %\nOperating margin\n27 %\n32 %\n5 %\nOther income (expense), net\n$\n1,424 \n$\n7,425 \n$\n6,001 \n\n\ne in constant currency revenues year over year\n15 %\n32 %\nOperating income\n$\n7,977 \n$\n16,437 \nOperating margin\n19 %\n30 %\nOther income (expense), net\n$\n(220)\n$\n4,846 \nNet Income\n$\n6,836 \n$\n17,930 \nDiluted EPS\n$\n9.87 \n$\n26.29 \n•\nTotal revenues were $55.3 billion, an increase of 34% year over year, primarily\ndriven by an increase in Google Services segment revenues of $13.0 billion or\n34% and an increase in Google Cloud segment\n29\nTable of Contents\nAlphabet Inc.\nrevenues of $1.3 billion or 46%. The \n\ns\nas a percentage of revenues\n5 %\n4 %\n5 %\n4 %\nGeneral and administrative expenses decreased $380 million and $1.4 billion from the\nthree and nine months ended September 30, 2023 to the three and nine months ended\nSeptember 30, 2024, primarily driven by a reduction in charges related to legal and other\nmatters of $693 million and $1.4 billion, respectively, partially offset by a combination of\nfactors, none of which were individually significant.\nSegment Profitability\nThe following table presents",
      "contexts": [
        "dated financial results (in millions, except for per share information and\npercentages):\nYear Ended December 31,\n2023\n2024\n$ Change\n% Change\nConsolidated revenues\n$\n307,394 \n$\n350,018 \n$\n42,624 \n14 %\nChange in consolidated constant currency revenues\n15 %\nCost of revenues\n$\n133,332 \n$\n146,306 \n$\n12,974 \n10 %\nOperating expenses\n$\n89,769 \n$\n91,322 \n$\n1,553 \n2 %\nOperating income\n$\n84,293 \n$\n112,390 \n$\n28,097 \n33 %\nOperating margin\n27 %\n32 %\n5 %\nOther income (expense), net\n$\n1,424 \n$\n7,425 \n$\n6,001 \n",
        "e in constant currency revenues year over year\n15 %\n32 %\nOperating income\n$\n7,977 \n$\n16,437 \nOperating margin\n19 %\n30 %\nOther income (expense), net\n$\n(220)\n$\n4,846 \nNet Income\n$\n6,836 \n$\n17,930 \nDiluted EPS\n$\n9.87 \n$\n26.29 \n•\nTotal revenues were $55.3 billion, an increase of 34% year over year, primarily\ndriven by an increase in Google Services segment revenues of $13.0 billion or\n34% and an increase in Google Cloud segment\n29\nTable of Contents\nAlphabet Inc.\nrevenues of $1.3 billion or 46%. The ",
        "s\nas a percentage of revenues\n5 %\n4 %\n5 %\n4 %\nGeneral and administrative expenses decreased $380 million and $1.4 billion from the\nthree and nine months ended September 30, 2023 to the three and nine months ended\nSeptember 30, 2024, primarily driven by a reduction in charges related to legal and other\nmatters of $693 million and $1.4 billion, respectively, partially offset by a combination of\nfactors, none of which were individually significant.\nSegment Profitability\nThe following table presents",
        "fluctuations in our quarterly results, including fluctuations in sequential revenue growth rates.\n \nQuarter Ended\n \nMar 31,\n2019\nJun 30,\n2019\nSept 30,\n2019\nDec 31,\n2019\nMar 31,\n2020\nJun 30,\n2020\nSept 30,\n2020\nDec 31,\n2020\n(In millions, except per share amounts) (unaudited)\nConsolidated Statements of Income Data:\nRevenues\n$ 36,339  $ 38,944  $ 40,499  $ 46,075  $ 41,159  $ 38,297  $ 46,173 \n56,898 \nCosts and expenses:\nCost of revenues\n16,012 \n17,296 \n17,568 \n21,020 \n18,982 \n18,553 \n21,117 \n26,080",
        "161.9 billion and revenue growth of 18% year over year, constant currency revenue growth of\n20% year over year.\n•\nGoogle segment revenues of $160.7 billion with revenue growth of 18% year over year and Other Bets\nrevenues of $659 million with revenue growth of 11% year over year.\n•\nRevenues from the United States, EMEA, APAC, and Other Americas were $74.8 billion, $50.6 billion, $26.9\nbillion, and $9.0 billion, respectively.\n•\nCost of revenues was $71.9 billion, consisting of TAC of $30.1 billio"
      ],
      "retrieved_docs": 5,
      "top_scores": [
        0.5890885591506958,
        0.5798711776733398,
        0.5795484781265259
      ],
      "sources": [
        "goog-20241231.pdf",
        "goog-20210331.pdf",
        "goog-20240930.pdf",
        "goog-20201231.pdf",
        "Document.pdf"
      ],
      "execution_time": 0.009844064712524414,
      "embedding_dim": 384,
      "category": "comparison",
      "query_id": 28,
      "difficulty": "hard"
    },
    {
      "question": "How has the company’s debt level changed over the last three reporting periods?",
      "answer": "owing table summarizes our consolidated financial results (in millions, except for per share information and\npercentages):\nYear Ended December 31,\n2022\n2023\n$ Change\n% Change\nConsolidated revenues\n$\n282,836 \n$\n307,394 \n$\n24,558 \n9 %\nChange in consolidated constant currency revenues\n10 %\nCost of revenues\n$\n126,203 \n$\n133,332 \n$\n7,129 \n6 %\nOperating expenses\n$\n81,791 \n$\n89,769 \n$\n7,978 \n10 %\nOperating income\n$\n74,842 \n$\n84,293 \n$\n9,451 \n13 %\nOperating margin\n26 %\n27 %\n1 %\nOther income (expense), n\n\nover the next few years. We completed the implementation of certain\nof our subledgers, which included changes to our processes, procedures and internal controls over financial reporting\nduring the second quarter of 2021. There have been no changes in our internal control over financial reporting that\noccurred during the quarter ended December  31, 2021 that have materially affected, or are reasonably likely to\nmaterially affect, our internal control over financial reporting. However, as the phas\n\n of debt.\nNet cash used in financing activities increased from the six months ended June 30, 2019\nto the six months ended June 30, 2020 primarily due to an increase in cash payments for\nrepurchases of capital stock, partially offset by an increase in proceeds from the sale of\ninterest in consolidated entities.\nCritical Accounting Policies and Estimates\nSee Part II, Item 7, \"Critical Accounting Policies and Estimates\" in our Annual Report on\nForm 10-K for the year ended December 31, 2019. There h",
      "contexts": [
        "owing table summarizes our consolidated financial results (in millions, except for per share information and\npercentages):\nYear Ended December 31,\n2022\n2023\n$ Change\n% Change\nConsolidated revenues\n$\n282,836 \n$\n307,394 \n$\n24,558 \n9 %\nChange in consolidated constant currency revenues\n10 %\nCost of revenues\n$\n126,203 \n$\n133,332 \n$\n7,129 \n6 %\nOperating expenses\n$\n81,791 \n$\n89,769 \n$\n7,978 \n10 %\nOperating income\n$\n74,842 \n$\n84,293 \n$\n9,451 \n13 %\nOperating margin\n26 %\n27 %\n1 %\nOther income (expense), n",
        "over the next few years. We completed the implementation of certain\nof our subledgers, which included changes to our processes, procedures and internal controls over financial reporting\nduring the second quarter of 2021. There have been no changes in our internal control over financial reporting that\noccurred during the quarter ended December  31, 2021 that have materially affected, or are reasonably likely to\nmaterially affect, our internal control over financial reporting. However, as the phas",
        " of debt.\nNet cash used in financing activities increased from the six months ended June 30, 2019\nto the six months ended June 30, 2020 primarily due to an increase in cash payments for\nrepurchases of capital stock, partially offset by an increase in proceeds from the sale of\ninterest in consolidated entities.\nCritical Accounting Policies and Estimates\nSee Part II, Item 7, \"Critical Accounting Policies and Estimates\" in our Annual Report on\nForm 10-K for the year ended December 31, 2019. There h",
        "1 \nRepayments of debt\n(6,827)\n(585)\n(2,100)\nProceeds from sale of interest in consolidated entities, net\n950 \n220 \n2,800 \nNet cash used in financing activities\n(13,179)\n(23,209)\n(24,408)\nEffect of exchange rate changes on cash and cash equivalents\n(302)\n(23)\n24 \nNet increase in cash and cash equivalents\n5,986 \n1,797 \n7,967 \nCash and cash equivalents at beginning of period\n10,715 \n16,701 \n18,498 \nCash and cash equivalents at end of period\n$\n16,701 \n$\n18,498 \n$\n26,465 \nSupplemental disclosures of ",
        "d repayments of debt.\nNet cash used in financing activities increased from the three months ended March 31,\n2019 to the three months ended March 31, 2020 primarily due to an increase in cash\npayments for repurchases of capital stock, partially offset by an increase in proceeds from the\nsale of interest in consolidated entities.\n42\nTable of Contents\nAlphabet In\nCritical Accounting Policies and Estimates\nSee Part II, Item 7, \"Critical Accounting Policies and Estimates\" in our Annual Report on\nForm"
      ],
      "retrieved_docs": 5,
      "top_scores": [
        0.5714225172996521,
        0.5654827356338501,
        0.5524338483810425
      ],
      "sources": [
        "goog-20231231.pdf",
        "goog-20211231.pdf",
        "goog-20200630.pdf",
        "goog-20201231.pdf",
        "goog-20200331.pdf"
      ],
      "execution_time": 0.008584260940551758,
      "embedding_dim": 384,
      "category": "comparison",
      "query_id": 29,
      "difficulty": "medium"
    },
    {
      "question": "What changes in risk factors are highlighted when comparing the latest report to the previous year?",
      "answer": "subject to\nrisks and uncertainties, which could cause our actual results to differ materially from those\nreflected in the forward-looking statements. Factors that could cause or contribute to such\ndifferences include, but are not limited to, those discussed in this Quarterly Report on Form\n10-Q, and in particular, the risks discussed in Part I, Item 1A, \"Risk Factors\" in our Annual\nReport on Form 10-K for the fiscal year ended December  31, 2021, and including material\nchanges reflected in this \n\ncould cause our actual results to differ materially\nfrom those reflected in the forward-looking statements. Factors that could cause or\ncontribute to such differences include, but are not limited to, those discussed in this\nQuarterly Report on Form 10-Q, and in particular, the risks discussed in Part I, Item 1A,\n\"Risk Factors\" in our Annual Report on Form 10-K for the fiscal year ended December 31,\n2020, as updated in this Quarterly Report on Form 10-Q, and those discussed in other\ndocuments we \n\ns and uncertainties, which could\ncause our actual results to differ materially from those reflected in the forward-looking\nstatements. Factors that could cause or contribute to such differences include, but are not\nlimited to, those discussed in this Quarterly Report on Form 10-Q, and in particular, the\nrisks discussed in Part I, Item 1A, \"Risk Factors\" in our Annual Report on Form 10-K for\nthe fiscal year ended December 31, 2021, and those discussed in other documents we file\nwith the SEC. We u",
      "contexts": [
        "subject to\nrisks and uncertainties, which could cause our actual results to differ materially from those\nreflected in the forward-looking statements. Factors that could cause or contribute to such\ndifferences include, but are not limited to, those discussed in this Quarterly Report on Form\n10-Q, and in particular, the risks discussed in Part I, Item 1A, \"Risk Factors\" in our Annual\nReport on Form 10-K for the fiscal year ended December  31, 2021, and including material\nchanges reflected in this ",
        "could cause our actual results to differ materially\nfrom those reflected in the forward-looking statements. Factors that could cause or\ncontribute to such differences include, but are not limited to, those discussed in this\nQuarterly Report on Form 10-Q, and in particular, the risks discussed in Part I, Item 1A,\n\"Risk Factors\" in our Annual Report on Form 10-K for the fiscal year ended December 31,\n2020, as updated in this Quarterly Report on Form 10-Q, and those discussed in other\ndocuments we ",
        "s and uncertainties, which could\ncause our actual results to differ materially from those reflected in the forward-looking\nstatements. Factors that could cause or contribute to such differences include, but are not\nlimited to, those discussed in this Quarterly Report on Form 10-Q, and in particular, the\nrisks discussed in Part I, Item 1A, \"Risk Factors\" in our Annual Report on Form 10-K for\nthe fiscal year ended December 31, 2021, and those discussed in other documents we file\nwith the SEC. We u",
        "s and assumptions that are subject to risks and uncertainties, which could\ncause our actual results to differ materially from those reflected in the forward-looking\nstatements. Factors that could cause or contribute to such differences include, but are not\nlimited to, those discussed in this Quarterly Report on Form 10-Q, and in particular, the\nrisks discussed in Part I, Item 1A, \"Risk Factors\" in our Annual Report on Form 10-K for\nthe fiscal year ended December 31, 2021, and those discussed in ",
        "lected in the forward-\nlooking statements. Factors that could cause or contribute to such differences include, but are not limited to, those\ndiscussed in this Annual Report on Form 10-K, and in particular, the risks discussed in Item 1A, \"Risk Factors\" of this\nreport and those discussed in other documents we file with the SEC. We undertake no obligation to revise or publicly\nrelease the results of any revision to these forward-looking statements, except as required by law. Given these risks\nand "
      ],
      "retrieved_docs": 5,
      "top_scores": [
        0.7362623810768127,
        0.7235841751098633,
        0.7221707701683044
      ],
      "sources": [
        "goog-20220930.pdf",
        "goog-20210930.pdf",
        "goog-20220331.pdf",
        "goog-20220630.pdf",
        "goog-20201231.pdf"
      ],
      "execution_time": 0.009104728698730469,
      "embedding_dim": 384,
      "category": "comparison",
      "query_id": 30,
      "difficulty": "hard"
    },
    {
      "question": "Locate and summarize the table that presents the breakdown of revenue by geographic region.",
      "answer": "enues by Geography\nThe following table presents revenues by geography as a percentage of revenues,\ndetermined based on the addresses of our customers:\nThree Months Ended\nNine Months Ended\n \nSeptember 30,\nSeptember 30,\n \n2023\n2024\n2023\n2024\nUnited States\n47 %\n49 %\n47 %\n49 %\nEMEA\n30 %\n29 %\n30 %\n29 %\nAPAC\n17 %\n16 %\n17 %\n16 %\nOther Americas\n6 %\n6 %\n6 %\n6 %\nHedging gains (losses)\n0 %\n0 %\n0 %\n0 %\nFor additional information, see Note 2 of the Notes to Consolidated Financial Statements\nincluded in Item \n\ning table presents revenues by geography as a percentage of revenues,\ndetermined based on the addresses of our customers:\nThree Months Ended\nSix Months Ended\n \nJune 30,\nJune 30,\n \n2024\n2025\n2024\n2025\nUnited States\n49 %\n48 %\n48 %\n48 %\nEMEA\n29 %\n29 %\n29 %\n29 %\nAPAC\n16 %\n17 %\n17 %\n17 %\nOther Americas\n6 %\n6 %\n6 %\n6 %\nHedging gains (losses)\n0 %\n0 %\n0 %\n0 %\nFor additional information, see Note 2 of the Notes to Consolidated Financial Statements\nincluded in Item 1 of this Quarterly Report on Form 10-Q.\n\n \n84 \nTotal revenues\n$\n68,011  $\n69,787 \nThe following table presents revenues disaggregated by geography, based on the\naddresses of our customers (in millions):\n \nThree Months Ended\nMarch 31,\n \n2022\n2023\nUnited States\n$\n31,733 \n47 % $\n32,864 \n47 %\nEMEA\n20,317 \n30 \n21,078 \n30 \nAPAC\n11,841 \n17 \n11,681 \n17 \nOther Americas\n3,842 \n6 \n4,080 \n6 \nHedging gains (losses)\n278 \n0 \n84 \n0 \nTotal revenues\n$\n68,011 \n100 % $\n69,787 \n100 %\n    Regions represent Europe, the Middle East, and Africa (EMEA); Asia-Pa",
      "contexts": [
        "enues by Geography\nThe following table presents revenues by geography as a percentage of revenues,\ndetermined based on the addresses of our customers:\nThree Months Ended\nNine Months Ended\n \nSeptember 30,\nSeptember 30,\n \n2023\n2024\n2023\n2024\nUnited States\n47 %\n49 %\n47 %\n49 %\nEMEA\n30 %\n29 %\n30 %\n29 %\nAPAC\n17 %\n16 %\n17 %\n16 %\nOther Americas\n6 %\n6 %\n6 %\n6 %\nHedging gains (losses)\n0 %\n0 %\n0 %\n0 %\nFor additional information, see Note 2 of the Notes to Consolidated Financial Statements\nincluded in Item ",
        "ing table presents revenues by geography as a percentage of revenues,\ndetermined based on the addresses of our customers:\nThree Months Ended\nSix Months Ended\n \nJune 30,\nJune 30,\n \n2024\n2025\n2024\n2025\nUnited States\n49 %\n48 %\n48 %\n48 %\nEMEA\n29 %\n29 %\n29 %\n29 %\nAPAC\n16 %\n17 %\n17 %\n17 %\nOther Americas\n6 %\n6 %\n6 %\n6 %\nHedging gains (losses)\n0 %\n0 %\n0 %\n0 %\nFor additional information, see Note 2 of the Notes to Consolidated Financial Statements\nincluded in Item 1 of this Quarterly Report on Form 10-Q.",
        " \n84 \nTotal revenues\n$\n68,011  $\n69,787 \nThe following table presents revenues disaggregated by geography, based on the\naddresses of our customers (in millions):\n \nThree Months Ended\nMarch 31,\n \n2022\n2023\nUnited States\n$\n31,733 \n47 % $\n32,864 \n47 %\nEMEA\n20,317 \n30 \n21,078 \n30 \nAPAC\n11,841 \n17 \n11,681 \n17 \nOther Americas\n3,842 \n6 \n4,080 \n6 \nHedging gains (losses)\n278 \n0 \n84 \n0 \nTotal revenues\n$\n68,011 \n100 % $\n69,787 \n100 %\n    Regions represent Europe, the Middle East, and Africa (EMEA); Asia-Pa",
        "Geography\nThe following table presents our revenues by geography as a percentage of\nrevenues, determined based on the addresses of our customers:\nThree Months Ended\nSix Months Ended\n \nJune 30,\nJune 30,\n \n2020\n2021\n2020\n2021\nUnited States\n47 %\n46 %\n47 %\n45 %\nEMEA\n30 %\n31 %\n30 %\n31 %\nAPAC\n18 %\n18 %\n18 %\n19 %\nOther Americas\n5 %\n5 %\n5 %\n5 %\nFor further details on revenues by geography, see Note 2 of the Notes to\nConsolidated Financial Statements included in Part I, Item 1 of this Quarterly Report on",
        "affected by customer usage, market dynamics, as\nwell as new product and service launches.\nRevenues by Geography\nThe following table presents our revenues by geography as a percentage of revenues, determined based on the\naddresses of our customers:\n \nYear Ended December 31,\n \n2019\n2020\nUnited States\n46 %\n47 %\nEMEA\n31 %\n30 %\nAPAC\n17 %\n18 %\nOther Americas\n6 %\n5 %\nFor further details on revenues by geography, see Note 2 of the Notes to Consolidated Financial Statements\nincluded in Part II, Item 8 of"
      ],
      "retrieved_docs": 5,
      "top_scores": [
        0.7339742183685303,
        0.6920154690742493,
        0.6878490447998047
      ],
      "sources": [
        "goog-20240930.pdf",
        "goog-20250630.pdf",
        "goog-20230331.pdf",
        "goog-20210630.pdf",
        "goog-20201231.pdf"
      ],
      "execution_time": 0.008865594863891602,
      "embedding_dim": 384,
      "category": "technical",
      "query_id": 31,
      "difficulty": "medium"
    },
    {
      "question": "Identify the note in the financial statements that explains the company’s revenue recognition policy and summarize it.",
      "answer": "reafter. However, the amount and timing of revenue recognition is largely driven by when the\ncustomer utilizes the services and our ability to deliver in accordance with relevant contract terms, which could impact\nour estimate of the remaining performance obligations and when we expect to recognize such as revenues.\n(1)\n(1)\n(1)\n(1)\n66\nTable of Contents\nAlphabet Inc.\nNote 3. Financial Instruments\nDebt Securities\nWe classify our marketable debt securities, which are accounted for as available-for-\n\nNotes to Consolidated Financial Statements included in Part II, Item 8 of this Annual Report on Form\n10-K for a summary of significant accounting policies and the effect on our financial statements.\nRevenues\nFor the sale of third-party goods and services, we evaluate whether we are the principal, and report revenues on a\ngross basis, or an agent, and report revenues on a net basis. In this assessment, we consider if we obtain control of the\nspecified goods or services before they are transferred\n\nocuments as part of this Annual Report on Form 10-K:\n1. Consolidated Financial Statements\nReports of Independent Registered Public Accounting Firm\n48\nFinancial Statements:\nConsolidated Balance Sheets\n51\nConsolidated Statements of Income\n52\nConsolidated Statements of Comprehensive Income\n53\nConsolidated Statements of Stockholders’ Equity\n54\nConsolidated Statements of Cash Flows\n55\nNotes to Consolidated Financial Statements\n56\n2. Financial Statement Schedules\nSchedule II: Valuation and Qualifying ",
      "contexts": [
        "reafter. However, the amount and timing of revenue recognition is largely driven by when the\ncustomer utilizes the services and our ability to deliver in accordance with relevant contract terms, which could impact\nour estimate of the remaining performance obligations and when we expect to recognize such as revenues.\n(1)\n(1)\n(1)\n(1)\n66\nTable of Contents\nAlphabet Inc.\nNote 3. Financial Instruments\nDebt Securities\nWe classify our marketable debt securities, which are accounted for as available-for-",
        "Notes to Consolidated Financial Statements included in Part II, Item 8 of this Annual Report on Form\n10-K for a summary of significant accounting policies and the effect on our financial statements.\nRevenues\nFor the sale of third-party goods and services, we evaluate whether we are the principal, and report revenues on a\ngross basis, or an agent, and report revenues on a net basis. In this assessment, we consider if we obtain control of the\nspecified goods or services before they are transferred",
        "ocuments as part of this Annual Report on Form 10-K:\n1. Consolidated Financial Statements\nReports of Independent Registered Public Accounting Firm\n48\nFinancial Statements:\nConsolidated Balance Sheets\n51\nConsolidated Statements of Income\n52\nConsolidated Statements of Comprehensive Income\n53\nConsolidated Statements of Stockholders’ Equity\n54\nConsolidated Statements of Cash Flows\n55\nNotes to Consolidated Financial Statements\n56\n2. Financial Statement Schedules\nSchedule II: Valuation and Qualifying ",
        " of Cash Flows\n54\nNotes to Consolidated Financial Statements\n55\nThe supplementary financial information required by this Item 8 is included in Item 7 under the caption “Quarterly\nResults of Operations.”\n46\nTable of Contents\nAlphabet Inc.\nREPORT OF ERNST & YOUNG LLP, INDEPENDENT REGISTERED PUBLIC ACCOUNTING FIRM\nTo the Stockholders and the Board of Directors of Alphabet Inc.\nOpinion on the Financial Statements\nWe have audited the accompanying consolidated balance sheets of Alphabet Inc. (the Comp",
        "tors.\nPlease see Notes to Consolidated Financial Statements included in Part II, Item 8 of this Annual Report on Form\n10-K for a summary of significant accounting policies and the effect on our financial statements.\n(4)\n(5)\n45\nTable of Contents\nAlphabet Inc.\nRevenues\nFor the sale of third-party goods and services, we evaluate whether we are the principal, and report revenues on\na gross basis, or an agent, and report revenues on a net basis. In this assessment, we consider if we obtain control of"
      ],
      "retrieved_docs": 5,
      "top_scores": [
        0.6272314190864563,
        0.6102664470672607,
        0.6051459312438965
      ],
      "sources": [
        "goog-20201231.pdf",
        "Document.pdf",
        "goog-20231231.pdf",
        "Document.pdf",
        "goog-20201231.pdf"
      ],
      "execution_time": 0.010952949523925781,
      "embedding_dim": 384,
      "category": "technical",
      "query_id": 32,
      "difficulty": "hard"
    },
    {
      "question": "Which accounting standards (e.g., IFRS, US GAAP) does the company use, and are there any significant recent changes mentioned?",
      "answer": "ear ended December 31, 2020 filed with\nthe SEC.\nUse of Estimates\nPreparation of consolidated financial statements in conformity with GAAP requires us\nto make estimates and assumptions that affect the amounts reported and disclosed in the\nfinancial statements and the accompanying notes. Actual results could differ materially\nfrom these estimates. On an ongoing basis, we evaluate our estimates, including those\nrelated to the allowance for credit losses, fair values of financial instruments, intang\n\nnd the related notes included in our Annual Report\non Form 10-K for the fiscal year ended December 31, 2019 filed with the SEC.\nUse of Estimates\nPreparation of consolidated financial statements in conformity with GAAP requires us to\nmake estimates and assumptions that affect the amounts reported and disclosed in the\nfinancial statements and the accompanying notes. Actual results could differ materially from\nthese estimates. On an ongoing basis, we evaluate our estimates, including those related \n\ndated financial statements in conformity with GAAP requires us to make estimates and\nassumptions that affect the amounts reported and disclosed in the financial statements and the accompanying notes.\nActual results could differ materially from these estimates due to uncertainties, including the effects of COVID-19. On\nan ongoing basis, we evaluate our estimates, including those related to the allowance for credit losses; fair values of\nfinancial instruments, intangible assets, and goodwill; usef",
      "contexts": [
        "ear ended December 31, 2020 filed with\nthe SEC.\nUse of Estimates\nPreparation of consolidated financial statements in conformity with GAAP requires us\nto make estimates and assumptions that affect the amounts reported and disclosed in the\nfinancial statements and the accompanying notes. Actual results could differ materially\nfrom these estimates. On an ongoing basis, we evaluate our estimates, including those\nrelated to the allowance for credit losses, fair values of financial instruments, intang",
        "nd the related notes included in our Annual Report\non Form 10-K for the fiscal year ended December 31, 2019 filed with the SEC.\nUse of Estimates\nPreparation of consolidated financial statements in conformity with GAAP requires us to\nmake estimates and assumptions that affect the amounts reported and disclosed in the\nfinancial statements and the accompanying notes. Actual results could differ materially from\nthese estimates. On an ongoing basis, we evaluate our estimates, including those related ",
        "dated financial statements in conformity with GAAP requires us to make estimates and\nassumptions that affect the amounts reported and disclosed in the financial statements and the accompanying notes.\nActual results could differ materially from these estimates due to uncertainties, including the effects of COVID-19. On\nan ongoing basis, we evaluate our estimates, including those related to the allowance for credit losses; fair values of\nfinancial instruments, intangible assets, and goodwill; usef",
        "een eliminated.\nUse of Estimates\nPreparation of consolidated financial statements in conformity with GAAP requires us to make estimates and\nassumptions that affect the amounts reported and disclosed in the financial statements and the accompanying notes.\nActual results could differ materially from these estimates due to uncertainties. On an ongoing basis, we evaluate our\nestimates, including those related to the allowance for credit losses; content licenses; contingent liabilities; fair values o",
        "and\noperational decision-making and as a means to evaluate period-to-period comparisons. We believe the presentation of\nresults on a constant currency basis in addition to U.S. Generally Accepted Accounting Principles (GAAP) results helps\nimprove\n32\nTable of Contents\nAlphabet Inc.\nthe ability to understand our performance because they exclude the effects of foreign currency volatility that are not\nindicative of our core operating results.\nConstant currency information compares results between pe"
      ],
      "retrieved_docs": 5,
      "top_scores": [
        0.6155616044998169,
        0.606751561164856,
        0.5820446610450745
      ],
      "sources": [
        "goog-20210930.pdf",
        "goog-20200331.pdf",
        "goog-20211231.pdf",
        "goog-20231231.pdf",
        "Document.pdf"
      ],
      "execution_time": 0.01676797866821289,
      "embedding_dim": 384,
      "category": "technical",
      "query_id": 33,
      "difficulty": "medium"
    },
    {
      "question": "Find and summarize any sensitivity analysis related to interest rates, foreign exchange, or other market risks.",
      "answer": "ancial Statements included in Item 8 of this Annual Report on Form 10-K.\n44.\nTable of Contents\nAlphabet Inc.\nITEM 7A.\nQUANTITATIVE AND QUALITATIVE DISCLOSURES ABOUT MARKET RISK\nWe are exposed to financial market risks, including changes in foreign currency exchange rates, interest rates,\nand equity investment risks.\nForeign Currency Exchange Risk\nWe transact business globally in multiple currencies. International revenues, as well as costs and expenses\ndenominated in foreign currencies, expose u\n\nom the\nsensitivity analyses performed as of December  31, 2018 and 2019 due to the inherent limitations associated with\npredicting the timing and amount of changes in interest rates and our actual exposures and positions. VaR analysis is\nnot intended to represent actual losses but is used as a risk estimation.\n44\nTable of Contents\nAlphabet Inc.\nEquity Investment Risk\nOur marketable and non-marketable equity securities are subject to a wide variety of market-related risks that\ncould substantially\n\ne amount recorded, and such amounts could be material.\nITEM 7A.\nQUANTITATIVE AND QUALITATIVE DISCLOSURES ABOUT MARKET RISK\nWe are exposed to financial market risks, including changes in foreign currency exchange rates, interest rates,\nand equity investment risks.\nForeign Currency Exchange Risk\nWe transact business globally in multiple currencies. International revenues, as well as costs and expenses\ndenominated in foreign currencies, expose us to the risk of fluctuations in foreign currency exch",
      "contexts": [
        "ancial Statements included in Item 8 of this Annual Report on Form 10-K.\n44.\nTable of Contents\nAlphabet Inc.\nITEM 7A.\nQUANTITATIVE AND QUALITATIVE DISCLOSURES ABOUT MARKET RISK\nWe are exposed to financial market risks, including changes in foreign currency exchange rates, interest rates,\nand equity investment risks.\nForeign Currency Exchange Risk\nWe transact business globally in multiple currencies. International revenues, as well as costs and expenses\ndenominated in foreign currencies, expose u",
        "om the\nsensitivity analyses performed as of December  31, 2018 and 2019 due to the inherent limitations associated with\npredicting the timing and amount of changes in interest rates and our actual exposures and positions. VaR analysis is\nnot intended to represent actual losses but is used as a risk estimation.\n44\nTable of Contents\nAlphabet Inc.\nEquity Investment Risk\nOur marketable and non-marketable equity securities are subject to a wide variety of market-related risks that\ncould substantially",
        "e amount recorded, and such amounts could be material.\nITEM 7A.\nQUANTITATIVE AND QUALITATIVE DISCLOSURES ABOUT MARKET RISK\nWe are exposed to financial market risks, including changes in foreign currency exchange rates, interest rates,\nand equity investment risks.\nForeign Currency Exchange Risk\nWe transact business globally in multiple currencies. International revenues, as well as costs and expenses\ndenominated in foreign currencies, expose us to the risk of fluctuations in foreign currency exch",
        "lating to our ongoing business\noperations. The primary risk managed is foreign exchange risk. We use foreign currency\ncontracts to reduce the risk that our cash flows, earnings, and investment in foreign\nsubsidiaries will be adversely affected by foreign currency exchange rate fluctuations. We also\nenter into derivative instruments to partially offset our exposure to other risks and enhance\ninvestment returns.\nWe recognize derivative instruments in the Consolidated Balance Sheets at fair value\na",
        "quire\njudgment and the use of estimates, including discount rates, investee revenues and costs, and comparable market data\nof private and public companies, among others. When our assessment indicates that an impairment exists, we\nmeasure our non-marketable securities at fair value.\nITEM 7A.\nQUANTITATIVE AND QUALITATIVE DISCLOSURES ABOUT MARKET RISK\nWe are exposed to financial market risks, including changes in foreign currency exchange rates, interest rates,\nand equity investment risks.\nForeign "
      ],
      "retrieved_docs": 5,
      "top_scores": [
        0.6504826545715332,
        0.6474766731262207,
        0.6300241947174072
      ],
      "sources": [
        "goog-20231231.pdf",
        "Document.pdf",
        "goog-20241231.pdf",
        "goog-20250630.pdf",
        "Document.pdf"
      ],
      "execution_time": 0.011204242706298828,
      "embedding_dim": 384,
      "category": "technical",
      "query_id": 34,
      "difficulty": "hard"
    },
    {
      "question": "Does the report include non-GAAP financial measures, and how does the company reconcile them to GAAP/IFRS figures?",
      "answer": "ear ended December 31, 2020 filed with\nthe SEC.\nUse of Estimates\nPreparation of consolidated financial statements in conformity with GAAP requires us\nto make estimates and assumptions that affect the amounts reported and disclosed in the\nfinancial statements and the accompanying notes. Actual results could differ materially\nfrom these estimates. On an ongoing basis, we evaluate our estimates, including those\nrelated to the allowance for credit losses, fair values of financial instruments, intang\n\nnd the related notes included in our Annual Report\non Form 10-K for the fiscal year ended December 31, 2019 filed with the SEC.\nUse of Estimates\nPreparation of consolidated financial statements in conformity with GAAP requires us to\nmake estimates and assumptions that affect the amounts reported and disclosed in the\nfinancial statements and the accompanying notes. Actual results could differ materially from\nthese estimates. On an ongoing basis, we evaluate our estimates, including those related \n\ndated financial statements in conformity with GAAP requires us to make estimates and\nassumptions that affect the amounts reported and disclosed in the financial statements and the accompanying notes.\nActual results could differ materially from these estimates due to uncertainties, including the effects of COVID-19. On\nan ongoing basis, we evaluate our estimates, including those related to the allowance for credit losses; fair values of\nfinancial instruments, intangible assets, and goodwill; usef",
      "contexts": [
        "ear ended December 31, 2020 filed with\nthe SEC.\nUse of Estimates\nPreparation of consolidated financial statements in conformity with GAAP requires us\nto make estimates and assumptions that affect the amounts reported and disclosed in the\nfinancial statements and the accompanying notes. Actual results could differ materially\nfrom these estimates. On an ongoing basis, we evaluate our estimates, including those\nrelated to the allowance for credit losses, fair values of financial instruments, intang",
        "nd the related notes included in our Annual Report\non Form 10-K for the fiscal year ended December 31, 2019 filed with the SEC.\nUse of Estimates\nPreparation of consolidated financial statements in conformity with GAAP requires us to\nmake estimates and assumptions that affect the amounts reported and disclosed in the\nfinancial statements and the accompanying notes. Actual results could differ materially from\nthese estimates. On an ongoing basis, we evaluate our estimates, including those related ",
        "dated financial statements in conformity with GAAP requires us to make estimates and\nassumptions that affect the amounts reported and disclosed in the financial statements and the accompanying notes.\nActual results could differ materially from these estimates due to uncertainties, including the effects of COVID-19. On\nan ongoing basis, we evaluate our estimates, including those related to the allowance for credit losses; fair values of\nfinancial instruments, intangible assets, and goodwill; usef",
        "een eliminated.\nUse of Estimates\nPreparation of consolidated financial statements in conformity with GAAP requires us to make estimates and\nassumptions that affect the amounts reported and disclosed in the financial statements and the accompanying notes.\nActual results could differ materially from these estimates due to uncertainties. On an ongoing basis, we evaluate our\nestimates, including those related to the allowance for credit losses; content licenses; contingent liabilities; fair values o",
        "e read in conjunction\nwith the consolidated financial statements and the related notes included in our Annual Report\non Form 10-K for the fiscal year ended December 31, 2019 filed with the SEC.\nUse of Estimates\nPreparation of consolidated financial statements in conformity with GAAP requires us to\nmake estimates and assumptions that affect the amounts reported and disclosed in the\nfinancial statements and the accompanying notes. Actual results could differ materially from\nthese estimates. On an "
      ],
      "retrieved_docs": 5,
      "top_scores": [
        0.7095426321029663,
        0.6858831644058228,
        0.6800870895385742
      ],
      "sources": [
        "goog-20210930.pdf",
        "goog-20200331.pdf",
        "goog-20211231.pdf",
        "goog-20231231.pdf",
        "goog-20200630.pdf"
      ],
      "execution_time": 0.011173009872436523,
      "embedding_dim": 384,
      "category": "technical",
      "query_id": 35,
      "difficulty": "hard"
    }
  ],
  "metrics": {
    "average_execution_time": 0.04144567847251892,
    "average_top_score": 0.652219557762146,
    "total_queries": 40,
    "indexing_time": 50.03207588195801
  }
}