{
  "system_name": "FAISS RAG",
  "total_chunks": 16228,
  "chunk_size": 500,
  "chunk_overlap": 50,
  "embedding_model": "sentence-transformers/all-MiniLM-L6-v2",
  "embedding_dim": 384,
  "llm_model": "openai (gpt-4o-mini)",
  "queries": [
    {
      "question": "What are the main business segments of the company according to the latest annual report?",
      "answer": "According to the latest annual report, the main business segments of the company are Google Services, Google Cloud, and Other Bets (which includes all non-Google businesses).",
      "contexts": [
        " largest of which is Google. We report Google in two segments,\nGoogle Services and Google Cloud; we also report all non-Google businesses collectively as Other Bets. For additional\ninformation on our segments, see Part I, Item 1 Business and Note 15 of the Notes to Consolidated Financial\nStatements included in Item 8 of this Annual Report on Form 10-K.\nTrends in Our Business and Financial Effect\nThe following long-term trends have contributed to the results of our consolidated operations, and we",
        "of this Quarterly Report on Form\n10-Q as well as our Annual Report on Form 10-K for the fiscal year ended December  31,\n2024, including Part I, Item 1A \"Risk Factors.\"\nUnderstanding Alphabet’s Financial Results\nAlphabet is a collection of businesses — the largest of which is Google. We report\nGoogle in two segments, Google Services and Google Cloud; we also report all non-Google\nbusinesses collectively as Other Bets. For further details on our segments, see Note 15 of the\nNotes to Consolidated F",
        "redundant to the discussion previously included in\nItem 7 of our 2021 Annual Report on Form 10-K.\nUnderstanding Alphabet’s Financial Results\nAlphabet is a collection of businesses — the largest of which is Google. We report Google in two segments,\nGoogle Services and Google Cloud; we also report all non-Google businesses collectively as Other Bets. For further\ndetails on our segments, see Part I, Item 1 “Business” and Note 15 of the Notes to Consolidated Financial Statements\nincluded in Item 8 o",
        " be completed later this year.\n33\nTable of Contents\nAlphabet In\nITEM 2.\nMANAGEMENT’S DISCUSSION AND ANALYSIS OF FINANCIAL\nCONDITION AND RESULTS OF OPERATIONS\nPlease read the following discussion and analysis of our financial condition and results of\noperations together with our consolidated financial statements and related notes included\nunder Part I, Item 1 of this Quarterly Report on Form 10-Q.\nExecutive Overview of Results\nBelow are our key financial results for the three months ended June 30",
        "ddition to a combination of factors, none of which were\nindividually significant.\nSegment Profitability\nWe report our segment results as Google Services, Google Cloud, and Other Bets. Additionally, certain costs are\nnot allocated to our segments because they represent Alphabet-level activities. For further details on our segments, see\nPart I, Item 1 Business and Note 15 of the Notes to Consolidated Financial Statements included in Item 8 of this Annual\nReport on Form 10-K.\nThe following table pr"
      ],
      "retrieved_docs": 5,
      "top_scores": [
        0.6132380962371826,
        0.6081774234771729,
        0.6047688126564026
      ],
      "sources": [
        "goog-20231231.pdf",
        "goog-20250930.pdf",
        "goog-20221231.pdf",
        "goog-20200630.pdf",
        "goog-20241231.pdf"
      ],
      "execution_time": 1.920116901397705,
      "embedding_dim": 384,
      "category": "company_overview",
      "query_id": 1,
      "difficulty": "easy"
    },
    {
      "question": "What is the company's primary business and how does it generate revenue?",
      "answer": "The company's primary business involves early-stage ventures referred to as \"Other Bets,\" which operate as independent companies. Revenue is primarily generated from internet and TV services, as well as licensing, R&D services, and the sale of health technology.",
      "contexts": [
        "r them to become thriving, successful businesses in the medium to long term.\nWhile these early-stage businesses naturally come with considerable uncertainty, some of them are already generating\nrevenue and making important strides in their industries. Revenues are primarily generated from internet and TV\nservices, as well as licensing and R&D services.\nOther Bets operate as independent companies and some of them have their own boards with independent\nmembers and outside investors. We are investi",
        "nt phase to those that are in the beginning stages of\ncommercialization, and our goal is for them to become thriving, successful businesses in the medium to long term.\nWhile these early-stage businesses naturally come with considerable uncertainty, some of them are already generating\nrevenue and making important strides in their industries. Revenues are primarily generated from internet and TV\nservices, as well as licensing and R&D services.\nOther Bets operate as independent companies and some o",
        "e to those that are in the beginning stages of commercialization, and our goal is for\nthem to become thriving, successful businesses in the medium to long term. While these early-stage businesses\nnaturally come with considerable uncertainty, some of them are already generating revenue and making important\nstrides in their industries. Revenues from Other Bets are generated primarily from the sale of health technology and\ninternet services.\nOther Bets operate as independent companies and some of t",
        " not\nindividually material. Revenues from Other Bets are generated primarily from the\nsale of health technology and internet services.\nRevenues, certain costs, such as costs associated with content and traffic acquisition,\ncertain engineering activities, and hardware, as well as certain operating expenses are\ndirectly attributable to our segments. Due to the integrated nature of Alphabet, other costs\nand expenses, such as technical infrastructure and office facilities, are managed centrally\nat a",
        " revenues by delivering relevant, cost-effective online advertising; cloud-based solutions that provide\nenterprise customers of all sizes with infrastructure and platform services as well as communication and collaboration\ntools; sales of other products and services, such as apps and in-app purchases, and devices; and fees received for\nconsumer subscription-based products. For additional information on how we recognize revenue, see Note 1 of the\nNotes to Consolidated Financial Statements include"
      ],
      "retrieved_docs": 5,
      "top_scores": [
        0.5980791449546814,
        0.5739185810089111,
        0.5699866414070129
      ],
      "sources": [
        "Document.pdf",
        "goog-20201231.pdf",
        "goog-20211231.pdf",
        "goog-20220630.pdf",
        "goog-20231231.pdf"
      ],
      "execution_time": 1.4086227416992188,
      "embedding_dim": 384,
      "category": "company_overview",
      "query_id": 2,
      "difficulty": "easy"
    },
    {
      "question": "Summarize the company's core products and services described in the annual report.",
      "answer": "The company's core products and services include infrastructure and platform services, communication and collaboration tools, and various sales of products and services. This encompasses fees from subscription-based products, apps, in-app purchases, and devices.",
      "contexts": [
        "h infrastructure and platform\nservices as well as communication and collaboration tools; sales of other products and\nservices, such as fees received for subscription-based products, apps and in-app purchases,\nand devices. For additional information on how we recognize revenue, see Note 1 of the Notes\nto Consolidated Financial Statements included in Part II, Item 8 in our Annual Report on Form\n10-K for the fiscal year ended December 31, 2023.\nIn addition to the long-term trends and their financia",
        "platform\nservices, and applications; sales of other products and services, such as fees received for\nsubscription-based products, apps and in-app purchases, and devices. For additional\ninformation on how we recognize revenue, see Note 1 of the Notes to Consolidated Financial\nStatements included in Part II, Item 8 in our Annual Report on Form 10-K for the fiscal year\nended December 31, 2024.\nIn addition to the long-term trends and their financial effect on our business discussed in\n\"Trends in Our",
        ", platform\nservices, and applications; sales of other products and services, such as fees received for\nsubscription-based products, apps and in-app purchases, and devices. For additional\ninformation on how we recognize revenue, see Note 1 of the Notes to Consolidated Financial\nStatements included in Part II, Item 8 in our Annual Report on Form 10-K for the fiscal year\nended December 31, 2024.\nIn addition to the long-term trends and their financial effect on our business discussed in\n\"Trends in O",
        " products and\nservices, such as apps and in-app purchases, and hardware; and fees received for\nsubscription-based products. For details on how we recognize revenue, see Note 1 of the Notes\nto Consolidated Financial Statements included in Part II, Item 8 in our Annual Report on Form\n10-K for the fiscal year ended December 31, 2022.\nIn addition to the long-term trends and their financial effect on our business noted in\n\"Trends in Our Business and Financial Effect\" in Part II, Item 7 of our Annual ",
        " be completed later this year.\n33\nTable of Contents\nAlphabet In\nITEM 2.\nMANAGEMENT’S DISCUSSION AND ANALYSIS OF FINANCIAL\nCONDITION AND RESULTS OF OPERATIONS\nPlease read the following discussion and analysis of our financial condition and results of\noperations together with our consolidated financial statements and related notes included\nunder Part I, Item 1 of this Quarterly Report on Form 10-Q.\nExecutive Overview of Results\nBelow are our key financial results for the three months ended June 30"
      ],
      "retrieved_docs": 5,
      "top_scores": [
        0.5345152020454407,
        0.5191125869750977,
        0.5174891352653503
      ],
      "sources": [
        "goog-20240930.pdf",
        "goog-20250630.pdf",
        "goog-20250331.pdf",
        "goog-20230331.pdf",
        "goog-20200630.pdf"
      ],
      "execution_time": 1.462339162826538,
      "embedding_dim": 384,
      "category": "company_overview",
      "query_id": 3,
      "difficulty": "medium"
    },
    {
      "question": "How does the company describe its overall business model and value proposition?",
      "answer": "The company describes its overall business model and value proposition as being centered around fostering a strong corporate culture that promotes innovation, creativity, and teamwork. This culture is deemed essential for maintaining effective business operations, especially as the organization grows and implements complex management structures. \n\nThe company emphasizes its commitment to creating stockholder value, supported by a stable capital structure that allows for a focus on long-term opportunities rather than succumbing to short-term pressures. By adopting a multi-class structure, the management can take calculated risks to maximize long-term returns. \n\nAdditionally, the company highlights the importance of maintaining equity in its brands and being a technology leader, which is crucial for the success of its high-quality, innovative products and services. Overall, the value proposition is built on delivering useful and valuable solutions while ensuring a strong and supportive internal environment for employees.",
      "contexts": [
        "ain and motivate our\nexisting employees.\nIn addition, we believe that our corporate culture fosters innovation, creativity, and teamwork. As our organization\ngrows, and we are required to implement more complex organizational management structures, particularly in light of\nour holding company structure, adverse changes to our corporate culture could harm our business operations.\nIn preparing our financial statements, we incorporate valuation methodologies that are subjective in\nnature and valuat",
        " strong\ncompany and creating stockholder value. This value creation is supported by the stability provided by our capital structure, which insulates us from short-\nterm pressures and gives us greater ability to focus on long-term opportunities. A multi-class structure allows our management to take calculated risks in\nfurtherance of maximizing long-term returns, and the strategic decisions made over the years by Alphabet’s management has enabled it to become one\nof the most successful companies i",
        " by the use of our\nproducts or services to disseminate information that is deemed to be false or misleading.\nFurthermore, failure to maintain and enhance equity in our brands may harm our\nbusiness, financial condition, and operating results. Our success will depend largely on our\nability to remain a technology leader and continue to provide high-quality, innovative products\nand services that are truly useful and play a valuable role in a range of settings.\nWe face a number of manufacturing and s",
        "corporate culture and work environments\nto ever-changing circumstances, such as during times of a natural disaster or pandemic\n(including COVID-19), and these changes could impact our ability to compete effectively or\nhave an adverse impact on our corporate culture.\nIn preparing our financial statements, we incorporate valuation methodologies\nthat are subjective in nature and valuations may fluctuate over time.\nWe measure certain of our non-marketable equity and debt investments, certain other\ni",
        "lex\norganizational management structures or adapt our corporate culture and work environments\nto ever-changing circumstances, such as during times of a natural disaster or pandemic\n(including COVID-19), and these changes could impact our ability to compete effectively or\nhave an adverse impact on our corporate culture.\nIn preparing our financial statements, we incorporate valuation methodologies\nthat are subjective in nature and valuations may fluctuate over time.\nWe measure certain of our non-m"
      ],
      "retrieved_docs": 5,
      "top_scores": [
        0.5757277011871338,
        0.5123777389526367,
        0.4960891008377075
      ],
      "sources": [
        "Document.pdf",
        "ALPHABET INC. - DEF14A.pdf",
        "goog-20200930.pdf",
        "goog-20200930.pdf",
        "goog-20200630.pdf"
      ],
      "execution_time": 4.767637014389038,
      "embedding_dim": 384,
      "category": "company_overview",
      "query_id": 4,
      "difficulty": "hard"
    },
    {
      "question": "What are the company's main geographic markets and regions of operation?",
      "answer": "The company's main geographic markets and regions of operation are primarily in North America, Europe, South America, and Asia.",
      "contexts": [
        "surrounding areas near our headquarters. In addition, we own and lease office/building space and R&D sites around\nthe world, primarily in North America, Europe, South America, and Asia. We own and operate data centers in the U.S.,\nEurope, South America, and Asia. We believe our existing facilities, both owned and leased, are in good condition and\nsuitable for the conduct of our business.\nITEM 3.\nLEGAL PROCEEDINGS\nFor a description of our material pending legal proceedings, see Legal Matters in N",
        " our headquarters, which we believe is sufficient to accommodate anticipated future growth. In\naddition, we own and lease office/building space and research and development sites around the world, primarily in\nNorth America, Europe, South America, and Asia. We own and operate data centers in the U.S., Europe, South\nAmerica, and Asia. We believe our existing facilities, both owned and leased, are in good condition and suitable for the\nconduct of our business.\nITEM 3.\nLEGAL PROCEEDINGS\nFor a descr",
        "ing performance of those companies.\nThese broad market and industry factors may harm the market price of our Class A common stock and our Class\nC capital stock, regardless of our actual operating performance.\nITEM 1B.\nUNRESOLVED STAFF COMMENTS\nNot applicable.\n24\nTable of Contents\nAlphabet Inc.\nITEM 2.\nPROPERTIES\nOur headquarters are located in Mountain View, California. We also own and lease office and building space in the\nsurrounding areas near our headquarters, which we believe is sufficient ",
        "laws\nand regulations may require us to make new capital investments, build new products, and seek partners to deliver\nlocalized services in other countries, and we may not be able to meet sovereign operating requirements.\nWithin Other Bets, we are investing significantly in the areas of health, life sciences, and transportation, among\nothers. These investment areas face intense competition from large, experienced, and well-funded competitors, and\nour offerings, many of which involve the developm",
        "nation of multiple operating segments that are not individually\nmaterial. Revenues from Other Bets are generated primarily from the sale of health\ntechnology and internet services.\nRevenues, certain costs, such as costs associated with content and traffic acquisition,\ncertain engineering activities, and hardware, as well as certain operating expenses are directly\nattributable to our segments. Due to the integrated nature of Alphabet, other costs and\nexpenses, such as technical infrastructure and"
      ],
      "retrieved_docs": 5,
      "top_scores": [
        0.567379355430603,
        0.5441010594367981,
        0.5376152992248535
      ],
      "sources": [
        "goog-20211231.pdf",
        "goog-20201231.pdf",
        "goog-20201231.pdf",
        "goog-20221231.pdf",
        "goog-20230630.pdf"
      ],
      "execution_time": 1.2167730331420898,
      "embedding_dim": 384,
      "category": "company_overview",
      "query_id": 5,
      "difficulty": "medium"
    },
    {
      "question": "What is the company's mission statement and corporate values?",
      "answer": "The provided context does not explicitly state the company's mission statement or corporate values. However, it does suggest that the company values innovation, creativity, teamwork, and a strong corporate culture that motivates employees. The emphasis on adapting to changing circumstances and the potential impacts on competitiveness and culture indicates a commitment to resilience and flexibility in operations. For specific details on the mission statement and corporate values, you would need to refer to the company's official documentation or website.",
      "contexts": [
        "ain and motivate our\nexisting employees.\nIn addition, we believe that our corporate culture fosters innovation, creativity, and teamwork. As our organization\ngrows, and we are required to implement more complex organizational management structures, particularly in light of\nour holding company structure, adverse changes to our corporate culture could harm our business operations.\nIn preparing our financial statements, we incorporate valuation methodologies that are subjective in\nnature and valuat",
        "lex\norganizational management structures or adapt our corporate culture and work environments\nto ever-changing circumstances, such as during times of a natural disaster or pandemic\n(including COVID-19), and these changes could impact our ability to compete effectively or\nhave an adverse impact on our corporate culture.\nIn preparing our financial statements, we incorporate valuation methodologies\nthat are subjective in nature and valuations may fluctuate over time.\nWe measure certain of our non-m",
        "structures or adapt our corporate culture and work environments\nto ever-changing circumstances, such as during times of a natural disaster or pandemic\n(including COVID-19), and these changes could impact our ability to compete effectively or\nhave an adverse impact on our corporate culture.\nIn preparing our financial statements, we incorporate valuation methodologies\nthat are subjective in nature and valuations may fluctuate over time.\nWe measure certain of our non-marketable equity and debt inve",
        "corporate culture and work environments\nto ever-changing circumstances, such as during times of a natural disaster or pandemic\n(including COVID-19), and these changes could impact our ability to compete effectively or\nhave an adverse impact on our corporate culture.\nIn preparing our financial statements, we incorporate valuation methodologies\nthat are subjective in nature and valuations may fluctuate over time.\nWe measure certain of our non-marketable equity and debt investments, certain other\ni",
        "t of other blatantly Orwellian objectives.\n \nMost Alphabet shareholders are unaware (since the Board hides it from them) that their capital is in part being used to pursue this anti-human, anti-\nfreedom agenda. Moreover, none of this is congruent with the Company’s basic purpose of providing value to shareholders by serving customers.\n \n \n \n(1)\nhttps://www.google.org/our-work/; https://www.google.org/racial-justice/; https://impactchallenge.withgoogle.com/bayarea2021/charities;\nhttps://www.googl"
      ],
      "retrieved_docs": 5,
      "top_scores": [
        0.5937612652778625,
        0.5573187470436096,
        0.53227698802948
      ],
      "sources": [
        "Document.pdf",
        "goog-20200630.pdf",
        "goog-20200331.pdf",
        "goog-20200930.pdf",
        "ALPHABET INC. - DEF 14A_2.pdf"
      ],
      "execution_time": 3.108020067214966,
      "embedding_dim": 384,
      "category": "company_overview",
      "query_id": 6,
      "difficulty": "easy"
    },
    {
      "question": "How many employees does the company have and how has headcount changed?",
      "answer": "As of December 31, 2020, the company had 135,301 employees. The headcount increased by 19% in a later period, and during the nine months ended September 30, 2022, there was a 20% increase in headcount. The specific number of employees after these increases is not provided in the context, but the increases indicate a significant growth in workforce.",
      "contexts": [
        "n by headcount growth\nand partially offset by declines in advertising and promotional expenses and travel and entertainment\nexpenses.\nOther information:\n•\nOperating cash flow was $65.1 billion.\n•\nCapital expenditures, which primarily included investments in technical infrastructure, were $22.3 billion.\n•\nNumber of employees was 135,301 as of December 31, 2020. The majority of new hires during the year were\nengineers and product managers.\nOur Segments\nBeginning in the fourth quarter of 2020, we r",
        " resulting from a 19% increase in\nheadcount.\nSales and marketing expenses increased $4.1 billion from the nine months ended\nSeptember 30, 2021 to the nine months ended September 30, 2022 primarily driven by an\nincrease in advertising and promotional activities of $1.8 billion and an increase in\ncompensation expenses of $1.7 billion, largely resulting from a 20% increase in headcount.\n42\nTable of Contents\nAlphabet Inc.\nGeneral and Administrative\nThe following table presents general and administra",
        "es associated with the reduction in our workforce and a 7% increase in\naverage headcount, after adjusting for roles affected by the reduction in workforce for the\nquarter ended March 31, 2023, partially offset by the effect of the shift in timing of our annual\nemployee stock-based compensation awards.\nGeneral and Administrative\nThe following table presents general and administrative expenses (in millions, except\npercentages):\nThree Months Ended\n \nMarch 31,\n \n2022\n2023\nGeneral and administrative ",
        "sh flow was $54.5 billion.\n•\nCapital expenditures were $23.5 billion.\n•\nNumber of employees was 118,899 as of December 31, 2019. The majority of new hires during the year were\nengineers and product managers. By product area, the largest headcount additions were in Google Cloud and\nSearch.\nInformation about Segments\nWe operate our business in multiple operating segments. Google is our only reportable segment. None of our\nother segments meet the quantitative thresholds to qualify as reportable seg",
        "9%.\n•\nNet income was $7.0 billion with diluted net income per share of $10.13.\n•\nOperating cash flow was $14.0 billion.\n•\nCapital expenditures were $5.4 billion.\n•\nNumber of employees was 127,498 as of June 30, 2020. The majority of new hires\nduring the quarter were engineers and product managers. By product area, the\nlargest headcount additions were in Google Cloud and Search.\nThe Impact of COVID-19 on our Results and Operations\nIn late 2019, an outbreak of COVID-19 emerged and by March 11, 202"
      ],
      "retrieved_docs": 5,
      "top_scores": [
        0.5892879366874695,
        0.5770299434661865,
        0.5700032711029053
      ],
      "sources": [
        "goog-20201231.pdf",
        "goog-20220930.pdf",
        "goog-20230331.pdf",
        "Document.pdf",
        "goog-20200630.pdf"
      ],
      "execution_time": 3.255139112472534,
      "embedding_dim": 384,
      "category": "company_overview",
      "query_id": 7,
      "difficulty": "medium"
    },
    {
      "question": "What are the company's main facilities and locations?",
      "answer": "The company's main facilities include its headquarters located in Mountain View, California, as well as owned and leased office and building spaces and research and development sites around the world. These locations primarily include regions in North America, Europe, South America, and Asia. Additionally, the company owns and operates data centers in the U.S., Europe, South America, and Asia.",
      "contexts": [
        " our headquarters, which we believe is sufficient to accommodate anticipated future growth. In\naddition, we own and lease office/building space and research and development sites around the world, primarily in\nNorth America, Europe, South America, and Asia. We own and operate data centers in the U.S., Europe, South\nAmerica, and Asia. We believe our existing facilities, both owned and leased, are in good condition and suitable for the\nconduct of our business.\nITEM 3.\nLEGAL PROCEEDINGS\nFor a descr",
        "surrounding areas near our headquarters. In addition, we own and lease office/building space and R&D sites around\nthe world, primarily in North America, Europe, South America, and Asia. We own and operate data centers in the U.S.,\nEurope, South America, and Asia. We believe our existing facilities, both owned and leased, are in good condition and\nsuitable for the conduct of our business.\nITEM 3.\nLEGAL PROCEEDINGS\nFor a description of our material pending legal proceedings, see Legal Matters in N",
        "ing performance of those companies.\nThese broad market and industry factors may harm the market price of our Class A common stock and our Class\nC capital stock, regardless of our actual operating performance.\nITEM 1B.\nUNRESOLVED STAFF COMMENTS\nNot applicable.\n24\nTable of Contents\nAlphabet Inc.\nITEM 2.\nPROPERTIES\nOur headquarters are located in Mountain View, California. We also own and lease office and building space in the\nsurrounding areas near our headquarters, which we believe is sufficient ",
        "nts. For more\ninformation on our cybersecurity related risks, see Item 1A Risk Factors of this Annual Report on Form 10-K.\nITEM 2.\nPROPERTIES\nOur headquarters are located in Mountain View, California. We own and lease office facilities and data centers\naround the world, primarily in Asia, Europe, and North America. We believe our existing facilities are in good condition\nand suitable for the conduct of our business.\nITEM 3.\nLEGAL PROCEEDINGS\nFor a description of our material pending legal procee",
        "urance that they will not be materially affected in the future by such risks or any future material incidents. For more\ninformation on our cybersecurity related risks, see Item 1A Risk Factors of this Annual Report on Form 10-K.\nITEM 2.\nPROPERTIES\nOur headquarters are located in Mountain View, California. We own and lease office facilities and data centers\naround the world, primarily in Asia, Europe, and North America. We believe our existing facilities are in good condition\nand suitable for the"
      ],
      "retrieved_docs": 5,
      "top_scores": [
        0.5519946217536926,
        0.5354455709457397,
        0.5188643932342529
      ],
      "sources": [
        "goog-20201231.pdf",
        "goog-20211231.pdf",
        "goog-20201231.pdf",
        "goog-20231231.pdf",
        "goog-20241231.pdf"
      ],
      "execution_time": 1.985302209854126,
      "embedding_dim": 384,
      "category": "company_overview",
      "query_id": 8,
      "difficulty": "medium"
    },
    {
      "question": "What is the company's history and how has it evolved over time?",
      "answer": "The company has a history that spans 22 years, beginning with its inception and growing significantly over that time. It has evolved by adopting a structure called Alphabet in October 2015, which was created to facilitate investment in long-term opportunities and to manage a diverse portfolio of businesses with varying timelines. This structure allows the company to set up independent subsidiaries, referred to as \"Other Bets,\" like Waymo and Verily, which can attract outside investment.\n\nThe company's success is attributed to the leadership and vision of its co-founders, who continue to influence its strategy as board members, and is currently carried on by CEO Sundar Pichai. The company has established a consistent track record of building a strong organization and generating stockholder value, supported by a stable capital structure that protects it from short-term pressures and enhances its ability to pursue long-term goals. Overall, the company has transitioned from its foundational phase to a more complex and diversified entity, emphasizing innovation and strategic investments.",
      "contexts": [
        " this company with the vision and inventiveness that made us what we are today, 22 years after it all started. I am also very excited to see where Sundar takes us going forward. The Alphabet structure allows us to have a portfolio of different businesses with different time horizons, while also allowing us to set up independent companies that can raise money from outside investors, which Other Bets like Waymo and Verily have successfully done. As our company builds technologies that improve the ",
        "ference in the world.” The creation of our holding\ncompany, Alphabet, in October 2015 to facilitate investment in long-term opportunities reinforces this view.\n \nOur success is owed in large part to the leadership and vision of our co-founders, who continue to oversee the company’s strategy as members of our\nBoard, and that is carried on today by Alphabet CEO Sundar Pichai. We have established a consistent track record for continuously building a strong\ncompany and creating stockholder value. Th",
        "d.” The implementation of our\nholding company, Alphabet, in October 2015 further reinforces this view.\n \nOur success is owed in large part to the leadership and vision originated by our co-founders and carried on today by Alphabet CEO Sundar Pichai. We\nhave established a track record of building a strong company and creating stockholder value. This value creation is supported by the stability provided by\nour capital structure, which insulates us from short-term pressures and gives us greater abi",
        "oogle was incorporated in California in September 1998 and re-incorporated in the State\nof Delaware in August 2003. In 2015, we implemented a holding company reorganization, and\nas a result, Alphabet Inc. (\"Alphabet\") became the successor issuer to Google.\nWe generate revenues by delivering relevant, cost-effective online advertising; cloud-\nbased solutions that provide enterprise customers with infrastructure and platform services as\nwell as communication and collaboration tools; sales of other",
        "n California in September 1998 and re-incorporated in the\nState of Delaware in August 2003. In 2015, we implemented a holding company\nreorganization, and as a result, Alphabet Inc. (\"Alphabet\") became the successor issuer to\nGoogle.\nWe generate revenues by delivering relevant, cost-effective online advertising; cloud-\nbased solutions that provide enterprise customers with infrastructure and platform services as\nwell as communication and collaboration tools; sales of other products and services, "
      ],
      "retrieved_docs": 5,
      "top_scores": [
        0.5925093293190002,
        0.5174371004104614,
        0.4984714388847351
      ],
      "sources": [
        "lgoog2020_def14a.pdf",
        "ALPHABET INC. - DEF14A.pdf",
        "ALPHABET INC. - DEF 14A_2.pdf",
        "goog-20230331.pdf",
        "goog-20240630.pdf"
      ],
      "execution_time": 5.414236068725586,
      "embedding_dim": 384,
      "category": "company_overview",
      "query_id": 9,
      "difficulty": "medium"
    },
    {
      "question": "What are the company's main brands, products, or service lines?",
      "answer": "The company's main brands, products, or service lines include:\n\n1. **YouTube**: This encompasses services such as YouTube Premium and YouTube TV, which are subscription-based products.\n2. **Cloud-based solutions**: This includes infrastructure and platform services, as well as collaboration tools.\n3. **Digital content products**: This refers to various forms of digital content offered to customers.\n4. **Apps and in-app purchases**: This includes applications available for download and purchases made within those apps.\n5. **Hardware**: This represents physical products that the company sells.\n\nOverall, the company focuses on providing high-quality and innovative products and services across these areas.",
      "contexts": [
        "line advertising; cloud-\nbased solutions that provide customers with infrastructure and platform services and\ncollaboration tools; sales of other products and services, such as apps and in-app\npurchases, digital content products, and hardware; and fees received for subscription-\nbased products such as YouTube Premium and YouTube TV.\nBasis of Consolidation\nThe consolidated financial statements of Alphabet include the accounts of Alphabet\nand entities consolidated under the variable interest and v",
        " by the use of our\nproducts or services to disseminate information that is deemed to be false or misleading.\nFurthermore, failure to maintain and enhance equity in our brands may harm our\nbusiness, financial condition, and operating results. Our success will depend largely on our\nability to remain a technology leader and continue to provide high-quality, innovative products\nand services that are truly useful and play a valuable role in a range of settings.\nWe face a number of manufacturing and s",
        "ractices by advertisers, or to otherwise\nadequately address user concerns, our users may lose confidence in our brands.\nFurthermore, failure to maintain and enhance equity in our brands may harm our business, financial condition, and\noperating results. Our success will depend largely on our ability to remain a technology leader and continue to provide\nhigh-quality, innovative products and services that are truly useful and play a valuable role in a range of settings.\nWe face a number of manufact",
        "products, including businesses that have\ndeveloped proprietary platforms;\n•\nproviders of digital video services;\n•\nsocial networks, which users may rely on for product or service referrals, rather than seeking information\nthrough traditional search engines;\n•\nproviders of workspace communication and connectivity products; and\n•\ndigital assistant providers.\nCompeting successfully depends heavily on our ability to develop and distribute innovative products and\ntechnologies to the marketplace acros",
        "ts\nand services that are truly useful and play a valuable role in a range of settings.\nWe face a number of manufacturing and supply chain risks that, if not properly\nmanaged, could harm our financial condition, operating results, and prospects.\nWe face a number of risks related to manufacturing and supply chain management,\nwhich could affect our ability to supply both our products and our internet-based services.\nWe rely on other companies to manufacture many of our assemblies and finished\nprodu"
      ],
      "retrieved_docs": 5,
      "top_scores": [
        0.5252683758735657,
        0.5184400677680969,
        0.4767531752586365
      ],
      "sources": [
        "goog-20220331.pdf",
        "goog-20200930.pdf",
        "goog-20201231.pdf",
        "goog-20231231.pdf",
        "goog-20200630.pdf"
      ],
      "execution_time": 5.655563116073608,
      "embedding_dim": 384,
      "category": "company_overview",
      "query_id": 10,
      "difficulty": "easy"
    },
    {
      "question": "What is the company's approach to talent acquisition and retention?",
      "answer": "The company's approach to talent acquisition and retention involves identifying, hiring, developing, motivating, and retaining highly skilled personnel across all areas of the organization. However, the company faces challenges due to intense competition in the industry for qualified employees, with some competitors actively targeting its staff. The effectiveness of their compensation arrangements, including equity award programs, may not always be sufficient to attract new talent or retain existing employees. Overall, the company's ability to compete effectively and achieve future success hinges on its capacity to manage these talent-related issues.",
      "contexts": [
        "lity to identify, hire, develop, motivate, and\nretain highly skilled personnel for all areas of our organization. Competition in our industry for\nqualified employees is intense, and certain of our competitors have directly targeted our\nemployees. In addition, our compensation arrangements, such as our equity award programs,\nmay not always be successful in attracting new employees and retaining and motivating our\nexisting employees. Our continued ability to compete effectively depends on our abil",
        " may not be able to grow effectively.\nOur performance largely depends on the talents and efforts of highly skilled individuals. Our ability to compete\neffectively and our future success depends on our continuing to identify, hire, develop, motivate, and retain highly\nskilled personnel for all areas of our organization. Competition in our industry for qualified employees is intense, and\ncertain of our competitors have directly targeted our employees. In addition, our compensation arrangements, su",
        " their\nexperience and resources in ways that could affect our competitive position, including by\nmaking acquisitions, continuing to invest heavily in research and development and in talent,\naggressively initiating intellectual property claims (whether or not meritorious), and continuing\nto compete aggressively for users, advertisers, customers, and content providers. Our\ncompetitors may be able to innovate and provide products and services faster than we can or\nmay foresee the need for products ",
        "from large and established companies to emerging start-\nups. Some competitors have longer operating histories in various sectors. They can use their\nexperience and resources in ways that could affect our competitive position, including by\nmaking acquisitions, continuing to invest heavily in research and development and in talent,\naggressively initiating intellectual property claims (whether or not meritorious), and continuing\nto compete aggressively for users, advertisers, customers, and content",
        " through acquisitions, in order to enhance\nour technology and new and existing products and services.\nWe have many competitors in different industries. Our current and potential domestic\nand international competitors range from large and established companies to emerging start-\nups. Some competitors have longer operating histories in various sectors. They can use their\nexperience and resources in ways that could affect our competitive position, including by\nmaking acquisitions, continuing to inv"
      ],
      "retrieved_docs": 5,
      "top_scores": [
        0.6043546795845032,
        0.578295111656189,
        0.5750877857208252
      ],
      "sources": [
        "goog-20200630.pdf",
        "goog-20201231.pdf",
        "goog-20200630.pdf",
        "goog-20200331.pdf",
        "goog-20200930.pdf"
      ],
      "execution_time": 2.9305410385131836,
      "embedding_dim": 384,
      "category": "company_overview",
      "query_id": 11,
      "difficulty": "medium"
    },
    {
      "question": "What is the company's approach to corporate social responsibility and community engagement?",
      "answer": "The company's approach to corporate social responsibility (CSR) and community engagement is proactive and multifaceted. They actively engage with stockholders and stakeholders throughout the year on various topics of interest, including business strategy, performance, and environmental, social, and governance (ESG) issues. This includes a focus on environmental sustainability, human capital, workforce diversity, executive compensation, and Board leadership and composition.\n\nMoreover, the company emphasizes building successful partnerships with different customers and stakeholders, aiming to create a positive impact on the communities they serve and operate in. Their leadership experience, particularly in public and private sectors, enhances their understanding of CSR, as they align their strategies with the stakeholder theory, which asserts accountability to all parts of society. Overall, their CSR approach is centered around engagement, collaboration, and a commitment to social responsibility.",
      "contexts": [
        "d developments in corporate governance.\n \n \nEngagement\n \nWe proactively engage with our stockholders and other stakeholders throughout the year on a broad range of topics that are of interest and priority to the\ncompany and our stockholders. These include business strategy and performance, and environmental, social and governance (ESG) topics such as\nenvironmental sustainability, human capital, workforce diversity, executive compensation, and Board leadership and composition.\n \nOur engagement en",
        "ven organizations, foundations, and\nstrategies for building successful partnerships with different customers\nand stakeholders, along with a nuanced perspective on ways in which\nour products, services and operations can make a positive impact on\nthe communities we serve and operate within\n \n \n \n \n \nLeadership experience, including through service in public and private company executive roles or leadership of significant academic and other\ninstitutions, provides our Board with a deep understanding",
        " as an “international organization for public-private cooperation,” and that it was “founded on the stakeholder theory,\nwhich asserts that an organization is accountable to all parts of society.”7\n \nSimilarly, CFR describes itself as a “membership organization” for both “government officials” and “business executives” on an international scale,8 and\nBR pretended to redefine “the purpose of a corporation” such that a corporation ought to cater to the special interests of “stakeholders” rather tha",
        "socially responsible projects in the following eight areas: energy efficiency, clean energy, green\nbuildings, clean transportation, circular economy and design, affordable housing, commitment to racial equity, and support for small businesses\nand COVID-19 crisis response.\n• We earned a spot on the CDP (formerly the Carbon Disclosure Project) Climate Change A List for the seventh consecutive year.\n• We announced a goal to enable 5 gigawatts of new carbon-free energy across our key manufacturing r",
        "ance.\n \n \nEngagement\n \nWe proactively engage with our stockholders and other stakeholders throughout the year on a broad range of topics that are of interest and priority to the\ncompany and our stockholders. These include business strategy and performance, and ESG topics such as environmental sustainability, human capital,\nworkforce diversity, executive compensation, and Board leadership and composition.\n \nOur engagement enables us to better understand our stockholders’ priorities and perspectiv"
      ],
      "retrieved_docs": 5,
      "top_scores": [
        0.5927867293357849,
        0.5663988590240479,
        0.518488347530365
      ],
      "sources": [
        "ALPHABET INC. DEF 14A.pdf",
        "ALPHABET INC. - DEF 14A.pdf",
        "ALPHABET INC. - DEF 14A_2.pdf",
        "ALPHABET INC. - DEF 14A_3.pdf",
        "ALPHABET INC. - DEF 14A_2.pdf"
      ],
      "execution_time": 3.395084857940674,
      "embedding_dim": 384,
      "category": "company_overview",
      "query_id": 12,
      "difficulty": "medium"
    },
    {
      "question": "What was the company's total revenue in the most recent fiscal year, and how did it change compared to the previous year?",
      "answer": "The company's total revenue in the most recent fiscal year (2024) was $350,018 million. This represents a change of $42,624 million, or a 14% increase compared to the previous year (2023), which had total revenues of $307,394 million.",
      "contexts": [
        "dated financial results (in millions, except for per share information and\npercentages):\nYear Ended December 31,\n2023\n2024\n$ Change\n% Change\nConsolidated revenues\n$\n307,394 \n$\n350,018 \n$\n42,624 \n14 %\nChange in consolidated constant currency revenues\n15 %\nCost of revenues\n$\n133,332 \n$\n146,306 \n$\n12,974 \n10 %\nOperating expenses\n$\n89,769 \n$\n91,322 \n$\n1,553 \n2 %\nOperating income\n$\n84,293 \n$\n112,390 \n$\n28,097 \n33 %\nOperating margin\n27 %\n32 %\n5 %\nOther income (expense), net\n$\n1,424 \n$\n7,425 \n$\n6,001 \n",
        "fluctuations in our quarterly results, including fluctuations in sequential revenue growth rates.\n \nQuarter Ended\n \nMar 31,\n2019\nJun 30,\n2019\nSept 30,\n2019\nDec 31,\n2019\nMar 31,\n2020\nJun 30,\n2020\nSept 30,\n2020\nDec 31,\n2020\n(In millions, except per share amounts) (unaudited)\nConsolidated Statements of Income Data:\nRevenues\n$ 36,339  $ 38,944  $ 40,499  $ 46,075  $ 41,159  $ 38,297  $ 46,173 \n56,898 \nCosts and expenses:\nCost of revenues\n16,012 \n17,296 \n17,568 \n21,020 \n18,982 \n18,553 \n21,117 \n26,080",
        " see Note 9 of the Notes to Consolidated Financial Statements\nincluded in Item 1 of this Quarterly Report on Form 10-Q.\n•\nOperating cash flow was $26.6 billion for the three months ended June 30, 2024.\n•\nCapital expenditures, which primarily reflected investments in technical infrastructure,\nwere $13.2 billion for the three months ended June 30, 2024.\n•\nAs of June 30, 2024, we had 179,582 employees.\nFinancial Results\nRevenues\nThe following table presents revenues by type (in millions):\n \nThree M",
        "r the fiscal year ended\nDecember  31, 2022 as well as Note 13 of the Notes to Consolidated Financial Statements\nincluded in Item 1 of this Quarterly Report on Form 10-Q.\nExecutive Overview\nThe following table summarizes our consolidated financial results (in millions, except per\nshare information and percentages):\nThree Months Ended\nMarch 31,\n2022\n2023\n$ Change\n% Change\nConsolidated revenues\n$\n68,011 \n$\n69,787 \n$\n1,776 \n3 %\nChange in consolidated constant\ncurrency revenues\n6 %\nCost of revenues\n$",
        "atements\nincluded in Part II, Item 8 in our Annual Report on Form 10-K for the fiscal year ended\nDecember  31, 2024 as well as Note 14 of the Notes to Consolidated Financial Statements\nincluded in Item 1 of this Quarterly Report on Form 10-Q.\nExecutive Overview\nThe following table summarizes consolidated financial results (in millions, except per\nshare information and percentages):\nThree Months Ended\nJune 30,\n2024\n2025\n$ Change\n% Change\nConsolidated revenues\n$\n84,742 \n$\n96,428 \n$\n11,686 \n14 %\nCh"
      ],
      "retrieved_docs": 5,
      "top_scores": [
        0.6671781539916992,
        0.6299777626991272,
        0.6297902464866638
      ],
      "sources": [
        "goog-20241231.pdf",
        "goog-20201231.pdf",
        "goog-20240630.pdf",
        "goog-20230331.pdf",
        "goog-20250630.pdf"
      ],
      "execution_time": 2.163486957550049,
      "embedding_dim": 384,
      "category": "financials",
      "query_id": 13,
      "difficulty": "easy"
    },
    {
      "question": "What was the company's net income for the most recent quarter?",
      "answer": "The company's net income for the most recent quarter, as of September 30, 2023, was $53,108 million.",
      "contexts": [
        "dated financial results (in millions, except for per share information and\npercentages):\nYear Ended December 31,\n2023\n2024\n$ Change\n% Change\nConsolidated revenues\n$\n307,394 \n$\n350,018 \n$\n42,624 \n14 %\nChange in consolidated constant currency revenues\n15 %\nCost of revenues\n$\n133,332 \n$\n146,306 \n$\n12,974 \n10 %\nOperating expenses\n$\n89,769 \n$\n91,322 \n$\n1,553 \n2 %\nOperating income\n$\n84,293 \n$\n112,390 \n$\n28,097 \n33 %\nOperating margin\n27 %\n32 %\n5 %\nOther income (expense), net\n$\n1,424 \n$\n7,425 \n$\n6,001 \n",
        ")\n(46,156)\nNet income\n0 \n0 \n0 \n53,108 \n53,108 \nOther comprehensive\nincome (loss)\n0 \n0 \n567 \n0 \n567 \nBalance as of September 30,\n2023\n12,541  $\n74,591  $\n(7,036) $ 205,647  $\n273,202 \nSee accompanying notes.\n9\nTable of Contents\nAlphabet Inc.\nAlphabet Inc.\nCONSOLIDATED STATEMENTS OF CASH FLOWS\n(in millions; unaudited)\nNine Months Ended\nSeptember 30,\n2022\n2023\nOperating activities\nNet income\n$\n46,348  $\n53,108 \nAdjustments:\nDepreciation and impairment of property and equipment\n11,222 \n10,010 \nAmort",
        "mentary Data” of this Annual Report on\nForm 10-K. The historical results are not necessarily indicative of the results to be expected in any future period.\n \nYear Ended December 31,\n \n2016\n2017\n2018\n2019\n2020\n \n(in millions, except per share amounts)\nConsolidated Statements of Income Data:\nRevenues\n$\n90,272 \n$\n110,855 \n$\n136,819 \n$\n161,857 \n$\n182,527 \nIncome from operations\n$\n23,737 \n$\n26,178 \n$\n27,524 \n$\n34,231 \n$\n41,224 \nNet income\n$\n19,478 \n$\n12,662 \n$\n30,736 \n$\n34,343 \n$\n40,269 \nBasic net in",
        "fluctuations in our quarterly results, including fluctuations in sequential revenue growth rates.\n \nQuarter Ended\n \nMar 31,\n2019\nJun 30,\n2019\nSept 30,\n2019\nDec 31,\n2019\nMar 31,\n2020\nJun 30,\n2020\nSept 30,\n2020\nDec 31,\n2020\n(In millions, except per share amounts) (unaudited)\nConsolidated Statements of Income Data:\nRevenues\n$ 36,339  $ 38,944  $ 40,499  $ 46,075  $ 41,159  $ 38,297  $ 46,173 \n56,898 \nCosts and expenses:\nCost of revenues\n16,012 \n17,296 \n17,568 \n21,020 \n18,982 \n18,553 \n21,117 \n26,080",
        " Ended December 31,\n \n2015\n \n2016\n2017\n2018\n \n2019\n \n(in millions, except per share amounts)\nConsolidated Statements of Income Data:\nRevenues\n$\n74,989   $\n90,272\n$\n110,855\n$\n136,819   $\n161,857\nIncome from operations\n$\n19,360   $\n23,737\n$\n26,178\n$\n27,524   $\n34,231\nNet income\n$\n16,348   $\n19,478\n$\n12,662\n$\n30,736   $\n34,343\n \n \n \n \nBasic net income per share of Class A\nand B common stock\n$\n23.11   $\n28.32\n$\n18.27\n$\n44.22   $\n49.59\nBasic net income per share of Class C\ncapital stock\n$\n24.63   $\n2"
      ],
      "retrieved_docs": 5,
      "top_scores": [
        0.6646561622619629,
        0.6478052139282227,
        0.6461319327354431
      ],
      "sources": [
        "goog-20241231.pdf",
        "goog-20230930.pdf",
        "goog-20201231.pdf",
        "goog-20201231.pdf",
        "Document.pdf"
      ],
      "execution_time": 2.419822931289673,
      "embedding_dim": 384,
      "category": "financials",
      "query_id": 14,
      "difficulty": "easy"
    },
    {
      "question": "How did the company's operating expenses change compared to the previous period?",
      "answer": "The company's operating expenses were $21.4 billion, which represents a decrease of 2% year over year. However, there was also another mention of operating expenses being $89.8 billion, which indicates an increase of 10% year over year. This suggests that the company experienced mixed changes in operating expenses, with some categories decreasing while others increased significantly. Additionally, operating expenses excluding cost of revenues increased by 19% year over year, primarily due to headcount growth and increases in advertising and promotional expenses.",
      "contexts": [
        "eased 16%\nyear over year.\n•\nCost of revenues was $33.7 billion, an increase of 10% year over year, primarily\ndriven by increases in TAC, content acquisition costs, and depreciation expense.\nThese increases were partially offset by decreases in compensation expenses, largely\nthe result of a reduction in employee severance and related charges, and charges\nrelated to our office space optimization efforts.\n•\nOperating expenses were $21.4 billion, a decrease of 2% year over year, primarily\ndriven by ",
        "ociated with the reduction in our workforce. Additionally, cost of\nrevenues benefited from a reduction in depreciation due to the change in estimated useful lives of our servers\nand network equipment.\n•\nOperating expenses were $89.8 billion, an increase of 10% year over year, primarily driven by an increase in\ncompensation expenses and charges related to our office space optimization efforts. The increase in\ncompensation expenses was largely the result of charges related to employee severance as",
        " year over year, affected by a reduction in depreciation expense\ndue to the change in the estimated useful life of our servers and certain network\nequipment.\n•\nOperating expenses (excluding cost of revenues) were $16.5 billion, an increase\nof 19% year over year, primarily driven by headcount growth and increases in\nadvertising and promotional expenses.\nOther information\n•\nOperating cash flow was $25.5 billion for the three months ended September 30,\n2021.\n•\nCapital expenditures, which primarily ",
        "the estimated useful lives of our servers and certain network\nequipment.\n•\nOperating expenses were $22.1 billion, an increase of 6% year over year, primarily\ndriven by increases in compensation expenses largely due to an increase in stock-\nbased compensation, and charges related to legal matters, partially offset by a\ndecrease in advertising and promotional activities. Additionally, operating expenses\nbenefited from a reduction in depreciation expense due to the change in the estimated\nuseful li",
        " Our operating expenses\ninclude costs related to R&D, sales and marketing, and general and administrative functions. Certain of our costs and\nexpenses, including those associated with the operation of our technical infrastructure as well as components of our\noperating expenses, are generally less variable in nature and may not correlate to changes in revenue. Additionally,\nfluctuations in compensation expenses may not directly correlate with changes in headcount, in particular due to annual\nstoc"
      ],
      "retrieved_docs": 5,
      "top_scores": [
        0.6643515825271606,
        0.654567539691925,
        0.6434159874916077
      ],
      "sources": [
        "goog-20240331.pdf",
        "goog-20231231.pdf",
        "goog-20210930.pdf",
        "goog-20230930.pdf",
        "goog-20231231.pdf"
      ],
      "execution_time": 3.152981996536255,
      "embedding_dim": 384,
      "category": "financials",
      "query_id": 15,
      "difficulty": "medium"
    },
    {
      "question": "What is the company's cash and cash equivalents balance?",
      "answer": "As of March 31, 2023, the company's cash and cash equivalents balance is $25,924 million.",
      "contexts": [
        "of these\ncompanies.\n2\nTable of Contents\nAlphabet In\nPART I.    FINANCIAL INFORMATION\nITEM 1.\nFINANCIAL STATEMENTS\nAlphabet Inc.\nCONSOLIDATED BALANCE SHEETS\n(in millions, except share amounts which are reflected in thousands, and par value per share\namounts)\nAs of\nDecember 31,\n2019\nAs of\nSeptember 30,\n2020\n(unaudited)\nAssets\nCurrent assets:\nCash and cash equivalents\n$\n18,498  $\n20,129 \nMarketable securities\n101,177 \n112,467 \nTotal cash, cash equivalents, and marketable\nsecurities\n119,675 \n132,596",
        ", or any relationship with any of\nthese companies.\n4\nTable of Contents\nAlphabet Inc.\nPART I.    FINANCIAL INFORMATION\nITEM 1.\nFINANCIAL STATEMENTS\nAlphabet Inc.\nCONSOLIDATED BALANCE SHEETS\n(in millions, except par value per share amounts)\nAs of\nDecember 31,\n2022\nAs of\nMarch 31, 2023\n(unaudited)\nAssets\nCurrent assets:\nCash and cash equivalents\n$\n21,879  $\n25,924 \nMarketable securities\n91,883 \n89,178 \nTotal cash, cash equivalents, and marketable securities\n113,762 \n115,102 \nAccounts receivable, ne",
        "nd cash equivalents\n(5,520)\n934 \n2,169 \nCash and cash equivalents at beginning of period\n26,465 \n20,945 \n21,879 \nCash and cash equivalents at end of period\n$\n20,945 \n$\n21,879 \n$\n24,048 \nSupplemental disclosures of cash flow information\nCash paid for income taxes, net of refunds\n$\n13,412 \n$\n18,892 \n$\n19,164 \nSee accompanying notes.\n55.\nTable of Contents\nAlphabet Inc.\nAlphabet Inc.\nNOTES TO CONSOLIDATED FINANCIAL STATEMENTS\nNote 1. Summary of Significant Accounting Policies\nNature of Operations\nGo",
        "any relationship with any of these\ncompanies.\n4\nTable of Contents\nAlphabet Inc.\nPART I.    FINANCIAL INFORMATION\nITEM 1.\nFINANCIAL STATEMENTS\nAlphabet Inc.\nCONSOLIDATED BALANCE SHEETS\n(in millions, except par value per share amounts)\nAs of\nDecember 31,\n2021\nAs of\nSeptember 30,\n2022\n(unaudited)\nAssets\nCurrent assets:\nCash and cash equivalents\n$\n20,945  $\n21,984 \nMarketable securities\n118,704 \n94,275 \nTotal cash, cash equivalents, and marketable\nsecurities\n139,649 \n116,259 \nAccounts receivable, ne",
        "1. See Note 14 of the Notes to Consolidated Financial Statements\nincluded in Item 8 of this Annual Report on Form 10-K for further information.\nFinancial Condition\nCash, Cash Equivalents, and Marketable Securities\nAs of December 31, 2021, we had $139.6 billion in cash, cash equivalents, and short-term marketable securities.\nCash equivalents and marketable securities are comprised of time deposits, money market funds, highly liquid\ngovernment bonds, corporate debt securities, mortgage-backed and "
      ],
      "retrieved_docs": 5,
      "top_scores": [
        0.6402537822723389,
        0.6391175985336304,
        0.6272199153900146
      ],
      "sources": [
        "goog-20200930.pdf",
        "goog-20230331.pdf",
        "goog-20231231.pdf",
        "goog-20220930.pdf",
        "goog-20211231.pdf"
      ],
      "execution_time": 1.4644558429718018,
      "embedding_dim": 384,
      "category": "financials",
      "query_id": 16,
      "difficulty": "easy"
    },
    {
      "question": "How much did the company spend on research and development (R&D) in the most recent period?",
      "answer": "In the most recent period, the company spent $11,468 million on research and development (R&D) for the three months ended March 31, 2023.",
      "contexts": [
        "due to the change in the estimated useful life of\nour servers and certain network equipment.\nResearch and Development\nThe following table presents R&D expenses (in millions, except percentages):\nThree Months Ended\n \nMarch 31,\n \n2022\n2023\nResearch and development expenses\n$\n9,119 \n$\n11,468 \nResearch and development expenses as a percentage of\nrevenues\n13 %\n16 %\nR&D expenses increased $2.3 billion from the three months ended March 31, 2022 to the\nthree months ended March 31, 2023 primarily driven ",
        " presents R&D expenses (in millions, except percentages):\nThree Months Ended\nSix Months Ended\n \nJune 30,\nJune 30,\n \n2021\n2022\n2021\n2022\nResearch and development\nexpenses\n$\n7,675 \n$\n9,841 \n$ 15,160 \n$ 18,960 \nResearch and development\nexpenses as a percentage of\nrevenues\n12.4 %\n14.1 %\n12.9 %\n13.8 %\nR&D expenses increased $2.2 billion from the three months ended June 30, 2021 to\nthe three months ended June 30, 2022. The increase was primarily driven by an increase\nin compensation expenses of $1.4 b",
        ", which generally have higher\ncosts of revenues, relative to our advertising revenues.\nResearch and Development\nThe following table presents our R&D expenses (in millions, except percentages):\nThree Months Ended\n \nMarch 31,\n \n2020\n2021\nResearch and development expenses\n$\n6,820 \n$\n7,485 \nResearch and development expenses as a percentage\nof revenues\n16.6 %\n13.5 %\nR&D expenses consist primarily of:\n•\nCompensation expenses (including SBC) for engineering and technical employees\nresponsible for R&D o",
        "ves of our servers and certain network equipment.\nResearch and Development\nThe following table presents R&D expenses (in millions, except percentages):\nThree Months Ended\nNine Months Ended\n \nSeptember 30,\nSeptember 30,\n \n2022\n2023\n2022\n2023\nResearch and development expenses $\n10,273 \n$\n11,258 \n$\n29,233 \n$\n33,314 \nResearch and development expenses\nas a percentage of revenues\n15 %\n15 %\n14 %\n15 %\nR&D expenses increased $985 million from the three months ended September 30, 2022\nto the three months ",
        "\n27,573 \n$\n31,562 \nResearch and development expenses as a percentage of revenues\n15.1 %\n12.3 %\nR&D expenses increased $4.0 billion from 2020 to 2021. The increase was primarily due to an increase in\ncompensation expenses of $3.5 billion, largely resulting from an 11% increase in headcount, and an increase in\nprofessional service fees of $516 million. This increase was partially offset by a reduction in depreciation expense of\n$450 million including the effect of our change in the estimated usefu"
      ],
      "retrieved_docs": 5,
      "top_scores": [
        0.7575871348381042,
        0.7430546879768372,
        0.728786289691925
      ],
      "sources": [
        "goog-20230331.pdf",
        "goog-20220630.pdf",
        "goog-20210331.pdf",
        "goog-20230930.pdf",
        "goog-20211231.pdf"
      ],
      "execution_time": 4.2507970333099365,
      "embedding_dim": 384,
      "category": "financials",
      "query_id": 17,
      "difficulty": "medium"
    },
    {
      "question": "What is the company's total assets and how has it changed over time?",
      "answer": "To calculate the company's total assets, we need to sum the current assets and long-lived assets for both years provided.\n\nAs of December 31, 2023:\n- Total current assets: $171,530 million\n- Total long-lived assets: $148,436 million\n- Total assets for 2023: $171,530 + $148,436 = $319,966 million\n\nAs of December 31, 2024:\n- Total current assets: $163,711 million\n- Total long-lived assets: $174,831 million\n- Total assets for 2024: $163,711 + $174,831 = $338,542 million\n\nNow, we can analyze the change in total assets over time:\n- Total assets increased from $319,966 million in 2023 to $338,542 million in 2024.\n- The change in total assets: $338,542 - $319,966 = $18,576 million.\n\nIn summary, the company's total assets increased by $18,576 million from 2023 to 2024.",
      "contexts": [
        "illions, except par value per share amounts)\nAs of December 31,\n2023\n2024\nAssets\nCurrent assets:\nCash and cash equivalents\n$\n24,048 \n$\n23,466 \nMarketable securities\n86,868 \n72,191 \nTotal cash, cash equivalents, and marketable securities\n110,916 \n95,657 \nAccounts receivable, net\n47,964 \n52,340 \nOther current assets\n12,650 \n15,714 \nTotal current assets\n171,530 \n163,711 \nNon-marketable securities\n31,008 \n37,982 \nDeferred income taxes\n12,169 \n17,180 \nProperty and equipment, net\n134,345 \n171,036 \nOpe",
        "ets:\nUnited States\n$\n110,053  $\n129,318 \nInternational\n38,383 \n45,513 \nTotal long-lived assets\n$\n148,436  $\n174,831 \n32\nITEM \n2.\nMANAGEMENT’S \nDISCUSSION AND ANALYSIS \nOF \nFINANCIAL\nCONDITION AND RESULTS OF OPERATIONS\nPlease read the following discussion and analysis of our financial condition and results of\noperations together with \"Note About Forward-Looking Statements\" and our consolidated\nfinancial statements and related notes included under Item 1 of this Quarterly Report on Form\n10-Q as we",
        "dated financial results (in millions, except for per share information and\npercentages):\nYear Ended December 31,\n2023\n2024\n$ Change\n% Change\nConsolidated revenues\n$\n307,394 \n$\n350,018 \n$\n42,624 \n14 %\nChange in consolidated constant currency revenues\n15 %\nCost of revenues\n$\n133,332 \n$\n146,306 \n$\n12,974 \n10 %\nOperating expenses\n$\n89,769 \n$\n91,322 \n$\n1,553 \n2 %\nOperating income\n$\n84,293 \n$\n112,390 \n$\n28,097 \n33 %\nOperating margin\n27 %\n32 %\n5 %\nOther income (expense), net\n$\n1,424 \n$\n7,425 \n$\n6,001 \n",
        "023 were\nas follows (in millions):\nGoogle\nServices\nGoogle\nCloud\nOther Bets\nTotal\nBalance as of December 31, 2022\n$\n20,847  $\n7,205  $\n908  $\n28,960 \nAcquisitions\n240 \n0 \n0 \n240 \nForeign currency translation and other\nadjustments\n37 \n1 \n(28)\n10 \nBalance as of June 30, 2023\n$\n21,124  $\n7,206  $\n880  $\n29,210 \n(1)\n(2)\n25\nTable of Contents\nAlphabet Inc.\nOther Intangible Assets\nInformation regarding intangible assets was as follows (in millions):\nAs of December 31, 2022\nAs of June 30, 2023\n \nGross\nCa",
        "axes\n5,261 \n12,169 \nProperty and equipment, net\n112,668 \n134,345 \nOperating lease assets\n14,381 \n14,091 \nGoodwill\n28,960 \n29,198 \nOther non-current assets\n8,707 \n10,051 \nTotal assets\n$\n365,264 \n$\n402,392 \nLiabilities and Stockholders’ Equity\nCurrent liabilities:\nAccounts payable\n$\n5,128 \n$\n7,493 \nAccrued compensation and benefits\n14,028 \n15,140 \nAccrued expenses and other current liabilities\n37,866 \n46,168 \nAccrued revenue share\n8,370 \n8,876 \nDeferred revenue\n3,908 \n4,137 \nTotal current liabilit"
      ],
      "retrieved_docs": 5,
      "top_scores": [
        0.629773736000061,
        0.6198208332061768,
        0.6171799302101135
      ],
      "sources": [
        "goog-20241231.pdf",
        "goog-20240930.pdf",
        "goog-20241231.pdf",
        "goog-20230630.pdf",
        "goog-20231231.pdf"
      ],
      "execution_time": 5.412417888641357,
      "embedding_dim": 384,
      "category": "financials",
      "query_id": 18,
      "difficulty": "medium"
    },
    {
      "question": "How does the company's operating margin compare to previous periods?",
      "answer": "The company's operating margin may differ significantly from previous periods, and past operating margins may not be indicative of future performance. The context suggests that there are fluctuations in operating results due to various factors, making it difficult to predict future margins based on historical data. Additionally, the company indicates that it may not be able to successfully or timely re-engineer its cost base, which could further impact the operating margin.",
      "contexts": [
        "sition of those holdings.\nOur operating results may fluctuate, which makes our results difficult to predict\nand could cause our results to fall short of expectations.\nOur operating results may fluctuate as a result of a number of factors, many outside of\nour control.\nAs a result, comparing our operating results on a period-to-period basis may not be\nmeaningful, and you should not rely on our past results as an indication of our future\nperformance. Our quarterly, year-to-date, and annual expenses",
        "a result, comparing our operating results on a period-to-period basis may not be\nmeaningful, and you should not rely on our past results as an indication of our future\nperformance. Our quarterly, year-to-date, and annual expenses as a percentage of our\nrevenues may differ significantly from our historical rates. Our operating results in future\nquarters may fall below expectations. Any of these events could cause our stock price to fall.\nEach of the risk factors listed in this section in addition",
        "aspects of our business. Further, certain of our costs and expenses are generally less variable in nature and\nmay not correlate to changes in revenue. We may also not be able to execute our efforts to re-engineer our cost base\nsuccessfully or in a timely manner. Due to these factors and the evolving nature of our business, our historical revenue\ngrowth rate and historical operating margin may not be indicative of our future performance. For additional information,\nsee Trends in Our Business and ",
        "Accordingly, actual results could differ materially from\nour estimates. We base our estimates on past experience and other assumptions that we believe are reasonable under\nthe circumstances, and we evaluate these estimates on an ongoing basis. We have reviewed our critical accounting\nestimates with the Audit and Compliance Committee of our Board of Directors.\nFor a summary of significant accounting policies and the effect on our financial statements, see Note 1 of the\nNotes to Consolidated Finan",
        " operations. Accordingly, actual results could differ materially from\nour estimates. We base our estimates on past experience and other assumptions that we believe are reasonable under\nthe circumstances, and we evaluate these estimates on an ongoing basis. We have reviewed our critical accounting\nestimates with the Audit and Compliance Committee of our Board of Directors.\nFor a summary of significant accounting policies and the effect on our financial statements, see Note 1 of the\nNotes to Conso"
      ],
      "retrieved_docs": 5,
      "top_scores": [
        0.631973385810852,
        0.5903352499008179,
        0.5765071511268616
      ],
      "sources": [
        "goog-20200930.pdf",
        "goog-20200331.pdf",
        "goog-20231231.pdf",
        "goog-20241231.pdf",
        "goog-20231231.pdf"
      ],
      "execution_time": 4.867064952850342,
      "embedding_dim": 384,
      "category": "financials",
      "query_id": 19,
      "difficulty": "hard"
    },
    {
      "question": "What is the company's free cash flow and how is it calculated?",
      "answer": "Free cash flow (FCF) is a measure of a company's financial performance, representing the cash generated by operations after accounting for capital expenditures. It is calculated using the following formula:\n\n\\[ \\text{Free Cash Flow} = \\text{Net Cash Provided by Operating Activities} - \\text{Capital Expenditures} \\]\n\nIn this context, capital expenditures can be inferred from the cash used in investing activities, as it often includes purchases of property, plant, equipment, and other capital investments.\n\nBased on the provided cash flow data, we can calculate the free cash flow for the periods mentioned:\n\n### For Nine Months Ended September 30, 2024:\n- **Net cash provided by operating activities**: $86,186 million\n- **Net cash used in investing activities (Capital Expenditures)**: $29,356 million\n\nCalculating free cash flow:\n\\[ \n\\text{Free Cash Flow} = 86,186 - 29,356 = 56,830 \\text{ million} \n\\]\n\n### For Nine Months Ended September 30, 2023:\n- **Net cash provided by operating activities**: $82,831 million\n- **Net cash used in investing activities (Capital Expenditures)**: $20",
      "contexts": [
        "or the long-term growth of the business. We regularly evaluate our\ncash and capital structure, including the size, pace, and form of capital return to stockholders.\nThe following table presents cash flows (in millions):\n \nNine Months Ended\nSeptember 30,\n \n2024\n2025\nNet cash provided by operating activities\n$\n86,186  $\n112,311 \nNet cash used in investing activities\n$\n(29,356) $\n(68,515)\nNet cash used in financing activities\n$\n(60,697) $\n(44,416)\nCash Provided by Operating Activities\nOur largest s",
        "wth of the business. We regularly\nevaluate our cash and capital structure, including the size, pace and form of capital return\nto stockholders.\nThe following table presents our cash flows (in millions):\n \nThree Months Ended\nMarch 31,\n \n2021\n2022\nNet cash provided by operating activities\n$\n19,289  $\n25,106 \nNet cash used in investing activities\n$\n(5,383) $\n(9,051)\nNet cash used in financing activities\n$\n(13,606) $\n(16,214)\nCash Provided by Operating Activities\nOur largest source of cash provided ",
        "ur\ncash and capital structure, including the size, pace, and form of capital return to stockholders.\nThe following table presents our cash flows (in millions):\n \nNine Months Ended\nSeptember 30,\n \n2023\n2024\nNet cash provided by operating activities\n$\n82,831  $\n86,186 \nNet cash used in investing activities\n$\n(20,896) $\n(29,356)\nNet cash used in financing activities\n$\n(52,785) $\n(60,697)\nCash Provided by Operating Activities\nOur largest source of cash provided by operations are advertising revenues",
        "\nItem 1 of this Quarterly Report on Form 10-Q for additional information.\n•\nOperating cash flow was $25.1 billion, primarily driven by revenues generated\nfrom our advertising products.\n•\nCapital expenditures of $9.8 billion reflects the increase in purchases of office\nfacilities.\n33\nTable of Contents\nAlphabet Inc.\nFinancial Results\nRevenues\nThe following table presents revenues by type (in millions):\n \nThree Months Ended\nMarch 31,\n \n2021\n2022\nGoogle Search & other\n$\n31,879  $\n39,618 \nYouTube ads",
        " see Note 9 of the Notes to Consolidated Financial Statements\nincluded in Item 1 of this Quarterly Report on Form 10-Q.\n•\nOperating cash flow was $26.6 billion for the three months ended June 30, 2024.\n•\nCapital expenditures, which primarily reflected investments in technical infrastructure,\nwere $13.2 billion for the three months ended June 30, 2024.\n•\nAs of June 30, 2024, we had 179,582 employees.\nFinancial Results\nRevenues\nThe following table presents revenues by type (in millions):\n \nThree M"
      ],
      "retrieved_docs": 5,
      "top_scores": [
        0.5736691355705261,
        0.5716924667358398,
        0.5560541749000549
      ],
      "sources": [
        "goog-20250930.pdf",
        "goog-20220331.pdf",
        "goog-20240930.pdf",
        "goog-20220331.pdf",
        "goog-20240630.pdf"
      ],
      "execution_time": 9.323914051055908,
      "embedding_dim": 384,
      "category": "financials",
      "query_id": 20,
      "difficulty": "hard"
    },
    {
      "question": "What are the company's capital expenditures and investment plans?",
      "answer": "The company's capital expenditures and investment plans include:\n\n1. Continuing to invest in new businesses, products, services, and technologies.\n2. Investing in systems, land, and buildings for data centers and offices.\n3. Investing in infrastructure.\n4. Continuing to invest in acquisitions and strategic investments.\n5. Maintaining a pace of hiring with plans to provide competitive compensation programs.\n\nOverall, the company is focused on significant investments aimed at growth and expansion in various areas.",
      "contexts": [
        " revenue;\n•\nfluctuations in our capital expenditures;\n•\nour plans to continue to invest in new businesses, products, services and\ntechnologies, systems, land and buildings for data centers and offices, and\ninfrastructure, as well as to continue to invest in acquisitions and strategic\ninvestments;\n•\nour pace of hiring and our plans to provide competitive compensation programs;\n•\nour expectation that our cost of revenues, research and development (R&D)\nexpenses, sales and marketing expenses, and g",
        "es;\n•\nour plans to continue to invest in new businesses, products, services and\ntechnologies, and systems, as well as to continue to invest in acquisitions and\nstrategic investments;\n•\nour pace of hiring and our plans to provide competitive compensation programs;\n•\nour expectation that our cost of revenues, research and development (R&D)\nexpenses, sales and marketing expenses, and general and administrative expenses\nmay increase in amount and/or may increase as a percentage of revenues and may\nb",
        "ditures;\n•\nour plans to continue to invest in new businesses, products, services and\ntechnologies, systems, land and buildings for data centers and offices, and\ninfrastructure, as well as to continue to invest in acquisitions and strategic\ninvestments;\n•\nour pace of hiring and our plans to provide competitive compensation programs;\n•\nour expectation that our cost of revenues, research and development (R&D)\nexpenses, sales and marketing expenses, and general and administrative\nexpenses may increa",
        "ur users and expand our businesses, we will invest heavily in operating and\ncapital expenditures.\nWe continue to make significant R&D investments in areas of strategic focus such as advertising, cloud, machine\nlearning, and search, as well as in new products and services. In addition, our capital expenditures have grown over\nthe last several years. We expect this trend to continue in the long term as we invest heavily in land and buildings for\ndata centers and offices, and information technology",
        "s\nWe expect existing cash, cash equivalents, short-term marketable securities, and cash\nflows from operations and financing activities to continue to be sufficient to fund our operating\nactivities and cash commitments for investing and financing activities for at least the next 12\nmonths, and thereafter for the foreseeable future.\n44\nCapital Expenditures and Leases\nWe make investments in land and buildings for data centers and offices and information\ntechnology assets through purchases of proper"
      ],
      "retrieved_docs": 5,
      "top_scores": [
        0.6570598483085632,
        0.6316607594490051,
        0.627855658531189
      ],
      "sources": [
        "goog-20220930.pdf",
        "goog-20250930.pdf",
        "goog-20220630.pdf",
        "Document.pdf",
        "goog-20240630.pdf"
      ],
      "execution_time": 3.8837480545043945,
      "embedding_dim": 384,
      "category": "financials",
      "query_id": 21,
      "difficulty": "medium"
    },
    {
      "question": "What is the company's debt structure and outstanding debt obligations?",
      "answer": "The company's debt structure consists of both long-term debt obligations and future finance lease payments. As of December 31, 2023, the total outstanding debt is summarized as follows:\n\n1. **Long-Term Debt Obligations**: \n   - Total outstanding long-term debt is $13,000 million (or $13 billion) from the 2014-2020 notes issuances, which have maturities ranging from 2024 to 2060 with coupon rates between 0.45% and 3.38%.\n   - As of June 30, 2024, the long-term debt is reported at $12,000 million (or $12 billion).\n\n2. **Future Finance Lease Payments**:\n   - The future finance lease payments were $2,142 million as of December 31, 2022, and increased to $2,208 million as of March 31, 2023.\n\n3. **Total Debt**:\n   - The total debt, which includes both long-term debt and finance lease payments, was $15,142 million as of December 31, 2022, and increased slightly to $15,208 million as of March 31, 2023.\n\n4. **No Commercial Paper**: \n   -",
      "contexts": [
        "0\n1,314  \n5,005\nPurchase obligations(2)\n5,660  \n4,212  \n933\n202  \n313\nLong-term debt obligations(3)\n5,288  \n227  \n1,258\n1,224  \n2,579\nTax payable(4)\n7,315  \n0  \n1,166\n3,661  \n2,488\nOther long-term liabilities reflected on our\nbalance sheet(5)\n1,484  \n245  \n643\n367  \n229\nTotal contractual obligations\n$\n41,019   $\n6,690   $\n8,375\n$\n9,577   $\n16,377\n(1) \nFor further information, refer to Note 4 of the Notes to Consolidated Financial Statements included in Part II, Item 8 of this\nAnnual Report on Fo",
        " balance also includes the current portion of certain long-term debt.\n19\nTable of Contents\nAlphabet Inc.\nLong-Term Debt\nTotal outstanding debt is summarized below (in millions, except percentages):\nMaturity\nCoupon Rate\nEffective\nInterest Rate\nAs of\nDecember\n31, 2022\nAs of\nMarch 31,\n2023\nDebt\n2014-2020 Notes issuances\n2024 -\n2060\n0.45% -\n3.38%\n0.57% -\n3.38%\n$\n13,000  $\n13,000 \nFuture finance lease\npayments, net and other \n2,142 \n2,208 \n      Total debt\n15,142 \n15,208 \nUnamortized discount and\ndeb",
        "m this program are used for general corporate purposes.\nWe had no commercial paper outstanding as of December 31, 2023 and June 30, 2024.\nOur short-term debt balance also includes the current portion of certain long-term debt.\n21\nLong-Term Debt\nTotal outstanding debt is summarized below (in millions, except percentages):\nMaturity\nCoupon Rate\nEffective\nInterest Rate\nAs of\nDecember\n31, 2023\nAs of\nJune 30,\n2024\nDebt\n2016-2020 Notes issuances\n2025 -\n2060\n0.45% -\n2.25%\n0.57% -\n2.33%\n$\n13,000  $\n12,00",
        "-term debt\n14,817 \n14,653 \nDeferred revenue, non-current\n535 \n594 \nIncome taxes payable, non-current\n9,176 \n8,572 \nDeferred income taxes\n5,257 \n476 \nOperating lease liabilities\n11,389 \n11,984 \nOther long-term liabilities\n2,205 \n2,371 \nTotal liabilities\n107,633 \n104,629 \nContingencies (Note 9)\nStockholders’ equity:\nPreferred stock, $0.001 par value per share, 100 shares\nauthorized; no shares issued and outstanding\n0 \n0 \nClass A, Class B, and Class C stock and additional paid-\nin capital, $0.001 p",
        "0 \n77,709 \nLong-term debt\n14,701 \n13,705 \nDeferred revenue, non-current\n599 \n667 \nIncome taxes payable, non-current\n9,258 \n8,753 \nDeferred income taxes\n514 \n558 \nOperating lease liabilities\n12,501 \n12,746 \nOther long-term liabilities\n2,247 \n1,765 \nTotal liabilities\n109,120 \n115,903 \nCommitments and contingencies (Note 9)\nStockholders’ equity:\nPreferred stock, $0.001 par value per share, 100 shares\nauthorized; no shares issued and outstanding\n0 \n0 \nClass A, Class B, and Class C stock and addition"
      ],
      "retrieved_docs": 5,
      "top_scores": [
        0.6019304394721985,
        0.601061224937439,
        0.5922077298164368
      ],
      "sources": [
        "Document.pdf",
        "goog-20230331.pdf",
        "goog-20240630.pdf",
        "goog-20220930.pdf",
        "goog-20230630.pdf"
      ],
      "execution_time": 6.892132997512817,
      "embedding_dim": 384,
      "category": "financials",
      "query_id": 22,
      "difficulty": "hard"
    },
    {
      "question": "How does the company manage working capital and cash conversion cycles?",
      "answer": "The context provided does not explicitly detail how the company manages its working capital and cash conversion cycles. However, we can infer some strategies based on the cash flow information presented.\n\n1. **Monitoring Cash Flows**: The company regularly evaluates its cash flows from operating, investing, and financing activities. By providing substantial cash from operating activities, it suggests that the company is generating sufficient cash from its core operations, which is crucial for managing working capital.\n\n2. **Investment and Financing Activities**: The company's cash used in investing activities has increased, indicating potential investments in growth or capital expenditures that could affect working capital. However, the cash used in financing activities also shows significant outflows, which might suggest that the company is managing its debts and returns to stockholders carefully, balancing the need for cash with obligations.\n\n3. **Cash Conversion Cycles**: Although not explicitly mentioned, a company that generates a strong cash flow from operations likely has an efficient cash conversion cycle, meaning it can quickly convert its investments in inventory and accounts receivable back into cash. This efficiency can help maintain liquidity and reduce reliance on external financing.\n\n4. **Return to Stockholders**: The mention of evaluating the size, pace, and form of capital returns to stockholders suggests that the company is considering how",
      "contexts": [
        "wth of the business. We regularly\nevaluate our cash and capital structure, including the size, pace and form of capital return\nto stockholders.\nThe following table presents our cash flows (in millions):\n \nThree Months Ended\nMarch 31,\n \n2021\n2022\nNet cash provided by operating activities\n$\n19,289  $\n25,106 \nNet cash used in investing activities\n$\n(5,383) $\n(9,051)\nNet cash used in financing activities\n$\n(13,606) $\n(16,214)\nCash Provided by Operating Activities\nOur largest source of cash provided ",
        "or the long-term growth of the business. We regularly evaluate our\ncash and capital structure, including the size, pace, and form of capital return to stockholders.\nThe following table presents cash flows (in millions):\n \nNine Months Ended\nSeptember 30,\n \n2024\n2025\nNet cash provided by operating activities\n$\n86,186  $\n112,311 \nNet cash used in investing activities\n$\n(29,356) $\n(68,515)\nNet cash used in financing activities\n$\n(60,697) $\n(44,416)\nCash Provided by Operating Activities\nOur largest s",
        "ur\ncash and capital structure, including the size, pace, and form of capital return to stockholders.\nThe following table presents our cash flows (in millions):\n \nNine Months Ended\nSeptember 30,\n \n2023\n2024\nNet cash provided by operating activities\n$\n82,831  $\n86,186 \nNet cash used in investing activities\n$\n(20,896) $\n(29,356)\nNet cash used in financing activities\n$\n(52,785) $\n(60,697)\nCash Provided by Operating Activities\nOur largest source of cash provided by operations are advertising revenues",
        "gularly\nevaluate our cash and capital structure, including the size, pace and form of capital return\nto stockholders.\nThe following table presents our cash flows (in millions):\n \nSix Months Ended\nJune 30,\n \n2021\n2022\nNet cash provided by operating activities\n$\n41,179  $\n44,528 \nNet cash used in investing activities\n$\n(14,457) $\n(13,238)\nNet cash used in financing activities\n$\n(29,597) $\n(34,031)\nCash Provided by Operating Activities\nOur largest source of cash provided by operations are advertisi",
        "urities,\nas well as the cash flow that we generate from operations. The primary use of capital\ncontinues to be to invest for the long-term growth of the business. We regularly evaluate our\ncash and capital structure, including the size, pace, and form of capital return to stockholders.\nThe following table presents our cash flows (in millions):\n \nSix Months Ended\nJune 30,\n \n2023\n2024\nNet cash provided by operating activities\n$\n52,175  $\n55,488 \nNet cash used in investing activities\n$\n(13,746) $\n("
      ],
      "retrieved_docs": 5,
      "top_scores": [
        0.5854579210281372,
        0.5756065845489502,
        0.5743929147720337
      ],
      "sources": [
        "goog-20220331.pdf",
        "goog-20250930.pdf",
        "goog-20240930.pdf",
        "goog-20220630.pdf",
        "goog-20240630.pdf"
      ],
      "execution_time": 9.398859024047852,
      "embedding_dim": 384,
      "category": "financials",
      "query_id": 23,
      "difficulty": "hard"
    },
    {
      "question": "What are the company's share repurchase programs and dividend policies?",
      "answer": "The company's share repurchase program allows for the repurchase of shares from time to time, depending on general business and market conditions as well as other investment opportunities. These repurchases can be executed through open market purchases or privately negotiated transactions, including the use of Rule 10b5-1 plans. Notably, the repurchase program does not have an expiration date.\n\nFor the year ended December 31, 2024, the company repurchased a total of 122 million shares for $15.9 billion during the three months and 410 million shares for $46.2 billion during the nine months ended September 30, 2023.\n\nRegarding the company's dividend policy, total cash dividends paid during the year ended December 31, 2024, amounted to $3.5 billion, $519 million, and $3.3 billion for Class A, Class B, and Class C shares, respectively. The company intends to pay these dividends on a quarterly basis. The first payment of dividends was made in June 2024.",
      "contexts": [
        "868 \n306\n50,192 \nTotal share repurchases\n528 $\n62,184 \n379 $\n62,047 \nShares repurchased include unsettled repurchases.\nRepurchases are executed from time to time, subject to general business and market conditions and other\ninvestment opportunities, through open market purchases or privately negotiated transactions, including through Rule\n10b5-1 plans. The repurchase program does not have an expiration date.\nDividends\nDuring the year ended December 31, 2024, total cash dividends, which were first",
        "28 $\n62,184 \n379 $\n62,047 \nShares repurchased include unsettled repurchases.\nFor additional information, see Note 11 of the Notes to Consolidated Financial Statements included in Item 8 of\nthis Annual Report on Form 10-K.\nDividend Program\n(1)\n(1) \nDuring the year ended December 31, 2024 total cash dividends, which were first paid in June 2024, were $3.5\nbillion, $519 million, and $3.3 billion for Class A, Class B, and Class C shares, respectively.\nThe company intends to pay quarterly cash divide",
        "\narrangements result in a portion of the cash received from and paid to the contract\nmanufacturers to be presented as financing activities in the Consolidated Statements of Cash\nFlows included in Item 1 of this Quarterly Report on Form 10-Q.\nShare Repurchase Program\nDuring the three and nine months ended September 30, 2023, we repurchased and\nsubsequently retired 122 million and 410 million shares for $15.9 billion and $46.2 billion,\nrespectively. Of the aggregate amount repurchased and subseque",
        "aims are successful, they may harm our\nbusiness, including our product and service offerings, financial condition, or operating results.\nRisks Related to Ownership of our Stock\nWe cannot guarantee that any share repurchase program will be fully\nconsummated or that any share repurchase program will enhance long-term\nstockholder value, and share repurchases could increase the volatility of the price of\nour stock and could diminish our cash reserves.\nWe engage in share repurchases from time to time",
        " devices. Certain of these\narrangements result in a portion of the cash received from and paid to the contract\nmanufacturers to be presented as financing activities in the Consolidated Statements of Cash\nFlows included in Item 1 of this Quarterly Report on Form 10-Q.\nShare Repurchase Program\nDuring the three and six months ended June 30, 2025, we repurchased and\nsubsequently retired 81 million and 164 million shares for $13.3 billion and $28.6 billion,\nrespectively.\nIn April 2024, the Board of D"
      ],
      "retrieved_docs": 5,
      "top_scores": [
        0.7481036186218262,
        0.6616617441177368,
        0.6547036170959473
      ],
      "sources": [
        "goog-20241231.pdf",
        "goog-20241231.pdf",
        "goog-20230930.pdf",
        "goog-20200930.pdf",
        "goog-20250630.pdf"
      ],
      "execution_time": 4.67785906791687,
      "embedding_dim": 384,
      "category": "financials",
      "query_id": 24,
      "difficulty": "medium"
    },
    {
      "question": "What are the company's pension and post-retirement benefit obligations?",
      "answer": "The context provided does not explicitly detail the company's pension and post-retirement benefit obligations. However, it does mention the maintenance of a tax-qualified retirement savings plan, specifically a 401(k) plan for eligible employees, along with various employee benefits such as life insurance, disability insurance, and other health-related plans. \n\nTo obtain specifics about pension and post-retirement benefit obligations, one would typically need to refer to additional financial documents or disclosures, such as annual reports or detailed financial statements, which outline these obligations comprehensively. The context primarily focuses on current liabilities and employee benefit plans without providing specific figures or obligations related to pensions or post-retirement benefits.",
      "contexts": [
        "in various employee benefit plans, including medical, dental, and vision care\nplans; flexible spending accounts for health and dependent care; life, accidental death and dismemberment, disability, and travel insurance; survivor\nincome benefit; employee assistance programs (e.g., confidential counseling); matching gift program; and paid time off. We also pay life insurance\npremiums for all employees (other than Larry and Sergey).\n \nIn addition, we maintain a tax-qualified retirement savings plan ",
        " and benefits\n15 069\n9 984\nAccrued compensation and benefits\n15,069 \n9,984 \nAccrued expenses and other current liabilities\n51,228 \n58,300 \nAccrued revenue share\n9,802 \n9,965 \nDeferred revenue\n5,036 \n4,908 \nTotal current liabilities\n89,122 \n91,654 \nLong-term debt\n10,883 \n10,886 \nIncome taxes payable, non-current\n8,782 \n9,773 \nOperating lease liabilities\n11,691 \n11,678 \nOther long-term liabilities\n4,694 \n6,116 \nTotal liabilities\n125,172 \n130,107 \nCommitments and Contingencies (Note 10)\nStockholder",
        "time off. We also pay life insurance\npremiums for all employees (other than Larry and Sergey).\n \nAlphabet 2024 Proxy Statement     51\n \nBack to Contents\nProxy Statement\nSummary &\nHighlights\nCorporate\nGovernance\nDirector and\nExecutive\nCompensation\nAudit Matters\nProposals\nQ&A\n \nIn addition, we maintain a tax-qualified 401(k) retirement savings plan with both pre-tax and after-tax Roth savings features for eligible employees,\nincluding our named executive officers. In 2023, we provided a company ma",
        "gation of assets to provide for payments under the Plan.\nTo the extent any person acquires any rights to receive payments hereunder from the Company, such rights shall be no greater than those of an\nunsecured creditor.\n \nALPHABET  •  2022 PROXY STATEMENT     A-6\n \nBack to Contents\n1\nCorporate\nGovernance\n2\nDirector and\nExecutive\nCompensation\n3\nAudit\nMatters\n4\nManagement\nand Stockholder\nProposals\n5\nQuestions and\nAnswers\n6\nAppendices\n \n11. No Special Employment Rights; No Right to Incentive Award\n ",
        "may also contribute to difficulty in worker recruitment and retention, as polling indicates employee demand for\nresponsible retirement options.10\n \nFederal law requires that retirement plan fiduciaries act in beneficiaries’ best interests and ensure prudence of the plan’s investments. Recent regulatory\namendments have confirmed that managing material climate risk is an appropriate consideration for retirement plan fiduciaries.11 The Company can best\nensure that it is meeting its obligations to e"
      ],
      "retrieved_docs": 5,
      "top_scores": [
        0.5324882864952087,
        0.5313118696212769,
        0.5230960845947266
      ],
      "sources": [
        "ALPHABET INC. - DEF14A.pdf",
        "goog-20250331.pdf",
        "ALPHABET INC. - DEF 14A.pdf",
        "ALPHABET INC. DEF 14A.pdf",
        "ALPHABET INC. - DEF 14A.pdf"
      ],
      "execution_time": 3.751002311706543,
      "embedding_dim": 384,
      "category": "financials",
      "query_id": 25,
      "difficulty": "hard"
    },
    {
      "question": "What are the company's off-balance sheet arrangements and commitments?",
      "answer": "As of December 31, 2020, the company reported that it did not have any off-balance sheet arrangements that would have a material effect on its financial condition, revenues, expenses, or other financial aspects. \n\nRegarding commitments, as of December 31, 2021, the company regularly enters into significant non-cancelable contractual obligations primarily related to:\n\n1. Data center operations and build-outs\n2. Information technology assets\n3. Office buildings\n4. Purchases of inventory\n5. Network capacity arrangements\n\nThese purchase commitments do not qualify for recognition on the company's Consolidated Balance Sheet. The total contractual obligations as of December 31, 2021, amounted to $62,416 million, categorized into different liabilities.",
      "contexts": [
        " in Part II, Item 8 of this Annual Report on Form 10-K.\nOff-Balance Sheet Arrangements\nAs of December 31, 2020, we did not have any off-balance sheet arrangements, as defined in Item 303(a)(4)(ii) of\nRegulation S-K, that have or are reasonably likely to have a current or future effect on our financial condition, changes\nin our financial condition, revenues, or expenses, results of operations, liquidity, capital expenditures, or capital\nresources that is material to investors. See Note 10 include",
        "We also have\ntaxes payable of $3.5 billion primarily related to uncertain tax positions as of December 31, 2021.\nPurchase Commitments\nWe regularly enter into significant non-cancelable contractual obligations primarily related to data center\noperations and build-outs, information technology assets, office buildings, purchases of inventory, and network capacity\narrangements. As of December  31, 2021, such purchase commitments, which do not qualify for recognition on our\nConsolidated Balance Sheet",
        "payable\n7,359 \n834 \n1,916 \n4,609 \n0 \nOther long-term liabilities reflected on our\nbalance sheet\n1,421 \n532 \n616 \n185 \n88 \nTotal contractual obligations\n$\n62,416 \n$\n12,659 \n$\n10,497 \n$\n12,331 \n$\n26,929 \n    For further information, refer to Note 4 of the Notes to Consolidated Financial Statements included in Part II, Item 8 of this\nAnnual Report on Form 10-K.\n        Represents non-cancelable contractual obligations primarily related to data center operations and build-outs; information\ntechnolog",
        "ations. We also consider\ncustomer-specific information, current market conditions, and reasonable and supportable forecasts of future economic\nconditions.\nOther\nOur financial instruments also include debt and equity investments in companies with which we also have\ncommercial arrangements. For these transactions, judgment is required to assess the substance of the arrangements,\nwhether the arrangements and each component of the arrangements should be accounted for as separate transactions\nunder t",
        " netting arrangements\nwith various counterparties, and cash and non-cash collateral received and pledged\nunder such agreements were as follows (in millions):\nOffsetting of Assets\nAs of December 31, 2021\nGross Amounts Not Offset in the\nConsolidated Balance Sheets, but\nHave Legal Rights to Offset\nGross\nAmounts of\nRecognized\nAssets\nGross\nAmounts\nOffset in the\nConsolidated\nBalance\nSheets\nNet\nPresented in\nthe\nConsolidated\nBalance\nSheets\nFinancial\nInstruments\n Cash\nCollateral\nReceived\nNon-\nCash\nCollat"
      ],
      "retrieved_docs": 5,
      "top_scores": [
        0.7188175916671753,
        0.6383129358291626,
        0.6130767464637756
      ],
      "sources": [
        "goog-20201231.pdf",
        "goog-20211231.pdf",
        "goog-20201231.pdf",
        "goog-20221231.pdf",
        "goog-20220630.pdf"
      ],
      "execution_time": 4.786376237869263,
      "embedding_dim": 384,
      "category": "financials",
      "query_id": 26,
      "difficulty": "hard"
    },
    {
      "question": "What are the principal risk factors identified in the company's risk factors section?",
      "answer": "The principal risk factors identified in the company's risk factors section include:\n\n1. **Dependence on Advertising Revenue**: A significant portion of the company's revenues comes from advertising, making it vulnerable to reduced spending by advertisers, the loss of advertising partners, and the impact of technologies that block online ads.\n\n2. **Operational and Financial Uncertainties**: The company's operations and financial results are subject to various risks and uncertainties that could adversely affect its business, financial condition, results of operations, cash flows, and the trading price of its common and capital stock.\n\n3. **Reputation Risks**: Factors that could harm the company's reputation, which in turn could affect its business and financial performance.\n\n4. **Market Fluctuations**: Changes in the trading price of the company's Class A and Class C stock due to the aforementioned risks.\n\nThese factors highlight the potential challenges the company faces in maintaining its revenue and overall business health.",
      "contexts": [
        "ated herein by reference.\nITEM 1A.\nRISK FACTORS                \nOur operations and financial results are subject to various risks and uncertainties,\nincluding but not limited to those described below, which could harm our business, reputation,\nfinancial condition, and operating results.\nRisks Specific to our Company\nWe generate a significant portion of our revenues from advertising, and reduced\nspending by advertisers, a loss of partners, or new and existing technologies that\nblock ads online an",
        "1A.\nRISK FACTORS                \nOur operations and financial results are subject to various risks and uncertainties,\nincluding those described in Part I, Item 1A, \"Risk Factors\" in our Annual Report on Form\n10-K for the year ended December 31, 2020, which could adversely affect our business,\nfinancial condition, results of operations, cash flows, and the trading price of our common\nand capital stock. Below are changes to our risk factors since our Annual Report on Form\n10-K for the year ended D",
        " 10-Q, which is incorporated herein\nby reference.\nITEM 1A.\nRISK FACTORS                \nOur operations and financial results are subject to various risks and uncertainties,\nincluding but not limited to those described in Part I, Item 1A, \"Risk Factors\" in our Annual\nReport on Form 10-K for the year ended December 31, 2024, which could harm our business,\nreputation, financial condition, and operating results, and affect the trading price of our Class A\nand Class C stock.\nFor additional informatio",
        "\n \nRisks and exposures associated with (1) financial matters, in particular, financial strategy, financial reporting, tax,\naccounting, disclosure, internal control over financial reporting, investment guidelines and credit and liquidity\nmatters; (2) data privacy and security, competition, legal, regulatory, compliance, civil and human rights,\nsustainability, and reputational risks; and (3) our operations and infrastructure, particularly reliability, business\ncontinuity, and capacity.\nLeadership ",
        "al Statements included in Part I, Item 1\nof this Quarterly Report on Form 10-Q, which is incorporated herein by reference.\nITEM 1A.\nRISK FACTORS    \nOur operations and financial results are subject to various risks and uncertainties,\nincluding but not limited to those described below, which could harm our business, reputation,\nfinancial condition, and operating results.\nRisks Specific to our Company\nWe generate a significant portion of our revenues from advertising, and reduced\nspending by adver"
      ],
      "retrieved_docs": 5,
      "top_scores": [
        0.5983200073242188,
        0.5907491445541382,
        0.5872340202331543
      ],
      "sources": [
        "goog-20200930.pdf",
        "goog-20210630.pdf",
        "goog-20250630.pdf",
        "ALPHABET INC. DEF 14A.pdf",
        "goog-20200630.pdf"
      ],
      "execution_time": 4.184513092041016,
      "embedding_dim": 384,
      "category": "risks",
      "query_id": 27,
      "difficulty": "easy"
    },
    {
      "question": "What regulatory risks does the company face in its operations?",
      "answer": "The company faces several regulatory risks in its operations, including:\n\n1. **Increased Regulatory Scrutiny**: The company is experiencing heightened scrutiny from regulatory agencies, which may impact its business operations and strategies.\n\n2. **Regulatory Reviews**: Various authorities, including those focused on competition, consumer protection, and privacy, are reviewing the company's products and services. This could lead to potential restrictions or changes in how the company operates.\n\n3. **Changes in Public Policies**: The company is subject to evolving public policies that could negatively affect its business practices and financial condition.\n\n4. **Challenges Related to Acquisitions and Strategic Arrangements**: The company may face operational difficulties and additional expenditures due to the diversion of management focus from core business activities to address regulatory challenges associated with acquisitions and strategic partnerships.\n\n5. **Approval Delays or Denials**: There is a risk of failing to obtain required governmental approvals in a timely manner, or of facing conditions that could delay or prevent the completion of transactions. \n\nOverall, these regulatory risks could impact the company's ability to operate effectively and maintain its competitive position in the market.",
      "contexts": [
        " a range of settings.\nWe face a number of manufacturing and supply chain risks that, if not properly managed, could harm our\nfinancial condition, operating results, and prospects.\nWe face a number of risks related to manufacturing and supply chain management, which could affect our ability\nto supply both our products and our internet-based services.\nWe rely on other companies to manufacture many of our finished products, to design certain of our components\nand parts, and to participate in the di",
        " business.\nRisks Related to Laws and Regulations\nWe are subject to increasing regulatory scrutiny as well as changes in public\npolicies governing a wide range of topics that may negatively affect our business.\nWe and other companies in the technology industry are experiencing increased\nregulatory scrutiny. For instance, various regulatory agencies, including competition,\nconsumer protection, and privacy authorities, are reviewing aspects of our products and\nservices. We continue to cooperate wit",
        " strategic arrangements,\nwhich could create unforeseen operating difficulties and expenditures. Some of the areas where we face risks include:\n•\ndiversion of management time and focus from operating our business to challenges related to acquisitions and\nother strategic arrangements;\n•\nfailure to obtain required approvals on a timely basis, if at all, from governmental authorities, or conditions\nplaced upon approval that could, among other things, delay or prevent us from completing a transaction",
        " settings.\nWe face a number of manufacturing and supply chain risks that, if not properly\nmanaged, could harm our financial condition, operating results, and prospects.\nWe face a number of risks related to manufacturing and supply chain management,\nwhich could affect our ability to supply both our products and our internet-based services.\nWe rely on other companies to manufacture many of our assemblies and finished\nproducts, to design certain of our components and parts, and to participate in th",
        "olitical, and regulatory risks associated with specific countries.\n•\nCultural challenges associated with integrating employees from the acquired company into our organization,\nand retention of employees from the businesses we acquire.\n•\nLiability for activities of the acquired company before the acquisition, including patent and trademark\ninfringement claims, data privacy and security issues, violations of laws, commercial disputes, tax liabilities,\nand other known and unknown liabilities.\n•\nLit"
      ],
      "retrieved_docs": 5,
      "top_scores": [
        0.7128140926361084,
        0.6920947432518005,
        0.669651210308075
      ],
      "sources": [
        "goog-20201231.pdf",
        "goog-20200630.pdf",
        "goog-20231231.pdf",
        "goog-20200930.pdf",
        "Document.pdf"
      ],
      "execution_time": 6.2532572746276855,
      "embedding_dim": 384,
      "category": "risks",
      "query_id": 28,
      "difficulty": "medium"
    },
    {
      "question": "How does the company describe competitive risks and market competition?",
      "answer": "The company describes competitive risks and market competition as significant challenges that could impact its operating results. It acknowledges that it must compete with other entities that may offer products and services that are similar or superior to its own. This competition may necessitate the company to invest substantial resources and adopt different strategies to maintain its market position. The company also highlights ongoing legal proceedings related to antitrust and competition matters, indicating that these issues are part of the competitive landscape it navigates. Overall, the company emphasizes the inherent risks associated with competition, regulatory compliance, and the need for careful oversight by its Audit and Compliance Committee.",
      "contexts": [
        "ng of how\nthe company oversees competition risks. In fact, the requested report could be a detriment to both the company’s and our stockholders’ interests. As\ndisclosed in our filings with the SEC, our company is involved in legal proceedings concerning antitrust and various competition matters both in the\nUnited States and in other jurisdictions around the world, and disagrees with a number of the claims and characterizations in those matters and in the\nsupporting statement to this proposal. As",
        "Committee is specifically charged with overseeing risks and\nexposures associated with competition and regulatory compliance. In undertaking this risk assessment, the members of the Audit and Compliance\nCommittee, aided by members of management, including the company’s Chief Legal Officer and competition\n \n(1)\nE.g., https://www.usatoday.com/story/opinion/2020/02/14/googles-anti-competitive-practices-decimates-online-shopping-antitrust-column/4718626002/;\nhttps://www.mediapost.com/publications/art",
        ", substantially similar to or better than ours. This may force\nus to compete in different ways and expend significant resources in order to remain competitive. If our competitors are\nmore successful than we are in providing compelling products and services or in attracting and retaining users,\nadvertisers, publishers, customers, and content providers, our operating results could be harmed.\nOur ongoing investment in new businesses, products, services, and technologies is inherently risky, and\ncou",
        "ur financial\ncondition and operating results.\nWe face intense competition. If we do not continue to innovate and provide products and services that are\nuseful to users, customers, and other partners, we may not remain competitive, which could harm our\nbusiness and operating results.\nOur business environment is rapidly evolving and intensely competitive. Our businesses face changing\ntechnologies, shifting user needs, and frequent introductions of rival products and services. To compete successful",
        " competitive position relative to our peers,\nand/or otherwise have an adverse effect on our business, reputation, financial condition, and operating results.\nFor additional information about government regulation applicable to our business, see Risk Factors in Item 1A,\nTrends in Our Business and Financial Effect in Part II, Item 7, and Legal Matters in Note 10 of the Notes to\nConsolidated Financial Statements included in Part II, Item 8 of this Annual Report on Form 10-K.\nIntellectual Property\nW"
      ],
      "retrieved_docs": 5,
      "top_scores": [
        0.6584646105766296,
        0.6225073933601379,
        0.6199679374694824
      ],
      "sources": [
        "ALPHABET INC. - DEF 14A_3.pdf",
        "ALPHABET INC. - DEF 14A_3.pdf",
        "goog-20211231.pdf",
        "goog-20211231.pdf",
        "goog-20211231.pdf"
      ],
      "execution_time": 3.1472511291503906,
      "embedding_dim": 384,
      "category": "risks",
      "query_id": 29,
      "difficulty": "medium"
    },
    {
      "question": "What cybersecurity risks and data privacy concerns are mentioned in the report?",
      "answer": "The report mentions several cybersecurity risks and data privacy concerns, including:\n\n1. **Claims and Lawsuits**: The potential for legal action resulting from inadequate data privacy practices.\n2. **Brand or Reputational Harm**: Risks associated with damage to the organization's reputation due to data privacy and security issues.\n3. **Regulatory Scrutiny**: Increased oversight and scrutiny from regulatory bodies as a result of failing to manage data privacy effectively.\n4. **Liability**: The possibility of incurring significant liability due to data privacy and security concerns.\n5. **Deterrence of Users**: The risk that current and potential users or customers may be discouraged from using the organization's products and services due to concerns over data privacy and security.\n6. **Computer Viruses and Software Bugs**: Risks associated with technical issues such as viruses, bugs, or defects that could compromise data security.\n7. **Security Breaches**: The threat of unauthorized access to systems and data, which could lead to data loss or exposure.\n8. **Attacks on Systems**: The risk of external attacks targeting the organization's systems, potentially compromising data integrity and security.\n\nThese risks reflect a comprehensive approach to managing and disclosing the organization's vulnerabilities related to data privacy and security.",
      "contexts": [
        "Data Privacy and Security Risks and Management\n \nWe also regularly disclose both our Board’s oversight and our internal processes and procedures for managing risks associated with data collection,\nprivacy, and security, in addition to the related or anticipated impacts of new, existing, and contemplated interpretations of laws and regulations that far\nexceed the proponent’s request.\n \nOur existing disclosures demonstrate our commitment to publicly providing insight into our management of data pr",
        "y providing insight into our management of data privacy and security risks. For example,\nour Annual Report on Form 10-K includes robust disclosures on the most significant risks we face, including risks related to user data collection, privacy,\nand security. In fact, six of our risk factors discuss these risks, and two risk factors give detailed descriptions of these risks and the steps we take to\nmanage them. Specifically, our risk factors disclose:\n \n• The adequacy of our practices with regard",
        "may\nresult in claims, lawsuits, brand or reputational harm, and increased regulatory scrutiny, any of which could harm our\nbusiness, financial condition, and operating results.\nData privacy and security concerns relating to our technology and our practices could harm our\nreputation, cause us to incur significant liability, and deter current and potential users or customers from\nusing our products and services. Computer viruses, software bugs or defects, security breaches, and attacks\non our syst",
        "ition, and operating results and ability to capture future business opportunities.\nData privacy and security concerns relating to our technology and our practices could damage our\nreputation, cause us to incur significant liability, and deter current and potential users or customers from\nusing our products and services. Software bugs or defects, security breaches, and attacks on our systems\ncould result in the improper disclosure and use of user data and interference with our users and customers",
        "s and ability to capture future business opportunities.\nData privacy and security concerns relating to our technology and our practices could damage our\nreputation, cause us to incur significant liability, and deter current and potential users or customers from\nusing our products and services. Software bugs or defects, security breaches, and attacks on our systems\ncould result in the improper disclosure and use of user data and interference with our users’ and customers’\nability to use our produ"
      ],
      "retrieved_docs": 5,
      "top_scores": [
        0.7337528467178345,
        0.7255818247795105,
        0.7104717493057251
      ],
      "sources": [
        "ALPHABET INC. DEF 14A.pdf",
        "ALPHABET INC. DEF 14A.pdf",
        "goog-20231231.pdf",
        "Document.pdf",
        "goog-20211231.pdf"
      ],
      "execution_time": 6.086471080780029,
      "embedding_dim": 384,
      "category": "risks",
      "query_id": 30,
      "difficulty": "hard"
    },
    {
      "question": "What are the company's foreign currency and international risks?",
      "answer": "The company's foreign currency and international risks include:\n\n1. **Fluctuations in Foreign Currency Exchange Rates**: The company is exposed to risks from changes in foreign currency exchange rates against the U.S. dollar, which can impact both international revenues and costs/expenses that are denominated in foreign currencies.\n\n2. **International Revenue Exposure**: A significant portion of the company's revenues (approximately 51% in 2022) comes from international operations, making it vulnerable to foreign currency fluctuations.\n\n3. **Restrictions on Foreign Ownership and Investments**: The company may face regulatory risks related to foreign ownership and investment restrictions in different countries.\n\n4. **Operational Risks in International Markets**: As the company plans to continue growing internationally, it may encounter various operational challenges that are inherent to doing business in foreign markets, which can impact financial performance. \n\nThese risks collectively could harm the company's business, financial condition, and operating results.",
      "contexts": [
        "ancial Statements included in Item 8 of this Annual Report on Form 10-K.\n44.\nTable of Contents\nAlphabet Inc.\nITEM 7A.\nQUANTITATIVE AND QUALITATIVE DISCLOSURES ABOUT MARKET RISK\nWe are exposed to financial market risks, including changes in foreign currency exchange rates, interest rates,\nand equity investment risks.\nForeign Currency Exchange Risk\nWe transact business globally in multiple currencies. International revenues, as well as costs and expenses\ndenominated in foreign currencies, expose u",
        "risks that could harm our business, financial\ncondition, and operating results.\nOur international operations are significant to our revenues and net income, and we plan to continue to grow\ninternationally. International revenues accounted for approximately 51% of our consolidated revenues in 2022. In\naddition to risks described elsewhere in this section, our international operations expose us to other risks, including the\nfollowing:\n•\nrestrictions on foreign ownership and investments, and string",
        "es, interest rates,\nand equity investment risks.\nForeign Currency Exchange Risk\nWe transact business globally in multiple currencies. International revenues, as well as costs and expenses\ndenominated in foreign currencies, expose us to the risk of fluctuations in foreign currency exchange rates against the\nU.S. dollar. Principal currencies hedged included the Australian dollar,  British pound, Canadian dollar,  Euro, and\nJapanese yen. For the purpose of analyzing foreign currency exchange risk, ",
        "lating to our ongoing business\noperations. The primary risk managed is foreign exchange risk. We use foreign currency\ncontracts to reduce the risk that our cash flows, earnings, and investment in foreign\nsubsidiaries will be adversely affected by foreign currency exchange rate fluctuations. We also\nenter into derivative instruments to partially offset our exposure to other risks and enhance\ninvestment returns.\nWe recognize derivative instruments in the Consolidated Balance Sheets at fair value\na",
        "ations are significant to our revenues and net income, and we plan to continue to grow\ninternationally. International revenues accounted for approximately 53% of our consolidated revenues in 2023. In\naddition to risks described elsewhere in this section, our international operations expose us to other risks, including the\nfollowing:\n•\nrestrictions on foreign ownership and investments, and stringent foreign exchange controls that might prevent\nus from repatriating cash earned in countries outside"
      ],
      "retrieved_docs": 5,
      "top_scores": [
        0.7714701890945435,
        0.7606251239776611,
        0.7266892194747925
      ],
      "sources": [
        "goog-20231231.pdf",
        "goog-20221231.pdf",
        "goog-20211231.pdf",
        "goog-20250630.pdf",
        "goog-20231231.pdf"
      ],
      "execution_time": 5.144598007202148,
      "embedding_dim": 384,
      "category": "risks",
      "query_id": 31,
      "difficulty": "hard"
    },
    {
      "question": "How does the company address supply chain and operational disruption risks?",
      "answer": "The provided context does not specify how the company addresses supply chain and operational disruption risks. It primarily outlines the risks associated with manufacturing and supply chain management and emphasizes the potential negative impact on financial condition, operating results, and prospects if these risks are not properly managed. To fully understand how the company addresses these risks, additional information or context would be needed.",
      "contexts": [
        " a range of settings.\nWe face a number of manufacturing and supply chain risks that, if not properly managed, could harm our\nfinancial condition, operating results, and prospects.\nWe face a number of risks related to manufacturing and supply chain management, which could affect our ability\nto supply both our products and our internet-based services.\nWe rely on other companies to manufacture many of our finished products, to design certain of our components\nand parts, and to participate in the di",
        " settings.\nWe face a number of manufacturing and supply chain risks that, if not properly\nmanaged, could harm our financial condition, operating results, and prospects.\nWe face a number of risks related to manufacturing and supply chain management,\nwhich could affect our ability to supply both our products and our internet-based services.\nWe rely on other companies to manufacture many of our assemblies and finished\nproducts, to design certain of our components and parts, and to participate in th",
        "ill depend largely on our\nability to remain a technology leader and continue to provide high-quality, innovative products\nand services that are truly useful and play a valuable role in a range of settings.\nWe face a number of manufacturing and supply chain risks that, if not properly\nmanaged, could harm our financial condition, operating results, and prospects.\nWe face a number of risks related to manufacturing and supply chain management,\nwhich could affect our ability to supply both our produc",
        "y a valuable role in a range of\nsettings.\nWe face a number of manufacturing and supply chain risks that could harm our financial condition,\noperating results, and prospects.\nWe face a number of risks related to manufacturing and supply chain management, which could affect our ability\nto supply both our products and our internet-based services.\nWe rely on other companies to manufacture many of our finished products; to design certain of our components\nand parts; to participate in the distribution",
        "turing and supply chain risks that could harm our business, financial\ncondition, and operating results.\nWe face a number of risks related to manufacturing and supply chain management, which could affect our ability\nto supply both our products and our services.\nWe rely on contract manufacturers to manufacture or assemble our devices as well as servers and networking\nequipment used in our technical infrastructure, certain components of which we may supply. We rely on third parties to\nsupply compon"
      ],
      "retrieved_docs": 5,
      "top_scores": [
        0.7234965562820435,
        0.7034215927124023,
        0.692204475402832
      ],
      "sources": [
        "goog-20201231.pdf",
        "goog-20200930.pdf",
        "goog-20200331.pdf",
        "goog-20211231.pdf",
        "goog-20241231.pdf"
      ],
      "execution_time": 2.3154492378234863,
      "embedding_dim": 384,
      "category": "risks",
      "query_id": 32,
      "difficulty": "medium"
    },
    {
      "question": "What are the company's liquidity and capital resources risks?",
      "answer": "The company's liquidity and capital resources risks include:\n\n1. **Financial Strategy and Reporting Risks**: There are potential challenges related to financial strategy, financial reporting, tax, accounting, and internal control over financial reporting, which could impact the company's liquidity.\n\n2. **Investment Guidelines and Credit Matters**: Risks associated with adherence to investment guidelines and credit and liquidity matters could affect the company's ability to access capital or manage its financial resources effectively.\n\n3. **Diversion of Management Focus**: Management time and focus may be diverted from core operations to address challenges related to acquisitions and strategic transactions, potentially affecting operational efficiency and financial stability.\n\n4. **Unforeseen Expenditures**: Engaging in strategic transactions may lead to unforeseen operating difficulties and expenditures that could strain liquidity and capital resources.\n\n5. **Overall Financial Condition**: Material transactions, such as joint ventures, investments, and divestitures, could significantly impact the company's overall financial condition and operating results, posing risks to liquidity.\n\nThese factors collectively create a complex environment where the company's ability to manage its liquidity and capital resources may be compromised.",
      "contexts": [
        "use of capital, and these transactions could be material to our financial condition and operating results. We expect\nto continue to evaluate and enter into discussions regarding a wide array of such potential strategic transactions, which\ncould create unforeseen operating difficulties and expenditures. Some of the areas where we face risks include:\n•\ndiversion of management time and focus from operating our business to challenges related to acquisitions and\nother strategic transactions;\n•\nfailur",
        "s, joint ventures, investments and divestitures are important elements of our\noverall corporate strategy and use of capital, and these transactions could be material to our\nfinancial condition and operating results. We expect to continue to evaluate and enter into\ndiscussions regarding a wide array of potential strategic transactions, which could create\nunforeseen operating difficulties and expenditures. Some of the areas where we face risks\ninclude:\n•\nDiversion of management time and focus from",
        "\n \nRisks and exposures associated with (1) financial matters, in particular, financial strategy, financial reporting, tax,\naccounting, disclosure, internal control over financial reporting, investment guidelines and credit and liquidity\nmatters; (2) data privacy and security, competition, legal, regulatory, compliance, civil and human rights,\nsustainability, and reputational risks; and (3) our operations and infrastructure, particularly reliability, business\ncontinuity, and capacity.\nLeadership ",
        "7.7% stake in the company. This agreement is subject to\nregulatory review in India and is expected to be completed later this year.\nOur principal sources of liquidity are our cash, cash equivalents, and marketable\nsecurities, as well as the cash flow that we generate from our operations. The primary use of\ncapital continues to be to invest for the long term growth of the business. We regularly\nevaluate our cash and capital structure, including the size, pace and form of capital return to\nstockho",
        "rily an\nindication of the current fair value as of the balance sheet date. These investments, especially those that are in the\nearly stages, are inherently risky because the technologies or products these companies have under development are\ntypically in the early phases and may never materialize, and they may experience a decline in financial condition, which\ncould result in a loss of a substantial part of our investment in these companies. The success of our investment in any\nprivate company i"
      ],
      "retrieved_docs": 5,
      "top_scores": [
        0.6442602276802063,
        0.6205814480781555,
        0.6199350357055664
      ],
      "sources": [
        "goog-20211231.pdf",
        "goog-20200331.pdf",
        "ALPHABET INC. DEF 14A.pdf",
        "goog-20200630.pdf",
        "goog-20211231.pdf"
      ],
      "execution_time": 8.838934898376465,
      "embedding_dim": 384,
      "category": "risks",
      "query_id": 33,
      "difficulty": "medium"
    },
    {
      "question": "How does the company manage interest rate and credit risks?",
      "answer": "The company manages interest rate risk by investing primarily in a diversified portfolio of debt securities, including both fixed rate and floating rate instruments. This diversification helps mitigate the impact of interest rate fluctuations on the fair market value of their investments. Additionally, the company employs a strategy aimed at achieving a return that preserves capital and maintains liquidity, which is important in managing overall financial risk.\n\nTo manage credit risk, the company implements a policy that limits the amount of credit exposure to any one issuer. This policy helps to reduce the potential negative impact on the company's financial health should any single issuer face financial difficulties. By spreading their investments across various issuers and types of debt securities, the company aims to minimize the risks associated with defaults or credit downgrades.",
      "contexts": [
        "ty. We invest primarily in debt securities including those of the U.S. government and its agencies,\ncorporate debt securities, mortgage-backed securities, money market and other funds, municipal securities, time\ndeposits, asset backed securities, and debt instruments issued by foreign governments. By policy, we limit the amount\nof credit exposure to any one issuer. Our investments in both fixed rate and floating rate interest earning securities\ncarry a degree of interest rate risk. Fixed rate se",
        "d its agencies, corporate debt securities, mortgage-backed securities,\nmoney market and other funds, municipal securities, time deposits, asset backed securities,\nand debt instruments issued by foreign governments. By policy, we limit the amount of credit\nexposure to any one issuer. Our investments in both fixed rate and floating rate interest\nearning securities carry a degree of interest rate risk. Fixed rate securities may have their fair\nmarket value adversely affected due to a rise in intere",
        " be expected to\noffset a corresponding foreign currency translation gain or loss from our investment in foreign subsidiaries.\nInterest Rate Risk\nOur Corporate Treasury investment strategy is to achieve a return that will allow us to preserve capital and\nmaintain liquidity. We invest primarily in debt securities, including government bonds, corporate debt securities,\nmortgage-backed and asset-backed securities, money market and other funds, time deposits, and interest rate\nderivatives. By policy,",
        "able.\nCredit Risks\nWe are subject to credit risk primarily from cash equivalents, marketable debt securities, derivative financial\ninstruments, including foreign exchange contracts, and accounts receivable. We manage our credit risk exposure\nthrough timely assessment of our counterparty creditworthiness, credit limits and use of collateral management.\nForeign exchange contracts are transacted with various financial institutions with high credit standing. Accounts\nreceivable are typically unsecur",
        "thiness of customers based on ongoing credit evaluations. We also consider\ncustomer-specific information, current market conditions, and reasonable and supportable forecasts of future economic\nconditions.\nOther\nOur financial instruments also include debt and equity investments in companies with which we also entered into\ncommercial arrangements at or near the same time. For these transactions, judgment is required in assessing the\nsubstance of the arrangements, including assessing whether the co"
      ],
      "retrieved_docs": 5,
      "top_scores": [
        0.5733915567398071,
        0.5605191588401794,
        0.5596131682395935
      ],
      "sources": [
        "Document.pdf",
        "goog-20200630.pdf",
        "goog-20231231.pdf",
        "goog-20231231.pdf",
        "goog-20231231.pdf"
      ],
      "execution_time": 2.6181859970092773,
      "embedding_dim": 384,
      "category": "risks",
      "query_id": 34,
      "difficulty": "hard"
    },
    {
      "question": "What are the company's environmental, social, and governance (ESG) risks?",
      "answer": "The company's environmental, social, and governance (ESG) risks include:\n\n1. **Potential Liabilities**: Expectations related to ESG considerations may lead to legal liabilities if the company fails to comply with emerging laws and regulations.\n\n2. **Increased Costs**: Compliance with new laws, regulations, and policies regarding sustainability and climate change may result in higher operational costs.\n\n3. **Reputational Harm**: Negative perceptions or backlash from stakeholders regarding the company's ESG practices could damage its reputation and brand value.\n\n4. **Regulatory Compliance**: The company is subject to a variety of laws and regulations that govern ESG matters, which means it must navigate a complex regulatory landscape that is continually evolving.\n\n5. **Exposure to Market Changes**: Changes in international accords or public sentiment regarding environmental sustainability and social governance could impact the company's operations and market position.\n\n6. **Human Capital Risks**: Issues related to workforce diversity and human capital management may pose challenges that affect employee relations and overall company performance.\n\nThese risks highlight the importance of robust oversight and management of ESG factors to mitigate potential negative impacts on the company and its stakeholders.",
      "contexts": [
        " the best interests of our company\nand our stockholders and recommends a vote AGAINST this proposal.\n \nOur Board Already Has Robust Oversight of ESG Risks and Opportunities\n \nBuilding a sustainable company and contributing to a sustainable future has long been core to our corporate DNA. Our Board oversees the risks and\nexposures associated with environmental sustainability and climate change, and the Audit Committee, per its charter, reviews and discusses with\nmanagement our major risk exposures",
        "on, and operating results.\nExpectations relating to ESG considerations could expose us to potential liabilities, increased costs, and\nreputational harm.\nWe are subject to laws, regulations, and other measures that govern a wide range of topics, including those\nrelated to matters beyond our core products and services. For instance, new laws, regulations, policies, and\ninternational accords relating to ESG matters, including sustainability, climate change, human capital, and diversity, are\nbeing d",
        "ronmental, social, and governance (ESG) considerations could expose us to\npotential liabilities, increased costs, and reputational harm.\nWe are subject to laws, regulations, and other measures that govern a wide range of topics, including those\nrelated to matters beyond our core products and services. For instance, new laws, regulations, policies, and\ninternational accords relating to ESG matters, including sustainability, climate change, human capital, and diversity, are\nbeing developed and for",
        "ee members of large corporations,\n“How prepared are we to deal with climate risk”? Globally 42% of respondents indicated that their company’s “climate response is not as swift and robust\nas they would like” and almost half “do not believe that they are well-equipped to fulfil their climate regulatory responsibilities.” Deloitte called the\nresponses “sobering.”\n \nWith over 78 offices in more than 50 countries, Alphabet has a major international presence. Though ESG or environmental, social and co",
        "es and barriers, forced labor concerns, sustainability\nsourcing requirements, geopolitical tensions, armed conflicts, natural disasters or pandemics, the effects of climate\nchange (such as sea level rise, drought, flooding, heat waves, wildfires and resultant air quality effects and power\nshutdowns associated with wildfire prevention, and increased storm severity), power and transmission availability, and\nsignificant changes in the financial or business condition of our suppliers. Some of the co"
      ],
      "retrieved_docs": 5,
      "top_scores": [
        0.734345018863678,
        0.6580413579940796,
        0.6484947204589844
      ],
      "sources": [
        "ALPHABET INC. DEF 14A.pdf",
        "goog-20231231.pdf",
        "goog-20221231.pdf",
        "ALPHABET INC. DEF 14A.pdf",
        "goog-20241231.pdf"
      ],
      "execution_time": 6.399601936340332,
      "embedding_dim": 384,
      "category": "risks",
      "query_id": 35,
      "difficulty": "medium"
    },
    {
      "question": "How does the company address climate change and environmental risks?",
      "answer": "The company addresses climate change and environmental risks by publishing regular assessments of its resilience to the physical risks associated with climate change. This includes detailing the measures it is taking in the short, medium, and long term to mitigate these risks, particularly those affecting its headquarters and key assets from threats like sea level rise and flooding. \n\nAdditionally, the company emphasizes the oversight of climate-related risks through its Board, which includes the Audit Committee's role in reviewing sustainability risks. The company has established processes for identifying and assessing these risks and has defined management's responsibilities in managing both risks and opportunities related to climate change. This approach aligns with the recommendations from the Task Force on Climate-related Financial Disclosures (TCFD) and demonstrates a commitment to environmental sustainability and proactive risk management.",
      "contexts": [
        " that Alphabet (“the Company”) publish a regular periodic assessment of resilience to the physical risks of climate\nchange, including description of short-, medium-, and long-term measures that the Company is taking to mitigate physical risks, including threats to its\nheadquarters and other key assets from sea level rise and flooding. The report should be completed at reasonable cost and omit proprietary information.\n \nSupporting Statement:\n \nS&P Global states that nearly 60% of companies in the",
        "o\noversee and review policies and provide guidance on matters relating to environmental sustainability.\n \nSUPPORTING STATEMENT\n \nAs one of the largest corporations in the world, our company’s exposure to environmental sustainability and issues around climate change are\nconsiderable and could substantially affect our bottom line.\n \nIn a recent report put out by consulting firm Deloitte titled “Addressing Climate Change”1 the firm asked 353 committee members of large corporations,\n“How prepared ar",
        "his disclosure aligns with TCFD’s recommendations and contains, among others, a description of:\n \n• Our Board’s oversight of climate-related risks and opportunities, including oversight responsibilities of the Audit Committee of sustainability risks;\n• Our processes for identifying and assessing climate-related risks, as described above;\n• Management’s role in assessing and managing risks and opportunities;\n• The climate-related risks and opportunities we have identified over the short, medium, ",
        "ovide the necessary information to\nunderstand the scope of the company’s lobbying\nactivities, including as it relates to our positions on\nclimate change and the Paris Agreement\n(7)\nStockholder proposal regarding a report on physical risks of\nclimate change (page 74 )\n \nAGAINST\n \nWe conduct a robust climate risk assessment and already\npublish information on this assessment, as well as on our\nclimate strategies and performance, through our annual\nCDP and Environmental Reports\n(8)\nStockholder propo",
        "environmental sustainability policies and practices will only strengthen\nthe bottom line and reinforce our company’s position as an industry leader in environmental stewardship. The significant risks associated with climate\nchange warrant more fine-tuned accountability and responsibility at the board level. The issue at hand and this proposal seems to go beyond ordinary\nbusiness and for that reason we urge shareholders to support it.\n \n \n \n(1)\nhttps://www.lexology.com/library/detail.aspx?g=9db08"
      ],
      "retrieved_docs": 5,
      "top_scores": [
        0.7071665525436401,
        0.7055565118789673,
        0.7031524777412415
      ],
      "sources": [
        "ALPHABET INC. DEF 14A.pdf",
        "ALPHABET INC. DEF 14A.pdf",
        "ALPHABET INC. DEF 14A.pdf",
        "ALPHABET INC. DEF 14A.pdf",
        "ALPHABET INC. DEF 14A.pdf"
      ],
      "execution_time": 3.7302870750427246,
      "embedding_dim": 384,
      "category": "risks",
      "query_id": 36,
      "difficulty": "medium"
    },
    {
      "question": "What are the company's intellectual property and patent risks?",
      "answer": "The company's intellectual property and patent risks include:\n\n1. **Indemnification for Liabilities**: The company has agreed to provide indemnification for potential liabilities related to intellectual property claims, which could incur significant costs.\n\n2. **Litigation and Settlement Expenses**: Intellectual property claims can be time-consuming and expensive to litigate or settle, regardless of their merits.\n\n3. **Harm to Business Operations**: Successful claims could negatively impact the company's business, affecting product and service offerings, financial condition, and operating results.\n\n4. **Changes in Tax Legislation**: The company could be subject to changes in tax rates or new legislation, which could affect its financial position in relation to intellectual property.\n\n5. **Insufficient Protection**: There is a risk that the scope of protection gained from patents may be inadequate, or that issued patents could be deemed invalid or unenforceable.\n\n6. **Compromise of Trade Secrets**: The company seeks to maintain certain intellectual property as trade secrets, and any compromise of these secrets could result in a loss of competitive advantage.\n\n7. **Trademarks Risks**: There are risks associated with trademarks, such as the potential for the trademark \"Google\" to be challenged or deemed at risk. \n\nOverall, these risks highlight the",
      "contexts": [
        "ection with our divestitures, we have agreed, and\nmay in the future agree, to provide indemnification for certain potential liabilities, including\nthose associated with intellectual property claims.\nRegardless of their merits, intellectual property claims are often time consuming and\nexpensive to litigate or settle. To the extent such claims are successful, they may harm our\nbusiness, including our product and service offerings, financial condition, or operating results.\nRisks Related to Ownersh",
        "r certain potential liabilities, including those associated with intellectual property claims.\nRegardless of their merits, intellectual property claims are often time consuming and expensive to litigate or settle. To\nthe extent such claims are successful, they could harm our business, including our product and service offerings,\nfinancial condition, and operating results.\nWe could be subject to changes in tax rates, the adoption of new U.S. or international tax legislation, or\nexposure to additi",
        "ur efforts, that the scope of the protection gained will be insufficient or that an issued\npatent may be deemed invalid or unenforceable.\nWe also seek to maintain certain intellectual property as trade secrets. The secrecy of such trade secrets and\nother sensitive information could be compromised, which could cause us to lose the competitive advantage resulting\nfrom these trade secrets. We also face risks associated with our trademarks. For example, there is a risk that the word\n“Google” could b",
        "o be important. Furthermore,\nthere is always the possibility, despite our efforts, that the scope of the protection gained will\nbe insufficient or that an issued patent may be deemed invalid or unenforceable.\nWe also seek to maintain certain intellectual property as trade secrets. The secrecy of\nsuch trade secrets and other sensitive information could be compromised, which could cause\nus to lose the competitive advantage resulting from these trade secrets. We also face risks\nassociated with our ",
        "brand.\nAny significant impairment of our intellectual property rights could harm our business and our ability to compete.\nAlso, protecting our intellectual property rights is costly and time consuming. Any increase in the unauthorized use of\nour intellectual property could make it more expensive to do business and harm our operating results.\nOur business depends on strong brands, and failing to maintain and enhance our brands would hurt our\nability to expand our base of users, advertisers, custo"
      ],
      "retrieved_docs": 5,
      "top_scores": [
        0.6927340030670166,
        0.6627287268638611,
        0.6565073132514954
      ],
      "sources": [
        "goog-20200331.pdf",
        "goog-20241231.pdf",
        "goog-20201231.pdf",
        "goog-20200331.pdf",
        "goog-20211231.pdf"
      ],
      "execution_time": 8.905647039413452,
      "embedding_dim": 384,
      "category": "risks",
      "query_id": 37,
      "difficulty": "hard"
    },
    {
      "question": "What are the company's data privacy and regulatory compliance risks?",
      "answer": "The company's data privacy and regulatory compliance risks include:\n\n1. **Reputation Damage**: Concerns about the company's practices regarding the collection, use, disclosure, or security of personal information can harm its reputation, even if these concerns are unfounded.\n\n2. **Financial Impact**: Issues related to data privacy and security may lead to monetary liabilities or penalties, which could adversely affect the company’s financial condition.\n\n3. **Operational Disruption**: Regulatory scrutiny or changes may require the company to alter its business practices in a way that could negatively affect its operations.\n\n4. **Evolving Regulations**: The rapidly changing landscape of privacy and data protection regulations poses a risk, as adverse interpretations of these laws could impact the company's compliance status and operational results.\n\n5. **Resource Allocation**: Managing data privacy and security risks demands significant time, attention, and resources from management, potentially diverting them from other business priorities.\n\n6. **Increased Oversight**: The need for ongoing disclosure regarding the Board’s oversight and internal processes related to data management may impose additional operational burdens.\n\nOverall, these risks highlight the importance of maintaining robust data privacy practices and staying ahead of regulatory changes to mitigate potential negative impacts on the business.",
      "contexts": [
        "data and interference with our users and customers’\nability to use our products and services, harming our business operations and reputation.\nConcerns about our practices with regard to the collection, use, disclosure, or security of personal information or\nother data-privacy-related matters, even if unfounded, could harm our reputation, financial condition, and operating\nresults. Our policies and practices may change over time as expectations regarding privacy and data change.\nOur products and ",
        "Data Privacy and Security Risks and Management\n \nWe also regularly disclose both our Board’s oversight and our internal processes and procedures for managing risks associated with data collection,\nprivacy, and security, in addition to the related or anticipated impacts of new, existing, and contemplated interpretations of laws and regulations that far\nexceed the proponent’s request.\n \nOur existing disclosures demonstrate our commitment to publicly providing insight into our management of data pr",
        "ant time and attention of our management and\nother resources, may result in monetary liabilities or penalties, and may require us to change\nour business in an adverse manner.\nPrivacy and data protection regulations are complex and rapidly evolving areas.\nAdverse interpretations of these laws could harm our business, reputation, financial\ncondition, and operating results.\nAuthorities around the world have adopted and are considering a number of legislative\nand regulatory proposals concerning data",
        "nificance of privacy, regulatory scrutiny is likely to only increase going forward. Companies who wish to\nremain competitive must stay ahead of the regulatory curve by proactively managing, mitigating, and disclosing information about such issues.\n \nAlphabet is particularly exposed to these risks. Unfortunately, the company may not be adequately managing these risks and lacks transparency in its\nhandling of such issues, as evidenced by multiple Congressional inquiries regarding the Company’s dat",
        "may\nresult in claims, lawsuits, brand or reputational harm, and increased regulatory scrutiny, any of which could harm our\nbusiness, financial condition, and operating results.\nData privacy and security concerns relating to our technology and our practices could harm our\nreputation, cause us to incur significant liability, and deter current and potential users or customers from\nusing our products and services. Computer viruses, software bugs or defects, security breaches, and attacks\non our syst"
      ],
      "retrieved_docs": 5,
      "top_scores": [
        0.753282904624939,
        0.7497662305831909,
        0.7371515035629272
      ],
      "sources": [
        "Document.pdf",
        "ALPHABET INC. DEF 14A.pdf",
        "goog-20200930.pdf",
        "ALPHABET INC. DEF 14A.pdf",
        "goog-20231231.pdf"
      ],
      "execution_time": 5.754647970199585,
      "embedding_dim": 384,
      "category": "risks",
      "query_id": 38,
      "difficulty": "medium"
    },
    {
      "question": "What are the company's key person risks and dependency on key personnel?",
      "answer": "The company's key person risks and dependency on key personnel are significant due to several factors:\n\n1. **At-Will Employment**: All executive officers and key employees are at-will employees, meaning they can leave the company at any time without notice. This increases the risk of losing important personnel unexpectedly.\n\n2. **Lack of Key-Person Insurance**: The company does not maintain any key-person life insurance policies. This means that if a key employee were to pass away or become unable to work, the company would not have financial protection or resources to help manage the impact of that loss.\n\n3. **Impact on Business Operations**: The loss of key personnel could seriously harm the business, affecting its ability to function effectively. These individuals play crucial roles in technology development, maintaining corporate culture, and setting strategic direction.\n\n4. **Dependency on Highly Skilled Personnel**: The company's performance and future success largely depend on the talents and efforts of highly skilled individuals. If the company fails to retain, motivate, or hire qualified personnel, it may struggle to grow and achieve its objectives.\n\n5. **Corporate Culture Maintenance**: The ability to maintain a strong corporate culture is linked to the retention of key personnel. If the company cannot uphold its culture, it may lead to decreased employee morale",
      "contexts": [
        " the development of our technology, maintaining our culture and setting our strategic direction. All of\nour executive officers and key employees are at-will employees, and we do not maintain any key-person life insurance\npolicies. The loss of key personnel could seriously harm our business.\nWe rely on highly skilled personnel and, if we are unable to retain or motivate key personnel, hire qualified\npersonnel, or maintain our corporate culture, we may not be able to grow effectively.\nOur performa",
        "ure and setting our strategic direction. All of our executive\nofficers and key employees are at-will employees, and we do not maintain any key-person life\ninsurance policies. The loss of key personnel could seriously harm our business.\nWe rely on highly skilled personnel and, if we are unable to retain or motivate key\npersonnel, hire qualified personnel, or maintain our corporate culture, we may not be\nable to grow effectively.\nOur performance largely depends on the talents and efforts of highly",
        " The loss of key personnel could seriously\nharm our business.\nWe rely on highly skilled personnel and, if we are unable to retain or motivate key\npersonnel, hire qualified personnel, or maintain our corporate culture, we may not be\nable to grow effectively.\nOur performance largely depends on the talents and efforts of highly skilled individuals.\nOur future success depends on our continuing ability to identify, hire, develop, motivate, and\nretain highly skilled personnel for all areas of our orga",
        "our senior management\nteam. For instance, Sundar Pichai is critical to the overall management of Alphabet and its subsidiaries and plays an\nimportant role in the development of our technology. He also plays a key role in maintaining our culture and setting our\nstrategic direction. All of our executive officers and key employees are at-will employees, and we do not maintain any\nkey-person life insurance policies. The loss of key personnel could seriously harm our business.\nWe rely on highly skill",
        "large part upon the continued service of key members of\nour senior management team. For instance, Sundar Pichai is critical to the overall\nmanagement of Alphabet and its subsidiaries and plays an important role in the development\nof our technology. He also plays a key role in maintaining our culture and setting our strategic\ndirection. All of our executive officers and key employees are at-will employees, and we do not\nmaintain any key-person life insurance policies. The loss of key personnel co"
      ],
      "retrieved_docs": 5,
      "top_scores": [
        0.69832444190979,
        0.6375538110733032,
        0.6319223046302795
      ],
      "sources": [
        "goog-20201231.pdf",
        "goog-20200331.pdf",
        "goog-20200930.pdf",
        "Document.pdf",
        "goog-20200630.pdf"
      ],
      "execution_time": 5.593543291091919,
      "embedding_dim": 384,
      "category": "risks",
      "query_id": 39,
      "difficulty": "medium"
    },
    {
      "question": "Who are the members of the company's board of directors?",
      "answer": "The specific names of the members of the company's Board of Directors are not provided in the context. However, it mentions that the board consists of Outside Directors, some of whom have experience as presidents or trustees of significant academic, research, and philanthropic institutions, as well as entrepreneurial experience and expertise in developing or managing technology companies. For the actual names of the members, you would need to refer to the company's official documentation or website.",
      "contexts": [
        "and board committees of other public companies,\nand have an understanding of corporate governance practices and trends, different business processes, challenges, and strategies. Other directors\nhave experience as presidents or trustees of significant academic, research, and philanthropic institutions, which brings unique perspectives to the\nBoard of Directors. Further, our directors also have other experience that makes them valuable members, such as entrepreneurial experience and\nexperience dev",
        "the Corporation’s compensation committee and the governance and nominating committee (or such\ncommittees serving similar functions as the Board of Directors of the Corporation shall constitute from time to time) shall consist of at least two\n(2) members of the Board of Directors and shall be composed entirely of Outside Directors. In the event the number of Outside Directors\nserving on the Board of Directors constitutes less than a majority of the directors on the Board of Directors as a result ",
        " Directors. Further, our directors also have other experience that makes them valuable members, such as entrepreneurial experience and experience developing technology or managing technology companies, which provides insight into strategic and operational issues faced by us. The Nominating and Corporate Governance Committee and the Board of Directors believe that the above-mentioned attributes, along with the leadership skills and other experiences of our board members described below, provide u",
        "Back to Contents\nDIRECTORS, EXECUTIVE OFFICERS, AND CORPORATE GOVERNANCE Corporate Governance Highlights Our Board of Directors is composed of highly experienced directors who have led, advised, and established leading global organizations and institutions. Our Board of Directors has taken a thoughtful approach to board composition to ensure that our directors have backgrounds that collectively add significant value to the strategic decisions made by the Company and that enable them to provide o",
        "\nthe Board of Directors and the respective committees of the Board of Directors, and the qualifications of candidates in light of these needs.\nCandidates may come to the attention of the Nominating and Corporate Governance Committee through stockholders, management, current\nmembers of the Board of Directors, or search firms. The evaluation of these candidates may be based solely upon the information provided to the\nNominating and Corporate Governance Committee or may also include discussions wit"
      ],
      "retrieved_docs": 5,
      "top_scores": [
        0.7113039493560791,
        0.7099515199661255,
        0.7060593366622925
      ],
      "sources": [
        "ALPHABET INC. - DEF 14A_3.pdf",
        "ALPHABET INC. DEF 14A.pdf",
        "lgoog2020_def14a.pdf",
        "lgoog2020_def14a.pdf",
        "ALPHABET INC. - DEF 14A_3.pdf"
      ],
      "execution_time": 3.055785894393921,
      "embedding_dim": 384,
      "category": "governance",
      "query_id": 40,
      "difficulty": "easy"
    },
    {
      "question": "What is the executive compensation structure for the CEO and other named executive officers?",
      "answer": "The executive compensation structure for the CEO and other named executive officers primarily consists of a combination of GSUs (Global Stock Units) and PSUs (Performance Stock Units). The majority of their compensation is tied to long-term company performance, with payouts based on the achievement of specific performance metrics. This structure is designed to attract and retain top talent, support a culture of innovation and performance, and align the interests of employees with those of stockholders. The Compensation Committee, through discussions with management, incorporates future company performance expectations into their compensation decisions.",
      "contexts": [
        " the strategic, financial, and execution risks and exposures associated with the financial, operational, and capital decisions that serve as inputs\nto our compensation programs.\n●Through discussions with management, the Compensation Committee gains insight into a reasonable range of future company performance\nexpectations. This information is incorporated into decisions regarding the compensation of our named executive officers.\n●The majority of compensation provided to our named executive offic",
        "ur compensation programs. •Through discussions with management, the Leadership Development and Compensation Committee gains insight into a reasonable range of future company performance expectations. This information is incorporated into decisions regarding compensation of our named executive officers. •The majority of compensation provided to our named executive officers is delivered in GSUs and/or PSUs, with payout based on long-term company performance. As compensation of our named executive ",
        "for five named executive officers during the\nfiscal year ended December 31, 2020:\n \n \nSection 1—Executive Summary\n \nCompensation Philosophy\n \nWe designed our employee and executive compensation programs to support three goals:\n \n• Attract and retain the world’s best talent\n• Support our culture of innovation and performance\n• Align employee and stockholder interests\n \nWe pay employees competitively compared to other opportunities they might have in the market. Additionally, we offer competitive ",
        " basis, the compensation paid to our named executive officers as described in this proxy statement, for the reasons below. Sound Program Design Best Practices in Executive Compensation We design our executive officer compensation programs to attract and retain the world’s best talent, support Alphabet’s culture of innovation and performance, and align employee and stockholder interests. We achieve our objectives through compensation that: Provides a competitive total pay opportunity Consists pri",
        " help achieve these objectives, we structure our named executive officers’ compensation to reward the achievement of short-term and long-term strategic and operational goals. You are being asked to approve the following resolution at the Annual Meeting: Resolved, that the stockholders approve, on an advisory basis, the compensation awarded to Alphabet’s named executive officers, as disclosed under SEC rules, including the Compensation Discussion and Analysis, the compensation tables, and related"
      ],
      "retrieved_docs": 5,
      "top_scores": [
        0.743262767791748,
        0.7228165864944458,
        0.7187700271606445
      ],
      "sources": [
        "ALPHABET INC. - DEF 14A_2.pdf",
        "lgoog2020_def14a.pdf",
        "ALPHABET INC. - DEF 14A_3.pdf",
        "lgoog2020_def14a.pdf",
        "lgoog2020_def14a.pdf"
      ],
      "execution_time": 3.650512218475342,
      "embedding_dim": 384,
      "category": "governance",
      "query_id": 41,
      "difficulty": "hard"
    },
    {
      "question": "What are the company's corporate governance policies and practices?",
      "answer": "The company's corporate governance policies and practices include:\n\n1. **Effective Access to Board and Management**: They promote transparency and accountability by allowing stockholders to effectively communicate with the Board and management.\n\n2. **Special Meetings of Stockholders**: The bylaws permit special meetings to be called, facilitating stockholder engagement.\n\n3. **Evaluation of Stockholder Proposals**: The company evaluates stockholder proposals submitted for consideration at the annual meeting and provides appropriate oversight.\n\n4. **Enhancing Communication**: The governance practices involve recommending ways to improve communications and relations with stockholders.\n\n5. **Risk Oversight**: There is oversight of risks and exposures related to directors and management, ensuring that governance issues are addressed.\n\n6. **Governance Committee Responsibilities**: The Governance Committee oversees the evaluation of the Board and management, updates corporate governance principles, and evaluates the composition of the Board and its committees, including aspects such as diversity, size, and tenure.\n\n7. **Director Nominee Policy**: The company establishes a policy for considering director nominees and evaluates candidates for election consistent with this policy.\n\nOverall, these practices emphasize stakeholder engagement, risk management, and the ongoing evaluation and enhancement of corporate governance.",
      "contexts": [
        "nancial burdens on the company with no corresponding\nbenefit to our stockholders.\n \nOur corporate governance practices give our stockholders effective access to our Board and management, promoting\ntransparency and accountability\n \nOur corporate governance practices provide meaningful opportunities for our stockholders to communicate their priorities and concerns with our Board,\nmanagement, and other stockholders. Such practices include:\n \n• Our bylaws provide that special meetings of stockholder",
        "ce framework and the Corporate\nGovernance Guidelines and considering corporate governance issues that may arise from time to time, and developing appropriate\nrecommendations to our Board.\n \n• Evaluating stockholder proposals submitted to Alphabet for consideration at the annual meeting of stockholders and providing appropriate\noversight.\n \n• Recommending ways to enhance communications and relations with our stockholders.\n \n• Overseeing risks and exposures associated with director and management ",
        "ate Governance Guidelines, to oversee the evaluation of the Board and management, and to\ndevelop and update our corporate governance principles. The Governance Committee’s responsibilities include but are not limited to:\n \n \n• Evaluating Board and Committee composition, including diversity, size, tenure, organization, and governance and determining future\nrequirements.\n \n• Establishing a policy for considering director nominees; evaluating and recommending candidates for election consistent with",
        "ance Guidelines and considering corporate governance issues that may arise from time to time, and developing appropriate\nrecommendations to our Board.\n \n• Evaluating stockholder proposals submitted to Alphabet for consideration at the annual meeting of stockholders and providing appropriate\noversight.\n \n \n• Recommending ways to enhance communications and relations with our stockholders.\n \n• Overseeing risks and exposures associated with director and management succession planning, corporate gove",
        "a set by our Board and as provided in the Corporate Governance Guidelines, to oversee the evaluation of the Board and management, and to\ndevelop and update our corporate governance principles. The Governance Committee’s responsibilities include but are not limited to:\n \n \n• Evaluating Board and Committee composition, including size, tenure, organization, and governance and determining future requirements.\n \n• Establishing a policy for considering director nominees; evaluating and recommending ca"
      ],
      "retrieved_docs": 5,
      "top_scores": [
        0.6574668884277344,
        0.6313298344612122,
        0.6232477426528931
      ],
      "sources": [
        "ALPHABET INC. - DEF14A.pdf",
        "ALPHABET INC. - DEF14A.pdf",
        "ALPHABET INC. - DEF 14A.pdf",
        "ALPHABET INC. - DEF 14A.pdf",
        "ALPHABET INC. - DEF14A.pdf"
      ],
      "execution_time": 7.189799070358276,
      "embedding_dim": 384,
      "category": "governance",
      "query_id": 42,
      "difficulty": "medium"
    },
    {
      "question": "How does the company handle related party transactions and conflicts of interest?",
      "answer": "The company handles related party transactions and conflicts of interest through a structured review and assessment process involving the Audit Committee. Here's a summary of the key steps:\n\n1. **Identification of Relationships**: The company reviews all known relationships and transactions involving Alphabet's directors, executive officers, significant stockholders, and their immediate family members to identify any direct or indirect interests in transactions.\n\n2. **Annual Review**: The Audit Committee conducts an annual review of ongoing relationships with related parties to ensure compliance with its guidelines and to assess whether the related party transactions remain appropriate.\n\n3. **Decision Making**: Based on relevant facts and circumstances, the Audit Committee decides whether it is in the best interests of Alphabet and its stockholders to continue, modify, or terminate a related party transaction.\n\n4. **Participation Restrictions**: Individuals involved in a transaction under review are prohibited from participating in the deliberations or voting on the approval of that transaction.\n\n5. **Guidelines for Ongoing Transactions**: If a related party transaction is ongoing, the Audit Committee may establish specific guidelines to govern future dealings with that related party.\n\nThrough these measures, the company aims to monitor and manage potential conflicts of interest effectively.",
      "contexts": [
        "not a related party transaction under\nour policy if such related party’s interest in such transaction arises only from an ownership interest of less than five percent in, or as a director of, such\nentity that is a party to the transaction.\n \nWe review all known relationships and transactions in which Alphabet and our directors, executive officers, and significant stockholders or their\nimmediate family members are participants to determine whether such persons have a direct or indirect interest. ",
        " dealings with the related party.\nThereafter, the Audit Committee, on at least an annual basis, will review and assess ongoing relationships with the related party to monitor compliance\nwith the Audit Committee’s guidelines and that the related party transaction remains appropriate. Based on all relevant facts and circumstances, the Audit\nCommittee will determine if it is in the best interests of Alphabet and its stockholders to continue, modify, or terminate the related party transaction.\n \nALP",
        " to a transaction under review may not participate in the deliberations or vote on\nthe approval of the transaction.\n \nIf a related party transaction will be ongoing, the Audit Committee may establish guidelines for us to follow in our ongoing dealings with the related party.\nThereafter, the Audit Committee, on at least an annual basis, will review and assess ongoing relationships with the related party to monitor compliance\nwith the Audit Committee’s guidelines and that the related party transac",
        "partnership, or other entity in which any of the persons listed above is a general partner or principal or in a similar position or in which any of the persons listed above has a five percent or greater beneficial ownership interest. A related party is not deemed to have a direct or indirect material interest in a transaction and such transaction is not a related party transaction under our policy if such related party’s interest in such transaction arises only from an ownership interest of less",
        "d above has a five percent or greater beneficial ownership interest.\n \nA related party is not deemed to have a direct or indirect material interest in a transaction and such transaction is not a related party transaction under\nour policy if such related party’s interest in such transaction arises only from an ownership interest of less than five percent in, or as a director of, such\nentity that is a party to the transaction.\n \nWe review all known relationships and transactions in which Alphabet "
      ],
      "retrieved_docs": 5,
      "top_scores": [
        0.6706288456916809,
        0.6474795341491699,
        0.6309939026832581
      ],
      "sources": [
        "ALPHABET INC. - DEF 14A.pdf",
        "ALPHABET INC. DEF 14A.pdf",
        "ALPHABET INC. - DEF14A.pdf",
        "lgoog2020_def14a.pdf",
        "ALPHABET INC. - DEF14A.pdf"
      ],
      "execution_time": 6.601423978805542,
      "embedding_dim": 384,
      "category": "governance",
      "query_id": 43,
      "difficulty": "hard"
    },
    {
      "question": "What is the company's policy on stock ownership by directors and executives?",
      "answer": "The company's policy requires that each director must own shares of Alphabet stock equal in value to at least $1.0 million. Directors have five years from the date they become a director to comply with this ownership requirement. As of December 31, 2020, all directors either met this minimum stock ownership guideline or were within the grace period to achieve compliance.",
      "contexts": [
        " Stockholders will have final approval over whether directors receive what directors\npropose. Stockholders will vote on director compensation as disclosed in the proxy statement for a stockholder meeting before the fiscal year in which\ndirectors receive that compensation. Stock owned by directors will not count in the vote, so the vote result represents the independent views of\nstockholders.\n \nWe urge stockholders to approve this bylaw amendment and assume proper authority over the compensation ",
        "t such approval is obtained, for so long as shares of the capital stock of the Corporation are listed on either the Nasdaq or the NYSE\nand the Corporation remains eligible for the Controlled Company Exemption under the requirements of the applicable Exchange Governance\nRules, then the Board of Directors shall be constituted such that (i) a majority of the directors on the Board of Directors shall be Outside\nDirectors (as defined below), and (ii) the Corporation’s compensation committee and the g",
        "s with those of our stockholders, each director is required to own shares of Alphabet stock equal in value to at least $1.0\nmillion. Each director has five years from the date he or she became a director to comply with these ownership requirements. All of our directors\neither met the applicable minimum stock ownership guideline as of December 31, 2020 or were within the grace period noted above to come into\ncompliance with these requirements.\n \nDuring 2020, Larry, Sergey, and Sundar served as ou",
        "nuing the influence of Larry and Sergey.\n•\nOur board of directors has the right to elect directors to fill a vacancy created by the\nexpansion of the board of directors or the resignation, death, or removal of a director,\nwhich prevents stockholders from being able to fill vacancies on our board of\ndirectors.\n•\nOur stockholders may not act by written consent. As a result, a holder, or holders,\ncontrolling a majority of our capital stock would not be able to take certain actions\nwithout holding a ",
        "imited to $1.5 million.\n \nTo further align directors’ interests with those of our stockholders, each non-employee director is required to own shares of Alphabet stock equal in value\nto at least $1.0 million. Each director has five years from the date he or she became a director to comply with this ownership requirement. All of our non-\nemployee directors either met this minimum stock ownership requirement as of December 31, 2023 or were within the grace period noted above to come\ninto compliance"
      ],
      "retrieved_docs": 5,
      "top_scores": [
        0.6768304109573364,
        0.6644891500473022,
        0.6606049537658691
      ],
      "sources": [
        "ALPHABET INC. - DEF 14A.pdf",
        "ALPHABET INC. DEF 14A.pdf",
        "ALPHABET INC. - DEF 14A_3.pdf",
        "goog-20200331.pdf",
        "ALPHABET INC. - DEF 14A.pdf"
      ],
      "execution_time": 2.6568360328674316,
      "embedding_dim": 384,
      "category": "governance",
      "query_id": 44,
      "difficulty": "medium"
    },
    {
      "question": "What is the composition and structure of the board committees?",
      "answer": "The board committees are composed entirely of independent members, with 100% independence in key committees, which include the Audit Committee (ACC), the Leadership Development and Inclusion Committee (LDIC), and the Nominating and Corporate Governance Committee (NCGC). Additionally, there is an independent Chair of the Board who is separate from the CEO role. The performance of each committee chair is reviewed at least every three years.",
      "contexts": [
        "and effectively composed Board. Our Board is committed to maintaining alignment with stockholder interests through our strong governance\npractices and by seeking and incorporating stockholder feedback that informs key areas of focus for our Board and the company each year.\n \n \n     \n     \nBoard Leadership and Composition\n    Board and Committee Practices\n    Stockholder Alignment\n \n     \n     \n•  Independent Chair of the Board, separate\nfrom CEO role\n•  100% independent key committees (ACC,\nLDIC",
        "provided by our\nthoughtfully and effectively composed Board. Our Board is committed to maintaining alignment with stockholder interests through our strong governance\npractices and by seeking and incorporating stockholder feedback that informs key areas of focus for our Board and the company each year.\n Board Leadership and Composition   \n \nBoard and Committee Practices   \n \nStockholder Alignment   \nIndependent Chair of the Board,\nseparate from CEO role\n100% independent key committees\n(ACC, LDICC",
        "interests through our strong governance\npractices and by seeking and incorporating stockholder feedback that informs key areas of focus for our Board and the company each year.\n \n \n     \n     \nBoard Leadership and Composition\n    Board and Committee Practices\n    Stockholder Alignment\n \n     \n     \n•  Independent Chair of the Board, separate\nfrom CEO role\n•  100% independent key committees (ACC,\nLDICC, NCGC) and committee chairs\n•  Review of each committee chair at least\nevery three years\n•  Boa",
        "Committee, 3. a Nominating and Corporate Governance Committee, and 4. an Executive Committee. From time to time, the Board of Directors may also\nestablish ad hoc committees to address particular matters. Each of the standing committees operates under a written charter adopted by the Board of Directors. All of the current standing committee charters are available on the Investor Relations section of our website at https://abc.xyz/investor/other/board/. Printed copies of the charters are available",
        "a set by our Board and as provided in the Corporate Governance Guidelines, to oversee the evaluation of the Board and management, and to\ndevelop and update our corporate governance principles. The Governance Committee’s responsibilities include but are not limited to:\n \n \n• Evaluating Board and Committee composition, including size, tenure, organization, and governance and determining future requirements.\n \n• Establishing a policy for considering director nominees; evaluating and recommending ca"
      ],
      "retrieved_docs": 5,
      "top_scores": [
        0.7073944211006165,
        0.7029268741607666,
        0.6853069067001343
      ],
      "sources": [
        "ALPHABET INC. - DEF 14A.pdf",
        "ALPHABET INC. DEF 14A.pdf",
        "ALPHABET INC. - DEF14A.pdf",
        "lgoog2020_def14a.pdf",
        "ALPHABET INC. - DEF14A.pdf"
      ],
      "execution_time": 1.4460906982421875,
      "embedding_dim": 384,
      "category": "governance",
      "query_id": 45,
      "difficulty": "medium"
    },
    {
      "question": "What are the company's policies on shareholder rights and proxy voting?",
      "answer": "Based on the provided context, the company's policy on shareholder rights and proxy voting indicates that shareholders can vote by proxy at the Annual Meeting, with proxies being voted together as a single class. The company has a clear recommendation from its Board of Directors to vote against the stockholder proposal unless the proxies are marked otherwise. This suggests a stance of the Board in favor of maintaining control over certain proposals and reflects a dismissal of stockholder proposals unless actively opposed by shareholders. Additionally, it is mentioned that shareholders can vote by mail, telephone, or online, depending on their method of holding shares. Overall, the company encourages shareholder participation in voting but has a specific recommendation against certain proposals put forth by stockholders.",
      "contexts": [
        " proxy at the Annual Meeting and entitled to vote thereon, voting together as a\nsingle class. Unless marked to the contrary, proxies received will be voted AGAINST the stockholder proposal.\n \nAlphabet Recommendation\n \nOUR BOARD OF DIRECTORS RECOMMENDS A VOTE AGAINST THE STOCKHOLDER PROPOSAL.\n \nALPHABET  •  2022 PROXY STATEMENT     97\n \nBack to Contents\n1\nCorporate\nGovernance\n2\nDirector and\nExecutive\nCompensation\n3\nAudit\nMatters\n4\nManagement\nand Stockholder\nProposals\n5\nQuestions and\nAnswers\n6\nApp",
        "ive printed\nproxy materials, you can also vote by mail or telephone pursuant to instructions provided on the proxy card.\n \nALPHABET ● 2023 PROXY STATEMENT        111\n \nBack to contents\n \n1\nCorporate  \nGovernance\n2\nDirector and\nExecutive\nCompensation\n3\nAudit  \nMatters\n4\nManagement\nand Stockholder\nProposals\n5\nQuestions and   \nAnswers\n6\nAppendices\n \nIf you hold shares beneficially in street name, you may also vote by proxy online by following the instructions provided in the Notice, or, if you requ",
        " by proxy at the Annual Meeting and entitled to vote thereon, voting together as a\nsingle class. Unless marked to the contrary, proxies received will be voted AGAINST the stockholder proposal.\n \nAlphabet Recommendation\n \nOUR BOARD OF DIRECTORS RECOMMENDS A VOTE AGAINST THE STOCKHOLDER PROPOSAL.\n \nALPHABET ● 2023 PROXY STATEMENT        104\n \nBack to contents\n \n1\nCorporate  \nGovernance\n2\nDirector and\nExecutive\nCompensation\n3\nAudit  \nMatters\n4\nManagement\nand Stockholder\nProposals\n5\nQuestions and   ",
        "on stock present or represented by proxy at the Annual Meeting and entitled to vote thereon, voting together as a\nsingle class. Unless marked to the contrary, proxies received will be voted AGAINST the stockholder proposal.\n \nAlphabet Recommendation\n \nOUR BOARD OF DIRECTORS RECOMMENDS A VOTE AGAINST THE STOCKHOLDER PROPOSAL.\n \nAlphabet 2025 Proxy Statement     87\n \nBack to Contents\nProxy Statement\nSummary &\nHighlights\nCorporate\nGovernance\nDirector and\nExecutive\nCompensation\nAudit Matters\nProposa",
        "sented by proxy at the Annual Meeting and entitled to vote thereon, voting together as a\nsingle class. Unless marked to the contrary, proxies received will be voted AGAINST the stockholder proposal.\n \nAlphabet Recommendation\n \nOUR BOARD OF DIRECTORS RECOMMENDS A VOTE AGAINST THE STOCKHOLDER PROPOSAL.\n \nALPHABET  •  2022 PROXY STATEMENT     101\n \nBack to Contents\n1\nCorporate\nGovernance\n2\nDirector and\nExecutive\nCompensation\n3\nAudit\nMatters\n4\nManagement\nand Stockholder\nProposals\n5\nQuestions and\nAns"
      ],
      "retrieved_docs": 5,
      "top_scores": [
        0.6913959980010986,
        0.6697399020195007,
        0.6663212776184082
      ],
      "sources": [
        "ALPHABET INC. DEF 14A.pdf",
        "ALPHABET INC. - DEF 14A_2.pdf",
        "ALPHABET INC. - DEF 14A_2.pdf",
        "ALPHABET INC. - DEF14A.pdf",
        "ALPHABET INC. DEF 14A.pdf"
      ],
      "execution_time": 3.216665029525757,
      "embedding_dim": 384,
      "category": "governance",
      "query_id": 46,
      "difficulty": "hard"
    },
    {
      "question": "What is the company's code of conduct and ethics policies?",
      "answer": "The company's code of conduct and ethics policies are encapsulated in the \"Alphabet Code of Conduct,\" which applies to directors, officers (including the principal executive officer, principal financial officer, and principal accounting officer), and employees. This code emphasizes the highest standards of ethics and conduct, prohibiting actions that fail to maintain basic standards of civility and that do not treat others with dignity. Additionally, the company has established a Conduct Policy that addresses issues such as harassment, discrimination, retaliation, and workplace concerns. This Conduct Policy reinforces the commitment to ethical behavior and respectful treatment among all employees. Furthermore, the company has Community Guidelines that support responsible and thoughtful discussions, reflecting the values of its culture.",
      "contexts": [
        "business conduct and ethics for directors, officers (including our principal executive officer, principal financial officer, and\nprincipal accounting officer), and employees, known as the Alphabet Code of Conduct. We have also adopted Corporate Governance Guidelines,\nwhich, in conjunction with our certificate of incorporation, bylaws, and charters of the standing committees of our Board of Directors, form the\nframework for our corporate governance. The Alphabet Code of Conduct and Corporate Gove",
        " and\nAnswers\n6\nAppendices\n \n—\nCORPORATE GOVERNANCE AND BOARD MATTERS\n \nWe have adopted a code of business conduct and ethics for directors, officers (including our principal executive officer, principal financial officer, and\nprincipal accounting officer), and employees, known as the Alphabet Code of Conduct. We have also adopted Corporate Governance Guidelines, which,\nin conjunction with our certificate of incorporation, bylaws, and charters of the standing committees of our Board, form the fra",
        " Harassment,\nDiscrimination, Retaliation, Standards of Conduct, and Workplace Concerns (the Conduct Policy). The Conduct Policy states that all employees are held\nto the highest standards of ethics and conduct and prohibits failing to maintain basic standards of civility and not treating each other with dignity.\n \nOur Community Guidelines further help support the responsible and thoughtful discussion that has always been part of our culture. For example, the\nCommunity Guidelines make clear that ",
        "atters\n4\nManagement\nand Stockholder\nProposals\n5\nQuestions and\nAnswers\n6\nAppendices\n \n—  CORPORATE GOVERNANCE AND BOARD MATTERS\n \nWe have adopted a code of business conduct and ethics for directors, officers (including our principal executive officer, principal financial officer, and\nprincipal accounting officer), and employees, known as the Alphabet Code of Conduct. We have also adopted Corporate Governance Guidelines, which,\nin conjunction with our certificate of incorporation, bylaws, and char",
        "an Assistant U.S. Attorney in San Francisco and Washington D.C.\n \nAlphabet 2025 Proxy Statement     23\n \nBack to Contents\nProxy Statement\nSummary &\nHighlights\nCorporate\nGovernance\nDirector and\nExecutive\nCompensation\nAudit Matters\nProposals\nQ&A\n \nCorporate Governance and Board Matters\n \nWe have adopted a code of business conduct and ethics for directors, officers (including our principal executive officer, principal financial officer, and\nprincipal accounting officer), and employees, known as the"
      ],
      "retrieved_docs": 5,
      "top_scores": [
        0.711280107498169,
        0.6617543697357178,
        0.6200533509254456
      ],
      "sources": [
        "ALPHABET INC. - DEF 14A_3.pdf",
        "ALPHABET INC. DEF 14A.pdf",
        "ALPHABET INC. - DEF 14A.pdf",
        "ALPHABET INC. - DEF 14A_2.pdf",
        "ALPHABET INC. - DEF14A.pdf"
      ],
      "execution_time": 3.279491901397705,
      "embedding_dim": 384,
      "category": "governance",
      "query_id": 47,
      "difficulty": "medium"
    },
    {
      "question": "How does the company ensure diversity and inclusion in its leadership?",
      "answer": "The company ensures diversity and inclusion in its leadership by integrating diversity metrics into performance measures and vesting conditions for senior executives under its compensation plans. This includes a focus on gender, racial, and ethnic diversity among senior executives. Additionally, Alphabet employs various strategies and practices aimed at increasing the diversity of board candidates. Furthermore, the company provides high-quality training and support to managers, which includes courses for new managers, learning resources for performance management, and coaching, all aimed at fostering an inclusive work environment. Overall, Alphabet is committed to making diversity, equity, and inclusion a fundamental aspect of its operations and to building a workforce that reflects the diversity of its user base.",
      "contexts": [
        "ability metrics, including metrics regarding diversity among senior executives, into performance measures or vesting conditions that may apply to senior executives under the Company’s compensation plans or arrangements. For the purposes of this proposal, “sustainability” is defined as how environmental and social considerations, and related financial impacts, are\nintegrated into long-term corporate strategy, and “diversity” refers to gender, racial, and ethnic diversity. Alphabet Opposing Statem",
        " racial and/or gender board diversity targets\n \n• Strategies or practices deployed to increase diversity of board candidates\n \nALPHABET  •  2022 PROXY STATEMENT     98\n \nBack to Contents\n1\nCorporate\nGovernance\n2\nDirector and\nExecutive\nCompensation\n3\nAudit\nMatters\n4\nManagement\nand Stockholder\nProposals\n5\nQuestions and\nAnswers\n6\nAppendices\n \nAlphabet Opposing Statement\n \nDiversity, equity, and inclusion are critical to our success and future innovation. We are committed to diversity in all areas o",
        " a variety of high quality training and\nsupport to managers to build and strengthen their capabilities-–ranging from courses for new managers, to learning\nresources that help them provide feedback and manage performance, to coaching and individual support.\nAt Alphabet, we are committed to making diversity, equity, and inclusion part of everything we do and to growing a\nworkforce that is representative of the users we serve. More information on Google’s approach to diversity can be\nfound in our a",
        "idering ESG factors in\ncompensation can help protect long-term shareholder value.\n \nDiversity, inclusion, and equity are key components of business sustainability and success:\n \n• McKinsey research shows that companies in the top quartiles for gender and racial/ethnic diversity were more likely to have above average\nfinancial returns (“Diversity Matters,” McKinsey & Company, 2015).\n• In a 2013 Catalyst report, diversity was positively associated with more customers, increased sales revenue, and ",
        " Principles for Responsible Investment (2012) state that considering ESG factors in compensation can help protect long-term shareholder value. Diversity, inclusion, and equity are key components of business sustainability and success: . McKinsey research shows that companies in the top quartiles for gender and racial/ethnic diversity were more likely to have above- average financial returns (“Diversity Matters,” McKinsey & Company, 2015). . In a 2013 Catalyst report, diversity was positively ass"
      ],
      "retrieved_docs": 5,
      "top_scores": [
        0.6638944149017334,
        0.6520945429801941,
        0.6477954387664795
      ],
      "sources": [
        "lgoog2020_def14a.pdf",
        "ALPHABET INC. DEF 14A.pdf",
        "goog-20231231.pdf",
        "ALPHABET INC. - DEF 14A_3.pdf",
        "lgoog2020_def14a.pdf"
      ],
      "execution_time": 3.71158504486084,
      "embedding_dim": 384,
      "category": "governance",
      "query_id": 48,
      "difficulty": "medium"
    },
    {
      "question": "What is the company's approach to executive succession planning?",
      "answer": "The company's approach to executive succession planning involves collaboration between the Board of Directors and the Chief Executive Officer. They believe that the entire Board should participate in the critical aspects of the management succession planning process. This includes:\n\n1. Establishing selection criteria that align with the company's business strategies.\n2. Identifying and developing internal candidates to ensure continuity of the corporate culture.\n3. Making key management succession decisions.\n\nAdditionally, management succession is a regular topic of discussion in Board meetings and executive sessions, allowing directors to become familiar with potential successors for key management positions through various means, such as regular organizational assessments.",
      "contexts": [
        "seeing the risks and exposures\nassociated with management succession planning.\n \nOur Board believes that the directors and the Chief Executive Officer should collaborate on succession planning and that the entire Board should be\ninvolved in the critical aspects of the management succession planning process, including establishing selection criteria that reflect our business\nstrategies, identifying and developing internal candidates to ensure the continuity of our culture, and making key manageme",
        "should be\ninvolved in the critical aspects of the management succession planning process, including establishing selection criteria that reflect our business\nstrategies, identifying and developing internal candidates to ensure the continuity of our culture, and making key management succession decisions.\n \nALPHABET  •  2022 PROXY STATEMENT     34\n \nBack to Contents\n1\nCorporate\nGovernance  \n2\nDirector and\nExecutive\nCompensation\n3\nAudit\nMatters\n4\nManagement\nand Stockholder\nProposals\n5\nQuestions an",
        "planning process, including establishing selection criteria that reflect our business\nstrategies, identifying and developing internal candidates to ensure the continuity of our corporate culture, and making key management succession\ndecisions.\n \nManagement succession is regularly discussed by the directors in meetings and in executive sessions of our Board. Directors become familiar with\npotential successors for key management positions through various means, including regular organization and t",
        " \nOur Board of Directors believes that the directors and the Chief Executive Officer should collaborate on succession planning and that the entire\nBoard of Directors should be involved in the critical aspects of the management succession planning process, including establishing selection criteria\nthat reflect our business strategies, identifying and developing internal candidates to ensure the continuity of our culture, and making key\nmanagement succession decisions.\n \nManagement succession is r",
        " plans for the development, retention, and replacement of executive officers, including the Chief Executive Officer of\nAlphabet. Additionally, the Compensation Committee and the Nominating Committee are jointly responsible for overseeing the risks and exposures\nassociated with management succession planning.\n \nOur Board believes that the directors and the Chief Executive Officer should collaborate on succession planning and that the entire Board should be\ninvolved in the critical aspects of the "
      ],
      "retrieved_docs": 5,
      "top_scores": [
        0.7544509172439575,
        0.7396776080131531,
        0.7269607186317444
      ],
      "sources": [
        "ALPHABET INC. - DEF 14A_2.pdf",
        "ALPHABET INC. DEF 14A.pdf",
        "ALPHABET INC. - DEF14A.pdf",
        "ALPHABET INC. - DEF 14A_3.pdf",
        "ALPHABET INC. DEF 14A.pdf"
      ],
      "execution_time": 3.196249008178711,
      "embedding_dim": 384,
      "category": "governance",
      "query_id": 49,
      "difficulty": "hard"
    },
    {
      "question": "What is the company's approach to risk management and internal controls?",
      "answer": "The company's approach to risk management involves oversight by the Board of Directors and its committees, which is supported by management reporting processes. These processes include an annual company-wide risk assessment aimed at identifying, assessing, and managing critical risks, along with management’s risk mitigation strategies. The Audit Committee plays a key role in this oversight, focusing on major risk exposures related to financial matters, data privacy and security, competition, and other relevant areas.\n\nIn terms of internal controls over financial reporting, the company has established a process designed to provide reasonable assurance regarding the reliability of financial reporting. This ensures that financial statements are prepared in accordance with generally accepted accounting principles for external purposes. The Audit Committee is responsible for overseeing various aspects of internal control, including financial strategy, reporting, tax, accounting, disclosure, and other treasury and investment matters. Overall, the company’s risk management and internal control framework emphasizes thorough oversight, assessment, and proactive management of risks.",
      "contexts": [
        "h its committees, has responsibility for oversight of risk management. The oversight responsibility of\nthe Board of Directors and its committees is enabled by management reporting processes, including an annual company-wide risk assessment, that\nare designed to provide visibility to the Board of Directors and its committees about the identification, assessment, and management of critical risks\nand management’s risk mitigation strategies. While the Board of Directors is ultimately responsible for",
        "sed risk, and performing such other procedures as we considered necessary in the circumstances. We believe\nthat our audit provides a reasonable basis for our opinion.\nDefinition and Limitations of Internal Control Over Financial Reporting\nA company’s internal control over financial reporting is a process designed to provide reasonable assurance regarding\nthe reliability of financial reporting and the preparation of financial statements for external purposes in accordance with\ngenerally accepted ",
        " discuss with management the company’s major risk\nexposures. The Audit Committee’s responsibilities include but are not limited to:\n \n \n• Overseeing the risks and exposures associated with:\n \n \n• Financial matters, including but not limited to financial strategy and reporting, tax, accounting, disclosure, internal control over financial reporting,\ntreasury policies and activities, investment guidelines, and credit and liquidity matters;\n \n \n• Data privacy and security, competition, civil and hum",
        "esponsible for risk oversight\n \nOur Board’s oversight function of major risks and risk exposures, including those relating to or resulting from our development and implementation of AI\nin our products and services, sits at the top of our risk management framework. As set forth in our Corporate Governance Guidelines, our Board is\nultimately responsible for covering strategic, financial, and execution risks and exposures associated with our business strategy, production innovation,\nand policy and ",
        "egated to its\ncommittees oversight of risks associated with their respective areas of responsibility.\n \nThe Audit Committee is responsible for overseeing our enterprise risk management and major risk exposures, including risks beyond the scope of\nfinancial and operations risks. The Audit Committee has rigorous frameworks and processes for fulfilling these responsibilities, and regularly evaluates\nand adjusts its strategies to best meet the needs of our Board and Alphabet. Detailed information ab"
      ],
      "retrieved_docs": 5,
      "top_scores": [
        0.6267874240875244,
        0.6219209432601929,
        0.6095057725906372
      ],
      "sources": [
        "ALPHABET INC. - DEF 14A_3.pdf",
        "goog-20221231.pdf",
        "ALPHABET INC. - DEF14A.pdf",
        "ALPHABET INC. - DEF 14A.pdf",
        "ALPHABET INC. - DEF 14A_2.pdf"
      ],
      "execution_time": 4.324525833129883,
      "embedding_dim": 384,
      "category": "governance",
      "query_id": 50,
      "difficulty": "hard"
    }
  ],
  "metrics": {
    "average_execution_time": 4.285312948226928,
    "average_top_score": 0.6525744473934174,
    "total_queries": 50,
    "indexing_time": 47.76447415351868
  }
}